abstract,lead_paragraph,headline,keywords,pub_date,document_type,section_name
"The top United Nations court in The Hague did not rule on whether Israel was committing genocide in Gaza, the accusation that South Africa brought before the court.","The United Nations’ highest court said on Friday that Israel must take action to prevent acts of genocide by its forces in the Gaza Strip, adding to the international pressure on Prime Minister Benjamin Netanyahu to reduce death and destruction in the battered Palestinian enclave.","{'main': 'U.N. Court Orders Israel to Prevent Genocide, but Does Not Demand Stop to War', 'kicker': None, 'content_kicker': None, 'print_headline': 'Israel Must Shun Acts Of Genocide, U.N. Court Rules', 'name': None, 'seo': None, 'sub': None}","['Israel-Gaza War (2023- )', 'Israel', 'Defense and Military Forces', 'Gaza Strip', 'Palestinians', 'Hamas', 'Terrorism', 'International Relations', 'War Crimes, Genocide and Crimes Against Humanity', 'Humanitarian Aid', 'Civilian Casualties', 'International Court of Justice (UN)', 'United Nations', 'Netanyahu, Benjamin', 'South Africa']",2024-01-27T00:00:13+0000,article,World
"A military jury sentenced two Malaysian men to 23 years for helping perpetrators of the bombing that killed 202 people, but a side deal reduced the punishment.","A military jury at Guantánamo Bay sentenced two prisoners to 23 years in confinement on Friday for conspiring in the 2002 terrorist bombing that killed 202 people in Bali, Indonesia. But the men could be freed by 2029 under a secret deal and with sentencing credit.","{'main': 'Bali Bombing Conspirators Get 5 More Years at Guantánamo Bay', 'kicker': None, 'content_kicker': None, 'print_headline': 'Bali Bombing Conspirators Sentenced to 5 More Years at Guantánamo Bay', 'name': None, 'seo': None, 'sub': None}","['Terrorism', 'Decisions and Verdicts', 'Prisons and Prisoners', 'Detainees', 'Torture', 'Military Tribunals', 'AL QAEDA', 'Jemaah Islamiyah', 'Central Intelligence Agency', 'Bali (Indonesia)', 'Guantanamo Bay Naval Base (Cuba)']",2024-01-27T00:08:31+0000,article,U.S.
"Heather Stines told the police the head, arms and legs belonged to a man her husband had killed in September, according to court records.","A Brooklyn woman was charged this week with concealing a human corpse after the police found a head and other body parts in garbage bags stuffed in her refrigerator, officials said on Friday.","{'main': 'Woman Charged With Hiding Corpse Over Body Parts Found in Refrigerator', 'kicker': None, 'content_kicker': None, 'print_headline': '', 'name': None, 'seo': None, 'sub': None}","['Murders, Attempted Murders and Homicides', 'Police', 'Police Department (NYC)', 'New York City']",2024-01-27T01:11:41+0000,article,New York
"Animal welfare authorities say the animals were being illegally held and included a South American ostrich, a giant African snail, two prairie dogs and an endangered tiger salamander.","Animal welfare authorities seized more than 100 animals from a Long Island home this week — including a South American ostrich, a giant African snail, two prairie dogs and an endangered tiger salamander — after a tip they received about exotic animals led them to their owner’s doorstep.","{'main': 'More Than 100 Animals Seized From Long Island Home', 'kicker': None, 'content_kicker': None, 'print_headline': '', 'name': None, 'seo': None, 'sub': None}","['Animal Abuse, Rights and Welfare', 'Animals', 'Endangered and Extinct Species', 'Bellmore (NY)']",2024-01-27T01:24:25+0000,article,New York
"The department received documents on Friday signed by Turkey’s leader approving Sweden’s long-delayed entry into NATO. The alliance now awaits word from the lone holdout, Hungary.","The State Department notified Congress on Friday that it had approved a $23 billion sale of F-16 fighter jets and related equipment to Turkey after the country’s leader signed documents to allow Sweden’s long-delayed entry into the North Atlantic Treaty Organization, department officials and the Pentagon said.","{'main': 'State Dept. Tells Congress It Has Approved Sale of F-16 Jets to Turkey', 'kicker': None, 'content_kicker': None, 'print_headline': 'State Department Tells Congress It Has Approved Sale of F-16 Jets to Turkey', 'name': None, 'seo': None, 'sub': None}","['United States Politics and Government', 'United States International Relations', 'Military Aircraft', 'Arms Trade', 'North Atlantic Treaty Organization', 'HOUSE COMMITTEE ON FOREIGN AFFAIRS', 'Senate Committee on Foreign Relations', 'State Department', 'Erdogan, Recep Tayyip', 'Turkey', 'Sweden', 'Hungary']",2024-01-27T01:53:44+0000,article,U.S.
"As Trump campaign surrogates defended the former president in light of an $83.3 million defamation verdict, Nikki Haley said his legal troubles continued to be a distraction.","Nikki Haley criticized Donald J. Trump on Friday, saying, “America can do better than Donald Trump and Joe Biden,” after a Manhattan jury had ordered the former president to pay $83.3 million for defaming the writer E. Jean Carroll.","{'main': 'After Carroll Verdict, Haley Says ‘America Can Do Better’ Than Trump or Biden', 'kicker': None, 'content_kicker': None, 'print_headline': '', 'name': None, 'seo': None, 'sub': None}","['Presidential Election of 2024', 'Decisions and Verdicts', 'CARROLL, E JEAN', 'Biden, Joseph R Jr', 'Haley, Nikki R', 'Greene, Marjorie Taylor (1974- )', 'Stefanik, Elise', 'Trump, Donald J', 'Coons, Christopher A']",2024-01-27T02:30:53+0000,article,U.S.
The co-founder of World Wrestling Entertainment stepped down from its parent company’s board one day after an ex-employee accused him of sexual assault in a lawsuit.,"Vince McMahon, the longtime chairman and former chief executive of World Wrestling Entertainment, resigned from the board of W.W.E.’s parent company on Friday, one day after a former employee accused him of sexual assault and sex trafficking in a lawsuit.","{'main': 'Vince McMahon Cuts W.W.E. Ties After Sex Trafficking Accusation', 'kicker': None, 'content_kicker': None, 'print_headline': '', 'name': None, 'seo': None, 'sub': None}","['McMahon, Vince', 'World Wrestling Entertainment Inc', 'Grant, Janel', 'Suits and Litigation (Civil)']",2024-01-27T02:41:22+0000,article,Business Day
"The owner, Dr. Patrick Soon-Shiong, had raised concerns with Kevin Merida, who stepped down this month, over reporting about a wealthy doctor and his dog.","When Dr. Patrick Soon-Shiong, the billionaire owner of The Los Angeles Times, hired Kevin Merida to be the newspaper’s top editor nearly three years ago, he hailed the journalist as someone who would maintain the publication’s high standards and journalistic integrity.","{'main': 'Los Angeles Times Owner Clashed With Top Editor Over Unpublished Article', 'kicker': None, 'content_kicker': None, 'print_headline': 'Owner of Los Angeles Times  Had Clashed With Top Editor', 'name': None, 'seo': None, 'sub': None}","['Los Angeles Times', 'Soon-Shiong, Patrick', 'Merida, Kevin (1957- )', 'Newspapers', 'News and News Media']",2024-01-27T02:55:27+0000,article,Business Day
"Corrections that appeared in print on Saturday, Jan. 27, 2024.","An article on Dec. 31 about details showing a pattern of rape, mutilation and extreme brutality against women in the Oct. 7 attack by Hamas on Israel misstated the age of Sapir, the woman who has become one of the Israeli police’s key witnesses to the attack. She is 26, not 24.","{'main': 'Corrections: Jan. 27, 2024', 'kicker': None, 'content_kicker': None, 'print_headline': 'Corrections', 'name': None, 'seo': None, 'sub': None}",[],2024-01-27T02:57:07+0000,article,Corrections
"Quotation of the Day for Saturday, January 27, 2024.",“I didn’t feel really myself on the court during this tournament.”,"{'main': 'Quotation of the Day: Djokovic’s Perfection Finally Comes to End Against Italy’s Sinner', 'kicker': None, 'content_kicker': None, 'print_headline': 'Quote of the Day', 'name': None, 'seo': None, 'sub': None}",[],2024-01-27T02:58:34+0000,article,Corrections
Grace and Greg Warrington make their New York Times debut.,Jump to: Today’s Theme | Tricky Clues,"{'main': 'Tiny Scrap', 'kicker': 'wordplay, the crossword column', 'content_kicker': None, 'print_headline': '', 'name': None, 'seo': None, 'sub': None}","['Crossword Puzzles', 'Games']",2024-01-27T03:00:09+0000,article,Crosswords & Games
"The country singer had been charged with disorderly conduct, assaulting an officer and resisting arrest after an altercation at a downtown bar.",Prosecutors on Friday dropped all charges that had been brought against the country music singer Chris Young in connection with an altercation with an Alcoholic Beverage Commission agent at a Nashville bar.,"{'main': 'Prosecutors in Nashville Drop Charges Against Chris Young', 'kicker': None, 'content_kicker': None, 'print_headline': '', 'name': None, 'seo': None, 'sub': None}","['Country Music', 'Reality Television', 'Assaults', 'District Attorneys', 'Bars and Nightclubs', 'Music', 'Young, Chris (1985- )', 'Nashville (Tenn)', 'Tennessee']",2024-01-27T03:18:14+0000,article,Arts
"A businessman who had worked in China for decades vanished from view in 2018, but his fate had been unknown, and publicly unremarked upon, until now.","A British businessman who disappeared from public view in China in 2018 was sentenced to five years in prison in 2022, China’s Foreign Ministry said on Friday, in its first public acknowledgment of the case.","{'main': 'China Acknowledges Imprisoning a British Man on Spy Charges', 'kicker': None, 'content_kicker': None, 'print_headline': 'China Acknowledges Imprisoning British Man on Spy Charges in 2022', 'name': None, 'seo': None, 'sub': None}","['China', 'Great Britain', 'Political Prisoners', 'International Relations', 'Espionage and Intelligence Services']",2024-01-27T04:49:51+0000,article,World
"Hoping to repeat the success of Manhattan’s park, London is transforming a disused rail line, elevated 25 feet above the city’s streets, into its own floating green space.","The derelict rail bridge stretches across a busy north London street, green foliage peeking out of the gaps between the beams overhead, where bright blue paint flakes from rusting steel.","{'main': 'London’s Highline Will Echo Its New York Inspiration, With Local Notes', 'kicker': 'London Dispatch', 'content_kicker': None, 'print_headline': 'Take a Rail Line and Turn It Into a Park. But Make It British.', 'name': None, 'seo': None, 'sub': None}","['Area Planning and Renewal', 'Parks and Other Recreation Areas', 'Camden Highline (London, England)', 'High Line (Manhattan, NY)', 'Corner, James, Field Operations', ""King's Cross (London, England)"", 'Urban Areas', 'ARCHITECTURE']",2024-01-27T05:01:13+0000,article,World
"As documentaries and series about teams proliferate, it’s easy to pine for the ones that offered the clearest windows into the game.","Being early, Marc Andreessen once ruefully said, is the same as being wrong. Admittedly, Andreesen, the software engineer, angel investor and all-purpose Silicon Valley maven, deployed the maxim in the context of his own somewhat bitter experiences in the world of cloud computing, but it works surprisingly well as an analysis of “Being: Liverpool.”","{'main': 'When Soccer’s Content Mine Loses Sight of Reality', 'kicker': 'The On Soccer Newsletter', 'content_kicker': None, 'print_headline': 'Showing How the Sausage Is Made. Into Prime Rib.', 'name': None, 'seo': None, 'sub': None}","['Soccer', 'Documentary Films and Programs', 'Rodgers, Brendan (1973- )', 'Salah, Mohamed (1992- )', 'English Premier League', 'Wrexham AFC (Soccer Team)']",2024-01-27T07:00:03+0000,article,World
In case you need some puzzle help.,"Welcome to The Wordle Review. Be warned: This page contains spoilers for today’s puzzle. Solve Wordle first, or scroll at your own risk.","{'main': 'Today’s Wordle Review', 'kicker': None, 'content_kicker': None, 'print_headline': '', 'name': None, 'seo': None, 'sub': None}",['Wordle (Puzzle)'],2024-01-27T08:00:02+0000,article,Crosswords & Games
In case you need some puzzle help.,"Good morning, dear connectors. Welcome to today’s Connections forum, where you can give and receive puzzle — and emotional — support.","{'main': 'The Connections Companion', 'kicker': None, 'content_kicker': None, 'print_headline': '', 'name': None, 'seo': None, 'sub': None}","['Crossword Puzzles', 'Connections (Game)']",2024-01-27T08:00:03+0000,article,Crosswords & Games
Feeling stuck on today’s puzzle? We can help.,"Hi busy bees! Welcome to today’s Spelling Bee forum. There are a number of terms that appear in both this article and other online discussions of the Spelling Bee; a glossary of those terms compiled by Monicat, a Times reader, can be found below.","{'main': 'Spelling Bee Forum', 'kicker': None, 'content_kicker': None, 'print_headline': '', 'name': None, 'seo': None, 'sub': None}",['Spelling Bee (Game)'],2024-01-27T08:00:03+0000,article,Crosswords & Games
"The actor, singer and reality TV personality fills his day with video games, comfort food with friends and a teary trip to the movies.",Frankie Grande likes to stay busy — even on Sundays.,"{'main': 'How Frankie Grande Spends His Sundays', 'kicker': None, 'content_kicker': None, 'print_headline': 'An Entertainer Consumes Entertainment', 'name': None, 'seo': None, 'sub': None}","['Theater', 'Actors and Actresses', 'Golden Globes (Awards)', 'Daryl Roth Theater', 'Garber, Victor', 'Grande, Frankie J', 'Bryant Park (Manhattan, NY)', 'Chelsea (Manhattan, NY)', ""Hell's Kitchen (Manhattan, NY)"", 'New York City', 'Oppenheimer (Movie)']",2024-01-27T08:00:40+0000,article,New York
The president likes to talk about his climate agenda as an opportunity to create jobs. Polling shows that may be the wrong way to win over voters.,"President Biden has done more than any president to tackle climate change, but strategists are grappling with an uncomfortable fact: Voters don’t seem to know it.","{'main': 'Democrats Say Biden Hasn’t ‘Made the Case’ on Climate Despite Achievements', 'kicker': None, 'content_kicker': None, 'print_headline': 'Democrats Want Biden to Shine Brighter Light on His Climate Achievements', 'name': None, 'seo': None, 'sub': None}","['Biden, Joseph R Jr', 'Inflation Reduction Act of 2022', 'Global Warming', 'Greenhouse Gas Emissions', 'Presidential Election of 2024', 'Polls and Public Opinion', 'Oil (Petroleum) and Gasoline', 'United States Politics and Government']",2024-01-27T08:00:40+0000,article,Climate
"Arlene Gottfried, a sister of the late comedian Gilbert Gottfried, memorialized a grittier era of the city. Now her family wants to share her collection with the world.","A nondescript locker in a Lower Manhattan storage center is a portal to a New York City still plagued by crack, AIDS and rampant crime.","{'main': 'Unboxing Thousands of Photos of New York City in the ’70s and ’80s', 'kicker': None, 'content_kicker': None, 'print_headline': '', 'name': None, 'seo': None, 'sub': None}","['Photography', 'New York City', 'Archives and Records', 'Gottfried, Arlene', 'Gottfried, Dara (1970- )', 'Gottfried, Gilbert']",2024-01-27T08:00:41+0000,article,New York
"In her second novel, “Good Material,” Dolly Alderton adds her own flair to the classic rom-com.","Andy, the 35-year-old struggling comedian who narrates most of Dolly Alderton’s new novel, “Good Material,” has been freshly dumped by his ex, Jen, for mysterious reasons. Like Rob in Nick Hornby’s “High Fidelity,” an obvious inspiration, Andy knows his relationship had its problems. He’s even compiled a list of Jen’s faults, including “lingered too long in museums” where he “once saw her nod respectfully at a TINY JADE SPOON.” It doesn’t soothe his heartbreak; Andy is obsessed with working out what went wrong. In the process, maybe he can get to the bottom of why the rest of his life has derailed, too.","{'main': 'Like Nora Ephron, With a British Twist', 'kicker': 'Fiction', 'content_kicker': None, 'print_headline': '', 'name': None, 'seo': None, 'sub': None}","['Alderton, Dolly', 'Books and Literature', 'Good Material (Book)']",2024-01-27T10:00:07+0000,article,Books
"In “How We Named the Stars,” a young, queer student in mourning recounts the tale of a pivotal romance.","Andrés N. Ordorica’s debut novel, “How We Named the Stars,” begins with a crushing declaration: “Sam’s dead.” It’s an opening that colors everything to come, introducing a loss that will reverberate across every page of this meditative and tender book.","{'main': 'A Tender Debut Novel About the Beauty and Pain of First Love', 'kicker': 'Fiction', 'content_kicker': None, 'print_headline': '', 'name': None, 'seo': None, 'sub': None}","['Books and Literature', 'Ordorica, Andres N', 'How We Named the Stars (Book)']",2024-01-27T10:00:08+0000,article,Books
"When you have no job, and too much time on your hands, the little things begin to grate.","On a hot Tuesday afternoon, a German shepherd met my gaze as he emptied his bowels on the Brooklyn sidewalk. The man holding the leash was large and bald and wearing a tank top. As he turned to walk away, I shot him a look.","{'main': 'My Life as a Neighborhood Crank', 'kicker': 'episode', 'content_kicker': None, 'print_headline': 'One Man’s Life as a Neighborhood Crank', 'name': None, 'seo': None, 'sub': None}","['Layoffs and Job Reductions', 'Age, Chronological', 'Brooklyn (NYC)']",2024-01-27T10:00:14+0000,article,Style
How an intense longing for a romantic connection can lead to a serious addiction.,"For most people, crushes come and go.","{'main': 'Is It a Crush or Have You Fallen Into Limerence?', 'kicker': None, 'content_kicker': None, 'print_headline': '', 'name': None, 'seo': None, 'sub': None}","['Dating and Relationships', 'Love (Emotion)', 'Addiction (Psychology)', 'Anxiety and Stress', 'Mental Health and Disorders']",2024-01-27T10:00:18+0000,article,Style
Experts are already encouraging students and parents to exchange usernames and passwords to expedite aid applications. One problem: It’s not legal.,"Here’s the good news: The Free Application for Federal Student Aid, or FAFSA, website is now open 24 hours a day, seven days a week after a yearslong effort to simplify the process of seeking financial assistance. This month, I watched two high school seniors and their college counselor start the forms from scratch and submit them in just over an hour.","{'main': 'How Some Families Are Breaking the Rules to Apply for Financial Aid', 'kicker': 'your money', 'content_kicker': None, 'print_headline': '', 'name': None, 'seo': None, 'sub': None}","['Financial Aid (Education)', 'Personal Finances', 'Colleges and Universities', 'Education (Secondary)', 'Computers and the Internet', 'Guidance Counselors', 'Education Department (US)']",2024-01-27T10:00:21+0000,article,Your Money
"Hefei has led the country in making electric vehicles and other tech products, but it still has not escaped a nationwide housing crisis.","Ultramodern factories churn out electric cars and solar panels in Hefei, an industrial center in the heart of central China. Broad avenues link office towers and landscaped parks. Subway lines open at a brisk pace.","{'main': 'What China’s E.V. City Says About the State of the Economy', 'kicker': None, 'content_kicker': None, 'print_headline': '', 'name': None, 'seo': None, 'sub': None}","['Electric and Hybrid Vehicles', 'Factories and Manufacturing', 'Foreign Investments', 'Politics and Government', 'Automobiles', 'Real Estate (Commercial)', 'Real Estate and Housing (Residential)', 'Computers and the Internet', 'Small Business', 'Labor and Jobs', 'Local Government', 'Supply Chain', 'Colleges and Universities', 'Hiring and Promotion', 'International Trade and World Market', 'BYD Co Ltd', 'Au.to', 'Nio Ltd', 'Tesla Motors Inc', 'China', 'Hefei (China)']",2024-01-27T10:00:27+0000,article,Business Day
"“When you get on this roller coaster, you don’t know how long you’re going to be allowed to play while you’re here,” the “New Girl” actor said about his filmmaking debut, “Self Reliance.”","If you were bored enough — a stultifying job, living with Mom after a bad breakup — you, too, might climb into a mysterious limo carrying Andy Samberg. You might even consider the offer: outwit assassins for 30 days and win $1 million.","{'main': 'Jake Johnson Likes to Play the Hollywood Game, Especially When It Changes', 'kicker': 'My Ten', 'content_kicker': None, 'print_headline': '', 'name': None, 'seo': None, 'sub': None}","['Content Type: Personal Profile', 'Movies', 'Actors and Actresses', 'Comedy and Humor', 'Johnson, Jake M']",2024-01-27T10:00:36+0000,article,Movies
"While 2024 is still new, assessing where you stand in some key areas of personal finance can help smooth the transition to your later years.","The crash diets have crashed, the brand-new budgets won’t budge and your Peloton is now the world’s most expensive laundry rack. But even if every one of your New Year’s resolutions is toast, there’s still one start-of-the-year chore you would be wise to handle: your retirement review.","{'main': 'January Is Nearly Over. Have You Done Your Retirement Review?', 'kicker': 'retiring', 'content_kicker': None, 'print_headline': 'The Time to Review Your Financial Position Is Now', 'name': None, 'seo': None, 'sub': None}","['Personal Finances', 'Content Type: Service', 'New Year', 'Pensions and Retirement Plans', 'Retirement', 'Social Security (US)', 'Medicare', 'Elderly', 'Asset Allocation (Personal Finances)', 'Wills and Estates']",2024-01-27T10:00:40+0000,article,Business Day
"Tiler Peck, a New York City Ballet star, is making her first work for the company. “It’s my opportunity to pass on to the next generation anything that’s been given to me.”","During rehearsals for New York City Ballet’s winter season, there was something very unusual about one of the choreographers creating a new dance. It wasn’t just that the person in charge was a woman, though that would have been uncommon until a few years ago. Nor was it that the choreographer, Tiler Peck, was one of the company’s star ballerinas, though that is still quite rare. The difference was what Peck wore on her feet as she made and rehearsed the work: pointe shoes.","{'main': 'The Choreographer Wore Pointe Shoes', 'kicker': None, 'content_kicker': None, 'print_headline': 'A Choreographer in Pointe Shoes', 'name': None, 'seo': None, 'sub': None}","['Peck, Tiler', 'Content Type: Personal Profile', 'Dancing', 'New York City Ballet']",2024-01-27T10:00:42+0000,article,Arts
"Seven tech stocks, including Meta, Nvidia and Apple, have accounted for roughly 90 percent of the S&P’s gains over the past 12 months.","Seven tech stocks, including Meta, Nvidia and Apple, have accounted for roughly 90 percent of the S&P’s gains over the past 12 months.","{'main': 'The S&P 500 Through the Prism of a ‘Magnificent 7’', 'kicker': 'Shop Talk', 'content_kicker': None, 'print_headline': '', 'name': None, 'seo': None, 'sub': None}","[""Standard & Poor's 500-Stock Index"", 'Stocks and Bonds', 'Corporations', 'Artificial Intelligence', 'Alphabet Inc', 'Amazon.com Inc', 'Apple Inc', 'Facebook Inc', 'Microsoft Corp', 'NVIDIA Corporation', ""Standard & Poor's Corp"", 'Google Inc', 'Meta Platforms Inc']",2024-01-27T10:00:45+0000,multimedia,Business Day
Two Supreme Court decisions and a lower court’s ruling have cast doubt on the legal basis for a host of prosecutions. Several defendants want their records cleared and their money back.,"Nearly a decade after police officers marched world soccer officials out of a luxury hotel in Zurich at dawn, revealing a corruption scandal that shook the world’s most popular sport, the case is at risk of falling apart.","{'main': 'FIFA Convictions Are Imperiled by Questions of U.S. Overreach', 'kicker': None, 'content_kicker': None, 'print_headline': 'U.S. Overreach Becomes Thorn For FIFA Cases', 'name': None, 'seo': None, 'sub': None}","['Soccer', 'Corruption (Institutional)', 'International Federation of Association Football (FIFA)', 'Napout, Juan Angel (1958- )', 'Decisions and Verdicts', 'Supreme Court (US)', 'United States International Relations']",2024-01-27T10:00:51+0000,article,World
"A longtime counternarcotics agent said he used CBD for chronic pain, considering it safer than opioids. The choice set off a legal fight.","The Drug Enforcement Administration regarded Anthony L. Armour as an “outstanding” special agent on the front lines of the nation’s opioid epidemic. But in 2019, a routine drug test derailed his career.","{'main': 'A Drug Test Cost a D.E.A. Agent His Job. He Sued, and Got It Back.', 'kicker': None, 'content_kicker': None, 'print_headline': 'Fired for Using CBD Oil, a D.E.A. Agent Sued to Get His Job Back', 'name': None, 'seo': None, 'sub': None}","['Cannabis Foods and Products', 'Pain-Relieving Drugs', 'Drug Enforcement Administration', 'Justice Department', 'National Organization for the Reform of Marijuana Laws']",2024-01-27T10:01:01+0000,article,U.S.
