abstract,lead_paragraph,headline,keywords,pub_date,document_type,section_name
"Inflation in the countries that use the euro rose to 2.9 percent in December, but the underlying rate continued a downward trend.","Inflation across the countries using the common European currency rose at the end of 2023, after falling steadily over the past months, as government subsidies to help consumers manage energy costs ran out.","{'main': 'Eurozone Price Pressures Edged Higher to End the Year', 'kicker': None, 'content_kicker': None, 'print_headline': 'Inflation Increased in Eurozone as Energy Subsidies Ran Out', 'name': None, 'seo': None, 'sub': None}","['Eurozone', 'Economic Conditions and Trends', 'Inflation (Economics)', 'Prices (Fares, Fees and Rates)', 'Europe', 'Germany', 'France', 'Spain']",2024-01-05T12:05:53+0000,article,World
"Corrections that appeared in print on Friday, Jan. 5, 2024.","An article on Thursday about a colonel who said the Army punished him for claiming generals lied about Jan. 6 misstated Gen. Charles Flynn’s role in the Army at the time of the Jan. 6, 2021, attack on the Capitol. He was a deputy chief of staff, not the commander of the Pacific.","{'main': 'Corrections: Jan. 5, 2024', 'kicker': None, 'content_kicker': None, 'print_headline': 'Corrections', 'name': None, 'seo': None, 'sub': None}",[],2024-01-05T12:56:59+0000,article,Corrections
"With its simple olive oil, lemon and garlic dressing, Julia Moskin’s kale classic is a launchpad for any and all improvisations.","Good morning. I took a few days off and went down to Florida to visit family. We ate like royals. There was bo ssam for Christmas Eve and ham for dinner the next day. One night led to barbecue shrimp straight from the boat, another to grouper fish tacos from a similar vessel.","{'main': 'Our Five-Star Kale Salad to Zhuzh Up However You Please', 'kicker': None, 'content_kicker': None, 'print_headline': '', 'name': None, 'seo': None, 'sub': None}","['Cooking and Cookbooks', 'Content Type: Service']",2024-01-05T13:00:03+0000,article,Food
"The agency authorized Florida to purchase medicines directly from wholesalers in Canada, where prices are far cheaper. Pharmaceutical companies oppose the plan.","The Food and Drug Administration has allowed Florida to import millions of dollars worth of medications from Canada at far lower prices than in the United States, overriding fierce decades-long objections from the pharmaceutical industry.","{'main': 'F.D.A. Issues First Approval for Mass Drug Imports to States From Canada', 'kicker': None, 'content_kicker': None, 'print_headline': 'F.D.A. Opens Door To Import Drugs Made in Canada', 'name': None, 'seo': None, 'sub': None}","['Food and Drug Administration', 'Drugs (Pharmaceuticals)', 'Canada', 'Prices (Fares, Fees and Rates)', 'International Trade and World Market', 'States (US)', 'Florida', 'United States', 'Pharmaceutical Research and Manufacturers of America', 'Suits and Litigation (Civil)', 'Regulation and Deregulation of Industry', 'your-feed-healthcare']",2024-01-05T13:00:08+0000,article,Health
All eyes will be on the latest nonfarm payrolls data scheduled for release on Friday. Here’s what to look out for.,"Wall Street, the White House and the Fed will all be watching Friday’s jobs report for signs of how the labor market is holding up. The numbers may also deliver clues on the central bank’s next move on interest rates.","{'main': 'What Investors and the Fed Will Look For in the Jobs Report', 'kicker': 'DealBook Newsletter', 'content_kicker': None, 'print_headline': '', 'name': None, 'seo': None, 'sub': None}","['Labor and Jobs', 'Labor Department (US)', 'Federal Reserve System', 'United States Economy', 'Wages and Salaries']",2024-01-05T13:03:16+0000,article,Business Day
"Reading her audiobook memoir, “How to Say Babylon,” the poet gives voice to her Jamaican roots, her early ambition and the Rastafari father who would have quashed it.","After her strict Rastafari father threatens to kick her out of the family home for refusing to cower to his verbal abuse, a teenage Safiya Sinclair looks out into the darkness of the Jamaican mountains, “the thick countryside where our first slave rebellion was born,” and sees the specter of a woman dressed in white, her dreadlocked head bowed “under the gaze of a Rastaman.” The woman, she realizes, is herself, a harbinger of “the future that awaited me at my father’s hands.”","{'main': 'Audiobook of the Week: Safiya Sinclair’s Rhythmic Incantations', 'kicker': 'Audiobooks', 'content_kicker': None, 'print_headline': '', 'name': None, 'seo': None, 'sub': None}","['Sinclair, Safiya', 'How to Say Babylon: A Memoir (Book)', 'Audiobooks', 'Books and Literature', 'Poetry and Poets', 'Rastafarianism']",2024-01-05T13:11:49+0000,article,Books
"A predawn blaze raged for most of Friday near New York harbor, leading to the collapse of three buildings. Plumes of dark smoke were visible miles away.","More than 100 firefighters from New York City and northern New Jersey battled a large warehouse fire on Friday, pumping water from New York Harbor onto a blaze that eventually engulfed five industrial buildings in Elizabeth, N.J.","{'main': 'Fire Engulfs 5 Buildings at Storied Singer Sewing Industrial Site', 'kicker': None, 'content_kicker': None, 'print_headline': '', 'name': None, 'seo': None, 'sub': None}","['Fires and Firefighters', 'Buildings (Structures)', 'Elizabeth (NJ)', 'Staten Island (NYC)']",2024-01-05T13:22:57+0000,article,New York
"Donald Erwin, a 59-year-old disabled veteran, disappeared in 2013 after leaving his home in the Ozarks. Last month, a YouTube diver found his car submerged at a nearby property.","One morning in late December 2013, Donald L. Erwin, a 59-year-old disabled veteran, told his wife he was going to buy cigarettes.","{'main': 'He Went Out for Cigarettes. A Decade Later, His Car Was Found in a Pond.', 'kicker': None, 'content_kicker': None, 'print_headline': 'Lake Yields Man’s Remains, Closing a Decade-Old Case', 'name': None, 'seo': None, 'sub': None}","['Missing Persons', 'Deaths (Fatalities)', 'Diving and Divers', 'Traffic Accidents and Safety', 'Camdenton (Mo)']",2024-01-05T13:43:23+0000,article,U.S.
A talk with the co-creator of “Schitt’s Creek” on making the transition to drama with his feature directorial debut.,"“Good Grief” might have made an alternate name for “Schitt’s Creek,” the multi-Emmy-winning comedy Daniel Levy created and starred in with his father, Eugene. But unlike that series, which mined comedy from the dynamics of a family in financial crisis, Levy’s latest project, a drama, explores how loss affects a close-knit group of friends who are in their late 30s.","{'main': 'With ‘Good Grief,’ Daniel Levy Goes From Laughs to Tears', 'kicker': None, 'content_kicker': None, 'print_headline': 'Expert at Comedy, Keen on Drama', 'name': None, 'seo': None, 'sub': None}","['Movies', 'Levy, Daniel (Actor)', 'Good Grief (Movie)', ""Schitt's Creek (TV Program)""]",2024-01-05T14:00:10+0000,article,Movies
"The incumbent George Gascón, who was first elected in 2020, faces 11 challengers, many of them from within his own office.","After the murder of George Floyd in Minneapolis ignited protests across the country against police brutality, voters in Los Angeles County chose to take their criminal justice system in a new direction by electing George Gascón as district attorney.","{'main': 'Who Are All the Candidates Running for L.A. County District Attorney?', 'kicker': 'California Today', 'content_kicker': None, 'print_headline': '', 'name': None, 'seo': None, 'sub': None}",['California'],2024-01-05T14:00:16+0000,article,U.S.
Residents of 12 states are eligible to participate if they meet certain criteria. But the agency’s plans have already met resistance from tax preparation companies.,The Internal Revenue Service is rolling out a free option for filing federal tax returns this year to some residents of a dozen states.,"{'main': 'I.R.S. to Begin Trial of Its Own Free Tax-Filing System', 'kicker': 'your money adviser', 'content_kicker': None, 'print_headline': 'I.R.S. to Begin Trial of Free Tax-Filing System', 'name': None, 'seo': None, 'sub': None}","['Internal Revenue Service', 'Tax Preparers and Preparation', 'Income Tax', 'Personal Finances', 'Inflation Reduction Act of 2022', 'Content Type: Service', 'TurboTax (Intuit Inc)', 'Intuit Inc', 'United States Politics and Government']",2024-01-05T14:00:16+0000,article,Your Money
President Vladimir V. Putin is seeking to strengthen his military to fight in Ukraine while avoiding a potentially unpopular mobilization of Russians.,"President Vladimir V. Putin of Russia has approved a measure that makes it easier for foreigners to acquire Russian citizenship if they enlist in the army amid the war in Ukraine, part of an effort to increase the military’s ranks while also sparing Russians from being deployed to the battlefield.","{'main': 'To Bolster Russia’s Army, Putin Eases Citizenship Path for Foreign Fighters', 'kicker': None, 'content_kicker': None, 'print_headline': 'Putin Eases Citizenship Path for Foreign Fighters', 'name': None, 'seo': None, 'sub': None}","['Putin, Vladimir V', 'Russia', 'Russian Invasion of Ukraine (2022)', 'Citizenship and Naturalization', 'Defense and Military Forces', 'Foreign Workers', 'Draft and Recruitment (Military)']",2024-01-05T14:02:08+0000,article,World
"As leader of opera companies in Santa Fe and St. Louis, he welcomed new works as well as new artists.","Richard Gaddes, a British-born opera impresario who nurtured young talent as director of companies in Santa Fe, N.M., and St Louis, died on Dec. 12 in Manhattan. He was 81.","{'main': 'Richard Gaddes, Opera Impresario Who Spotted Young Talent, Dies at 81', 'kicker': None, 'content_kicker': None, 'print_headline': 'Richard Gaddes, 81, Opera Impresario Who Nurtured Talent', 'name': None, 'seo': None, 'sub': None}","['Gaddes, Richard', 'Deaths (Obituaries)', 'Opera', 'Opera Theater of St Louis', 'Santa Fe Opera']",2024-01-05T14:03:07+0000,article,Arts
"The collision of two trains, which injured 26 people, appears to have been caused by confusion over which vehicle had the right of way.","A collision between two subway trains in Manhattan on Thursday occurred when a train carrying about 300 passengers was driven into the path of an out-of-service train because of confusion over which vehicle had the right of way, according to three transit officials with knowledge of the investigation into the crash.","{'main': 'Human Error Likely Caused Subway Crash and Derailings, Officials Say', 'kicker': None, 'content_kicker': None, 'print_headline': 'Human Error Likely Cause of M.T.A. Crash and Derailment', 'name': None, 'seo': None, 'sub': None}","['Subways', 'Railroad Accidents and Safety', 'Stations and Terminals (Passenger)', 'Metropolitan Transportation Authority', 'New York City']",2024-01-05T14:26:23+0000,article,New York
"President Biden is using the weekend anniversary of the Capitol attack for a speech on democracy, seeking to set himself apart from Donald J. Trump, who is heading to Iowa.","Saturday is the third anniversary of the Jan. 6 attack on the Capitol. The consequences of that fateful day still reverberate through American politics, and its fallout looms intensely over the 2024 presidential race.","{'main': 'Three years later, Jan. 6 hangs over the presidential contest.', 'kicker': None, 'content_kicker': None, 'print_headline': '', 'name': None, 'seo': None, 'sub': None}","['Storming of the US Capitol (Jan, 2021)', 'Biden, Joseph R Jr', 'Trump, Donald J', 'DeSantis, Ron', 'Haley, Nikki R', 'Ramaswamy, Vivek (1985- )', 'Christie, Christopher J', 'Presidential Election of 2024']",2024-01-05T14:31:31+0000,article,U.S.
Details of a clash between the U.S. secretary of state and Israel’s prime minister point to the challenges ahead.,Secretary of State Antony J. Blinken is returning to the Middle East this week with the goals of getting Israel to curtail attacks that are killing thousands of Palestinian civilians and preventing the war from spreading across the region.,"{'main': 'Blinken Returns to Middle East as Tensions Grow With Israel', 'kicker': None, 'content_kicker': None, 'print_headline': 'Blinken Makes a Return To the Region as Discord With Israel Keeps Rising', 'name': None, 'seo': None, 'sub': None}","['Israel-Gaza War (2023- )', 'Israel', 'Defense and Military Forces', 'Hamas', 'Terrorism', 'Kidnapping and Hostages', 'Gaza Strip', 'Palestinians', 'Civilian Casualties', 'Blinken, Antony J', 'Biden, Joseph R Jr', 'Netanyahu, Benjamin', 'Middle East', 'United States International Relations']",2024-01-05T14:56:35+0000,article,U.S.
"The S&P 500 logged its first weekly decline since October, ending Wall Street’s longest winning streak in nearly 20 years.","Wall Street’s longest weekly winning streak in almost 20 years came to an end on Friday, as stock investors’ celebrations over slowing inflation and the potential for cuts to interest rates were replaced with caution over the lingering risks to the economy.","{'main': 'Wall Street Sobers Up After December’s Rally', 'kicker': None, 'content_kicker': None, 'print_headline': 'Streak Ends, Sobering Up Wall Street', 'name': None, 'seo': None, 'sub': None}","['Stocks and Bonds', ""Standard & Poor's 500-Stock Index"", 'Government Bonds', 'Interest Rates', 'Nasdaq Composite Index', 'United States Economy', 'Federal Reserve System']",2024-01-05T14:57:04+0000,article,Business Day
"As part of Under the Radar, Nile Harris resurrects his play that weaves together text, sound, minstrelsy and dance to explore the American experience.","What makes a house a home? And what constitutes an American home? Planted dead center on the stage in “This House Is Not a Home,” a slippery, ever-shifting work by Nile Harris, is a house — a bounce house. But it’s more than an inflatable plaything.","{'main': 'In a Land of Primary Colors, Home Is Where the Bounce House Is', 'kicker': None, 'content_kicker': None, 'print_headline': 'Home Is Where The Bounce House Is', 'name': None, 'seo': None, 'sub': None}","['Harris, Nile (Choreographer)', 'Content Type: Personal Profile', 'This House Is Not a Home (Play)', 'Black People', 'Blacks', 'Dancing', 'Theater', 'Under the Radar Festival', 'ABRONS ARTS CENTER']",2024-01-05T15:00:27+0000,article,Arts
"Next month, over 100 works by Black art stars from the couple’s collection will travel to the Great Hall for “Giants.”","Call it an embarrassment of riches: The musician Alicia Keys and her husband Kasseem Dean, the producer and D.J. known professionally as Swizz Beatz, have purchased such massive artworks that only a few could squeeze inside their homes in California, New York and New Jersey. Some colossal paintings by artists like Kehinde Wiley, Derrick Adams and Titus Kaphar eventually got through the door and became staples of the couple’s daily routine — backdrops to movie nights and family parties.","{'main': 'Brooklyn Museum, Courting Pop-Culture Icons, Readies for Alicia Keys and Swizz Beatz', 'kicker': None, 'content_kicker': None, 'print_headline': 'Large Art, By Way Of Some Big Names', 'name': None, 'seo': None, 'sub': None}","['Art', 'Brooklyn Museum', 'Keys, Alicia', 'Dean, Kasseem (Swizz Beatz)', 'Collectors and Collections', 'Museums']",2024-01-05T15:00:37+0000,article,Arts
The 30-second spot is set to air on cable channels and during Sunday network news programs in the United States for the next several weeks.,The families of Americans held hostage in Gaza since the Oct. 7 Hamas attacks in southern Israel have released a television ad to press for urgent action to rescue their loved ones.,"{'main': '‘Bring Them Home’: Families of American Hostages in Gaza Release TV Ad', 'kicker': None, 'content_kicker': None, 'print_headline': '', 'name': None, 'seo': None, 'sub': None}","['Israel-Gaza War (2023- )', 'Kidnapping and Hostages', 'Advertising and Marketing', 'Israel']",2024-01-05T15:24:07+0000,article,World
Mukhtar Babayev has been appointed to preside over this year’s global climate talks in Azerbaijan.,"Azerbaijan’s minister of ecology and natural resources, who occupies a relatively obscure position in the country’s authoritarian government, was appointed president of the annual United Nations-sponsored climate summit that will be held in the country in November. The announcement thrusts him into a role defined by the intense pressure of brokering negotiations on one of the most complex crises to ever face humanity.","{'main': 'An Ecology Minister With an Oil Pedigree Will Lead Global Climate Talks', 'kicker': None, 'content_kicker': None, 'print_headline': 'Ecology Minister To Lead U.N. Global Climate Talks', 'name': None, 'seo': None, 'sub': None}","['Global Warming', 'United Nations Framework Convention on Climate Change', 'Oil (Petroleum) and Gasoline', 'Appointments and Executive Changes', 'Babayev, Mukhtar (1967- )', 'Azerbaijan', 'Socar']",2024-01-05T15:54:53+0000,article,Climate
"Jaap van Zweden returned to the orchestra for the first time since October with a conservative lineup of works by Wagner, Beethoven and Brahms.","With the new year, it’s the homestretch for Jaap van Zweden’s six-year tenure as music director of the New York Philharmonic, which ends this spring.","{'main': 'Review: The Philharmonic’s Maestro Revels in the Classics', 'kicker': 'Critic’s Pick', 'content_kicker': None, 'print_headline': 'A Maestro Chooses to Revel in the Classics', 'name': None, 'seo': None, 'sub': None}","['Classical Music', 'New York Philharmonic', 'van Zweden, Jaap']",2024-01-05T15:59:15+0000,article,Arts
"This month’s picks riff on disorientation, with an unknowable ex, an unnatural house and an uncanny dad.","Steph (Steph Holmbo) starts a new life after leaving her awful boyfriend by getting a new apartment and a new group of friends. But she’s having bizarre dreams of traipsing through the woods, and what’s worse, her furniture sometimes moves on its own. Then, in this strange film’s strangest scene, Steph digs out the flesh of a giant watermelon, turning the floor where she’s sitting into what looks like a brutal crime scene — a taste of the spectral, time-collapsing horrors to come.","{'main': 'Five Horror Movies to Stream Now', 'kicker': None, 'content_kicker': None, 'print_headline': 'These Films Will Leave Your Head Spinning', 'name': None, 'seo': None, 'sub': None}",['Movies'],2024-01-05T16:00:02+0000,article,Movies
"The Africa Cup of Nations and the Asian Cup, once seen as poorly timed intrusions by European soccer, may finally be getting the respect they deserve.","At last, we appear to be getting somewhere. Late on New Year’s Day, Mohamed Salah’s beaming face appeared on British television screens. Salah always has the slightly ruffled appearance of a man who has not slept desperately well, but he was in distinctly good cheer.","{'main': 'Out of Sight, Out of Mind No More', 'kicker': 'The On Soccer Newsletter', 'content_kicker': None, 'print_headline': 'Players, if Not Fans, Know the Africa and Asian Cups Matter', 'name': None, 'seo': None, 'sub': None}","['Soccer', 'African Cup of Nations (Soccer)', 'Asian Cup (Soccer)', 'English Premier League', 'Europe', 'AFRICA', 'Far East, South and Southeast Asia and Pacific Areas', 'Salah, Mohamed (1992- )']",2024-01-05T16:15:05+0000,article,World
"Anjali Huynh, a politics reporter for The New York Times, spoke to young voters about the 2024 presidential election.","Anjali Huynh, a politics reporter for The New York Times, spoke to young voters about the 2024 presidential election.","{'main': 'Young Voters Worry About a Biden-Trump Rematch', 'kicker': None, 'content_kicker': None, 'print_headline': '', 'name': None, 'seo': None, 'sub': None}","['Presidential Election of 2024', 'Voting and Voters']",2024-01-05T16:15:19+0000,multimedia,U.S.
The dissatisfaction with the presidential front-runners among a key coalition of voters — who may vote third party or not at all — poses a serious threat to the president’s re-election effort.,"The first time Lucy VanDyke voted for president, she reluctantly supported Joseph R. Biden Jr. But she says she won’t be doing that again.","{'main': 'Young Voters Are Voicing Discontent: ‘I Don’t Want a Biden-Trump Rematch’', 'kicker': None, 'content_kicker': None, 'print_headline': 'Prospect of a Rematch Of Biden-Trump Causes Young Voters to Retreat', 'name': None, 'seo': None, 'sub': None}","['Biden, Joseph R Jr', 'Trump, Donald J', 'Presidential Election of 2024', 'United States Politics and Government', 'Youth', 'Polls and Public Opinion']",2024-01-05T16:15:28+0000,article,U.S.
"The men, who were described by the police as “homophobic, racist, antisemitic, Islamophobic and misogynistic,” received eight- and seven-year sentences.",Two neo-Nazi podcasters who called for the execution of Prince Harry were sentenced to prison in London on Thursday.,"{'main': 'Neo-Nazi Podcasters Who Called for Prince Harry’s Death Receive Prison Sentences', 'kicker': None, 'content_kicker': None, 'print_headline': '', 'name': None, 'seo': None, 'sub': None}","['Neo Nazi Groups', 'Right-Wing Extremism and Alt-Right', 'Scotland Yard (Metropolitan Police Service)', 'Harry, Duke of Sussex']",2024-01-05T16:17:37+0000,article,World
"Heavy, wet snow from the storm could cause power failures in some areas, especially in parts of New England, forecasters said.","A strong winter storm will drop the first significant snow of the season across parts of the Northeast this weekend, bringing up to a foot of snow in some places across the northern Mid-Atlantic and New England.","{'main': 'Winter Storm Moves Into the Northeast and New York City Could Get a Dose', 'kicker': None, 'content_kicker': None, 'print_headline': '', 'name': None, 'seo': None, 'sub': None}","['Snow and Snowstorms', 'Northeastern States (US)']",2024-01-05T16:28:10+0000,article,U.S.
The recall follows a similar move by the company in the United States to upgrade the cars’ Autopilot feature.,"The Chinese government announced on Friday that Tesla would recall practically all of the cars it has sold in the country to adjust their assisted-driving systems, less than a month after a similar recall in the United States.","{'main': 'Tesla Recalls 1.6 Million Cars in China to Fix Self-Driving Systems', 'kicker': None, 'content_kicker': None, 'print_headline': 'Tesla Recalls Cars in China To Fix Self-Driving Systems', 'name': None, 'seo': None, 'sub': None}","['Tesla Motors Inc', 'Recalls and Bans of Products', 'Electric and Hybrid Vehicles', 'China', 'Automobiles', 'Driverless and Semiautonomous Vehicles', 'Regulation and Deregulation of Industry', 'Traffic Accidents and Safety', 'National Highway Traffic Safety Administration', 'United States']",2024-01-05T16:34:44+0000,article,Business Day
"Despite calls from politicians for her resignation, Sally Kornbluth has avoided a concerted effort to bring down her presidency.","As the presidents of Harvard and the University of Pennsylvania were pushed out of their jobs in recent weeks, it was an open question whether the president of another prestigious institution, the Massachusetts Institute of Technology, would suffer the same fate.","{'main': 'M.I.T.’s President Has Weathered the Storm, for Now', 'kicker': None, 'content_kicker': None, 'print_headline': 'President of M.I.T. Has Weathered the Storm, for Now', 'name': None, 'seo': None, 'sub': None}","['Colleges and Universities', 'Massachusetts Institute of Technology', 'Kornbluth, Sally A', 'Demonstrations, Protests and Riots', 'Anti-Semitism', 'Freedom of Speech and Expression', 'Israel-Gaza War (2023- )']",2024-01-05T16:50:08+0000,article,U.S.
"The Tony winner for best musical, about a high school girl with a rare genetic disorder and a criminally dysfunctional family, will begin a national tour in September.","“Kimberly Akimbo,” a quirky show that combined pathos and comedy to win last year’s Tony Award for best musical, will end its Broadway run in April, nearly 19 months after it began performances.","{'main': '‘Kimberly Akimbo’ Will End Its Broadway Run in April', 'kicker': None, 'content_kicker': None, 'print_headline': '‘Kimberly Akimbo’ Will End Its Broadway Run in April', 'name': None, 'seo': None, 'sub': None}","['Theater', 'Theater (Broadway)', 'Kimberly Akimbo (Play)']",2024-01-05T17:00:08+0000,article,Theater
"The former president has visited the state infrequently, at least compared with his rivals in the Republican primary.","Former President Donald J. Trump will return to Iowa on Friday for the first time this year, and will hold four campaign rallies in two days there as he looks to cement his dominant lead in the polls as the Iowa caucuses draw nearer.","{'main': 'Trump Turns His Attention to Iowa as Caucuses Grow Near', 'kicker': None, 'content_kicker': None, 'print_headline': '', 'name': None, 'seo': None, 'sub': None}","['Trump, Donald J', 'Presidential Election of 2024', 'Primaries and Caucuses', 'United States Politics and Government', 'Republican Party', 'Iowa']",2024-01-05T17:00:09+0000,article,U.S.
