abstract,lead_paragraph,headline,keywords,pub_date,document_type,section_name
In case you need some puzzle help.,"Welcome to The Wordle Review. Be warned: This page contains spoilers for today’s puzzle. Solve Wordle first, or scroll at your own risk.","{'main': 'Today’s Wordle Review', 'kicker': None, 'content_kicker': None, 'print_headline': '', 'name': None, 'seo': None, 'sub': None}",['Wordle (Puzzle)'],2024-01-15T15:34:13+0000,article,Crosswords & Games
Joseph Tacopina brought extensive experience with high-profile cases to former president Donald J. Trump’s legal team.,"Joseph Tacopina, the trial lawyer on Donald J. Trump’s legal team with the most successes defending high-profile clients, will no longer represent the former president in his criminal trial in Manhattan, according to a notice sent to the court on Monday.","{'main': 'Key Trump Lawyer Withdraws as Manhattan Criminal Trial Nears', 'kicker': None, 'content_kicker': None, 'print_headline': 'Key Trump Lawyer Withdraws as Manhattan Criminal Trial Nears', 'name': None, 'seo': None, 'sub': None}","['New York State Criminal Case Against Trump (71543-23)', 'Tacopina, Joseph', 'Trump, Donald J', 'Manhattan (NYC)']",2024-01-15T15:37:16+0000,article,U.S.
"Snowstorms, a thinning field of candidates and Donald Trump’s polling lead contributed to a smaller media turnout for the nation’s first caucus.",Follow for live updates on the Iowa caucuses.,"{'main': 'This Again? In Frozen Iowa, the Press Corps Ponders a Slog of a Campaign.', 'kicker': 'Media Memo', 'content_kicker': None, 'print_headline': 'In Frozen Iowa, a Compact Press Corps Ponders a Slog of a Campaign', 'name': None, 'seo': None, 'sub': None}","['Television', 'Presidential Election of 2024', 'News and News Media', 'Primaries and Caucuses', 'Snow and Snowstorms', 'Media', 'Des Moines (Iowa)', 'Muir, David', 'NBC News', 'MSNBC', 'Associated Press']",2024-01-15T15:39:15+0000,article,Business Day
It’s the sort of gleefully pungent dish that brightens up the dullest winter weeknight.,"Is it me, or is a clear sky bluer in winter than in summer? Maybe it’s because, on my daily jaunts in the park, everything else is muted with little or no greenery or blossoms to compete with, so the blue always seems ready to burst between the bare branches.","{'main': 'Horseradish-Roasted Salmon With Mustard Potatoes Packs a Solid Punch', 'kicker': None, 'content_kicker': None, 'print_headline': '', 'name': None, 'seo': None, 'sub': None}","['Cooking and Cookbooks', 'Content Type: Service']",2024-01-15T16:00:03+0000,article,Food
Responses to an article in the “Uncharted Waters” series. Also: Paxlovid and Covid; Taylor Swift’s fans; Democratic vice-presidential choices.,To the Editor:,"{'main': 'What America’s Eating Affects Its Water Supply', 'kicker': 'letters', 'content_kicker': None, 'print_headline': 'What America’s Eating Affects Its Water', 'name': None, 'seo': None, 'sub': None}","['Food', 'Diet and Nutrition', 'Water', 'Water Pollution', 'Coronavirus (2019-nCoV)', 'Paxlovid (Drug)', 'Swift, Taylor', 'Pop and Rock Music', 'Presidential Election of 2024', 'Vice Presidents and Vice Presidency (US)', 'Harris, Kamala D', 'Whitmer, Gretchen', 'Biden, Joseph R Jr']",2024-01-15T16:00:13+0000,article,Opinion
Britain’s national library made the first major steps in its recovery process after a ransomware group took down its website and online catalog.,"The British Library on Monday began restoring its online catalog, which holds details of books, journals and music scores, the first step in its recovery from a brazen cyberattack in October, the library said.","{'main': 'Months After Cyberattack, British Library Crawls Back Online', 'kicker': None, 'content_kicker': None, 'print_headline': 'A Hacked British Library Is Staggering Back Online', 'name': None, 'seo': None, 'sub': None}","['Libraries and Librarians', 'Cyberattacks and Hackers', 'British Library', 'Great Britain']",2024-01-15T16:04:30+0000,article,Arts
"The Premier League announced charges against Everton and Nottingham Forest, increasing the risk that both clubs could be relegated at the end of the season.","Everton, which tumbled down the Premier League standings after receiving a record 10-point deduction in November, faces the prospect of a second points penalty for new violations of the competition’s financial regulations.","{'main': 'Everton Faces Second Points Penalty in New Financial Case', 'kicker': None, 'content_kicker': None, 'print_headline': '2nd Penalty For Finances Is Looming For Everton', 'name': None, 'seo': None, 'sub': None}","['Soccer', 'English Premier League', 'Everton (Soccer Team)', 'Nottingham Forest (Soccer Team)', 'Fines (Penalties)']",2024-01-15T16:30:59+0000,article,World
"In Texas, where a 2021 storm killed 246 people and knocked out electricity for millions, officials urged residents to conserve power.","Extreme weather gripped large parts of the Southern United States on Monday, with ice and snow hampering plans to commemorate the Rev. Dr. Martin Luther King Jr.’s birthday, and several governors declaring states of emergency.","{'main': 'Biting Cold Sweeping U.S. Hits the South With an Unfamiliar Freeze', 'kicker': None, 'content_kicker': None, 'print_headline': 'Biting Cold Sweeping Much of U.S. Hits South With Unfamiliar Freeze', 'name': None, 'seo': None, 'sub': None}","['Snow and Snowstorms', 'Southern States (US)']",2024-01-15T16:39:08+0000,article,U.S.
His innovations in the use of drugs to prevent organ rejection helped bring a remarkable increase in the one-year survival rate.,"Roy Calne, a British surgeon whose work on organ transplantation helped turn what was once considered impossible into a lifesaving procedure for millions of people around the world, died on Jan. 6 at a retirement home in Cambridge, England. He was 93.","{'main': 'Roy Calne, Pioneering British Organ-Transplant Surgeon, Dies at 93', 'kicker': None, 'content_kicker': None, 'print_headline': 'Roy Calne, 93, Surgeon  Who Persevered to Prove  Organ Transplants Work', 'name': None, 'seo': None, 'sub': None}","['Calne, Roy Y', 'Surgery and Surgeons', 'Transplants', 'Liver', 'Doctors', 'Great Britain', 'Deaths (Obituaries)']",2024-01-15T16:42:48+0000,article,Health
Some states have consistent enough histories to allow that question to be answered with relative confidence. Iowa is not one of them.,Check here after initial votes are reported to get our live estimates of the race’s outcome.,"{'main': 'When Will Iowa Caucus Results Be In?', 'kicker': None, 'content_kicker': None, 'print_headline': '', 'name': None, 'seo': None, 'sub': None}","['Politics and Government', 'Presidential Election of 2024', 'Primaries and Caucuses', 'Republican Party', 'Trump, Donald J', 'DeSantis, Ron', 'Haley, Nikki R', 'Iowa']",2024-01-15T16:47:09+0000,article,U.S.
"The victim, Richard Henderson, “got shot stepping into an altercation that he had nothing to do with,” his wife said. He was killed on a No. 3 train.","Next month would have marked the 30th year that Richard and Jakeba Henderson had been together, and March the 20th year they had been married.","{'main': 'Grandfather Who Tried to Break Up Fight Is Killed in Subway Shooting', 'kicker': None, 'content_kicker': None, 'print_headline': 'Man Is Fatally Shot Aboard A Subway Train in Brooklyn', 'name': None, 'seo': None, 'sub': None}","['Subways', 'Murders, Attempted Murders and Homicides', 'New York City']",2024-01-15T16:56:40+0000,article,New York
"At the Francis Kite Club, a collectively-built space for artists people debate culture and politics over cocktails.","There is something bigger than beer brewing at the Francis Kite Club, a new haunt in the East Village whose artists hold performances, shape its programming and debate politics from their barstools.","{'main': 'Museum Director Laura Raicovich Gets a Second Act: Barkeep', 'kicker': None, 'content_kicker': None, 'print_headline': 'Museum Director  Has a Second Act  As a Barkeep', 'name': None, 'seo': None, 'sub': None}","['Art', 'Bars and Nightclubs', 'Queens Museum', 'Raicovich, Laura', 'East Village (Manhattan, NY)', 'Francis Kite Club']",2024-01-15T16:57:07+0000,article,Arts
Collectors give the museum 27 box constructions and collages by the homebody artist who rarely left Queens but became a central figure in 20th century art.,"Joseph Cornell, who died in 1972 at the age of 69, belongs to the tradition of the homebody-artist. A gray whisper of a man, he eschewed the excitements of travel in favor of a tea-filled life in his house on Utopia Parkway in Queens. His medium was the Box — that is, the Victorian-era shadow box, and he spent his days in his basement workshop, assembling cork balls, paper cutouts of birds and other dime-store material into improbably poetic arrangements that owed something to French Surrealism.","{'main': 'National Gallery of Art Receives Major Gift of Joseph Cornell Boxes', 'kicker': None, 'content_kicker': None, 'print_headline': 'National Gallery Receives Major Gift of Joseph Cornell Boxes', 'name': None, 'seo': None, 'sub': None}","['Art', 'National Gallery of Art', 'Cornell, Joseph', 'Collectors and Collections', 'Museums', 'Hirshhorn Museum and Sculpture Garden', 'Washington (DC)']",2024-01-15T17:18:46+0000,article,Arts
"The secretary, Lloyd J. Austin III, kept the White House in the dark about his hospitalization for several days, a major breach of protocol at the highest national security levels.","Defense Secretary Lloyd J. Austin III was released from the hospital on Monday, after a two-week stay for complications from prostate cancer surgery that he had kept secret from the White House for several days, the Pentagon announced.","{'main': 'U.S. Defense Secretary Is Released From the Hospital After 2 Weeks', 'kicker': None, 'content_kicker': None, 'print_headline': 'Austin Released From Hospital After Complications From Prostate Cancer Surgery', 'name': None, 'seo': None, 'sub': None}","['Defense Department', 'Reed, Walter, National Military Medical Center', 'Austin, Lloyd J III', 'Washington (State)', 'United States Defense and Military Forces', 'Prostate Cancer', 'United States Politics and Government', 'Biden, Joseph R Jr']",2024-01-15T17:39:37+0000,article,U.S.
"Presidential candidates often enmesh themselves in the state’s politics to woo voters, but the nature of this race means much less focus on local issues.","Campaigning in Iowa in the months leading up to the caucuses has traditionally involved candidates’ embracing local customs, visiting familiar locations and championing policies aimed at helping the state’s farm-driven economy.","{'main': 'How Trump Sidestepped the Tradition of Iowa Pandering', 'kicker': None, 'content_kicker': None, 'print_headline': '', 'name': None, 'seo': None, 'sub': None}","['Iowa', 'Primaries and Caucuses', 'Trump, Donald J', 'Haley, Nikki R', 'Ramaswamy, Ashwini', 'DeSantis, Ron']",2024-01-15T18:00:32+0000,article,U.S.
"Get live election results, maps and our live forecast of the outcome from the Iowa Republican caucus.","Get live election results, maps and our live forecast of the outcome from the Iowa Republican caucus.","{'main': 'Iowa Caucus Results', 'kicker': None, 'content_kicker': None, 'print_headline': '', 'name': None, 'seo': None, 'sub': None}","['internal-paywall-exempt', 'Elections', 'Iowa', 'Christie, Christopher J', 'Hutchinson, Asa', 'Trump, Donald J', 'Haley, Nikki R', 'Ramaswamy, Vivek (1985- )', 'DeSantis, Ron', 'Presidential Election of 2024', 'Presidential Elections (US)', 'Primaries and Caucuses']",2024-01-15T18:18:24+0000,multimedia,U.S.
"The candidates — and their campaigns — are a study in contrasts, from the vibes of their events to how they interact with voters and the press.","For months, Nikki Haley and Ron DeSantis, Republican contenders locked in a heated rivalry for second place in their party’s 2024 presidential nominating contest, have been crisscrossing Iowa ahead of the first-in-the-nation caucuses.","{'main': 'Our DeSantis and Haley Reporters Switched Places. Here’s What They Found.', 'kicker': None, 'content_kicker': None, 'print_headline': 'What Our Campaign Reporters Found When They Traded Places', 'name': None, 'seo': None, 'sub': None}","['Presidential Election of 2024', 'Primaries and Caucuses', 'Republican Party', 'DeSantis, Ron', 'Haley, Nikki R']",2024-01-15T18:35:26+0000,article,U.S.
"The government said it would designate the international Islamist political group a terrorist organization, citing what it said was Hizb ut-Tahrir’s praise for the Oct. 7 attack on Israel.","The British government plans to ban Hizb ut-Tahrir, an international Islamist political group, by designating it a terrorist organization, the government announced on Monday, citing what it said was the group’s praise for the Oct. 7 Hamas-led attack on Israel.","{'main': 'Britain Moves to Ban the Islamist Group Hizb ut-Tahrir', 'kicker': None, 'content_kicker': None, 'print_headline': 'Britain to Ban Organization Of Islamists', 'name': None, 'seo': None, 'sub': None}","['Israel-Gaza War (2023- )', 'Hizb ut-Tahrir', 'Terrorism', 'Cameron, David', 'Blair, Tony', 'Cleverly, James', 'Tugendhat, Tom', 'Great Britain']",2024-01-15T19:52:40+0000,article,World
None of the governors who set interest rates have dissented from a rate decision since 2005.,"For governors of the Federal Reserve, dissenting from rate-setting decisions has become as gauche as wearing tie-dye to a funeral. As the chart below shows, dissents by governors went out of fashion around 1995. The last time any governor cast a contrary vote on a decision by the Federal Open Market Committee was September 2005. (For your next Fed trivia contest: That was Mark Olson, an appointee of President George W. Bush, who thought monetary policy should be more dovish.)","{'main': 'Is the Fed Falling Prey to Groupthink?', 'kicker': 'Peter Coy', 'content_kicker': None, 'print_headline': '', 'name': None, 'seo': None, 'sub': None}","['internal-sub-only-nl', 'Federal Reserve System', 'Interest Rates', 'Federal Open Market Committee', 'Inflation (Economics)']",2024-01-15T20:00:03+0000,article,Opinion
"A four-time Pro Bowl selection, he spent seven years with the Philadelphia Eagles, where his record was better than the team’s.","Norm Snead, a National Football League quarterback for 16 seasons in the 1960s and ’70s and a four-time Pro Bowl selection, died on Sunday at his home in Naples. Fla. He was 84.","{'main': 'Norm Snead, Skillful Loser as an N.F.L. Quarterback, Is Dead at 84', 'kicker': None, 'content_kicker': None, 'print_headline': 'Norm Snead, 84, a 4-Time Pro Bowl Quarterback Traded for a Hall of Famer', 'name': None, 'seo': None, 'sub': None}","['Snead, Norm (1939-2024)', 'Football', 'National Football League', 'Pro Bowl', 'Philadelphia Eagles', 'Wake Forest University', 'Deaths (Obituaries)']",2024-01-15T20:13:26+0000,article,Sports
"Also, the Iowa caucuses and Indigenous tourism.","Houthi fighters fired a missile yesterday that caused limited damage to a U.S.-owned cargo vessel off the coast of Yemen, the U.S. military said.","{'main': 'Tuesday Briefing: Houthis Attack a U.S. Ship', 'kicker': None, 'content_kicker': None, 'print_headline': '', 'name': None, 'seo': None, 'sub': None}","['Far East, South and Southeast Asia and Pacific Areas']",2024-01-15T20:46:27+0000,article,World
"Hila Rotem Shoshani, 13, is the youngest of the hostages freed from Gaza to speak out about the harsh conditions in which they were held.","Hila Rotem Shoshani had invited her friend Emily Hand over for a sleepover in Kibbutz Be’eri, Israel. The girls, then 12 and 8, woke early the next morning, Oct. 7, to the sound of thundering booms — the start of the deadliest attack in the history of their country.","{'main': 'Israeli Teenager Recounts Her Time as a Hostage in Gaza', 'kicker': None, 'content_kicker': None, 'print_headline': 'Young Israeli  Tells of Time  As a Hostage  After Oct. 7', 'name': None, 'seo': None, 'sub': None}","['Kidnapping and Hostages', 'Hamas', 'Israel-Gaza War (2023- )']",2024-01-15T20:49:14+0000,article,World
Ice and snow created dangerous driving conditions in parts of the southern United States and led several governors to declare states of emergency.,Ice and snow created dangerous driving conditions in parts of the southern United States and led several governors to declare states of emergency.,"{'main': 'Arctic Air Freezes Parts of the South', 'kicker': None, 'content_kicker': None, 'print_headline': '', 'name': None, 'seo': None, 'sub': None}","['Southern States (US)', 'Snow and Snowstorms']",2024-01-15T20:50:40+0000,multimedia,U.S.
"A video captured the moment when a winter storm surge knocked the last of the historic shacks, a local attraction and backdrop for paintings and photos, into Casco Bay.",The fishing shacks that once perched on the rocks at Willard Beach in South Portland were part of a childhood that Maureen Connolly described on Monday as “quintessential Maine.”,"{'main': '‘Oh No, They’re Both Gone’: Beloved Maine Fishing Shacks Tumble Into Bay', 'kicker': None, 'content_kicker': None, 'print_headline': '', 'name': None, 'seo': None, 'sub': None}","['Coastal Areas', 'Oceans and Seas', 'Fishing, Commercial', 'Maine', 'Portland (Me)', 'Video Recordings, Downloads and Streaming', 'Beaches', 'Historic Buildings and Sites']",2024-01-15T21:01:35+0000,article,U.S.
They argued that the future of the nation would be at risk if former President Donald J. Trump were re-elected.,"All the political action in Iowa may be among Republicans, but President Biden’s campaign sought on Monday to get a piece of the action, sending three top surrogates to Des Moines to promote his agenda and trash his potential opponents.","{'main': 'Pritzker Is Among Democrats Making Case for Biden in Iowa', 'kicker': None, 'content_kicker': None, 'print_headline': '', 'name': None, 'seo': None, 'sub': None}","['Presidential Election of 2024', 'Democratic Party', 'Biden, Joseph R Jr', 'Katzenberg, Jeffrey', 'Pritzker, J B', 'Smith, Tina F', 'Des Moines (Iowa)']",2024-01-15T21:36:58+0000,article,U.S.
Coming in second can be a win in early-state contests.,One thing is certain in tonight’s Iowa caucuses: The loser will make a triumphant victory speech.,"{'main': 'The Joy of Defeat in the Iowa Caucuses', 'kicker': None, 'content_kicker': None, 'print_headline': '', 'name': None, 'seo': None, 'sub': None}","['Elections', 'Presidential Election of 2024', 'Politics and Government', 'Olympic Games (2022)', 'Weather', 'Iowa', 'DeSantis, Ron', 'Haley, Nikki R', 'Trump, Donald J']",2024-01-15T22:05:41+0000,article,U.S.
"The Needle can offer a much clearer picture of the outcome of an election than the early returns, which are often biased toward a particular candidate.","Once polls close in the New Hampshire primary tonight, The Times will start publishing a live estimate of the final result, better known as the Needle.","{'main': 'The Needle Returns for the New Hampshire Republican Primary', 'kicker': None, 'content_kicker': None, 'print_headline': '', 'name': None, 'seo': None, 'sub': None}","['Presidential Election of 2024', 'Primaries and Caucuses', 'Iowa']",2024-01-15T22:34:08+0000,article,U.S.
The decision to place another festival right on top of Jazzfest highlighted how much has been flipped upside-down in jazz over the past 20 years.,"Back in 2005 — when the first NYC Winter Jazzfest was held at the Knitting Factory in Lower Manhattan, and Jazz at Lincoln Center’s multimillion-dollar facilities had recently opened on the Upper West Side — it was clear which represented the establishment, and which was proposing an alternative. Today, it’s not such an easy distinction.","{'main': 'Winter Jazzfest Has Company: Unity Jazz Festival', 'kicker': 'Critic’s Notebook', 'content_kicker': None, 'print_headline': 'Winter Jazz Gets a Bit Crowded', 'name': None, 'seo': None, 'sub': None}","['Jazz', 'Winter Jazzfest', 'Jazz at Lincoln Center', 'Festivals']",2024-01-15T22:51:16+0000,article,Arts
"The trophies were supposed to have been handed out in September, but were delayed by Hollywood’s labor problems.",Nominations were announced six months ago. The ceremony was supposed to take place in September. So why on earth are the Emmys happening now?,"{'main': 'Why are the 2023 Emmy Awards taking place in 2024?', 'kicker': None, 'content_kicker': None, 'print_headline': '', 'name': None, 'seo': None, 'sub': None}","['Emmy Awards', 'Television', 'Strikes', 'Writers Guild of America']",2024-01-15T23:00:13+0000,article,Arts
"Here are the winners from the 75th Emmy Awards, which took place Monday night.",[See all of our Emmys night coverage here.],"{'main': 'Emmy Winners: The Full List', 'kicker': None, 'content_kicker': None, 'print_headline': 'And the Winners Are ...', 'name': None, 'seo': None, 'sub': None}","['Television', 'Emmy Awards', 'Actors and Actresses']",2024-01-15T23:00:13+0000,article,Arts
One of our reporters grew up in Iowa City and was inspired to become a journalist after witnessing the caucuses in action. Another touched down here for the first time two months ago. They compared notes.,"KELLEN BROWNING If you were trying to think of a city that feels like the polar opposite of San Francisco, Des Moines would be a pretty good bet.","{'main': 'My Iowa: Covering the Caucuses as a Native or a Newcomer', 'kicker': None, 'content_kicker': None, 'print_headline': '', 'name': None, 'seo': None, 'sub': None}","['Primaries and Caucuses', 'Presidential Election of 2024', 'News and News Media', 'Politics and Government', 'Ramaswamy, Vivek (1985- )', 'New York Times', 'Des Moines (Iowa)']",2024-01-15T23:01:58+0000,article,U.S.
"Stars brought fringe, floral and skin to the 75th Emmy Awards.","Television’s big night is finally here. Last summer, one day after the 75th Emmy Award nominations were announced, the Screen Actors Guild voted to strike, postponing the ceremony to January.","{'main': 'See the Looks From the Emmys Red Carpet', 'kicker': None, 'content_kicker': None, 'print_headline': '', 'name': None, 'seo': None, 'sub': None}","['Television', 'Emmy Awards', 'Fashion and Apparel']",2024-01-15T23:18:58+0000,article,Style
