abstract,lead_paragraph,headline,keywords,pub_date,document_type,section_name
"The Israeli leader has come under international pressure to drop a threatened incursion into the city where more than a million Palestinians are gathered, seeking refuge from the war.","Prime Minister Benjamin Netanyahu of Israel insisted on Saturday that Israel would not bow to international pressure to call off its plan for a ground invasion of Rafah, the southernmost city in Gaza that is now packed with more than a million Palestinians.","{'main': 'Netanyahu Says He Won’t Bow to Pressure to Call Off Rafah Invasion', 'kicker': None, 'content_kicker': None, 'print_headline': 'Netanyahu Vows Not to Call Off Invasion as Global Pressure Grows', 'name': None, 'seo': None, 'sub': None}","['Israel-Gaza War (2023- )', 'Israel', 'Netanyahu, Benjamin', 'Defense and Military Forces', 'Gaza Strip', 'Rafah (Gaza Strip)', 'Palestinians', 'Civilian Casualties', 'Refugees and Displaced Persons', 'Hamas', 'Terrorism', 'International Relations', 'Politics and Government', 'International Court of Justice (UN)', 'United Nations', 'Egypt', 'War Crimes, Genocide and Crimes Against Humanity']",2024-02-18T00:50:32+0000,article,World
Nikki Haley has long criticized her former boss over what she has described as his love of dictators and authoritarian leaders.,"Nikki Haley on Saturday called Aleksei A. Navalny, the outspoken Russian opposition leader, “a hero” and amped up the pressure on former President Donald J. Trump to respond to the news of his death. She said Mr. Navalny had died at the hands of President Vladimir V. Putin and that Mr. Trump needed to “answer to that.”","{'main': 'Haley Calls Navalny a ‘Hero,’ Saying Trump Must Answer for His Death', 'kicker': None, 'content_kicker': None, 'print_headline': '', 'name': None, 'seo': None, 'sub': None}","['Presidential Election of 2024', 'Haley, Nikki R', 'Trump, Donald J', 'Navalny, Aleksei A', 'Putin, Vladimir V', 'United States Politics and Government']",2024-02-18T01:24:54+0000,article,U.S.
"“Our court system is a mess,” said the former president, who faces felony charges in four other cases and has been found liable in civil cases related to business fraud, sexual assault and defamation.","Former President Donald J. Trump vented about his latest legal defeat to freezing supporters at a Michigan rally on Saturday night, a day after a New York judge fined him nearly $355 million plus interest in his civil fraud case.","{'main': 'At Rally in Michigan, Trump Lashes Out at Judge Who Fined Him $355 Million', 'kicker': None, 'content_kicker': None, 'print_headline': '', 'name': None, 'seo': None, 'sub': None}","['Trump, Donald J', 'New York State Civil Case Against Trump (452564/2022)', 'Trump Organization', 'Frauds and Swindling', 'Fines (Penalties)', 'Compensation for Damages (Law)', 'James, Letitia', 'Engoron, Arthur F', 'Suits and Litigation (Civil)', 'Presidential Election of 2024', 'United States Politics and Government', 'Republican Party', 'Michigan']",2024-02-18T03:01:20+0000,article,U.S.
The restaurateur Nicole Ponseca gives a tutorial on how to properly eat a kamayan feast.,The restaurateur Nicole Ponseca gives a tutorial on how to properly eat a kamayan feast.,"{'main': 'How to Eat With Your Hands', 'kicker': None, 'content_kicker': None, 'print_headline': '', 'name': None, 'seo': None, 'sub': None}",['Food'],2024-02-18T03:26:13+0000,multimedia,T Magazine
"Quotation of the Day for Sunday, Feb. 18, 2024.","“I don’t want to give up either my country or my beliefs. I cannot betray either the first or the second. If your beliefs are worth something, you must be willing to stand up for them. And if necessary, make some sacrifices.”","{'main': 'Quotation of the Day: Why Navalny, Sacrificing His Freedom and Ultimately His Life, Had to Return', 'kicker': None, 'content_kicker': None, 'print_headline': 'Quote of the Day', 'name': None, 'seo': None, 'sub': None}",[],2024-02-18T03:32:57+0000,article,Corrections
"Volkswagen and BASF, two German giants, are reassessing their activities in the region, where the Chinese government has cracked down on Muslim minorities.",Volkswagen Group is reviewing the future of its joint venture in the Xinjiang region of northwestern China and another German industrial giant is starting to sell its stakes there following new international scrutiny of forced labor using predominantly Muslim ethnic groups.,"{'main': 'Firms With Deep Roots in China Reconsider Their Xinjiang Ties', 'kicker': None, 'content_kicker': None, 'print_headline': 'Businesses Reconsider Their Xinjiang Ties', 'name': None, 'seo': None, 'sub': None}","['Forced Labor', 'Human Rights and Human Rights Violations', 'Uighurs (Chinese Ethnic Group)', 'Muslims and Islam', 'International Trade and World Market', 'Supply Chain', 'International Relations', 'Factories and Manufacturing', 'Automobiles', 'Chemicals', 'Politics and Government', 'Volkswagen AG', 'BASF SE', 'Xinjiang (China)', 'Urumqi (China)', 'China', 'Germany']",2024-02-18T05:01:10+0000,article,Business Day
"Thaksin Shinawatra, a divisive and compelling figure even in his years of exile, was once hailed as a champion of the common people. His recent moves have disillusioned followers.","Thailand’s ousted former prime minister, Thaksin Shinawatra, a leader once seen as a threat to the country’s wealthy elite, was released on parole on Sunday, after spending only a fraction of his original eight-year prison term in detention — in a hospital.","{'main': 'Thailand Paroles an Influential Former Prime Minister', 'kicker': None, 'content_kicker': None, 'print_headline': '', 'name': None, 'seo': None, 'sub': None}","['Thaksin Shinawatra', 'Pheu Thai Party (Thailand)', 'Thailand', 'Prisons and Prisoners', 'Move Forward Party (Thailand)', 'Politics and Government']",2024-02-18T05:50:38+0000,article,World
"Long considered more affordable than New York City, the Hudson Valley presents a stark example of how the nationwide housing crisis is squeezing renters.","It had become unbearable for Troy Mongillo and his girlfriend, Amanda Pabon, to spend time at home. The construction noise was constant, utilities were frequently shut off, and the insulation beneath their apartment was removed just before winter as the new owners of their building in Beacon, N.Y., renovated the vacant retail space downstairs into a trendy bar. So they decided to move.","{'main': 'These Small Towns Have a Big City Problem: The Rent Is Way Too High', 'kicker': None, 'content_kicker': None, 'print_headline': 'Small Cities Wrestle With High Rents and Few Options', 'name': None, 'seo': None, 'sub': None}","['Hudson River Valley (NY)', 'Real Estate and Housing (Residential)', 'Renting and Leasing (Real Estate)', 'Prices (Fares, Fees and Rates)', 'Affordable Housing', 'Local Government', 'Kingston (NY)', 'Newburgh (NY)', 'Poughkeepsie (NY)', 'Landlords', 'Rent Control and Stabilization', 'Law and Legislation']",2024-02-18T08:00:14+0000,article,New York
"Remington is leaving Ilion, N.Y., after two centuries, abandoning upstate for a gleaming new factory in Georgia. With it goes the village’s identity.","Eliphalet Remington built his first rifle barrel more than 200 years ago, painstakingly crafting it in his father’s forge in upstate New York. At that point, ammunition was round, the British were the bad guys and gun control involved forearm strength.","{'main': 'What Happens to a Gun Town When the Gun Factory Moves Out?', 'kicker': None, 'content_kicker': None, 'print_headline': 'Remington’s Departure Unsettles a Gun Town Upstate', 'name': None, 'seo': None, 'sub': None}","['Ilion (NY)', 'Firearms', 'Remington Arms Co', 'Factories and Manufacturing', 'Labor and Jobs', 'Law and Legislation', 'Relocation of Business', 'Private Equity', 'Cerberus Capital Management', 'Clayton Dubilier & Rice']",2024-02-18T08:00:16+0000,article,New York
Feeling stuck on today’s puzzle? We can help.,"Hi busy bees! Welcome to today’s Spelling Bee forum. There are a number of terms that appear in both this article and other online discussions of the Spelling Bee; a glossary of those terms compiled by Monicat, a Times reader, can be found below.","{'main': 'Spelling Bee Forum', 'kicker': None, 'content_kicker': None, 'print_headline': '', 'name': None, 'seo': None, 'sub': None}","['Spelling Bee (Game)', 'Crossword Puzzles']",2024-02-18T08:00:18+0000,article,Crosswords & Games
In case you need some puzzle help.,"Welcome to The Wordle Review. Be warned: This page contains spoilers for today’s puzzle. Solve Wordle first, or scroll at your own risk.","{'main': 'Today’s Wordle Review', 'kicker': None, 'content_kicker': None, 'print_headline': '', 'name': None, 'seo': None, 'sub': None}","['Wordle (Puzzle)', 'Crossword Puzzles']",2024-02-18T08:00:23+0000,article,Crosswords & Games
In case you need some puzzle help.,"Good morning, dear connectors. Welcome to today’s Connections forum, where you can give and receive puzzle — and emotional — support.","{'main': 'The Connections Companion', 'kicker': None, 'content_kicker': None, 'print_headline': '', 'name': None, 'seo': None, 'sub': None}","['Crossword Puzzles', 'Connections (Game)']",2024-02-18T08:00:27+0000,article,Crosswords & Games
A court fight over Rikers Island’s future has produced thousands of pages about the jail complex’s troubled state. Inmate authors have produced thousands more.,A female inmate falls for a handsome guard. He’s really a former con man in witness protection. Their forbidden flirtations smolder toward a climax: Murder!,"{'main': 'How a Notorious Jail Became a Literary Hotbed', 'kicker': None, 'content_kicker': None, 'print_headline': 'Rikers Is These Writers’ Muse', 'name': None, 'seo': None, 'sub': None}","['Books and Literature', 'Book Trade and Publishing', 'Rikers Island Prison Complex', 'Prisons and Prisoners', 'Prison Guards and Corrections Officers', 'New York City', 'audio-neutral-informative']",2024-02-18T08:00:42+0000,article,New York
"A teary night in Manhattan, a familiar sandwich order and more reader tales of New York City in this week’s Metropolitan Diary.",Dear Diary:,"{'main': '‘I Kissed Him Goodbye at Grand Central and Started Walking’', 'kicker': 'METROPOLITAN DIARY', 'content_kicker': None, 'print_headline': '', 'name': None, 'seo': None, 'sub': None}",['New York City'],2024-02-18T08:00:43+0000,article,New York
What do celebrities do in their downtime? A new project by The New York Times Magazine captures the awards season’s buzziest actors in their element.,"The photographer James Nachtwey showed up at Bradley Cooper’s farmhouse in Pennsylvania one freezing morning in January, armed with a coat and a camera.","{'main': 'Cold Plunges and Cuddling With Cats: Photographing the ‘Great Performers’', 'kicker': 'Times Insider', 'content_kicker': None, 'print_headline': 'Photographing ‘Great Performers’ in the Wild', 'name': None, 'seo': None, 'sub': None}","['Photography', 'Actors and Actresses', 'Movies', 'War and Armed Conflicts', 'Metropolitan Museum of Art', 'New York Times', 'Cooper, Bradley', 'Ellis-Taylor, Aunjanue', 'Giamatti, Paul', 'Ruffalo, Mark', 'Ryan, Kathy', 'Stone, Emma', 'Wright, Jeffrey (1965- )', 'Los Angeles (Calif)', 'Manhattan (NYC)']",2024-02-18T08:00:58+0000,article,Times Insider
The success of Alex Cooper’s “Call Her Daddy” podcast has birthed a new media company. Can this millennial solve the riddle of what Gen Z wants?,Is it possible that the next great American media mogul is a woman who would rather sit in bed watching hours of “Grey’s Anatomy” than sit courtside at a Los Angeles Lakers game?,"{'main': 'The ‘Daddy’ Will See You Now', 'kicker': None, 'content_kicker': None, 'print_headline': 'Bawdy and Revelatory Chats Fuel a Media Venture', 'name': None, 'seo': None, 'sub': None}","['Cooper, Alexandra (1994- )', 'Content Type: Personal Profile', 'Podcasts', 'Generation Z', 'Unwell (Media Co)', 'Call Her Daddy (Radio Program)']",2024-02-18T08:01:09+0000,article,Style
"Biometric technology is expanding at airports across the United States — and the world — and transforming the way we move through them, from checking a bag to boarding the plane.","On a recent Thursday morning in Queens, travelers streamed through the exterior doors of La Guardia Airport’s Terminal C. Some were bleary-eyed — most hefted briefcases — as they checked bags and made their way to the security screening lines.","{'main': 'Facial Recognition: Coming Soon to an Airport Near You', 'kicker': None, 'content_kicker': None, 'print_headline': 'On Airports’ Horizon: Facial Recognition', 'name': None, 'seo': None, 'sub': None}","['Facial Recognition Software', 'AIRLINES AND AIRPLANES', 'Airport Security', 'Airports', 'Surveillance of Citizens by Government', 'Biometrics', 'Privacy', 'Travel and Vacations', 'Immigration and Emigration', 'Transportation Security Administration', 'Customs and Border Protection (US)']",2024-02-18T10:00:10+0000,article,Travel
"A roundup of international fiction from Congo, Sweden, Bolivia and India.","Fiston Mwanza Mujila, the award-winning Congolese author of “Tram 83,” writes novels and poetry that move to an infectious, syncopated rhythm. His latest work, THE VILLAIN’S DANCE (Deep Vellum, 279 pp., paperback, $16.95), especially revels in this spirit. In 1990s Zaire, where Mobutu Sese Seko’s reign is on its last legs, survival is itself an elaborate hustle. The Kinshasa nightclubs are packed, the streets teeming with teenage runaways and rumors of insurrection. Just across the border, in an Angola racked by civil war, the diamond mines are a magnet for get-rich dreamers.","{'main': 'Four New Books in Translation Test the Bounds of Reality', 'kicker': 'The Shortlist', 'content_kicker': None, 'print_headline': 'International Literature', 'name': None, 'seo': None, 'sub': None}",['Books and Literature'],2024-02-18T10:00:19+0000,article,Books
"San Francisco has printed candidate names in Chinese characters since 1999. But now the city is cracking down on ones that some argue go overboard with flattering, flowery phrases.","Hong Le still remembers meeting a charismatic woman campaigning for San Francisco district attorney in 2003. In Cantonese, that woman’s name was 賀錦麗, which is pronounced Ho Gam-lai and means “Congratulate Brocade Beautiful.”","{'main': 'No, Your Honor, You Can’t Call Yourself ‘High Justice’ on the Ballot in Chinese', 'kicker': None, 'content_kicker': None, 'print_headline': 'In Chinese Characters, Some Politicians’ Names Are Too Good for Ballot', 'name': None, 'seo': None, 'sub': None}","['Chinese-Americans', 'Chinese Language', 'Elections', 'San Francisco Bay Area (Calif)', 'San Francisco (Calif)', 'Breed, London', 'Lurie, Daniel', 'Politics and Government']",2024-02-18T10:00:35+0000,article,U.S.
"The sense of touch can be a crucial part of dining, one thing that some cultures have understood better than others.","BEFORE THE $135-PER-PERSON tasting menu begins, you are gently invited to wash your hands. A sink stands along the wall. It’s important to make these ablutions publicly, to show everyone that your hands are clean, because at Naks, a Filipino restaurant that opened in Manhattan’s East Village in December, there are no forks on the tables — no eating implements of any kind.","{'main': 'What Do We Gain by Eating With Our Hands?', 'kicker': 'Food Matters', 'content_kicker': None, 'print_headline': 'The Touch, The Feel', 'name': None, 'seo': None, 'sub': None}","['Food', 'Touch (Sense)', 'Utensils and Cutlery', 'Customs, Etiquette and Manners', 'Restaurants', 'Hands']",2024-02-18T10:00:37+0000,article,T Magazine
"Sabato De Sarno, who showed his first collection for the Italian fashion house last year, discusses his creative touchstones.","In November 2022, Sabato De Sarno, now 40, was approached about a mysterious opportunity at Kering, the multinational luxury conglomerate whose portfolio includes the fashion brands Alexander McQueen, Balenciaga, Bottega Veneta, Gucci and Saint Laurent. “They called me for an interview without telling me the brand,” he says — or the role. Alessandro Michele’s departure as the creative director of Gucci hadn’t yet been announced. Eventually, of course, the nature of the job became clear, and “it was more than I expected for my life,” De Sarno says. “After I signed the contract, I slept with it in my bed because, during the night, I just wanted to check whether it was there or not.”","{'main': 'Why Gucci’s New Creative Director Counts Princess Diana Among His Muses', 'kicker': 'Profile in Style', 'content_kicker': None, 'print_headline': 'Sabato De Sarno', 'name': None, 'seo': None, 'sub': None}","['De Sarno, Sabato', 'Fashion and Apparel', 'Milan (Italy)', 'Gucci', 'Diana, Princess of Wales']",2024-02-18T10:00:53+0000,article,T Magazine
"From asymmetrical shapes to intricate tailoring, sculptural clothes with a strong sense of personality are front and center for spring.",,"{'main': 'This Season’s Fashion Is All About the Silhouette', 'kicker': None, 'content_kicker': None, 'print_headline': 'Self Portrait', 'name': None, 'seo': None, 'sub': None}","['Fashion and Apparel', 'Jewels and Jewelry', 'Burberry', 'Fendi SpA', 'Dolce & Gabbana', 'Max Mara']",2024-02-18T10:00:54+0000,article,T Magazine
"As a scholar, Laurence Ralph specialized in youth violence. Then a relative was killed. “Sito” tells the story.","The afternoon in 2014 when I drove around Englewood, on Chicago’s South Side, with a group of “violence interrupters” — former gang members and ex-offenders from the community — there were bodies on the ground. Nine people had been shot the previous afternoon; the interrupters’ challenge was to tour the neighborhood, from emergency rooms to street corners, and intervene before vengeance took over and the violence escalated.","{'main': 'When a Teen Was Shot Dead, the Tragedy for This Author Was Personal', 'kicker': 'Nonfiction', 'content_kicker': None, 'print_headline': '', 'name': None, 'seo': None, 'sub': None}","['Books and Literature', 'Youth', 'Murders, Attempted Murders and Homicides', 'Gangs', 'Sito: An American Teenager and the City That Failed Him (Book)', 'Chicago (Ill)', 'Criminal Justice', 'Ralph, Laurence']",2024-02-18T10:01:09+0000,article,Books
"A century later, the first African American modernist movement continues to inspire and challenge.","Derek Fordjour traces his interest in Harlem Renaissance art to his childhood in Tennessee, where he saw Aaron Douglas’s murals at Fisk University, and to his art history classes at Morehouse. “I was completely riveted by the contributions that the Harlem Renaissance artists had made to art history,” he said in a recent conversation. “It gave me this alternate canon that really made it clear that I was working out of a rich legacy.”","{'main': 'Six Artists Reflect on the Legacy of the Harlem Renaissance', 'kicker': None, 'content_kicker': None, 'print_headline': 'Artists Reflect on a Legacy’s Enduring Impact', 'name': None, 'seo': None, 'sub': None}","['Art', 'Black People', 'Blacks', 'Culture (Arts)', 'Discrimination', 'Metropolitan Museum of Art', 'Abney, Nina Chanel (1982- )', 'Harlem on My Mind (Exhibit)', 'Bey, Dawoud', 'Fordjour, Derek (1974- )', 'Johnson, William H', 'Simmons, Xaviera (1974- )', 'Sugar Hill (Manhattan, NY)', 'Harlem (Manhattan, NY)']",2024-02-18T10:01:10+0000,article,Arts
"In this collaboratively written novel, Lower East Side dwellers get through lockdown swapping colorful tales on the roof of their scruffy building.",New Yorkers generally don’t talk to their neighbors. This is to preserve psychological boundaries while living stacked on top of one another like ice cubes in trays.,"{'main': '36 Authors Times ‘Fourteen Days’ Adds Up to a Mixed Literary Experiment', 'kicker': 'Fiction', 'content_kicker': None, 'print_headline': '', 'name': None, 'seo': None, 'sub': None}","['Books and Literature', 'Coronavirus (2019-nCoV)', 'Writing and Writers', 'Fourteen Days (Book)', 'Atwood, Margaret', 'Preston, Douglas', 'Authors Guild']",2024-02-18T10:02:44+0000,article,Books
An ambitious new show at the Metropolitan Museum of Art uncovers work by long-ignored artists with the help of loans from Black colleges and family collections.,"How do you measure the United States in the 20th century without Langston Hughes, Zora Neale Hurston, Louis Armstrong and Duke Ellington?","{'main': 'With ‘Gems’ From Black Collections, the Harlem Renaissance Reappears', 'kicker': None, 'content_kicker': None, 'print_headline': 'Harlem Renaissance Met Show Spotlights Long-Ignored Artists', 'name': None, 'seo': None, 'sub': None}","['Art', 'Black People', 'Blacks', 'Museums', 'Harlem Renaissance Movement', 'Collectors and Collections', 'Historically Black Colleges and Universities', 'Metropolitan Museum of Art', 'Harlem (Manhattan, NY)', 'New York City']",2024-02-18T10:02:45+0000,article,Arts
"As the presidential election approaches, “LatinoLand,” by Marie Arana, explores the diverse politics and historical roots of Hispanic Americans.","The former Washington Post editor Marie Arana recently approached the Cuban American archaeologist Jorge Zamanillo with a question. As the founding director of the not-yet-open National Museum of the American Latino, Zamanillo would help make sense of Hispanic identity and history. How, Arana asked him, do you begin to define “us”?","{'main': 'A Journalist Asks, How Do You Define ‘Latino’?', 'kicker': 'Nonfiction', 'content_kicker': None, 'print_headline': '', 'name': None, 'seo': None, 'sub': None}","['Books and Literature', 'Hispanic-Americans', 'Arana, Marie', 'United States']",2024-02-18T10:02:51+0000,article,Books
"“Natural asset companies” would put a market price on improving ecosystems, rather than on destroying them.","Picture this: You own a few hundred acres near a growing town that your family has been farming for generations. Turning a profit has gotten harder, and none of your children want to take it over. You don’t want to sell the land; you love the open space, the flora and fauna it hosts. But offers from developers who would turn it into subdivisions or strip malls seem increasingly tempting.","{'main': 'Nature Has Value. Could We Literally Invest in It?', 'kicker': None, 'content_kicker': None, 'print_headline': '', 'name': None, 'seo': None, 'sub': None}","['Conservation of Resources', 'Stocks and Bonds', 'Land Use Policies', 'Forests and Forestry', 'Environment', 'United States Politics and Government', 'Regulation and Deregulation of Industry', 'Intrinsic Exchange Group Inc']",2024-02-18T10:03:02+0000,article,Business Day
"The celebrated writer discusses human freedom, immortality and the “stinginess” that has settled into the country.","The celebrated writer discusses human freedom, immortality and the “stinginess” that has settled into the country.","{'main': 'Marilynne Robinson Considers Biden a Gift of God', 'kicker': 'Talk', 'content_kicker': None, 'print_headline': 'Marilynne Robinson Considers Biden a Gift of God', 'name': None, 'seo': None, 'sub': None}","['Robinson, Marilynne', 'Obama, Barack', 'Books and Literature', 'Writing and Writers', 'Presidential Election of 2024', 'Elderly', 'Religion and Belief']",2024-02-18T10:03:04+0000,multimedia,Magazine
Desperate migrants. Cartel violence. It’s all happening in the Chiltons’ backyard.,"Jim Chilton, 84, had named the dirt roads and pastures on his land in honor of four generations of family cattle ranchers, but now he prepared to drive across his ranch on the U.S. border unsure of what he might find. He packed a handgun in case he encountered more smugglers working with the Sinaloa cartel and bottles of water for the migrants he’d recently seen lost and dehydrated in the Sonoran Desert.","{'main': 'A Family Ranch, Swallowed Up in the Madness of the Border', 'kicker': None, 'content_kicker': None, 'print_headline': 'For Ranch Family, Border Crisis Is Right Outside the Back Door', 'name': None, 'seo': None, 'sub': None}","['vis-photo', 'Immigration and Emigration', 'Asylum, Right of', 'Illegal Immigration', 'Border Barriers', 'Refugees and Displaced Persons', 'Ranches', 'Drug Cartels', 'Smuggling', 'Border Patrol (US)', 'Arivaca (Ariz)', 'Arizona', 'audio-neutral-informative']",2024-02-18T10:03:26+0000,article,U.S.
"A state trooper with his gun drawn pulled Nicole McClure, who had a brain bleed, out of her car and arrested her after she crashed into two roundabouts.","A state trooper with his gun drawn pulled Nicole McClure, who had a brain bleed, out of her car and arrested her after she crashed into two roundabouts.","{'main': 'She Was Arrested for DUI. Her Brain Was Bleeding.', 'kicker': None, 'content_kicker': None, 'print_headline': '', 'name': None, 'seo': None, 'sub': None}","['Olympia (Wash)', 'Traffic Accidents and Safety', 'Drunken and Reckless Driving', 'Police Brutality, Misconduct and Shootings']",2024-02-18T10:04:01+0000,multimedia,U.S.
