abstract,lead_paragraph,headline,keywords,pub_date,document_type,section_name
What happened to manufacturing in America is a story we think we know but do not.,"Growing up, my parents drove my brothers and me around in lumbering Fords and ungainly Oldsmobiles until one fateful day in the summer of 1980, when my dad showed up in a brand-new, all-beige VW Rabbit. It was a completely foreign thing, something from the future, a compact — perish the thought — German automobile. Buying a European car was now OK, my dad made a point of telling us, because this one was made in the U.S.A.","{'main': 'A Factory in Maine Proves ‘Made in America’ Is Still Possible', 'kicker': 'Guest Essay', 'content_kicker': None, 'print_headline': 'A Maine Factory Proves ‘Made in the U.S.A.’ Is Still Possible', 'name': None, 'seo': None, 'sub': None}","['American Roots Wear (Fashion Label)', 'Factories and Manufacturing', 'Labor and Jobs', 'Fashion and Apparel', 'Maine', 'AMERICAN FEDERATION OF LABOR-CONGRESS OF INDUSTRIAL ORGANIZATIONS', 'Supply Chain', 'Organized Labor', 'United States Economy', 'International Trade and World Market']",2024-01-05T10:00:37+0000,article,Opinion
"Starring Jodie Foster and Kali Reis, the new season travels to Alaska and takes on a decidedly more female perspective, starting with a new showrunner.","There were times, a year ago, in Iceland, on a glacier, in the dark, in temperatures well below freezing, when Issa López thought to herself: “Who wrote this? What is wrong with this person?” López, the showrunner and director of Season 4 of the HBO anthology series “True Detective,” had only herself to blame.","{'main': 'A Reinvented ‘True Detective’ Plays It Cool', 'kicker': None, 'content_kicker': None, 'print_headline': '‘True Detective’ Is Playing It Cool', 'name': None, 'seo': None, 'sub': None}","['Television', 'True Detective (TV Program)', 'Lopez, Issa', 'Foster, Jodie', 'Reis, Kali', 'Home Box Office']",2024-01-05T10:00:47+0000,article,Arts
We asked experts for advice on creating an exercise plan you can actually stick with — and enjoy.,Resolving to get back into exercise or take up a new fitness routine is one of the best things you can do for your health.,"{'main': 'How to Start Working Out Again', 'kicker': None, 'content_kicker': None, 'print_headline': '', 'name': None, 'seo': None, 'sub': None}","['Exercise', 'Content Type: Service', 'Muscles', 'Weight Lifting', 'Walking', 'Heart']",2024-01-05T10:01:05+0000,article,Well
"The “Color Purple” star talks candidly about her battles to get cast and paid her worth. Even as an Oscar-nominated veteran, she had to audition for her new film.","Before things started to click for Taraji P. Henson, she sought career counseling from the man upstairs.","{'main': 'Taraji P. Henson Is Tired of Fighting', 'kicker': 'The Projectionist', 'content_kicker': None, 'print_headline': 'The Fight To Gain Respect Takes A Toll', 'name': None, 'seo': None, 'sub': None}","['Henson, Taraji P', 'Content Type: Personal Profile', 'Actors and Actresses', 'Movies', 'The Color Purple (Movie)', 'Black People', 'Blacks', 'Women and Girls', 'Wages and Salaries', 'Discrimination', 'Empire (Movie)', 'Bazawule, Blitz']",2024-01-05T10:01:10+0000,article,Movies
Thousands of people from African nations are flying to Central America and then traveling over land to Mexico and on to the southern border.,"The young men from Guinea had decided it was time to leave their impoverished homeland in West Africa. But instead of seeking a new life in Europe, where so many African migrants have settled, they set out for what has become a far safer bet of late: the United States.","{'main': 'African Migration to the U.S. Soars as Europe Cracks Down', 'kicker': None, 'content_kicker': None, 'print_headline': 'U.S. Records  Big Increase  In Migration From Africa', 'name': None, 'seo': None, 'sub': None}","['United States', 'AFRICA', 'Illegal Immigration', 'International Relations', 'Smuggling', 'Asylum, Right of', 'Refugees and Displaced Persons', 'Immigration and Emigration', 'Border Patrol (US)', 'European Union', 'Biden, Joseph R Jr', 'Mauritania', 'Senegal', 'Angola', 'Europe', 'Guinea', 'Nicaragua', 'West Africa']",2024-01-05T10:01:21+0000,article,U.S.
"New year, new problems. The hosts try to make sense of it.","Is Donald Trump an insurrectionist who should be barred from the ballot? On this episode of “Matter of Opinion,” the hosts discuss who should get to decide if the former president can try to return to the White House. Plus, the hosts lay out what other stories are on their 2024 political bingo cards.","{'main': 'Should Trump Be on the Ballot? And Other 2024 Sticky Wickets', 'kicker': None, 'content_kicker': None, 'print_headline': '', 'name': None, 'seo': None, 'sub': None}","['audio-neutral-informative', 'Presidential Election of 2024', 'Trump, Donald J', 'Fourteenth Amendment (US Constitution)', 'Storming of the US Capitol (Jan, 2021)', 'Colorado', 'Supreme Courts (State)', 'Supreme Court (US)', 'Maine', 'United States Politics and Government']",2024-01-05T10:01:38+0000,article,Opinion
"Capes, knit caps and woolly coats were plentiful on the streets of New York in December, even though flakes were not.","A bright red cape and headband. Creamy cable knit pants. Overcoats of all sorts: Single-breasted and double-breasted, in shades of camel and pink, some skimming knees and others falling closer to the floor.","{'main': 'Winter Clothes, Hold the Snow', 'kicker': 'Style Outside', 'content_kicker': None, 'print_headline': 'Winter Clothes Come Out to Play, Hold the Snow', 'name': None, 'seo': None, 'sub': None}","['vis-photo', 'Fashion and Apparel', 'New York City']",2024-01-05T10:01:44+0000,article,Style
"Amid a dissident bid for board seats and boycotts by activists, the company has sent mixed signals about its willingness to engage with labor groups.","More than two years into a campaign that has unionized more than 350 Starbucks stores, the company is facing mounting pressure from union officials and activists who say it has illegally retaliated against workers and resisted contract negotiations.","{'main': 'Starbucks Faces New Pressure Over Union Campaign', 'kicker': None, 'content_kicker': None, 'print_headline': 'Starbucks Faces New Push Over Union Effort', 'name': None, 'seo': None, 'sub': None}","['Coffeehouses', 'Organized Labor', 'Boycotts', 'Labor and Jobs', 'Starbucks Corporation', 'Starbucks Workers United', 'Workers United', 'Narasimhan, Laxman', 'Schultz, Howard D', 'National Labor Relations Board']",2024-01-05T10:01:45+0000,article,Business Day
A scholar of attention outlines how you can get your focus back.,"I’m convinced that attention is the most important human faculty. Your life, after all, is just the sum total of the things you’ve paid attention to. And we lament our attention issues all the time: how distracted we are, how drained we feel, how hard it is to stay focused or present. And yet, while there’s no shortage of advice on how to improve our sleep hygiene, or spending, or physical fitness, there’s hardly any good information about how to build and replenish our capacity for paying attention.","{'main': 'Tired? Distracted? Burned Out? Listen to This.', 'kicker': None, 'content_kicker': None, 'print_headline': '', 'name': None, 'seo': None, 'sub': None}","['audio-neutral-informative', 'Anxiety and Stress', 'Computers and the Internet', 'Mark, Gloria']",2024-01-05T10:01:45+0000,article,Opinion
"Smartphones have become an indispensable part of any trip abroad. How you can use maps, social media and more without racking up international roaming fees.","The horror story goes something like this: A family returns from a trip abroad, and the glow from the vacation has barely begun to fade when a cellphone bill with hundreds — or even thousands — of dollars in international charges arrives. The phenomenon even has a name: bill shock.","{'main': 'Come Home With Memories, Not a Shocking Phone Bill', 'kicker': 'Travel 101', 'content_kicker': None, 'print_headline': 'Come Home From Your Trip Abroad With Memories, Not a Shocking Phone Bill', 'name': None, 'seo': None, 'sub': None}","['Content Type: Service', 'Prices (Fares, Fees and Rates)', 'Travel and Vacations', 'Smartphones', 'Budget Travel', 'AT&T Inc', 'T-Mobile US Inc', 'Verizon Communications Inc']",2024-01-05T10:01:46+0000,article,Travel
"“Artie Shaw: Time Is All You’ve Got,” a documentary, was embroiled in lawsuits for years. Now it has a weeklong run at the Film Forum.",Good morning. It’s Friday. We’ll find out about a film that is being shown in New York for the first time. We’ll also see why a judge refused to send a defendant in a drug case to a Brooklyn jail while the man awaits his sentencing in March.,"{'main': 'It Won an Oscar in 1987. It’s Finally Opening in New York.', 'kicker': 'New York Today', 'content_kicker': None, 'print_headline': '', 'name': None, 'seo': None, 'sub': None}","['Movies', 'Academy Awards (Oscars)', 'Prisons and Prisoners', 'Documentary Films and Programs', 'Film Forum', 'Metropolitan Detention Center (Brooklyn, NY)', 'Berman, Brigitte', 'Shaw, Artie', 'Manhattan (NYC)', 'Brooklyn (NYC)', 'Christmas Trees', 'Christmas']",2024-01-05T10:01:48+0000,article,New York
A tribute to one of pop music’s favorite words.,,"{'main': '5 Songs That Will Make You Say ‘Yeah!’', 'kicker': None, 'content_kicker': None, 'print_headline': '', 'name': None, 'seo': None, 'sub': None}","['Culture (Arts)', 'Music', 'Pop and Rock Music']",2024-01-05T10:02:04+0000,article,Podcasts
"Hollywood usually looks to the annual awards as a party, but this year they also have an unlikely mission: A bid for relevance.",Follow our live updates for the 2024 Golden Globes.,"{'main': 'How to Watch the Golden Globes 2024: Date, Time and Streaming', 'kicker': None, 'content_kicker': None, 'print_headline': '', 'name': None, 'seo': None, 'sub': None}","['Golden Globes (Awards)', 'Movies', 'Television', 'Actors and Actresses', 'Hollywood Foreign Press Assn', 'CBS Corporation', 'Gladstone, Lily', 'Gerwig, Greta', 'Koy, Jo', 'Nolan, Christopher', 'Streep, Meryl', 'Swift, Taylor', 'Wong, Ali (1982- )', 'Beverly Hills (Calif)', 'California', 'Los Angeles (Calif)', 'Barbie (Movie)', 'Killers of the Flower Moon (Movie)', 'Only Murders in the Building (TV Program)', 'Oppenheimer (Movie)', 'Taylor Swift: The Eras Tour (Movie)', 'The Bear (TV Program)']",2024-01-05T10:02:05+0000,article,Movies
"In Israel, they are putting pressure on the government, pushing for a political path to release the remaining hostages.","Ido Shamriz turned his eulogy for his brother, Alon, into a protest.","{'main': 'The Families of Hostages Are Calling on Israel to Do Something Radical', 'kicker': 'Guest Essay', 'content_kicker': None, 'print_headline': 'The Hostages’ Families Expose Israel’s Failures', 'name': None, 'seo': None, 'sub': None}","['Israel-Gaza War (2023- )', 'Israel', 'Defense and Military Forces', 'Netanyahu, Benjamin', 'Kidnapping and Hostages', 'Hamas', 'Terrorism', 'Gaza Strip', 'Palestinians']",2024-01-05T10:02:06+0000,article,Opinion
"After a pandemic hiatus, my family was finally back in Las Vegas for Christmas, and we were up $1.25. The world was ours.","It was almost the night before Christmas, and the house was winning.","{'main': 'There’s No Place Like Sin City for the Holidays', 'kicker': None, 'content_kicker': None, 'print_headline': 'There’s No Place Like Sin City for the Holidays', 'name': None, 'seo': None, 'sub': None}","['internal-sub-only', 'internal-great-read', 'Las Vegas (Nev)', 'Christmas', 'Casinos', 'Travel and Vacations', 'Gambling', 'Holidays and Special Occasions', 'Content Type: Personal Profile']",2024-01-05T10:02:06+0000,article,Travel
"The illustrator of classic children’s books like “Frederick” and “Swimmy” was also a painter, sculptor, graphic designer and more.","Before side hustles went mainstream, Leo Lionni was a multitasker — and a compartmentalizer. Best known as the writer and illustrator behind “Frederick,” “Swimmy” and more than 30 other children’s books, Lionni also had a distinguished career as a graphic designer and art director, helping Eric Carle and Andy Warhol get their starts. But, according to his granddaughter, Annie Lionni, the artist kept his own paintings, sculptures, mosaics and lithographs — what he called “art with a capital A” — separate from the rest of his work.","{'main': 'Like His Illustrations, Leo Lionni Contained Multitudes', 'kicker': 'Up Close', 'content_kicker': None, 'print_headline': 'Leo Lionni', 'name': None, 'seo': None, 'sub': None}","['genre-books-childrens', 'Books and Literature', 'Children and Childhood', 'Art', 'Content Type: Personal Profile', 'Lionni, Leo', 'Leo Lionni: Storyteller, Artist, Designer (Book)', 'Marcus, Leonard S']",2024-01-05T10:02:08+0000,article,Books
"The research, supported by the National Institutes of Health, may reassure some patients after a European drug safety agency raised concerns last year.","People taking the wildly popular drugs Ozempic, to treat diabetes, and Wegovy, to combat obesity, are slightly less likely to have suicidal thoughts than people who are not taking them, researchers reported on Friday.","{'main': 'Ozempic and Wegovy Users Had Less Risk of Suicidal Thoughts in Large Study', 'kicker': None, 'content_kicker': None, 'print_headline': '2 Drugs Show A Lower Risk Of Thoughts Of Suicide', 'name': None, 'seo': None, 'sub': None}","['Obesity', 'Diabetes', 'Semaglutide (Drug)', 'Ozempic (Drug)', 'Research', 'Suicides and Suicide Attempts', 'Nature Medicine (Journal)']",2024-01-05T10:02:18+0000,article,Health
"In dueling town halls hosted by CNN, Nikki Haley struggled to find her footing at times, while Ron DeSantis delivered a confident performance.","Gov. Ron DeSantis of Florida is finally taking the fight to the front-runner, former President Donald J. Trump.","{'main': 'DeSantis Lobs Most Forceful Attacks Yet Against Trump, Days Before Iowa Caucuses', 'kicker': None, 'content_kicker': None, 'print_headline': 'DeSantis Jabs Hard at Trump Over Abortion ‘Flip-Flop’', 'name': None, 'seo': None, 'sub': None}","['Presidential Election of 2024', 'DeSantis, Ron', 'Haley, Nikki R', 'Republican Party', 'Primaries and Caucuses', 'CNN', 'United States Politics and Government', 'Iowa', 'Trump, Donald J']",2024-01-05T10:02:21+0000,article,U.S.
The president’s speech on Friday in the battleground state of Pennsylvania represents a bet that many Americans remain shaken by the Jan. 6 attack.,President Biden is returning to the battleground state of Pennsylvania on Friday to try to define the 2024 presidential election as an urgent and intensifying fight for American democracy.,"{'main': 'Biden Plans Speech Casting Election as a Fight for Democracy', 'kicker': None, 'content_kicker': None, 'print_headline': '', 'name': None, 'seo': None, 'sub': None}","['Biden, Joseph R Jr', 'Pennsylvania', 'Democratic Party', 'Presidential Election of 2024', 'Democracy (Theory and Philosophy)', 'United States Politics and Government', 'Storming of the US Capitol (Jan, 2021)', 'Project Democracy']",2024-01-05T10:02:21+0000,article,U.S.
Did you follow the news this week? Take our quiz to see how well you stack up with other Times readers.,Did you follow the news this week? Take our quiz to see how well you stack up with other Times readers.,"{'main': 'The New York Times News Quiz, Jan. 5, 2024', 'kicker': None, 'content_kicker': None, 'print_headline': '', 'name': None, 'seo': None, 'sub': None}",['Content Type: Quiz'],2024-01-05T10:02:23+0000,multimedia,Briefing
"A selection of entertainment highlights this weekend, including Daniel Levy's film “Good Grief” on Netflix.","A selection of entertainment highlights this weekend, including Daniel Levy's film “Good Grief” on Netflix.","{'main': '5 Things to Do This Weekend', 'kicker': None, 'content_kicker': None, 'print_headline': '', 'name': None, 'seo': None, 'sub': None}","['Television', 'Art', 'Movies', 'Under the Radar Festival', 'Three Kings Day', 'Museums', 'Posters', 'El Museo del Barrio', 'Netflix Inc', 'Paley Center for Media', 'Poster House', 'Public Broadcasting Service', 'Home Box Office', 'Russell, Mark (Curator)', 'New York City', 'Good Grief (Movie)', 'True Detective (TV Program)']",2024-01-05T10:02:29+0000,multimedia,Arts
"On the first day of the year, over a thousand devotees passed through the old church where the Poetry Project has held its annual 12-hour marathon for the last half-century.","On the morning of New Year’s Day, along the sleepy streets of the East Village in Manhattan, scarf-bundled crowds trickled into St. Mark’s Church in-the-Bowery to attend a 12-hour poetry reading that has been a spiritually cleansing downtown tradition since the 1970s. To its devotees, the gathering’s hypnotically lengthy programming of readings and avant-garde performances provides a dependably radical initiation into the new year.","{'main': 'Where Downtown Poets Go to Church to Greet the New Year', 'kicker': None, 'content_kicker': None, 'print_headline': 'Explorers on the Frontier of Language', 'name': None, 'seo': None, 'sub': None}","['New Year', 'Poetry and Poets', 'Music', 'Writing and Writers', 'Poetry Project', ""St Mark's Church In-The-Bowery"", 'Waldman, Anne', 'Myles, Eileen (1949- )', 'Bowery (Manhattan, NY)']",2024-01-05T10:02:31+0000,article,Style
“Green Queen” gets an awkward early screening as Whitney tries to broach her feelings with Asher.,"It’s amazing what a reality television edit can do. Throughout “The Curse,” we’ve been exposed to what Asher and Whitney look like acting for the cameras, but we have rarely seen what they are like when they are actually on camera, once they’ve gotten the glossy treatment that the Property Brothers and other hosts have before them.","{'main': '‘The Curse’ Season 1, Episode 9 Recap: ‘All in’', 'kicker': 'The Curse', 'content_kicker': None, 'print_headline': '', 'name': None, 'seo': None, 'sub': None}","['Television', 'The Curse (TV Program)']",2024-01-05T10:02:32+0000,article,Arts
"This week's selection includes titles by Kyle Chayka, Matthew Delmont, Laura Zigman and more. ","This week's selection includes titles by Kyle Chayka, Matthew Delmont, Laura Zigman and more. ","{'main': '6 New Paperbacks to Read This Week ', 'kicker': 'Paperback Row', 'content_kicker': None, 'print_headline': '', 'name': None, 'seo': None, 'sub': None}","['Books and Literature', 'Race and Ethnicity', 'Apologies', 'Homosexuality and Bisexuality', 'World War II (1939-45)']",2024-01-05T10:02:34+0000,multimedia,Books
Government ministers’ calls to depopulate Gaza implicate the U.S.,"Two far-right members of Israel’s cabinet — the national security minister, Itamar Ben-Gvir, and the finance minister, Bezalel Smotrich — caused an international uproar this week with their calls to depopulate Gaza. “If in Gaza there will be 100,000 or 200,000 Arabs and not two million the entire conversation on ‘the day after’ will look different,” said Smotrich, who called for most Gazan civilians to be resettled in other countries. The war, said Ben-Gvir, presents an “opportunity to concentrate on encouraging the migration of the residents of Gaza,” facilitating Israeli settlement in the region.","{'main': 'America Must Face Up to Israel’s Extremism', 'kicker': 'Michelle Goldberg', 'content_kicker': None, 'print_headline': 'America Must Face Up to Israel’s Extremism', 'name': None, 'seo': None, 'sub': None}","['Israel-Gaza War (2023- )', 'Israel', 'Defense and Military Forces', 'Politics and Government', 'Right-Wing Extremism and Alt-Right', 'Ben-Gvir, Itamar', 'Smotrich, Bezalel (1980- )', 'Netanyahu, Benjamin', 'Gaza Strip', 'Palestinians', 'Civilian Casualties', 'Refugees and Displaced Persons', 'War Crimes, Genocide and Crimes Against Humanity', 'United States International Relations']",2024-01-05T10:02:35+0000,article,Opinion
“This is sort of the big kahuna.”,"The New York Times sued OpenAI and Microsoft last week for copyright infringement. Kevin Roose and Casey Newton walk through the lawsuit and discuss the stakes for news publishers. Then, they talk about Apple’s “walled garden,” which is facing threats from both regulators and 16-year-olds. Finally, we set our tech resolutions for the new year.","{'main': 'The Times Sues OpenAI, a Debate Over iMessage and Our New Year’s Tech Resolutions', 'kicker': None, 'content_kicker': None, 'print_headline': '', 'name': None, 'seo': None, 'sub': None}","['Science and Technology', 'New York Times', 'Microsoft Corp', 'ChatGPT', 'Altman, Samuel H', 'Beeper Inc']",2024-01-05T10:02:43+0000,article,Podcasts
Hear the news in five minutes.,"The New York Times Audio app is home to journalism and storytelling, and provides news, depth and serendipity. If you haven’t already, download it here — available to Times news subscribers on iOS — and sign up for our weekly newsletter.","{'main': 'The Jan. 6 Inquiry Three Years On, and a PepsiCo Boycott in France', 'kicker': None, 'content_kicker': None, 'print_headline': '', 'name': None, 'seo': None, 'sub': None}","['Drones (Pilotless Planes)', 'Boycotts', 'Prices (Fares, Fees and Rates)', 'Storming of the US Capitol (Jan, 2021)', 'International Relations', 'House Select Committee to Investigate the January 6th Attack', 'Pepsico Inc', 'Baghdad (Iraq)', 'France', 'Iraq', 'Taiwan', 'United States']",2024-01-05T11:00:08+0000,article,Podcasts
How high-school seniors have navigated the Supreme Court’s landmark ruling against affirmative action.,"In a landmark ruling last summer, the U.S. Supreme Court overturned nearly 50 years of precedent and banned the use of affirmative action in college admissions.","{'main': 'A Confusing New World for College Applicants', 'kicker': None, 'content_kicker': None, 'print_headline': '', 'name': None, 'seo': None, 'sub': None}","['Admissions Standards', 'Colleges and Universities', 'Decisions and Verdicts', 'Affirmative Action']",2024-01-05T11:00:13+0000,article,Podcasts
"Harry Dunn, who endured racist slurs as he fought off a pro-Trump mob and gained fame with his emotional testimony before the Jan. 6 committee, is joining a crowded Democratic primary.","Harry Dunn, a former U.S. Capitol Police officer who rose to prominence for his defense of the Capitol on Jan. 6, 2021, and for his emotional public testimony describing the attack, announced on Friday that he was running for Congress in Maryland’s third district.","{'main': 'Officer Who Defended Capitol on Jan. 6 Runs for Congress in Maryland', 'kicker': None, 'content_kicker': None, 'print_headline': 'Defender Of Capitol During Riot Seeks Office', 'name': None, 'seo': None, 'sub': None}","['Dunn, Harry (1983- )', 'Elections, House of Representatives', 'Maryland', 'United States Politics and Government', 'Storming of the US Capitol (Jan, 2021)', 'Attacks on Police', 'United States Capitol Police', 'Sarbanes, John']",2024-01-05T11:15:09+0000,article,U.S.
Prime Minister Sheikh Hasina is expected to roll to a fourth consecutive term as the gutted opposition boycotts what it calls an unfair election.,There is little doubt that Prime Minister Sheikh Hasina will seize a fourth consecutive term when Bangladesh goes to the polls on Sunday. The bigger question is what will remain of the country’s democracy.,"{'main': 'A One-Sided Affair as Bangladesh’s Ailing Democracy Goes to the Polls', 'kicker': None, 'content_kicker': None, 'print_headline': 'Bangladesh Paves Way  For One-Sided Election As Its Opposition Reels', 'name': None, 'seo': None, 'sub': None}","['Bangladesh', 'Elections', 'Politics and Government', 'Boycotts', 'Demonstrations, Protests and Riots', 'Democracy (Theory and Philosophy)', 'Bangladesh Awami League', 'Bangladesh Nationalist Party', 'Zia, Khaleda', 'Wazed, Hasina']",2024-01-05T11:16:45+0000,article,World
"In London, around 50 people were evacuated from rising waters. Heavy rain brought similar scenes to parts of France and Germany.","Torrential rains that swept across parts of England overnight prompted a wave of weather alerts and travel disruptions early Friday, forecasters and officials said, warning that some rivers could see flooding continue for days.","{'main': 'Heavy Rain in U.K. Causes Hundreds of Flood Warnings and Travel Disruptions', 'kicker': None, 'content_kicker': None, 'print_headline': '', 'name': None, 'seo': None, 'sub': None}","['Floods', 'Rain', 'Evacuations and Evacuees', 'Weather', 'Met Office (United Kingdom)', 'England', 'London (England)', 'River Thames (England)']",2024-01-05T11:18:13+0000,article,World
The war in Ukraine has entered a new phase.,"The war in Ukraine has again entered a new phase. With neither side believing that it can make significant territorial gains, the action has expanded beyond the front lines.","{'main': 'Beyond the Front Lines', 'kicker': None, 'content_kicker': None, 'print_headline': '', 'name': None, 'seo': None, 'sub': None}","['internal-storyline-no', 'Ukraine', 'Russia', 'Russian Invasion of Ukraine (2022)']",2024-01-05T11:26:40+0000,article,Briefing
