abstract,lead_paragraph,headline,keywords,pub_date,document_type,section_name
"As solicitor general under Reagan, he argued against abortion rights and affirmative action. But he came to see the current Supreme Court as “reactionary, not conservative.”","Charles Fried, a conservative legal scholar who as President Ronald Reagan’s solicitor general argued against abortion rights and affirmative action before the Supreme Court — but who later rejected the conservative legal movement’s rightward march, calling the current high court “reactionary” — died on Tuesday at his home in Cambridge, Mass. He was 88.","{'main': 'Charles Fried, Legal Scholar Who Broke With Conservatives, Dies at 88', 'kicker': None, 'content_kicker': None, 'print_headline': 'Charles Fried, Legal Scholar Who Broke With Conservatives, Dies at 88', 'name': None, 'seo': None, 'sub': None}","['Fried, Charles', 'Deaths (Obituaries)', 'Conservatism (US Politics)', 'Reagan, Ronald Wilson', 'Harvard Law School', 'Legal Profession', 'Supreme Court (US)', 'Solicitors General', 'United States Politics and Government']",2024-01-27T21:26:07+0000,article,U.S.
"The actions came as specific, “horrific” details were more widely shared by the U.N. and Israel.","Germany, Britain and at least four other countries said Saturday they were suspending funding for the United Nations agency that provides food, water and essential services for Palestinian civilians in the Gaza Strip, many of whom have been described as being on the brink of starvation after 16 weeks of war between Israel and Hamas.","{'main': 'Major Donors Pause Funding for U.N. Agency as Scandal Widens', 'kicker': None, 'content_kicker': None, 'print_headline': 'Israeli Claims Against U.N. Agency Lead More Nations to Halt Funding', 'name': None, 'seo': None, 'sub': None}","['Israel-Gaza War (2023- )', 'Terrorism', 'International Relations', 'Humanitarian Aid', 'Palestinians', 'United Nations Relief and Works Agency', 'Gaza Strip', 'Israel', 'Hamas']",2024-01-27T22:31:39+0000,article,World
"On social media, Ukraine’s foreign ministry posted clips of the Serbian actor Milos Bikovic receiving a medal for cultural achievement from Vladimir Putin in 2018.","Ukraine’s foreign ministry criticized HBO this week after Milos Bikovic was cast in the third season of “The White Lotus,” saying without evidence that the Serbian actor had supported Russia since its full-scale invasion of Ukraine.","{'main': 'Ukraine Criticizes HBO, Saying New ‘White Lotus’ Actor Supports War', 'kicker': None, 'content_kicker': None, 'print_headline': 'Ukraine Criticizes HBO Over ‘White Lotus’ Actor', 'name': None, 'seo': None, 'sub': None}","['Bikovic, Milos (1988- )', 'Television', 'The White Lotus (TV Program)', 'Actors and Actresses', 'Home Box Office', 'Ukraine', 'Russia', 'Serbia', 'Politics and Government', 'Russian Invasion of Ukraine (2022)']",2024-01-27T22:52:27+0000,article,Arts
Nathan Hasegawa’s second puzzle is a hit.,Jump to: Today’s Theme | Tricky Clues,"{'main': 'Hammer Time', 'kicker': 'wordplay, the crossword column', 'content_kicker': None, 'print_headline': '', 'name': None, 'seo': None, 'sub': None}","['Crossword Puzzles', 'Games']",2024-01-27T23:00:09+0000,article,Crosswords & Games
A written draft agreement calls for the phased release of captives held by Hamas in exchange for a cessation in Israel’s military offensive for about two months.,"American-led negotiators are edging closer to an agreement in which Israel would suspend its war in Gaza for about two months in exchange for the release of more than 100 hostages still held by Hamas, a deal that could be sealed in the next two weeks and would transform the conflict consuming the region.","{'main': 'Negotiators Close In on Hostage Deal That Would Halt Fighting in Gaza for Weeks', 'kicker': None, 'content_kicker': None, 'print_headline': 'U.S.-Led Talks Close In  On Cease-Fire in Gaza In Exchange for Captives', 'name': None, 'seo': None, 'sub': None}","['Israel-Gaza War (2023- )', 'Palestinians', 'Kidnapping and Hostages', 'United States International Relations', 'International Relations', 'Hamas', 'Israel', 'Qatar', 'Gaza Strip', 'Egypt', 'Biden, Joseph R Jr', 'Netanyahu, Benjamin']",2024-01-27T23:25:12+0000,article,U.S.
"The Republican presidential candidate was not home at the time of the episode on Dec. 30, one of several targeting politicians late last year, Reuters reported.","A bogus account of a shooting at a South Carolina home owned by Nikki Haley sent the authorities scrambling in late December, but the Republican presidential candidate and a former governor of the state, was not there at the time, Reuters reported on Saturday.","{'main': 'Nikki Haley Was Target of December ‘Swatting’ Incident, Authorities Say', 'kicker': None, 'content_kicker': None, 'print_headline': '', 'name': None, 'seo': None, 'sub': None}","['Presidential Election of 2024', 'United States Politics and Government', 'Swatting (Crime)', 'Primaries and Caucuses', 'Threats and Threatening Messages', 'Republican Party', 'Haley, Nikki R', 'Trump, Donald J', 'Kiawah Island (SC)', 'South Carolina']",2024-01-27T23:41:30+0000,article,U.S.
