abstract,lead_paragraph,headline,keywords,pub_date,document_type,section_name
Senators voted to kill a resolution that would have ordered the administration to assess whether Israel has violated human rights. But the debate highlighted Democratic resistance to providing unfettered aid.,"When Hamas unleashed a bloody attack against Israel in October, there was a swift and strong bipartisan clamor of support in Congress for the United States to spare no expense in backing a robust military response by the Jewish state. More than 100 days later, that consensus on Capitol Hill shows signs of fraying, as left-wing Democrats alarmed by the rising human toll of the war in Gaza press to limit aid to Israel or impose strict conditions on it.","{'main': 'Senate Rejects Israel Human Rights Measure, but Skepticism on Aid Persists', 'kicker': None, 'content_kicker': None, 'print_headline': 'Senate Tables Push for Report on Gaza Human Rights', 'name': None, 'seo': None, 'sub': None}","['Israel-Gaza War (2023- )', 'Civilian Casualties', 'United States Politics and Government', 'Human Rights and Human Rights Violations', 'Foreign Aid', 'Palestinians', 'Democratic Party', 'Senate', 'Sanders, Bernard', 'Gaza Strip', 'Israel']",2024-01-16T10:02:13+0000,article,U.S.
"The state’s electric infrastructure, which failed during a winter storm in 2021, withstood the worst of this week’s Arctic chill.","Millions of Texans endured wickedly cold air on Tuesday, but the Texas power grid, which failed spectacularly during a deep freeze in 2021, held firm.","{'main': 'Despite Frigid Cold, Texas Power Grid Has Kept the Heat On So Far', 'kicker': None, 'content_kicker': None, 'print_headline': 'Despite Frigid Temperatures, the Texas Power Grid Has Kept the Heat On, So Far', 'name': None, 'seo': None, 'sub': None}","['Power Failures and Blackouts', 'Texas', 'Cold and Cold Spells', 'Electric Reliability Council of Texas']",2024-01-16T10:02:14+0000,article,U.S.
A third-place finish didn’t deliver the boost Nikki Haley wanted as she tries to turn the race into a one-on-one with Donald Trump.,Nikki Haley had hoped to vault into New Hampshire ahead of next Tuesday’s first-in-the-nation primary with a head of steam from a second-place finish in Iowa and a powerful case to make that the 2024 nomination fight was a two-candidate race between her and Donald J. Trump.,"{'main': 'Haley’s Missed Opportunity: Iowa Slows Her Roll Into New Hampshire', 'kicker': None, 'content_kicker': None, 'print_headline': '', 'name': None, 'seo': None, 'sub': None}","['Haley, Nikki R', 'Trump, Donald J', 'Presidential Election of 2024', 'United States Politics and Government', 'Iowa', 'New Hampshire', 'Republican Party']",2024-01-16T10:02:16+0000,article,U.S.
The cold-weather closures affected about a million children in a region known for its mild winters.,"Because of severe cold weather, schools across a wide swath of the South — from Texas and Tennessee to Alabama and Arkansas — were closed on Tuesday, affecting about one million children in a region known for its mild winters.","{'main': 'A Rare and Punishing Cold Shuts Schools Across the South', 'kicker': None, 'content_kicker': None, 'print_headline': 'Severe Cold And Snow Shut Schools Across South', 'name': None, 'seo': None, 'sub': None}","['Cold and Cold Spells', 'Education (K-12)', 'Colleges and Universities', 'Texas', 'Fort Worth (Tex)', 'Dallas (Tex)', 'Houston (Tex)', 'Tennessee', 'Alabama', 'Arkansas', 'Sun Belt States (US)']",2024-01-16T10:02:17+0000,article,U.S.
"Gov. Kathy Hochul’s new spending plan, unveiled on Tuesday, also called for investments in mental health care and for an important change to the way that cannabis is taxed.",Gov. Kathy Hochul on Tuesday unveiled a $233 billion budget for New York State that includes $2.4 billion to help New York City manage its migrant crisis — a $500 million increase reflecting the mounting costs as immigrants continue to arrive.,"{'main': 'Migrant Costs Help Push New York State’s Budget to $233 Billion', 'kicker': None, 'content_kicker': None, 'print_headline': 'With Migrant Expenses, New York State’s Budget Plan Grows to $233 Billion', 'name': None, 'seo': None, 'sub': None}","['Politics and Government', 'Budgets and Budgeting', 'Immigration and Emigration', 'New York State', 'Hochul, Kathleen C']",2024-01-16T10:02:22+0000,article,New York
The Simons Foundation is to provide the largest gift in the history of New York City’s public university.,Good morning. It’s Tuesday. We’ll look at how Gov. Kathy Hochul’s artificial intelligence initiative is taking shape. We’ll also look at a key lawyer’s decision to drop Donald Trump as a client in two cases in Manhattan.,"{'main': 'A $75 Million Gift for CUNY Dedicated to A.I.', 'kicker': 'New York Today', 'content_kicker': None, 'print_headline': '', 'name': None, 'seo': None, 'sub': None}","['New York City', 'internal-storyline-no', 'Artificial Intelligence', 'Philanthropy', 'Colleges and Universities', 'Sex Crimes', 'Compensation for Damages (Law)', 'City University of New York', 'Simons Foundation', 'CARROLL, E JEAN', 'Matos Rodriguez, Felix V', 'Simons, James Harris', 'Trump, Donald J']",2024-01-16T10:02:22+0000,article,New York
A dominant victory and little momentum for his rivals.,"If there was any question whether Donald J. Trump was on track to win the Republican nomination, it was answered Monday night by the voters of Iowa.","{'main': 'Even the Battle for Second Turned Out Well for Trump in Iowa', 'kicker': None, 'content_kicker': None, 'print_headline': '', 'name': None, 'seo': None, 'sub': None}","['Presidential Election of 2024', 'Iowa', 'Primaries and Caucuses', 'Trump, Donald J', 'Haley, Nikki R', 'DeSantis, Ron', 'United States Politics and Government', 'internal-sub-only-nl', 'Republican Party']",2024-01-16T10:03:19+0000,article,The Upshot
"Can you find San Marino on a map? What else do you know about this European nation with 33,000 people?","Can you find San Marino on a map? What else do you know about this European nation with 33,000 people?","{'main': 'How Much Do You Know About San Marino?', 'kicker': 'Geography Quizzes', 'content_kicker': None, 'print_headline': '', 'name': None, 'seo': None, 'sub': None}","['San Marino, Republic of']",2024-01-16T10:30:00+0000,multimedia,The Learning Network
"“Dangerously cold” wind chills were forecast for the Great Plains and Midwest, with record lows reaching into the Gulf Coast.","A blast of Arctic air was expected to reach into the Deep South on Tuesday morning, potentially breaking or tying low-temperature records for the day from Texas to Mississippi, according to forecasters at the National Weather Service.","{'main': 'Frigid Temperatures Are Expected Across the U.S. on Tuesday', 'kicker': None, 'content_kicker': None, 'print_headline': '', 'name': None, 'seo': None, 'sub': None}","['Central Park (Manhattan, NY)', 'Weather', 'Snow and Snowstorms', 'FROSTBITE', 'Cold and Cold Spells', 'Gulf Coast (US)', 'Texas', 'Great Plains (US)', 'Rocky Mountains']",2024-01-16T10:40:04+0000,article,U.S.
"The Israeli military has been surprised by the extent, depth and quality of the tunnel network beneath Gaza.","One tunnel in Gaza was wide enough for a top Hamas official to drive a car inside. Another stretched nearly three football fields long and was hidden beneath a hospital. Under the house of a senior Hamas commander, the Israeli military found a spiral staircase leading to a tunnel approximately seven stories deep.","{'main': 'Israel Unearths More of a Subterranean Fortress Under Gaza', 'kicker': None, 'content_kicker': None, 'print_headline': 'Scope and Quality of Gaza Tunnels Awe Israelis', 'name': None, 'seo': None, 'sub': None}","['Israel-Gaza War (2023- )', 'Bridges and Tunnels', 'Defense and Military Forces', 'Palestinians', 'Terrorism', 'Hamas', 'Israel', 'Gaza Strip']",2024-01-16T11:00:14+0000,article,U.S.
The 2024 presidential race began with a hefty win for Donald Trump. Can any Republican challenge his command of the party?,"At the Iowa Republican caucuses on Monday night, Donald J. Trump secured a runaway victory. The only real drama was the fight for second place.","{'main': 'Trump’s Domination and the Battle for No. 2 in Iowa', 'kicker': None, 'content_kicker': None, 'print_headline': '', 'name': None, 'seo': None, 'sub': None}","['Primaries and Caucuses', 'Presidential Election of 2024', 'Trump, Donald J', 'Iowa']",2024-01-16T11:03:27+0000,article,Podcasts
Hear the news in five minutes.,"The New York Times Audio app is home to journalism and storytelling, and provides news, depth and serendipity. If you haven’t already, download it here — available to Times news subscribers on iOS — and sign up for our weekly newsletter.","{'main': 'Trump Wins Iowa, and Iceland’s Volcanic Eruption', 'kicker': None, 'content_kicker': None, 'print_headline': '', 'name': None, 'seo': None, 'sub': None}","['Volcanoes', 'Primaries and Caucuses', 'Emmy Awards', 'Earthquakes', 'Elections', 'Democratic Party', 'Senate', 'Iceland', 'Iowa', 'Israel', 'United States']",2024-01-16T11:07:39+0000,article,Podcasts
The Times’s chief political analyst explains the caucus results.,"If there was any question whether Donald Trump was on track to win the Republican nomination, it was answered Monday night by the voters of Iowa.","{'main': 'Trump’s Big Win in Iowa', 'kicker': None, 'content_kicker': None, 'print_headline': '', 'name': None, 'seo': None, 'sub': None}","['Iowa', 'Republican Party', 'Trump, Donald J', 'DeSantis, Ron', 'Haley, Nikki R']",2024-01-16T11:36:40+0000,article,Briefing
"Suri Botuck and her husband, Jacob Botuck, brought five of their children to Iowa from St. Louis for an up-close look at the political process.",Suri Botuck was eager to hear Gov. Ron DeSantis of Florida deliver his closing pitch to Iowans on Sunday in Cedar Rapids — but she didn’t caucus for him on Monday night. Nor is she even from Iowa.,"{'main': 'Kids, get in the car. We’re taking a road trip to the caucuses.', 'kicker': None, 'content_kicker': None, 'print_headline': '', 'name': None, 'seo': None, 'sub': None}","['Presidential Election of 2024', 'Iowa', 'Haley, Nikki R', 'DeSantis, Ron', 'Trump, Donald J']",2024-01-16T11:46:10+0000,article,U.S.
"Why is this image in the news? What does it show, and why is that information important?",The image above was published on The New York Times homepage on Jan. 16.  ,"{'main': 'Contenders', 'kicker': 'Picture Prompts', 'content_kicker': None, 'print_headline': '', 'name': None, 'seo': None, 'sub': None}",[],2024-01-16T11:58:17+0000,article,The Learning Network
"A dry winter has been devastating to Gulmarg, one of Asia’s highest ski resorts, in Indian-controlled Kashmir.","Every morning, Ishfaaq Ahmad Malik, a ski instructor in Indian-controlled Kashmir, opens his bedroom window and, like many others in the region, wonders: Where is the snow?","{'main': 'It’s January at a Big Himalayan Resort. Where’s the Snow?', 'kicker': None, 'content_kicker': None, 'print_headline': 'It’s January at a Big Himalayan Resort. Where’s the Snow?', 'name': None, 'seo': None, 'sub': None}","['Travel and Vacations', 'Snow and Snowstorms', 'Winter (Season)', 'Global Warming', 'Skiing', 'Weather', 'Gulmarg (Jammu and Kashmir)']",2024-01-16T12:01:07+0000,article,World
"More than an inch of snow fell in Central Park, ending a lengthy dry spell. Then it turned to rain.","New York City saw its biggest single-day snowfall in nearly two years on Tuesday, and while the total amount was less than two inches, it was enough to break the city’s longest recorded streak of no significant accumulation.","{'main': 'New York City Sees Significant Snowfall for First Time in 701 Days', 'kicker': None, 'content_kicker': None, 'print_headline': 'At Last, Significant Snowfall Arrives in New York City', 'name': None, 'seo': None, 'sub': None}","['Snow and Snowstorms', 'Central Park (Manhattan, NY)', 'New York City']",2024-01-16T12:17:14+0000,article,New York
"Speaking at the Davos global forum a day before China is set to release economic data, Premier Li Qiang said the economy grew “around 5.2 percent.”","China’s second-highest leader said Tuesday that his country’s economy had grown “around 5.2 percent” last year, providing an unusual early glimpse of important economic data a day before its official release.","{'main': 'Chinese Leader Gives Early Estimate of Economic Growth', 'kicker': None, 'content_kicker': None, 'print_headline': 'China’s Economy Grew 5.2% In 2023, a Top Official Reports', 'name': None, 'seo': None, 'sub': None}","['Economic Conditions and Trends', 'Li Qiang (1959- )', 'China', 'Switzerland', 'World Economic Forum', 'Davos (Switzerland)']",2024-01-16T12:50:50+0000,article,Business Day
"The seized items, including missile guidance systems and warheads, were for the Iran-backed Houthi militia, which has been targeting ships in the Red Sea, the Pentagon said.","Two members of the Navy SEALs who were reported missing last week off the coast of Somalia were part of a nighttime commando operation that seized a small boat carrying lethal aid from Iran to the Houthi militia in Yemen, the U.S. military said on Tuesday.","{'main': '2 Missing SEALs Were on Mission to Stop Yemen-Bound Iranian Weapons, U.S. Says', 'kicker': None, 'content_kicker': None, 'print_headline': '', 'name': None, 'seo': None, 'sub': None}","['United States Defense and Military Forces', 'Defense and Military Forces', 'Houthis', 'Navy Seals', 'United States Navy', 'Iran', 'Red Sea', 'Yemen', 'Somalia']",2024-01-16T12:54:06+0000,article,World
Test your memory with this short quiz featuring popular and award-winning books.,Test your memory with this short quiz featuring popular and award-winning books.,"{'main': 'Do You Recognize These Lines From Classic Young-Adult Novels?', 'kicker': None, 'content_kicker': None, 'print_headline': '', 'name': None, 'seo': None, 'sub': None}",['Books and Literature'],2024-01-16T13:00:03+0000,multimedia,Books
"In a speech in Switzerland, the Ukrainian president asked for more sanctions on Moscow, but he did not appeal for weaponry for new offenses.","With fighting still raging in Ukraine, and a front line that has barely shifted in more than a year, the country’s president, Volodymyr Zelensky, headed on Tuesday to the World Economic Forum in Davos, Switzerland, amid a swirl of diplomatic discussions about possible peace talks.","{'main': 'Zelensky Calls for Peace, Not More Weapons, in Davos', 'kicker': None, 'content_kicker': None, 'print_headline': ' Russia Sows  Instability,  Davos Forum  Is Cautioned', 'name': None, 'seo': None, 'sub': None}","['International Relations', 'Russian Invasion of Ukraine (2022)', 'Peace Process', 'World Economic Forum', 'Zelensky, Volodymyr', 'Switzerland', 'Ukraine', 'Russia']",2024-01-16T13:05:52+0000,article,World
"C.E.O.s and world leaders gather in the Swiss Alps this year as war, trade risks and disruptive new technologies loom large.","Thousands of global leaders have once again descended on snowy Davos, Switzerland, for the World Economic Forum’s annual meeting. The theme of this year’s event: “rebuilding trust.”","{'main': 'The Big Buzz at Davos: A.I., Ukraine, China, and the Middle East', 'kicker': 'DealBook Newsletter', 'content_kicker': None, 'print_headline': '', 'name': None, 'seo': None, 'sub': None}","['internal-storyline-no', 'Artificial Intelligence', 'Presidential Election of 2024', 'Israel-Gaza War (2023- )', 'European Central Bank', 'World Economic Forum', 'Davos (Switzerland)', 'Altman, Samuel H', 'Blinken, Antony J', 'Dalio, Raymond (1949- )', 'Gay, Claudine', 'Herzog, Isaac', 'Moynihan, Brian T', 'Kushner, Jared', 'Li Qiang (1959- )', 'Suleyman, Mustafa', 'Zelensky, Volodymyr']",2024-01-16T13:27:34+0000,article,Business Day
"The Wall Street bank earned $2 billion in the fourth quarter, beating expectations, after a period marked by management missteps.","Goldman Sachs on Tuesday reported its second consecutive quarter of steady profits, a return to form for the bank, which has struggled with management missteps that tarnished its once untouchable reputation on Wall Street.","{'main': 'Goldman Sachs Sticks the Landing at End of Tumultuous Year', 'kicker': None, 'content_kicker': None, 'print_headline': 'After Missteps, Goldman Sachs  Ends the Year Beating the Odds', 'name': None, 'seo': None, 'sub': None}","['Banking and Financial Institutions', 'Company Reports', 'Goldman Sachs Group Inc', 'Solomon, David M']",2024-01-16T13:38:33+0000,article,Business Day
A walkout at the nation’s largest four-year public university system would affect hundreds of thousands of students.,"Faculty members at the California State University system, the nation’s largest four-year public university system, are planning to cancel classes and strike next week as they demand higher pay and better benefits.","{'main': 'Why a Faculty Strike Looms at the State University System', 'kicker': 'California Today', 'content_kicker': None, 'print_headline': '', 'name': None, 'seo': None, 'sub': None}",['California'],2024-01-16T14:00:08+0000,article,U.S.
A $78 billion package to revive an expansion of the child tax credit and expired business breaks has drawn bipartisan support in the House and Senate.,"Top Democrats and Republicans in Congress on Tuesday released a $78 billion compromise they have reached to expand the child tax credit and restore three popular expired business tax breaks, but the package faces a challenging road to enactment in an election year.","{'main': 'Lawmakers Strike Tax Deal, but It Faces Long Election-Year Odds in Congress', 'kicker': None, 'content_kicker': None, 'print_headline': 'Bipartisan Tax Deal Faces Long Election-Year Odds in Congress', 'name': None, 'seo': None, 'sub': None}","['Tax Credits, Deductions and Exemptions', 'Child Tax Credits and Stipends', 'Poverty', 'Law and Legislation', 'House of Representatives', 'Senate', 'Democratic Party', 'Republican Party', 'United States Politics and Government']",2024-01-16T14:21:57+0000,article,U.S.
"Elon Musk, the electric car company’s chief executive, said he would “build products outside of Tesla” unless the board raises his stake to 25 percent.","Elon Musk, the chief executive of Tesla, stunned investors by demanding that the company’s board give him shares worth more than $80 billion if it wants him to continue developing products based on artificial intelligence.","{'main': 'Musk Demands Bigger Stake in Tesla as Price for A.I. Work', 'kicker': None, 'content_kicker': None, 'print_headline': 'Musk Says No to A.I. Work  Without Bigger Tesla Stake', 'name': None, 'seo': None, 'sub': None}","['Electric and Hybrid Vehicles', 'Artificial Intelligence', 'Stocks and Bonds', 'Boards of Directors', 'Robots and Robotics', 'Tesla Motors Inc', 'Musk, Elon']",2024-01-16T14:37:28+0000,article,Business Day
The latest adaptation of F. Scott Fitzgerald’s classic novel will feature Jeremy Jordan (“Newsies”) as Jay Gatsby and Eva Noblezada (“Hadestown”) as Daisy Buchanan.,"“The Great Gatsby,” F. Scott Fitzgerald’s 1925 novel of garish glamour and dashed dreams, is coming to Broadway as a musical this spring.","{'main': 'A ‘Great Gatsby’ Musical Is Coming to Broadway in March', 'kicker': None, 'content_kicker': None, 'print_headline': '‘Great Gatsby’ Musical Is Coming to Broadway', 'name': None, 'seo': None, 'sub': None}","['Theater', 'Theater (Broadway)', 'Fitzgerald, F Scott', 'The Great Gatsby (Book)', 'Jordan, Jeremy (1984- )', 'Noblezada, Eva']",2024-01-16T14:45:08+0000,article,Theater
The Emmys on Monday night felt in many ways like a bookend to one of the defining features of the streaming era: a never-ending supply of new programming.,"As “Succession” cast members marched up to the Emmy stage on Monday night to grab their statues for the show’s final season, they used it as one last opportunity to say goodbye.","{'main': 'Congrats, and Goodbye, to Peak TV', 'kicker': None, 'content_kicker': None, 'print_headline': 'Emmys Left Eerie Feeling That Peak TV Is Passing Prime Time', 'name': None, 'seo': None, 'sub': None}","['Television', 'Video Recordings, Downloads and Streaming', 'Emmy Awards', 'Budgets and Budgeting', 'Succession (TV Program)']",2024-01-16T14:46:14+0000,article,Business Day
Commuters navigated snowy sidewalks as the city ended a streak of 701 days without significant accumulation.,Commuters navigated snowy sidewalks as the city ended a streak of 701 days without significant accumulation.,"{'main': 'New York City Snowfall Ends Nearly Two-Year Dry Spell', 'kicker': None, 'content_kicker': None, 'print_headline': '', 'name': None, 'seo': None, 'sub': None}","['Snow and Snowstorms', 'New York City']",2024-01-16T14:46:30+0000,multimedia,New York
"Nobody was injured in the episode on Tuesday, which took place on the country’s northern island of Hokkaido amid heavy snow.","One plane clipped another at an airport on Japan’s snowy northern island of Hokkaido on Tuesday, according to the airlines involved, just weeks after a deadly runway blaze in Tokyo.","{'main': 'One Plane Clips Another at Japan Airport, Weeks After Deadly Runway Blaze', 'kicker': None, 'content_kicker': None, 'print_headline': 'Two Planes Collide at Snowy Japan Airport', 'name': None, 'seo': None, 'sub': None}","['AIRLINES AND AIRPLANES', 'Aviation Accidents, Safety and Disasters', 'Snow and Snowstorms', 'Hokkaido (Japan)', 'Japan', 'South Korea', 'Tokyo (Japan)', 'Cathay Pacific Airways Limited']",2024-01-16T14:48:14+0000,article,World
Krystian Lupa’s latest work had its premiere in Paris after an earlier attempt collapsed. The delay would have been a good time to rethink the four-and-a-half-hour show.,"The spotlight is rarely on them. Yet as the technical crew moved furniture between scenes of Krystian Lupa’s new play “The Emigrants,” which finally had its world premiere in Paris on Saturday, they were watched as carefully as headline performers.","{'main': '‘The Emigrants’ Review: A Troubled Show Finally Debuts', 'kicker': None, 'content_kicker': None, 'print_headline': 'A Show Debuts, Difficult Director and All', 'name': None, 'seo': None, 'sub': None}","['Lupa, Krystian', 'Sebald, W G', 'Odeon Theater (Paris, France)', 'Theater', 'The Emigrants (Play)', 'Braunschweig, Stephane', 'Paris (France)']",2024-01-16T14:51:07+0000,article,Theater
Golriz Ghahraman was the first refugee to be sworn in as a member of the country’s Parliament. She did not directly address the accusations but said her behavior “fell short.”,"A lawmaker from New Zealand quit her job on Tuesday after allegations emerged that she had shoplifted from two clothing stores, actions she said were caused by stress affecting her mental health.","{'main': 'New Zealand Lawmaker Resigns After Shoplifting Allegations', 'kicker': None, 'content_kicker': None, 'print_headline': 'M.P. Accused  Of Shoplifting  Steps Down,  Citing Health', 'name': None, 'seo': None, 'sub': None}","['New Zealand', 'International Relations', 'Politics and Government', 'Shoplifting and Employee Theft (Retail)', 'Legislatures and Parliaments', 'Ghahraman, Golriz', 'Refugees and Displaced Persons']",2024-01-16T14:52:09+0000,article,World
The highlight of the street dance festival “Motion/Matter” at the Perelman Performing Arts Center came at the end: an all-styles battle that honored roots.,"Fifty years into the history of hip-hop, street to stage transfers remain tricky. Hip-hop dance is diverse and globally dominant, but when it’s put on concert stages, something often gets lost.","{'main': 'Bringing a Diversity of Hip-Hop Dance to the Concert Stage', 'kicker': 'Critic’s Notebook', 'content_kicker': None, 'print_headline': 'Celebrating a Diversity of Hip-Hop Moves', 'name': None, 'seo': None, 'sub': None}","['Dancing', 'Rap and Hip-Hop', 'Perelman, Ronald O, Performing Arts Center', 'Korea National Contemporary Dance Co', 'Harris, Rennie', 'LaBeija, Kia', 'Blevins, Tyler (1991- )']",2024-01-16T15:00:08+0000,article,Arts
"Mr. Heuermann is accused of killing Maureen Brainard-Barnes, the last of the so-called Gilgo Four, whose bodies were found along a desolate beach.","When Rex Heuermann was arrested and charged in July as the Gilgo Beach serial killer, prosecutors outlined a narrative against him that his defense lawyer, Michael Brown, attacked as cherry-picked and DNA evidence that Mr. Brown derided as shaky.","{'main': 'Rex Heuermann Faces Fourth Murder Charge in Gilgo Beach Serial Killings', 'kicker': None, 'content_kicker': None, 'print_headline': 'Gilgo Beach Suspect Charged in 4th Woman’s Murder', 'name': None, 'seo': None, 'sub': None}","['Serial Murders', 'DNA (Deoxyribonucleic Acid)', 'Forensic Science', 'Brainard-Barnes, Maureen', 'Heuermann, Rex (1963- )', 'Gilgo Beach (NY)', 'Massapequa Park (NY)']",2024-01-16T15:01:16+0000,article,New York
"The energy company’s exit from onshore petroleum drilling in Nigeria is aimed to reduce risks, while it continues to produce oil and gas offshore.",Shell said Tuesday that it had agreed to sell its onshore oil and gas business in Nigeria to a group dominated by local companies for $1.3 billion.,"{'main': 'Shell to Sell Its Onshore Nigeria Oil Business for $1.3 Billion', 'kicker': None, 'content_kicker': None, 'print_headline': 'Shell Says It Will Sell Onshore Oil Business In Nigeria to Cut Risk', 'name': None, 'seo': None, 'sub': None}","['Oil (Petroleum) and Gasoline', 'Offshore Drilling and Exploration', 'Mergers, Acquisitions and Divestitures', 'Shell Plc', 'AFRICA', 'Nigeria', 'Natural Gas']",2024-01-16T15:10:55+0000,article,Business Day
