abstract,lead_paragraph,headline,keywords,pub_date,document_type,section_name
"An Alaska Airlines plane made an emergency landing at the Portland, Ore., airport on Friday after a hole opened up in the plane while it was in flight.","The Federal Aviation Administration on Saturday ordered U.S. airlines to stop using some Boeing 737 Max 9 planes until they were inspected, after one of those planes lost a piece of its body in midair, terrifying passengers until the plane landed safely.","{'main': 'F.A.A. Orders Airlines to Ground Some Boeing 737 Max 9 Jets After Midair Emergency', 'kicker': None, 'content_kicker': None, 'print_headline': 'F.A.A. Grounds Some Boeing Max 9s After Scare', 'name': None, 'seo': None, 'sub': None}","['Aviation Accidents, Safety and Disasters', 'Boeing 737 Max Groundings and Safety Concerns (2019)', 'AIRLINES AND AIRPLANES', 'ALASKA AIRLINES', 'Boeing Company', 'Federal Aviation Administration', 'Regulation and Deregulation of Industry']",2024-01-07T00:32:23+0000,article,Business Day
The effort to oust the state’s controversial G.O.P. chair after infighting and financial troubles faces challenges from her allies and is likely headed to the courts.,"Simmering tensions within the Michigan Republican Party boiled over on Saturday, with some party officials voting to remove their embattled chairwoman, Kristina Karamo, in a contentious proceeding that she and other state Republicans argued was illegitimate.","{'main': 'Michigan Republicans Hold Disputed Vote to Remove Party Leader', 'kicker': None, 'content_kicker': None, 'print_headline': 'Disputed Vote Aims to Oust Leader of Michigan G.O.P.', 'name': None, 'seo': None, 'sub': None}","['Michigan', 'Politics and Government', 'Republican Party', 'Karamo, Kristina']",2024-01-07T00:51:38+0000,article,U.S.
"The death might have been just a local tragedy. But some of the suspects were from an immigrant community, turning the case into a cause célèbre for the far right.",The traditional village ball 18 minutes outside the city ended in the traditional way: young men fighting outside.,"{'main': 'A Small-Town Stabbing Takes On a Larger Significance for France', 'kicker': None, 'content_kicker': None, 'print_headline': 'A Small-Town Stabbing Stirs the Far Right in France', 'name': None, 'seo': None, 'sub': None}","['Romans-sur-Isere (France)', 'Murders, Attempted Murders and Homicides', 'Immigration and Emigration', 'Discrimination', 'Men and Boys', 'Youth', 'Right-Wing Extremism and Alt-Right', 'Politics and Government', 'France', 'Local Government']",2024-01-07T05:01:20+0000,article,World
"The survivor, who was in her 90s, was dug out from under a collapsed house, injured but responsive.","The police and other rescue workers pulled a woman in her 90s out from under a collapsed house on Saturday in western Japan, five days after a powerful earthquake struck the region, killing more than 126 people.","{'main': 'Woman Rescued From Rubble in Japan Five Days After Deadly Quake', 'kicker': None, 'content_kicker': None, 'print_headline': 'Woman Alive After 5 Days In Rubble', 'name': None, 'seo': None, 'sub': None}","['Earthquakes', 'Japan', 'Rescues']",2024-01-07T05:07:56+0000,article,World
"Forecasters warned of low visibility and dangerous driving conditions during the heaviest snowfall, which could reach one to two inches per hour.","The first major storm of the winter season dropped more than a foot of snow in parts of the Northeast on Saturday, creating treacherous travel conditions in some areas while also bringing an end to a mostly snowless winter so far.","{'main': 'Winter Storm Hits the Northeast, Bringing a Foot of Snow to Some Areas', 'kicker': None, 'content_kicker': None, 'print_headline': 'Snow Wallops Northeast, Surpassing a Foot in Some Areas', 'name': None, 'seo': None, 'sub': None}","['Snow and Snowstorms', 'Northeastern States (US)', 'Floods', 'Weather', 'Rain', 'East Coast (US)']",2024-01-07T05:15:13+0000,article,U.S.
"Corrections that appeared in print on Sunday, Jan. 7, 2024.",An article last Sunday about “Car­men” at the Metropolitan Opera misstated the performance history of the Russian mezzo-­soprano Aigul Akhmetshina. She has performed at the Met before; “Carmen” is not her Met debut.,"{'main': 'Corrections: Jan. 7, 2024', 'kicker': None, 'content_kicker': None, 'print_headline': 'Corrections', 'name': None, 'seo': None, 'sub': None}",[],2024-01-07T05:51:53+0000,article,Corrections
"Quotation of the Day for Sunday, January 7, 2024.","“The biggest thing that my generation is begging for is for someone to be honest, and that is something we’re lacking from both sides.”","{'main': 'Quotation of the Day: Prospect of a Rematch of Biden-Trump Causes Young Voters to Retreat', 'kicker': None, 'content_kicker': None, 'print_headline': 'Quote of the Day', 'name': None, 'seo': None, 'sub': None}",[],2024-01-07T05:52:58+0000,article,Corrections
"Antony J. Blinken, the U.S. secretary of state, met separately in Amman with King Abdullah II and Ayman Safadi, Jordan’s foreign minister.","Antony J. Blinken, the U.S. secretary of state, held meetings on Sunday with leaders in Jordan and Qatar as part of a weeklong eastern Mediterranean and Middle East tour aimed at reducing the risk that the war in Gaza could spread in the region.","{'main': 'Blinken, in Jordan and Qatar, continues his Mideast tour in hopes of reducing tensions.', 'kicker': None, 'content_kicker': None, 'print_headline': '', 'name': None, 'seo': None, 'sub': None}",[],2024-01-07T07:34:15+0000,article,World
"For four days, Kareem Sabawi’s body lay wrapped in a blanket in a cold, empty apartment as his family sheltered nearby. He was killed during intense Israeli bombardment near his family home, his father and mother said, and in the days that followed, it was too dangerous to step outside and lay their 10-year-old child to rest.","For four days, Kareem Sabawi’s body lay wrapped in a blanket in a cold, empty apartment as his family sheltered nearby. He was killed during intense Israeli bombardment near his family home, his father and mother said, and in the days that followed, it was too dangerous to step outside and lay their 10-year-old child to rest.","{'main': 'Dignified burials have become another casualty in Gaza.', 'kicker': None, 'content_kicker': None, 'print_headline': '', 'name': None, 'seo': None, 'sub': None}",[],2024-01-07T07:35:06+0000,article,World
"What do Queen Camilla, Julia Roberts and Gayle King have in common? Sole Bliss. The brand has become a go to for women who don’t want to suffer foot pain.","Helen Mirren declared herself to be “in love with them,” and Gabrielle Union said that “they might be the most comfortable shoes I have ever worn in my life.” Julia Roberts, Viola Davis and Drew Barrymore have worn them to Hollywood premieres. Queen Camilla owns 13 pairs and wears them at almost all of her public engagements.","{'main': 'The Secret Weapon of Celebrity Stylists? Comfortable Shoes.', 'kicker': None, 'content_kicker': None, 'print_headline': 'The Secret Weapon of Celebrity Stylists', 'name': None, 'seo': None, 'sub': None}","['Sole Bliss (Shoemaker)', 'Shoes and Boots', 'Feet', 'Women and Girls', 'Fashion and Apparel']",2024-01-07T08:00:21+0000,article,Style
"Proposals to reverse stark racial disparities in who dies during childbirth face deep-rooted obstacles, including hospital quality and the pandemic’s uneven aftereffects.","Late last year, a 30-year-old woman, Christine Fields, died after giving birth at a public hospital in Brooklyn. Within a few weeks, inspectors from the New York State Department of Health arrived and began pulling medical files and interviewing doctors and nurses, the agency said.","{'main': 'Why New York Has Faltered in Making Childbirth Safer for Black Mothers', 'kicker': None, 'content_kicker': None, 'print_headline': 'Safer Childbirth for Black Mothers Faces Obstacles in New York', 'name': None, 'seo': None, 'sub': None}","['New York City', 'Maternal Mortality', 'Black People', 'Blacks', 'Race and Ethnicity', 'Infant Mortality', 'Centers for Disease Control and Prevention', 'Health and Mental Hygiene Department (NYC)', 'Health Department (NYS)', 'Montefiore Medical Center', 'Woodhull Medical Center', 'Hochul, Kathleen C', 'Hospitals', 'New York State', 'audio-neutral-informative']",2024-01-07T08:00:24+0000,article,New York
"Karissa Bodnar played on her customers’ desire to belong to something bigger than … well, beauty.","On a recent Monday, Karissa Bodnar, the 34-year-old founder and chief executive of Thrive, a cosmetics company, arrived at a launch party for her latest product line. The setting: a fluorescent-lit, fifth-floor office in midtown Manhattan. The bells and whistles: cheese, crudités, basic beer and wine. The entertainment: a Bluetooth speaker playing early aughts hip-hop (Flo Rida, Lil Jon).","{'main': 'How a Millennial Estée Lauder Built a Widely Popular Beauty Brand', 'kicker': None, 'content_kicker': None, 'print_headline': 'Makeup With a Bigger Purpose', 'name': None, 'seo': None, 'sub': None}","['Cosmetics and Toiletries', 'Philanthropy', 'Content Type: Personal Profile', 'Thrive Causemetics', 'Bodnar, Karissa', 'Corporate Social Responsibility']",2024-01-07T08:00:25+0000,article,Style
In case you need some puzzle help.,"Welcome to The Wordle Review. Be warned: This page contains spoilers for today’s puzzle. Solve Wordle first, or scroll at your own risk.","{'main': 'Today’s Wordle Review', 'kicker': None, 'content_kicker': None, 'print_headline': '', 'name': None, 'seo': None, 'sub': None}",['Wordle (Puzzle)'],2024-01-07T08:00:26+0000,article,Crosswords & Games
In case you need some puzzle help.,"Good morning, dear connectors. Welcome to today’s Connections forum, where you can give and receive puzzle — and emotional — support.","{'main': 'The Connections Companion', 'kicker': None, 'content_kicker': None, 'print_headline': '', 'name': None, 'seo': None, 'sub': None}","['Crossword Puzzles', 'Connections (Game)']",2024-01-07T08:00:28+0000,article,Crosswords & Games
Feeling stuck on today’s puzzle? We can help.,"Hi busy bees! Welcome to today’s Spelling Bee forum. There are a number of terms that appear in both this article and other online discussions of the Spelling Bee; a glossary of those terms compiled by Monicat, a Times reader, can be found below.","{'main': 'Spelling Bee Forum', 'kicker': None, 'content_kicker': None, 'print_headline': '', 'name': None, 'seo': None, 'sub': None}",['Spelling Bee (Game)'],2024-01-07T08:00:32+0000,article,Crosswords & Games
"College roommates get a surprise, dropped mango slices and more reader tales of New York City in this week’s Metropolitan Diary.",Dear Diary:,"{'main': '‘We Joked That Maybe We Could See Each Other Out Our Windows’', 'kicker': 'METROPOLITAN DIARY', 'content_kicker': None, 'print_headline': '', 'name': None, 'seo': None, 'sub': None}",['New York City'],2024-01-07T08:00:33+0000,article,New York
"At Hartsdale Pet Cemetery, Ed Martin III had become accustomed to unusual requests. Then came Patricia Chaarte.","Ed Martin III was 14 years old when he began working at his father’s pet cemetery, and in the decades since he has tended to the graves of innumerable dogs, many cats, flocks of birds, a few monkeys, a lion cub, a Bengal tiger and countless other creatures from every corner of the animal kingdom.","{'main': 'Who Was the Mysterious Woman Buried Alone at the Pet Cemetery?', 'kicker': None, 'content_kicker': None, 'print_headline': 'Here Lie Rex, Fluffy ... and a Mystery Woman', 'name': None, 'seo': None, 'sub': None}","['Chaarte, Patricia (1928-2020)', 'Grief (Emotion)', 'Content Type: Personal Profile', 'Hartsdale Pet Cemetery', 'Cemeteries', 'Pets', 'Wills and Estates', 'Hartsdale (NY)', 'San Miguel de Allende (Mexico)', 'internal-great-read', 'internal-sub-only', 'Families and Family Life']",2024-01-07T08:00:39+0000,article,New York
"The sunlit space buzzes with activity, as photographers and photo editors, food stylists and their assistants prep and cook, frame and reframe, in pursuit of the most mouthwatering shot.","Like so many things in the world of food, it starts, often, with a smell.","{'main': 'A Day in the Kitchen at The New York Times Cooking Studio', 'kicker': 'Times Insider', 'content_kicker': None, 'print_headline': 'A Day at The New York Times Cooking Studio', 'name': None, 'seo': None, 'sub': None}","['New York Times', 'Cooking and Cookbooks']",2024-01-07T08:00:46+0000,article,Times Insider
"With the opposition in jail or off the ballots in a boycott, the prime minister for the past 15 years was expected to maintain her grip on power in what appeared to be a low-turnout vote.",Prime Minister Sheikh Hasina of Bangladesh was headed toward a fourth consecutive term in office as voting ended on Sunday in a low-turnout election that had been marred by a widespread crackdown on the opposition.,"{'main': 'Bangladesh Leader Headed to 4th Straight Term in Vote Marred by Crackdown', 'kicker': None, 'content_kicker': None, 'print_headline': 'Bangladesh Votes Amid Widespread Crackdown on Opposition', 'name': None, 'seo': None, 'sub': None}","['Bangladesh', 'Elections', 'Wazed, Hasina', 'Bangladesh Awami League', 'Bangladesh Nationalist Party', 'Demonstrations, Protests and Riots']",2024-01-07T09:11:50+0000,article,World
"For his role in “The Holdovers,” set at a prep school not unlike the one he attended, the hyper-literate actor mined his own dormant memories.",Paul Giamatti would just like to put it out there that maybe he doesn’t always have to play such a motormouth.,"{'main': 'Paul Giamatti Has Done the Reading', 'kicker': None, 'content_kicker': None, 'print_headline': 'Cast as a Talker, an Actor Gobbles Up Books', 'name': None, 'seo': None, 'sub': None}","['Actors and Actresses', 'Movies', 'Content Type: Personal Profile', 'The Holdovers (Movie)', 'Giamatti, Paul', 'Payne, Alexander']",2024-01-07T10:00:31+0000,article,Movies
"“Angel Island,” an oratorio by Huang Ruo, brings to life the stark poetry of the people who were detained on the California island in the early 1900s.","In “Angel Island,” a staged oratorio about the anguish and isolation of Chinese detainees at Angel Island Immigration Station in California, a choir recites a poem about tyranny and misfortune.","{'main': 'Channeling the Pain of Chinese Immigrants, in Music and Verse', 'kicker': None, 'content_kicker': None, 'print_headline': 'Immigrants’ Pain in Music and Verse', 'name': None, 'seo': None, 'sub': None}","['Classical Music', 'Huang Ruo', 'Ozawa, Matthew', 'Del Sol String Quartet', 'Choir of Trinity Wall Street', 'Brooklyn Academy of Music', 'Chinese-Americans', 'Discrimination', 'Coronavirus (2019-nCoV)']",2024-01-07T10:00:31+0000,article,Arts
"In Marie-Helene Bertino’s remarkable funny-sad novel, the young visitor and her mother find the means to persevere in the aisles of a cosmetics store.","“He was too good for this earth,” Abraham Lincoln said of a son who died young.","{'main': 'In ‘Beautyland,’ an Awkward Alien Reports From Earth by Fax Machine', 'kicker': 'Fiction', 'content_kicker': None, 'print_headline': 'An Alien Reports From Earth by Fax Machine', 'name': None, 'seo': None, 'sub': None}","['Books and Literature', 'Bertino, Marie-Helene', 'Beautyland (Book)']",2024-01-07T10:00:31+0000,article,Books
"The shift reflects a broader generational change, and has exposed philosophical rifts in the labor movement about what the purpose of a union ought to be.","“Why are we here?” said Brandon Mancilla, a leader with the United Automobile Workers. Mr. Mancilla faced a crowd of hundreds of union members gathered on the steps of the New York Public Library’s Fifth Avenue branch, huddling against the cold as they rallied for a cease-fire in Gaza.","{'main': 'American Unions Long Backed Israel. Now, Some Are Protesting It.', 'kicker': None, 'content_kicker': None, 'print_headline': 'Unions’ Backing for Israel Shifts to Protests', 'name': None, 'seo': None, 'sub': None}","['Israel-Gaza War (2023- )', 'Organized Labor', 'Israel', 'United Automobile Workers', 'Demonstrations, Protests and Riots', 'United States', 'AMERICAN FEDERATION OF LABOR-CONGRESS OF INDUSTRIAL ORGANIZATIONS', 'Legal Aid Society', 'Bronx Defenders', 'NewsGuild', 'AMERICAN FEDERATION OF TEACHERS', 'Weingarten, Randi']",2024-01-07T10:00:38+0000,article,Business Day
"Sunland Park, along the Rio Grande, has joined the ranks of U.S. cities transformed by state cannabis laws. But the good times may not last forever.","In a desert valley along the Rio Grande in New Mexico, the city of Sunland Park has generally offered few amenities for its roughly 17,000 residents. No large grocery store. Few shops. Little to offer those uninterested in the racetrack casino or a hike to the gigantic cross of Cristo Del Rey that looms from a nearby mountaintop.","{'main': 'Marijuana Buyers From Texas Fuel a ‘Little Amsterdam’ in New Mexico', 'kicker': None, 'content_kicker': None, 'print_headline': 'Town Turned Marijuana Oasis Near Texas Rakes In the Green', 'name': None, 'seo': None, 'sub': None}","['SUNLAND PARK (NM)', 'Marijuana', 'El Paso (Tex)', 'New Mexico', 'Texas', 'vis-photo', 'Law and Legislation', 'States (US)']",2024-01-07T10:00:40+0000,article,U.S.
"At the University of Haifa, more than 40 percent of students are Arab, some with family in Gaza, and many others have now been called up as soldiers.","In a classroom at the University of Haifa in late December, Yitzhak Cohen, a fourth-year law student, began the shoulder-shrugging, arm-contorting choreography familiar to any student trying to remove a backpack.","{'main': 'War Brings Tensions, and Assault Rifles, Into an Israeli College', 'kicker': None, 'content_kicker': None, 'print_headline': 'Tensions, and Assault Rifles, Are Part of the Mix at an Israeli University', 'name': None, 'seo': None, 'sub': None}","['Israel-Gaza War (2023- )', 'Colleges and Universities', 'Palestinians', 'Jews and Judaism', 'Arabs', 'Politics and Government', 'University of Haifa', 'Robin, Ron (1951- )', 'Haifa (Israel)', 'Israel', 'Gaza Strip']",2024-01-07T10:01:15+0000,article,World
"It is out of step with the continent’s values, many bishops say, and threatens to derail expansion in the church’s fastest growing region in the world.","The Vatican’s recent declaration allowing the blessing of same-sex couples caused a stir around the globe, but perhaps most of all in Africa, a rising center of the Roman Catholic Church’s future. In one statement after the next, bishops in several countries spoke of the fear and confusion the declaration has caused among their flocks, and said it was out of step with the continent’s culture and values.","{'main': 'Blessing of Same-Sex Couples Rankles Africa’s Catholics', 'kicker': None, 'content_kicker': None, 'print_headline': 'Blessing of Same-Sex Couples Tests Faith of Africa’s Catholics', 'name': None, 'seo': None, 'sub': None}","['Homosexuality and Bisexuality', 'Same-Sex Marriage, Civil Unions and Domestic Partnerships', 'Christians and Christianity', 'Roman Catholic Church', 'Francis', 'AFRICA']",2024-01-07T10:01:16+0000,article,World
"They are the first line of treatment for soldiers wounded on the battlefield, racing against time to try to save lives.","To save lives, Ukrainian combat medics must stay alive.","{'main': '‘Two Men Down’: For Ukrainian Medics, It Was Time to Move', 'kicker': None, 'content_kicker': None, 'print_headline': 'Ukraine’s Medics, Under Fire and Racing Against Time', 'name': None, 'seo': None, 'sub': None}","['Russian Invasion of Ukraine (2022)', 'Defense and Military Forces', 'Ukraine']",2024-01-07T10:01:22+0000,article,World
"“I don’t have a relationship, and I’m very happy and have got all this work to do,” says the comedian turned politician.","“I don’t have a relationship, and I’m very happy and have got all this work to do,” says the comedian turned politician.","{'main': 'Eddie Izzard Doesn’t Trust This Whole Falling in Love Business', 'kicker': 'Talk', 'content_kicker': None, 'print_headline': 'Eddie Izzard Doesn’t Trust This Whole Falling in Love Business', 'name': None, 'seo': None, 'sub': None}","['Izzard, Eddie', 'Comedy and Humor', 'Transgender', 'Politics and Government', 'Marathon Running', 'Content Type: Personal Profile']",2024-01-07T10:01:36+0000,multimedia,Magazine
Scientists recently analyzed a Peruvian 10-cent piece with an unexplained origin.,"A decade ago, a funny money mystery fell into the hands of scientists and students at the Pontifical Catholic University of Peru in Lima.","{'main': 'The Mystery of the Coin That Shouldn’t Exist', 'kicker': 'Trilobites', 'content_kicker': None, 'print_headline': 'Peruvian Puzzler: The Case of the Doubtful Dinero', 'name': None, 'seo': None, 'sub': None}","['Currency', 'Counterfeit Money and Financial Instruments', 'Peru', 'Numismatics', 'Chemistry', 'Heritage Science (Journal)', 'Research', 'your-feed-science']",2024-01-07T10:01:58+0000,article,Science
Should you keep a separate checking account for writing checks? Is there a specific pen you should use? We answer some reader questions.,"Typewriters vanished, and then cassette tapes and encyclopedias did, too. But paper checks are one piece of our analog past that persists.","{'main': 'Writing Checks Can Be Risky. Here’s How to Protect Yourself.', 'kicker': None, 'content_kicker': None, 'print_headline': 'Safety Plan For Writing Your Checks', 'name': None, 'seo': None, 'sub': None}","['Personal Finances', 'Content Type: Service', 'Checks and Checking Accounts', 'Frauds and Swindling', 'Postal Service (US)', 'Mobile Commerce and Payments', 'Banking and Financial Institutions']",2024-01-07T10:01:59+0000,article,Business Day
"The president is under pressure from Democrats and Republicans to block the sale to Japan’s Nippon Steel, which could upset a key foreign ally.",U.S. Steel is an iconic example of the lost manufacturing muscle that President Biden says his economic policies will bring back to the United States.,"{'main': 'Japanese Company’s Bid for U.S. Steel Tests Biden’s Industrial Policy', 'kicker': None, 'content_kicker': None, 'print_headline': 'Calls to Block Bid for U.S. Steel Put Biden in Bind With Japan', 'name': None, 'seo': None, 'sub': None}","['Steel and Iron', 'United States Politics and Government', 'Factories and Manufacturing', 'Mergers, Acquisitions and Divestitures', 'United States International Relations', 'Collective Bargaining', 'United States Steel Corporation', 'Nippon Steel Corporation', 'United Steelworkers of America', 'Committee on Foreign Investment in the United States (CFIUS)', 'Republican Party', 'Democratic Party', 'Senate', 'Japan']",2024-01-07T10:02:00+0000,article,U.S.
"Nearly a week before the state’s caucuses, a frenzy of campaigning belies a seemingly static G.O.P. race, with former President Donald J. Trump the prohibitive front-runner.",Donald J. Trump’s escalating attacks on Nikki Haley both on the airwaves and at his rallies — criticisms she likened Saturday to “a temper tantrum” — captured the turbulent dynamics in the final week before the first votes of the 2024 Republican presidential primary are cast.,"{'main': 'Trump Takes Aim at Haley as Primary Enters Final Phase in Iowa', 'kicker': None, 'content_kicker': None, 'print_headline': 'In the Run-Up to Iowa, A Brawl to Come in 2nd', 'name': None, 'seo': None, 'sub': None}","['Presidential Election of 2024', 'Primaries and Caucuses', 'Republican Party', 'DeSantis, Ron', 'Haley, Nikki R', 'Trump, Donald J', 'Iowa']",2024-01-07T10:02:00+0000,article,U.S.
"Colleges have fled standardized tests, on the theory that they hurt diversity. That’s not what the research shows.","After the Covid pandemic made it difficult for high school students to take the SAT and ACT, dozens of selective colleges dropped their requirement that applicants do so. Colleges described the move as temporary, but nearly all have since stuck to a test-optional policy. It reflects a backlash against standardized tests that began long before the pandemic, and many people have hailed the change as a victory for equity in higher education.","{'main': 'The Misguided War on the SAT', 'kicker': None, 'content_kicker': None, 'print_headline': 'Colleges Fled SATs, Despite Their Utility', 'name': None, 'seo': None, 'sub': None}","['Colleges and Universities', 'Admissions Standards', 'SAT (College Admission Test)', 'ACT (Examination)', 'Education (Secondary)', 'Tests and Examinations', 'Race and Ethnicity', 'Discrimination', 'Minorities', 'Income Inequality']",2024-01-07T10:02:00+0000,article,Briefing
A sudden hole appearing in the side of an Alaska Airlines plane midflight follows years of problems with the manufacturer’s aircraft.,"A harrowing flight over the weekend is again forcing Boeing to confront concerns over its planes, particularly the 737 Max, already one of the most scrutinized jets in history.","{'main': 'Boeing Again Under Scrutiny After Latest 737 Max Problem', 'kicker': None, 'content_kicker': None, 'print_headline': 'For Boeing, A Problem  Gets Bigger', 'name': None, 'seo': None, 'sub': None}","['AIRLINES AND AIRPLANES', 'Aviation Accidents, Safety and Disasters', 'Boeing 737 Max Groundings and Safety Concerns (2019)', 'Boeing Company', 'ALASKA AIRLINES', 'Federal Aviation Administration', 'National Transportation Safety Board', 'Spirit AeroSystems Inc', 'United Airlines']",2024-01-07T10:02:08+0000,article,Business Day
