abstract,lead_paragraph,headline,keywords,pub_date,document_type,section_name
"The long-running project, sometimes described as the environmental version of the AIDS quilt, thrives on convoluted math and a sea of volunteers.","Every year after the full moons in late October and November, Australia’s Great Barrier Reef begins its annual spawning — first the coral species inshore, where waters are warmer, then the offshore corals, the main event. Last year, this natural spectacle coincided with the woolly propagation of two new colonies of the Crochet Coral Reef, a long-running craft-science collaborative artwork now inhabiting the Schlossmuseum in Linz, Austria, and the Carnegie Museum of Art in Pittsburgh.","{'main': 'The Crochet Coral Reef Keeps Spawning, Hyperbolically', 'kicker': None, 'content_kicker': None, 'print_headline': 'Crochet Coral Reef Grows Hyperbolically', 'name': None, 'seo': None, 'sub': None}","['Coral', 'Reefs', 'Art', 'Handicrafts', 'Mathematics', 'Global Warming', 'Carnegie Museum of Art', 'Great Barrier Reef (Australia)', 'Schlossmuseum', 'Wertheim, Christine (Artist)', 'Wertheim, Margaret']",2024-01-15T10:01:45+0000,article,Science
The Supreme Court will hear arguments on Wednesday over whether to overturn a key precedent on the power of executive agencies.,"On a blustery fall morning in southern New Jersey, the weather was too rough for the fishing boats at the center of a momentous Supreme Court case to set out to sea.","{'main': 'A Fight Over a Fishing Regulation Could Help Tear Down the Administrative State', 'kicker': None, 'content_kicker': None, 'print_headline': 'Fight Over a Fishing Regulation May Curb Government Agencies’ Power', 'name': None, 'seo': None, 'sub': None}","['Supreme Court (US)', 'Regulation and Deregulation of Industry', 'Fishing, Commercial', 'Chevron Corporation', 'Natural Resources Defense Council', 'Conservatism (US Politics)', 'Law and Legislation', 'Conservation of Resources', 'Cause of Action Institute', 'New Civil Liberties Alliance', 'New Jersey', 'Rhode Island']",2024-01-15T10:01:47+0000,article,U.S.
"Oligarchs have lost billions from the shelling of their factories, and the government has used its wartime powers to break their political influence.","For weeks, they fended off Russian assaults, holed up in a vast steel mill under barrages of missiles and mortars. And when the Ukrainian troops defending the Azovstal plant finally surrendered in May 2022, the mill had been reduced to rubble and twisted metal.","{'main': 'The War Has Reined In Ukraine’s Oligarchs, at Least for Now', 'kicker': None, 'content_kicker': None, 'print_headline': 'War in Ukraine Pulls Oligarchs Off Their Perch', 'name': None, 'seo': None, 'sub': None}","['Ukraine', 'Politics and Government', 'Corruption (Institutional)', 'Russian Invasion of Ukraine (2022)', 'Factories and Manufacturing', 'Bribery and Kickbacks', 'Akhmetov, Rinat', 'Firtash, Dmitry V', 'Kolomoisky, Igor V', 'Zelensky, Volodymyr', 'Russia']",2024-01-15T10:01:55+0000,article,World
"At 50, the classic sitcom is the model of a kind of nostalgia that’s as much about what we forget (the bad stuff) as what we remember. (Aaaay!)","Mention “Happy Days” to TV viewers of a certain age (raises hand) and the first thing they remember might be not an episode or a scene or a catchphrase but a lunchbox. I’m specifically thinking of a cool Thermos-brand one — featuring Henry Winkler as the show’s pop-phenom greaser, Arthur Fonzarelli, a.k.a. Fonzie, a.k.a. the Fonz — which luckier ’70s kids than I got to schlep their PBJs to school in and which is now in the collection of the Smithsonian.","{'main': '‘Happy Days’ Got Us Unstuck in Time', 'kicker': 'Critic’s Notebook', 'content_kicker': None, 'print_headline': 'How to Set Off a Nostalgic Time Loop', 'name': None, 'seo': None, 'sub': None}","['Television', 'Happy Days (TV Program)', 'ABC Inc', 'Bosley, Tom', 'Howard, Ron', 'Marshall, Garry', 'Moran, Erin (1960-2017)', 'Most, Donny', 'Winkler, Henry']",2024-01-15T10:01:55+0000,article,Arts
What we need are ambitious solutions that can address the scope of today’s migration challenge.,"For the past two months, a small group of senators from both parties has been negotiating a deal to address the crisis at our southern border. The lawmakers are united in their desire to stop unauthorized migrants from entering the United States — an ambitious objective that has eluded past administrations.","{'main': 'This Border Deal Is a Political Trap for Democrats', 'kicker': 'Guest Essay', 'content_kicker': None, 'print_headline': '', 'name': None, 'seo': None, 'sub': None}","['Illegal Immigration', 'Asylum, Right of', 'United States Politics and Government', 'Law and Legislation', 'Politics and Government', 'Presidential Election of 2024', 'Refugees and Displaced Persons', 'Immigration and Emigration', 'Deportation']",2024-01-15T10:01:57+0000,article,Opinion
"Crusty bread, brown rice, nutty farro. Our guide is packed with inspiration for nutritious cooking.",This is Day 1 of Well’s Mediterranean Diet Week.,"{'main': 'Looking for Little Ways to Eat Healthier? Start With Whole Grains.', 'kicker': 'Mediterranean Diet Week', 'content_kicker': None, 'print_headline': '', 'name': None, 'seo': None, 'sub': None}","['Diet and Nutrition', 'Grain', 'Cooking and Cookbooks', 'Content Type: Service', 'Recipes', 'Mediterranean Food (Cuisine)', 'Snack Foods']",2024-01-15T10:02:05+0000,article,Well
Is there more than one ticket out of Iowa?,"Update: On Monday night, Donald Trump won the Iowa caucus. Ron DeSantis finished a distant second, and Nikki Haley came in third.","{'main': 'Is Trump Steaming Toward a Candidacy-Sinking Iceberg? Three Writers Look at Iowa and Beyond.', 'kicker': 'Round table', 'content_kicker': None, 'print_headline': '', 'name': None, 'seo': None, 'sub': None}","['Presidential Election of 2024', 'Primaries and Caucuses', 'United States Politics and Government', 'Polls and Public Opinion', 'Republican Party', 'Biden, Joseph R Jr', 'Buttigieg, Pete (1982- )', 'Flynn, Michael T', 'Christie, Christopher J', 'Haley, Nikki R', 'Jenner, Kris', 'Landrieu, Mitch', 'Stefanik, Elise', 'Trump, Donald J']",2024-01-15T10:02:05+0000,article,Opinion
"An Oxford researcher measured the effect of popular workplace mental health interventions, and discovered little to none.","Employee mental health services have become a billion-dollar industry. New hires, once they have found the restrooms and enrolled in 401(k) plans, are presented with a panoply of digital wellness solutions, mindfulness seminars, massage classes, resilience workshops, coaching sessions and sleep apps.","{'main': 'Workplace Wellness Programs Have Little Benefit, Study Finds', 'kicker': None, 'content_kicker': None, 'print_headline': 'Workplace Wellness Programs Are of Little Benefit to Employees, Study Finds', 'name': None, 'seo': None, 'sub': None}","['Research', 'Mobile Applications', 'Workplace Environment', 'Mental Health and Disorders', 'Medicine and Health', 'Oxford University', 'Industrial Relations Journal']",2024-01-15T10:02:11+0000,article,Health
A TikTok home-décor trend has irked some bibliophiles.,"When it comes to aesthetic trends, social media loves a catchy name.","{'main': 'Do You Have ‘Bookshelf Wealth’?', 'kicker': None, 'content_kicker': None, 'print_headline': 'Does Your Home Reflect ‘Bookshelf Wealth’?', 'name': None, 'seo': None, 'sub': None}","['Social Media', 'Interior Design and Furnishings', 'Books and Literature', 'TikTok (ByteDance)']",2024-01-15T10:02:13+0000,article,Style
"From under a snowdrift and an Arctic chill, 2024 voting is underway.","Finally. More than a year after Donald Trump first announced his 2024 presidential run, six months after Gov. Ron DeSantis of Florida refocused his campaign strategy to be all-in on Iowa, and right in the midst of debilitating winter weather, the Iowa caucuses are upon us.","{'main': '‘The Run-Up’ Guide to Iowa', 'kicker': None, 'content_kicker': None, 'print_headline': '', 'name': None, 'seo': None, 'sub': None}","['Politics and Government', 'Presidential Election of 2024', 'Biden, Joseph R Jr', 'Trump, Donald J', 'DeSantis, Ron', 'Haley, Nikki R', 'Iowa']",2024-01-15T10:02:16+0000,article,Podcasts
"A chalet-style retreat in Idyllwild, a two-bedroom cottage with a guesthouse in Mendocino and a midcentury-modern home in Riverside.","This house is less than 10 minutes from a brewpub, a bakery, a grocery store and a number of restaurants and inns at the center of this small mountain community. But the location’s big draw is its proximity to Mount San Jacinto State Park, where hiking trails wind up Mount San Jacinto, offering views of the forest on one side and the desert on the other.","{'main': '$1.1 Million Homes in California', 'kicker': 'What You Get', 'content_kicker': None, 'print_headline': '', 'name': None, 'seo': None, 'sub': None}","['Real Estate and Housing (Residential)', 'Idyllwild (Calif)', 'Riverside (Calif)', 'Mendocino (Calif)']",2024-01-15T10:02:19+0000,article,Real Estate
"Republican campaigns are battling cold, complacency and voter discontent as they push voters to caucus on Monday.",Follow for live updates on the Iowa caucuses.,"{'main': 'How Trump, DeSantis and Haley’s Teams Are Thinking About Turnout in Iowa', 'kicker': None, 'content_kicker': None, 'print_headline': '', 'name': None, 'seo': None, 'sub': None}","['Presidential Election of 2024', 'Primaries and Caucuses', 'United States Politics and Government', 'Politics and Government', 'Never Back Down Inc', 'Republican Party', 'DeSantis, Ron', 'Trump, Donald J', 'Haley, Nikki R', 'Des Moines (Iowa)', 'Iowa']",2024-01-15T10:02:21+0000,article,U.S.
"A reader wonders if stacking jewelry can look tacky. Recent red carpets suggest otherwise, our critic writes.","When Ariana Greenblatt, the 16-year-old “Barbie” actress, made her red carpet debut at the Golden Globes this month, she did so in a plain white Saint Laurent tuxedo shirt, black trousers, a black cummerbund and about eight Chopard diamond rings, one on nearly every finger, which she proudly fluttered at the watching paparazzi. And she wasn’t the only attendee so adorned.","{'main': 'How Many Rings Is Too Many?', 'kicker': 'ASK Vanessa', 'content_kicker': None, 'print_headline': '', 'name': None, 'seo': None, 'sub': None}","['Fashion and Apparel', 'Content Type: Service']",2024-01-15T10:02:21+0000,article,Style
"Make Peter Luger burgers at home, learn about feasting in Middle Ages and more food news.","A demonstration last week involving butchering half an heirloom pig, and showing how to use various parts, kicked off a series in the basement workshop and bakery at Leland Eating and Drinking House in Prospect Heights, Brooklyn. It was followed by a five-course tasting dinner in the wine cellar, starring pork. The restaurant, which does its own butchering as a matter of course, has scheduled subsequent classes monthly throughout the year, with the next one on Feb. 21, followed by March 13, both pork-centric. Later in the year there will be sessions about duck and fish. The classes and dinners, starting at 6 p.m., are $100 plus tax, tip and beverages. ","{'main': 'Butchering Before Dinner at Leland Eating and Drinking House', 'kicker': 'Front Burner', 'content_kicker': None, 'print_headline': 'Butchering Before Dinner At the Same Restaurant', 'name': None, 'seo': None, 'sub': None}","['Wines', 'Cheese', 'Cooking and Cookbooks', 'Food']",2024-01-15T10:02:21+0000,article,Food
Second place could mean a lot to Nikki Haley tonight as a showdown with Donald Trump looms in the next primary contest.,"The long road to the Republican presidential nomination begins tonight in Iowa, where voters will gather at their neighborhood precinct caucuses to cast the first votes of the 2024 election campaign.","{'main': 'A Big Reason to Pay Attention to Iowa? New Hampshire.', 'kicker': None, 'content_kicker': None, 'print_headline': '', 'name': None, 'seo': None, 'sub': None}","['Presidential Election of 2024', 'internal-sub-only-nl', 'Primaries and Caucuses', 'Haley, Nikki R', 'Trump, Donald J', 'Iowa', 'United States Politics and Government', 'New Hampshire', 'DeSantis, Ron']",2024-01-15T10:02:22+0000,article,The Upshot
"Shunned by their own representatives, Republican gun-safety advocates are throwing in their lot with Democrats.","Red-state legislatures are the incubator and the proving ground of many varieties of right-wing nutjobbery that go on to affect national policy, but most people give no thought to what happens in their chambers. Even here in the South — where, to all appearances, our legislatures gather mainly to subvert democracy and rend the social safety net — few people seemed to be paying attention last week when the Tennessee General Assembly convened in Nashville for the new legislative session.","{'main': 'Another Gun Fight Is Looming in Tennessee', 'kicker': 'Guest Essay', 'content_kicker': None, 'print_headline': 'Another Gun Fight Is Looming in Tennessee', 'name': None, 'seo': None, 'sub': None}","['Gun Control', 'State Legislatures', 'Law and Legislation', 'Politics and Government', 'School Shootings and Armed Attacks', 'Covenant School, Nashville, Tenn, Shooting (2023)', 'Nashville (Tenn)', 'Tennessee']",2024-01-15T10:02:31+0000,article,Opinion
It might as well be “Frozen III” in Des Moines. And what a cast of characters.,"Bret Stephens: Gail, we are conversing on the eve of the Iowa caucuses — not yet knowing who came in second but not in much doubt about who’ll come in first. I’m trying to remember the last time the Republican winner went on to win the nomination: Ted Cruz in 2016? Rick Santorum in 2012? Mike Huckabee in 2008?","{'main': 'The Weather in Iowa Is Not the Only Thing That Is Bitterly Cold', 'kicker': 'The Conversation', 'content_kicker': None, 'print_headline': 'The Weather in Iowa Isn’t the Only Thing That’s Bitterly Cold', 'name': None, 'seo': None, 'sub': None}","['Presidential Election of 2024', 'Iowa', 'Primaries and Caucuses', 'Republican Party', 'Trump, Donald J', 'United States Politics and Government', 'International Relations', 'Anti-Semitism', 'House of Representatives', 'Austin, Lloyd J III', 'Biden, Joseph R Jr', 'United States', 'United States Economy', 'Education (K-12)', 'Inflation (Economics)', 'Immigration and Emigration']",2024-01-15T10:02:31+0000,article,Opinion
"The Supreme Court will consider whether to hear an appeal from an inmate who says his lawyer filed shoddy papers, including a brief saying the inmate must lose.","Joseph Gamboa, a death row inmate in Texas, says his court-appointed lawyer robbed him of the chance to challenge his murder conviction in federal court. Among other things, court records show, the lawyer ignored evidence supplied by Mr. Gamboa, filed a cut-and-paste habeas corpus petition that still bore the name of an earlier client and submitted a brief admitting that his client must lose.","{'main': 'A Death Row Lawyer Blunders. Must His Client Pay the Price?', 'kicker': 'Sidebar', 'content_kicker': None, 'print_headline': 'Must a Prisoner on Death Row Pay the Price for His Lawyer’s Shoddy Work?', 'name': None, 'seo': None, 'sub': None}","['Capital Punishment', 'Public Defenders and Court-Appointed Lawyers (Criminal)', 'Decisions and Verdicts', 'Supreme Court (US)', 'Paxton, Ken', 'Legal Profession', 'Appeals Courts (US)', 'Gamboa, Joseph']",2024-01-15T10:02:32+0000,article,U.S.
"At every precinct from Sioux City to Davenport, captains will give speeches on behalf of their preferred candidates and try to persuade their neighbors at the last minute.",Follow for live updates on the Iowa caucuses.,"{'main': 'Meet the Little-Known Biggest Players in the Iowa Caucuses', 'kicker': None, 'content_kicker': None, 'print_headline': '', 'name': None, 'seo': None, 'sub': None}","['Presidential Election of 2024', 'Primaries and Caucuses', 'Republican Party', 'Iowa', 'United States Politics and Government']",2024-01-15T10:03:29+0000,article,U.S.
"The president’s campaign, together with two allied committees, said they were entering 2024 with more than $117 million in cash.","President Biden’s re-election campaign said on Monday that, along with two allied committees, it had pulled in $97 million during the most recent fund-raising period. Together, they entered 2024 with more than $117 million in cash on hand, the campaign said.","{'main': 'Biden and Democratic Allies Announce $97 Million Fund-Raising Haul', 'kicker': None, 'content_kicker': None, 'print_headline': 'Biden’s Camp Says It Has $117 Million In War Chest', 'name': None, 'seo': None, 'sub': None}","['Biden, Joseph R Jr', 'Presidential Election of 2024', 'Campaign Finance', 'Democratic National Committee', 'Democratic Party', 'United States Politics and Government']",2024-01-15T10:03:30+0000,article,U.S.
"For a commander in chief, retail campaigning isn’t easy, what with the counterassault team that follows him everywhere. But President Biden is starting to hit the hustings on every Main Street he can find.","It was a quiet day in Emmaus, Pa. The only sound on Main Street was the idling engine of the sleek black truck that some call a rolling doomsday communications control center, which was parked outside the bike shop. The men with guns dressed all in black were perched on the roof using binoculars to scan the area for terrorists or other bad guys.","{'main': 'The Smoothie Stop-By: When a President Tries to Be a Regular Joe', 'kicker': 'White House Memo', 'content_kicker': None, 'print_headline': 'He’s Joe and Wants Your Vote. Don’t Mind the Metal Detector.', 'name': None, 'seo': None, 'sub': None}","['Presidential Election of 2024', 'United States Politics and Government', 'Biden, Joseph R Jr', 'Pennsylvania']",2024-01-15T10:03:33+0000,article,U.S.
"A storm bringing freezing temperatures to the South could end a snowless streak in the Northeast later in the week, the National Weather Service said.","A winter storm was pushing east over large parts of the Southeast on Monday, bringing more snow and freezing temperatures to the region before reaching the Mid-Atlantic and the Northeast on Tuesday, where forecasters said it could end a nearly two-year drought without snow.","{'main': 'Winter Storm Blankets South and May End Snow Drought in Northeast', 'kicker': None, 'content_kicker': None, 'print_headline': '', 'name': None, 'seo': None, 'sub': None}","['Cold and Cold Spells', 'Snow and Snowstorms', 'Southeastern States (US)', 'Weather', 'East Coast (US)']",2024-01-15T10:50:08+0000,article,U.S.
"Facing a weak consumer appetite and fierce competition from domestic rivals amid U.S.-China tensions, a typically discount-wary Apple is offering a four-day sale.","Ever bought a discounted new phone from Apple? For most people, the answer is no. That’s because Apple doesn’t really do discounts.","{'main': 'Apple to Offer Rare Discount on iPhones in China', 'kicker': None, 'content_kicker': None, 'print_headline': 'A Rare Discount by Apple On New iPhones in China', 'name': None, 'seo': None, 'sub': None}","['Computers and the Internet', 'Lunar New Year', 'Smartphones', 'Politics and Government', 'Consumer Behavior', 'iPhone', 'Prices (Fares, Fees and Rates)', 'Economic Conditions and Trends', 'Apple Inc', 'Huawei Technologies Co Ltd', 'China', 'Discount Selling']",2024-01-15T10:54:18+0000,article,Business Day
Hear the news in five minutes.,"The New York Times Audio app is home to journalism and storytelling, and provides news, depth and serendipity. If you haven’t already, download it here — available to Times news subscribers on iOS — and sign up for our weekly newsletter.","{'main': 'The Iowa Caucuses, and 100 Days of War in Gaza', 'kicker': None, 'content_kicker': None, 'print_headline': '', 'name': None, 'seo': None, 'sub': None}","['Primaries and Caucuses', 'Israel-Gaza War (2023- )', 'Shutdowns (Institutional)', 'Law and Legislation', 'Atlanta (Ga)', 'Iowa', 'Texas']",2024-01-15T11:13:30+0000,article,Podcasts
What to watch for in tonight’s caucuses.,"So far, the 2024 presidential campaign looks to be the least competitive in decades. The incumbent president is likely to win the Democratic nomination easily, while a former president seems to be running away with the Republican nomination.","{'main': 'Three Questions About Iowa', 'kicker': None, 'content_kicker': None, 'print_headline': '', 'name': None, 'seo': None, 'sub': None}","['internal-storyline-no', 'Iowa', 'Primaries and Caucuses', 'Des Moines (Iowa)', 'DeSantis, Ron', 'Trump, Donald J']",2024-01-15T11:48:19+0000,article,Briefing
"The player, Sagiv Jehezkel, displayed a pro-Israel message after scoring on Sunday and was promptly suspended by his club. He was released after questioning and returned to Israel.",An Israeli soccer player for a Turkish club was briefly detained by the Turkish authorities and suspended by the club after he displayed a message of support for Israel during a game on Sunday.,"{'main': 'Soccer Player Detained by Turkey After Message of Support for Israel', 'kicker': None, 'content_kicker': None, 'print_headline': '', 'name': None, 'seo': None, 'sub': None}","['Turkey', 'Israel-Gaza War (2023- )', 'Soccer', 'Gaza Strip', 'Israel', 'Jehezkel, Sagiv (1995- )', 'Antalyaspor (Soccer Team)']",2024-01-15T12:21:38+0000,article,World
"The group said the two were killed by Israeli airstrikes, which the Israeli military said was at least partly false.","Hamas said on Monday that two of the hostages captured on Oct. 7 had been killed in Israeli airstrikes and released images that appeared to show their bodies, but the Israeli military cast doubt on the claim.","{'main': 'Hamas Says Two More Israeli Hostages Are Dead', 'kicker': None, 'content_kicker': None, 'print_headline': 'Hamas Says Israeli Strikes Killed 2 Hostages and Injured 1', 'name': None, 'seo': None, 'sub': None}","['Kidnapping and Hostages', 'Hamas', 'Israel-Gaza War (2023- )']",2024-01-15T13:13:48+0000,article,World
The American Dialect Society selected a term that refers to the deterioration of online platforms.,"“So here’s blorbo,” said a man to my left, pointing to a word on his phone. I looked, and there was “blorbo,” next to its definition: “Beloved fictional character from television or other media, often appearing in the phrase blorbo from my shows.”","{'main': 'Among Linguists, the Word of the Year Is More of a Vibe', 'kicker': None, 'content_kicker': None, 'print_headline': '', 'name': None, 'seo': None, 'sub': None}","['English Language', 'Dictionaries', 'Slang', 'American Dialect Society', 'Linguistic Society of America', 'Language and Languages']",2024-01-15T14:00:02+0000,article,Crosswords & Games
"Two Palestinian men were arrested, according to the police, who said the incident was being treated as a terrorist attack. The French government said two of those injured were French nationals.","Two Palestinian men stole cars and ran over Israelis in a suburb of Tel Aviv on Monday, the Israeli police said. One person was killed and 17 others injured, according to emergency officials.","{'main': 'Car-Ramming Attack in Israel Kills 1 and Wounds 17, Officials Say', 'kicker': None, 'content_kicker': None, 'print_headline': '', 'name': None, 'seo': None, 'sub': None}","['Israel-Gaza War (2023- )', 'Palestinians', 'Israel', 'Hebron (West Bank)']",2024-01-15T14:37:00+0000,article,World
"Narges Mohammadi, the jailed human rights activist, was sentenced to additional prison time, while journalists who reported on the death of Mahsa Amini were freed for now.","The Iranian regime sentenced Narges Mohammadi, the jailed human rights activist who received the 2023 Nobel Peace Prize, to 15 more months in prison, her family said on Monday.","{'main': 'Iran Adds Prison Time for Nobel Winner and Frees 2 Journalists on Bail', 'kicker': None, 'content_kicker': None, 'print_headline': 'Iran Frees Journalists Whose Reports Prompted a Revolt, but Keeps Activist Jailed', 'name': None, 'seo': None, 'sub': None}","['Muslim Veiling', 'Freedom of the Press', 'Amini, Mahsa (2000-22)', 'Hamedi, Niloufar', 'Mohammadi, Elaheh', 'Iran']",2024-01-15T14:54:58+0000,article,World
"The country has many earthquakes and eruptions, but now, “a daunting period of upheaval has begun” in the southwest, the president said.","Living in a country that straddles two tectonic plates and has 130 or so volcanoes, Icelanders are no strangers to earthquakes and eruptions.","{'main': 'Iceland Faces ‘New Chapter’ of Seismic Activity as Lava Menaces Town', 'kicker': None, 'content_kicker': None, 'print_headline': 'Icelandic Peninsula Is in ‘Daunting Period of Upheaval,’ President Says', 'name': None, 'seo': None, 'sub': None}","['Volcanoes', 'Earthquakes', 'Geothermal Power', 'Evacuations and Evacuees', 'Johannesson, Gudni', 'Grindavik (Iceland)', 'Iceland']",2024-01-15T15:05:45+0000,article,World
"The plane manufacturer said it would add additional inspections, including at the supplier of a panel that blew off during a recent Alaska Airlines flight.",Boeing said Monday that it would make changes to quality control processes after one of its 737 Max 9 jets lost a portion of its body during a nearly catastrophic Alaska Airlines flight this month.,"{'main': '‘Not Where We Need to Be’: Boeing to Make Changes in Quality Control', 'kicker': None, 'content_kicker': None, 'print_headline': '‘Not Where We Need to Be’: Boeing to Make Changes in Quality Control After 737 Max 9 Incident', 'name': None, 'seo': None, 'sub': None}","['AIRLINES AND AIRPLANES', 'Aviation Accidents, Safety and Disasters', 'Factories and Manufacturing', 'Boeing 737 Max Groundings and Safety Concerns (2019)', 'Boeing Company', 'Spirit AeroSystems Inc']",2024-01-15T15:08:18+0000,article,Business Day
