abstract,lead_paragraph,headline,keywords,pub_date,document_type,section_name
"With a new season of his series “Next Level Chef,” reality TV’s most enduring antihero still reigns supreme. How long can he keep it up?","Gordon Ramsay insists he never wanted to be the bad boy. His image as the brash, bellicose chef and restaurateur, as the master of the culinary meltdown, was, he said, largely a matter of getting off on the wrong foot.","{'main': 'Gordon Ramsay Isn’t Going Anywhere', 'kicker': None, 'content_kicker': None, 'print_headline': 'An Angry Chef’s Enduring Appeal', 'name': None, 'seo': None, 'sub': None}","['Ramsay, Gordon', 'Content Type: Personal Profile', 'Chefs', 'Cooking and Cookbooks', 'Television', 'Next Level Chef (TV Program)', ""Hell's Kitchen (TV Program)"", 'Fox Broadcasting Co']",2024-01-27T10:01:01+0000,article,Arts
Reneé Rapp has been going off-script on the press circuit for “Mean Girls.” Maybe she lacks media training — and maybe that’s the point.,"On her press tour for the new adaptation of “Mean Girls,” Reneé Rapp has called out the owner of a bus touring company owner by name, described herself as “ageist” against millennial women, praised Megan Thee Stallion’s butt and used an interview as an opportunity to shoot her shot with Rachel McAdams, the original Regina George, whose shoes Ms. Rapp stepped into for her latest role. She also said that she might not want Ms. McAdams to see the new take on the character and suggested that she was weary of the franchise.","{'main': 'When Going Off Message Is the Message', 'kicker': None, 'content_kicker': None, 'print_headline': '', 'name': None, 'seo': None, 'sub': None}","['Rapp, Renee', 'Movies', 'Mean Girls (Movie)', 'Public Relations and Publicity', 'Media', 'Celebrities', 'Fans (Persons)']",2024-01-27T10:01:01+0000,article,Style
"Top American, Israeli and Arab officials are seeking to forge three parallel but related deals that could end the war in Gaza, finalize its postwar status, and, most ambitiously, set commitments for the creation of a Palestinian state.",Top officials from at least 10 different administrations are trying to forge a head-spinning set of deals to end the Gaza war and answer the divisive question of how the territory will be governed after the fighting stops.,"{'main': 'How Leaders and Diplomats Are Trying to End the Gaza War', 'kicker': None, 'content_kicker': None, 'print_headline': 'How Global Leaders and Diplomats Are Trying to End the War in Gaza', 'name': None, 'seo': None, 'sub': None}","['Palestinians', 'Israel-Gaza War (2023- )', 'International Relations', 'Peace Process', 'Elections', 'Palestinian Authority', 'Hamas', 'ABBAS, MAHMOUD', 'Blinken, Antony J', 'Mohammed bin Salman (1985- )', 'Netanyahu, Benjamin', 'Gaza Strip', 'Israel', 'Qatar', 'Saudi Arabia']",2024-01-27T10:01:02+0000,article,World
"Dick Bove, the ubiquitous banking expert, is going out swinging after more than half a century in the business.","Over his 54 years as a financial analyst, Richard X. Bove perfected the art of grabbing attention.","{'main': 'A Famed Analyst’s Final Forecast Is the Fall of the U.S. Economy', 'kicker': None, 'content_kicker': None, 'print_headline': 'Famed Financial Analyst Goes Out Swinging', 'name': None, 'seo': None, 'sub': None}","['United States Economy', 'Banking and Financial Institutions', 'Stocks and Bonds', 'Financial Brokers', 'Subprime Mortgage Crisis', 'Bove, Richard X', 'Content Type: Personal Profile']",2024-01-27T10:01:02+0000,article,Business Day
"Long lines have popped up in Russia and beyond to get Boris B. Nadezhdin, an antiwar candidate, onto the ballot for Russia’s presidential election in March.","His surname comes from the Russian word for hope — and for hundreds of thousands of antiwar Russians, that is, improbably enough, what he has become.","{'main': 'A Collective ‘No’: Anti-Putin Russians Embrace an Unlikely Challenger', 'kicker': None, 'content_kicker': None, 'print_headline': 'The Unexpected Campaign of a Putin Opponent', 'name': None, 'seo': None, 'sub': None}","['Politics and Government', 'Elections', 'Content Type: Personal Profile', 'Russian Invasion of Ukraine (2022)', 'Demonstrations, Protests and Riots', 'Nadezhdin, Boris (1963- )', 'Putin, Vladimir V', 'Russia', 'Ukraine']",2024-01-27T10:30:15+0000,article,World
A study led by researchers in Toronto found that crime had risen in several cities along with increases in spending.,One effect we’re now seeing from the inflation that is largely a product of the pandemic and Russia’s invasion of Ukraine are municipal tax increases on a scale that was politically unimaginable not long ago.,"{'main': 'Spending More Money on Police Shows No Clear Link to Lower Crime Levels', 'kicker': None, 'content_kicker': None, 'print_headline': '', 'name': None, 'seo': None, 'sub': None}","['Canada', 'Police', 'Crime and Criminals', 'Research', 'Politics and Government', 'Local Government', 'Taxation', 'Budgets and Budgeting']",2024-01-27T11:00:02+0000,article,World
What it means to have words — and to lose them.,"In Gaza and beyond, what it means to have words — and to lose them.","{'main': 'The Words to Say It', 'kicker': None, 'content_kicker': None, 'print_headline': '', 'name': None, 'seo': None, 'sub': None}",[],2024-01-27T11:28:14+0000,article,Podcasts
Streaming offers an infinity of choice. It also offers the illusion that we’ll find the perfect cinematic solution to whatever is ailing us.,"The year continues to get its bearings, to establish itself. Right now, it’s still a collection of post-holiday weeks, getting-going weeks, weeks for planning the year to come. An on-ramp where we get up to speed. Soon we’ll be properly in the flow of traffic, soon we’ll really be on our way.","{'main': 'The Joy and Sorrow of Streaming', 'kicker': None, 'content_kicker': None, 'print_headline': '', 'name': None, 'seo': None, 'sub': None}","['internal-storyline-no', 'Movies', 'Television', 'Video Recordings, Downloads and Streaming', 'Actors and Actresses']",2024-01-27T11:54:19+0000,article,Briefing
Readers discuss an article by David Leonhardt about research showing the tests’ usefulness.,To the Editor:,"{'main': 'Should SATs Be Optional?', 'kicker': 'letters', 'content_kicker': None, 'print_headline': 'Should SATs Be Optional?', 'name': None, 'seo': None, 'sub': None}","['SAT (College Admission Test)', 'Colleges and Universities', 'Admissions Standards', 'Education (K-12)', 'Tests and Examinations', 'Grading of Students', 'Intellectual Disabilities']",2024-01-27T12:00:02+0000,article,Opinion
Some well-meaning U.S. efforts to help Taiwan may end up provoking China when we should be trying to lower tensions.,"Michael Mullen, the former chairman of the Joint Chiefs of Staff, is concerned enough about the risk of war between the United States and China that he is listening to the audiobook version of Barbara Tuchman’s “The Guns of August,” the classic history of how the major powers in 1914 stumbled into World War I.","{'main': 'What Worries Me About War With China After My Visit to Taiwan', 'kicker': 'Nicholas Kristof', 'content_kicker': None, 'print_headline': 'Anxiety About War With China  May Raise the Danger of It', 'name': None, 'seo': None, 'sub': None}","['China', 'Taiwan', 'Defense and Military Forces', 'International Relations', 'Politics and Government', 'United States Defense and Military Forces', 'United States International Relations', 'Cyberwarfare and Defense', 'Biden, Joseph R Jr', 'Xi Jinping']",2024-01-27T12:00:08+0000,article,Opinion
"A newer, more vague vaccine hesitancy is emerging. A New York doctor has some advice for how to stop it.","The response has been almost like clockwork, at nearly every medical visit in the past few weeks. “It’s time for the flu shot,” I’ll say to my patients, “plus the updated Covid vaccine.” And that’s when the groans start.","{'main': 'My Patients Used to Be Enthusiastic About the Covid Vaccine. What Changed?', 'kicker': 'Guest Essay', 'content_kicker': None, 'print_headline': 'Covid Vaccine Hesitancy Is Getting Worse', 'name': None, 'seo': None, 'sub': None}","['Vaccination and Immunization', 'Coronavirus (2019-nCoV)', 'Influenza', 'Doctors', 'Polls and Public Opinion', 'Preventive Medicine', 'United States']",2024-01-27T12:00:08+0000,article,Opinion
"In the face of terminal illness, medical aid in dying should be a right.","Should terminally ill people be able to choose how they die? Six years after being diagnosed with advanced ovarian cancer, Julie Petrow-Cohen decided to use medical aid in dying — or MAID, as it is often called — to end her life. But for many Americans in similar circumstances, this is not an option. In this audio essay, the writer Steven Petrow shares the story of his sister’s last day and why MAID should be a right for everyone.","{'main': 'My Sister Chose the Day She Wanted to Die', 'kicker': None, 'content_kicker': None, 'print_headline': '', 'name': None, 'seo': None, 'sub': None}","['audio-neutral-informative', 'Cancer', 'Ovarian Cancer', 'Euthanasia and Assisted Suicide', 'New Jersey', 'Law and Legislation', 'Families and Family Life']",2024-01-27T12:00:10+0000,article,Opinion
There’s no reason to imitate Chris Christie and Liz Cheney just yet.,"Nikki Haley lost the New Hampshire primary but found a cause: getting under Donald Trump’s not exactly rhinoceros-thick skin. The story of the Republican primary campaign in the days since Trump’s victory has been one where the victor acts like a sore loser and the likely loser loosens up, goads her stronger rival and finds a pool of small-dollar donors to keep her in the race.","{'main': 'A Radical Proposal for Nikki Haley: Try to Win More Votes', 'kicker': 'Ross Douthat', 'content_kicker': None, 'print_headline': 'Haley Should Try to Win More Votes', 'name': None, 'seo': None, 'sub': None}","['Haley, Nikki R', 'Trump, Donald J', 'Presidential Election of 2024', 'Primaries and Caucuses', 'Republican Party', 'South Carolina', 'United States Politics and Government']",2024-01-27T12:00:11+0000,article,Opinion
Trump gives the whiniest victory speech ever.,"If you can imagine the lobby bar of the Manchester Marriott as an Anglo-Saxon mead hall, I can explain how it felt to cover the New Hampshire primary.","{'main': 'The Ogre Gorging on America', 'kicker': 'Maureen Dowd', 'content_kicker': None, 'print_headline': 'The Ogre Gorging on America', 'name': None, 'seo': None, 'sub': None}","['Presidential Election of 2024', 'Trump, Donald J', 'Haley, Nikki R', 'New Hampshire', 'Republican Party', 'United States Politics and Government', 'Primaries and Caucuses', 'Polls and Public Opinion']",2024-01-27T12:00:14+0000,article,Opinion
He has managed to alienate Israel’s most important allies.,It has become clear that Prime Minister Benjamin Netanyahu of Israel is not the leader for this critical moment.,"{'main': 'Netanyahu’s Cynical Political Game', 'kicker': 'Serge Schmemann', 'content_kicker': None, 'print_headline': '', 'name': None, 'seo': None, 'sub': None}","['Israel-Gaza War (2023- )', 'Netanyahu, Benjamin', 'Israel', 'Defense and Military Forces', 'Gaza Strip', 'Palestinians', 'Peace Process', 'International Court of Justice (UN)', 'War Crimes, Genocide and Crimes Against Humanity', 'Hamas', 'Terrorism']",2024-01-27T12:00:19+0000,article,Opinion
An editor recommends an Irish novel about a banker in trouble and a Swiss novel about schoolgirl obsession.,"Dear readers,","{'main': '2 Books That Wring Every Ounce From Their Story Lines', 'kicker': None, 'content_kicker': None, 'print_headline': '', 'name': None, 'seo': None, 'sub': None}",['Books and Literature'],2024-01-27T12:50:01+0000,article,Books
"Clean energy investments, trade policy and more than one kind of uncertainty could be on the line.","After beating Nikki Haley in New Hampshire on Tuesday, Donald Trump  reaffirmed his position as the leading candidate to win the Republican nomination. That has business leaders facing the possibility of another Trump presidency, and their investors trying to figure out what it could mean for their bottom lines.","{'main': 'The Key Issues for Business in a Likely Trump-Biden Rematch', 'kicker': 'DealBook Newsletter', 'content_kicker': None, 'print_headline': 'Trade Policy and Clean Energy Investments Will Be Key Issues in Likely Trump-Biden Rematch', 'name': None, 'seo': None, 'sub': None}","['Presidential Election of 2024', 'United States Politics and Government', 'Politics and Government', 'Regulation and Deregulation of Industry']",2024-01-27T13:00:02+0000,article,Business Day
An incident involving a group of frozen bodies on the fourth season of the HBO series has raised some scientific questions.,"The men lay frozen naked in a ghoulish pile, with mouths agape and eyes glazed over, their hair encrusted with ice and snow. They were all dead — or so the investigators on the HBO series “True Detective: Night Country” thought.","{'main': 'A ‘Corpsicle’ Came Back to Life on ‘True Detective.’ Is That Possible?', 'kicker': None, 'content_kicker': None, 'print_headline': '', 'name': None, 'seo': None, 'sub': None}","['Television', 'True Detective (TV Program)', 'Hypothermia', 'Ice']",2024-01-27T14:00:10+0000,article,Arts
"At a rally in Nevada, a key battleground state, Donald Trump sought to pivot to a general election message. A mile away, Vice President Kamala Harris framed the election as a battle for democracy.","Former President Donald J. Trump, who has been itching for months to focus on a likely matchup between him and President Biden in November, previewed on Saturday a likely general-election message, extensively attacking Mr. Biden at an event in Nevada, a critical battleground state.","{'main': 'In Las Vegas, Trump Turns His Focus Back to Biden', 'kicker': None, 'content_kicker': None, 'print_headline': '', 'name': None, 'seo': None, 'sub': None}","['Presidential Election of 2024', 'Primaries and Caucuses', 'Trump, Donald J', 'Republican Party', 'Nevada']",2024-01-27T15:05:07+0000,article,U.S.
"The photographer who took the portrait of the jazz artist Miles Davis, which inspired the tattoo, had filed a lawsuit based on copyright infringement.","Kat Von D, a celebrity tattoo artist, won a legal battle in federal court on Friday when a jury ruled unanimously that her reproduction of a photo of the celebrated jazz musician Miles Davis in a tattoo did not violate copyright law.","{'main': 'Kat Von D Wins Copyright Trial Over Miles Davis Tattoo', 'kicker': None, 'content_kicker': None, 'print_headline': 'Kat Von D’s Ink Of Miles Davis Is Ruled Legal  Doesn’t Break Law  Wins Copyright Trial Over Tattoo', 'name': None, 'seo': None, 'sub': None}","['Davis, Miles', 'Copyrights and Copyright Violations', 'Suits and Litigation (Civil)', 'Tattoos', 'Art', 'Intellectual Property']",2024-01-27T15:11:42+0000,article,Arts
"Palestinians see UNRWA as an essential lifeline for millions of descendants of refugees. In Israel, however, many see the agency as an obstacle to resolving the Israeli-Palestinian conflict.","Israel’s accusations against 12 employees of the United Nations aid agency for Palestinians, the main aid operation in Gaza, are the latest episode of a decades-long friction between Israel and the group.","{'main': 'Israel Has History of Friction With U.N. Agency for Palestinians', 'kicker': None, 'content_kicker': None, 'print_headline': '', 'name': None, 'seo': None, 'sub': None}","['Israel-Gaza War (2023- )', 'International Relations', 'Foreign Aid', 'United Nations Relief and Works Agency', 'United Nations', 'Hamas', 'Gaza Strip']",2024-01-27T15:30:57+0000,article,World
The magazine’s Ethicist columnist on how to manage relationships with loved ones you don’t really like.,"My only sibling is an (exhausted) single parent of one son. I have always disliked being around children and know I never want any of my own (or near me). I feel pressure from my sibling and family to form a relationship with the child. I’ve been directly asked to entertain or spend time with him, despite my lack of interest or ease in doing so.","{'main': 'I Hate Kids. Do I Have to Make Nice With My Nephew?', 'kicker': 'The Ethicist', 'content_kicker': None, 'print_headline': '', 'name': None, 'seo': None, 'sub': None}","['Ethics (Personal)', 'internal-sub-only-nl', 'Families and Family Life', 'Children and Childhood']",2024-01-27T15:31:39+0000,article,Magazine
Large crowds have protested since it was revealed that members of the far-right Alternative for Germany party had met with neo-Nazis and those calling for a mass deportation.,"Tens of thousands of people took to the streets across Germany on Holocaust Memorial Day on Saturday to demonstrate in support of democracy and against the rise of a far-right party, the Alternative for Germany, or AfD, which is on track to make political gains in state elections this year.","{'main': 'On Holocaust Memorial Day, Germans Rally Against Far Right and for Democracy', 'kicker': None, 'content_kicker': None, 'print_headline': '‘Never Again Is Now’ for Germans on Holocaust Memorial Day', 'name': None, 'seo': None, 'sub': None}","['Right-Wing Extremism and Alt-Right', 'Politics and Government', 'Demonstrations, Protests and Riots', 'Neo Nazi Groups', 'Holocaust and the Nazi Era', 'Immigration and Emigration', 'Deportation', 'Race and Ethnicity', 'Alternative for Germany', 'Germany']",2024-01-27T15:34:00+0000,article,World
"Sour cream and onion chicken, Buffalo chicken dip and bulgogi-style tofu make for some fun flip-flops.","Today’s newsletter is all about recipes that take the flavors of one beloved food and apply them to something else, creating a dish that’s both familiar and novel. What can we say? It’s the end of January, we’re a little stir-crazy and we love a bit of fun in the kitchen.","{'main': 'Chips as Chicken and Wings as Dip', 'kicker': None, 'content_kicker': None, 'print_headline': '', 'name': None, 'seo': None, 'sub': None}","['Cooking and Cookbooks', 'Content Type: Service']",2024-01-27T16:00:02+0000,article,Food
"President Biden, the man actually in the White House, faces a conundrum: How do you run against a man who never conceded his election loss, and is already acting like he has the job?",He promised to repeal the Affordable Care Act. He demanded states deploy the National Guard to the U.S.-Mexico border. He warned congressional Republicans to hold out for a perfect deal on immigration — or else.,"{'main': 'Biden Must Campaign Against a Man Who Already Thinks He’s President', 'kicker': 'White House Memo', 'content_kicker': None, 'print_headline': 'Puzzle for the President: A Rival Who Pretends He’s in Charge', 'name': None, 'seo': None, 'sub': None}","['Presidential Election of 2024', 'United States Politics and Government', 'Immigration and Emigration', 'Biden, Joseph R Jr', 'Trump, Donald J', 'Democratic Party', 'Republican Party']",2024-01-27T16:23:12+0000,article,U.S.
"In situations where people have died and their estate is in court, fixing a problem in their former apartment is legally complex.","Q: Six months ago, while I was out of town, there were two unattended deaths in my 60-unit co-op building in Brooklyn. The bodies were eventually discovered and removed. My apartment is above the unit where this occurred, and I returned to flies and a smelly apartment. Two months later, the co-op board got a court order allowing it to break the NYPD seal and remove the apartment’s contents. But the smell remains, and no work is planned. The odor is weaker now, but persistent, especially when the heat comes on. It’s too cold to keep the windows open. I’m running air purifiers, but have had to abandon one room and all the closets. My household insurance won’t help, because there is no physical damage. What recourse do I have?","{'main': 'When a Neighbor Dies Unattended, How Should the Building Handle It?', 'kicker': 'Ask Real Estate', 'content_kicker': None, 'print_headline': 'When a Neighbor Dies Unattended, How Should the Building Handle It?', 'name': None, 'seo': None, 'sub': None}","['Real Estate and Housing (Residential)', 'Condominiums']",2024-01-27T16:28:08+0000,article,Real Estate
"When they faced off at E. Jean Carroll’s defamation trial, it was a clash of two New Yorkers, both formidable combatants and talkers, but products of different worlds.",The meeting turned ugly fast.,"{'main': 'In Trump’s Bitter, Yearslong Brawl with Roberta Kaplan, He Keeps Losing', 'kicker': None, 'content_kicker': None, 'print_headline': 'The Legal Mind Behind the Win Against Trump  ', 'name': None, 'seo': None, 'sub': None}","['Libel and Slander', 'Compensation for Damages (Law)', 'Decisions and Verdicts', 'Suits and Litigation (Civil)', 'Sex Crimes', 'Legal Profession', 'United States Politics and Government', 'Kaplan, Roberta A', 'CARROLL, E JEAN', 'Trump, Donald J']",2024-01-27T16:35:36+0000,article,New York
"Lawmakers in Tennessee, Oklahoma and other Republican states want to turn the clock back to the 19th century.","Most of my writing this week was on the recent elections in Iowa and New Hampshire, but most of my reading was focused elsewhere. In particular, I want to highlight this report from Jessica Valenti, published in her excellent newsletter, on proposed travel bans for abortion care in Tennessee and Oklahoma. The Tennessee ban, proposed by State Representative Jason Zachary, would make it a felony to take a minor out of state to obtain an abortion. As Valenti notes, “That means a friend, aunt or grandmother who helps a teenager get an abortion could be sent to prison for 15 years.” The Oklahoma bill, if signed into law, would punish anyone who helped a minor obtain abortion care with up to five years in prison.","{'main': 'Dobbs Overturned Much More Than Roe v. Wade', 'kicker': 'Jamelle Bouie', 'content_kicker': None, 'print_headline': '', 'name': None, 'seo': None, 'sub': None}","['Law and Legislation', 'Abortion', 'States (US)', 'Federal-State Relations (US)', 'United States Politics and Government', 'Conservatism (US Politics)', 'Roe v Wade (Supreme Court Decision)', 'Supreme Court (US)', 'United States', 'Tennessee', 'Oklahoma', 'Slavery (Historical)']",2024-01-27T16:45:24+0000,article,Opinion
"A Republican state senator announced a run for governor, joining a dizzying array of high-profile races playing out under extraordinary circumstances.","New Jersey’s first lady is running for U.S. Senate. A former governor who resigned in disgrace is trying to make a political comeback, as a mayor. Two members of Congress and a half-dozen other political luminaries are preparing to campaign for governor.","{'main': 'New Jersey Political Races, Often Raucous, Are Bananas This Year', 'kicker': None, 'content_kicker': None, 'print_headline': 'New Jersey Political Races, Often Raucous, Turn Up Dial on the Frenzy', 'name': None, 'seo': None, 'sub': None}","['United States Politics and Government', 'Elections, Senate', 'Elections, Mayors', 'Democratic Party', 'Republican Party', 'Baraka, Ras', 'Bhalla, Ravinder S', 'McGreevey, James E', 'Menendez, Robert', 'Ciattarelli, Jack M', 'Fulop, Steven M', 'Gottheimer, Joshua S (1975- )', 'Kim, Andy (1982- )', 'Malinowski, Tom', 'Murphy, Philip D (1957- )', 'Sherrill, Mikie', 'Sweeney, Stephen M', 'New Jersey']",2024-01-27T17:00:11+0000,article,New York
"Ashton Connor Garcia, who called himself a “cyberterrorist,” made 20 calls about fake bombs, shootings and other threats that drew police responses, officials said.","A man in Washington State has pleaded guilty to federal charges stemming from several hoax calls he made to law enforcement agencies in which he falsely reported bombs, shootings and other threats that sometimes led police officers to enter victims’ homes with their weapons drawn, prosecutors said.","{'main': 'Washington Man Pleads Guilty to Making Numerous ‘Swatting’ Calls', 'kicker': None, 'content_kicker': None, 'print_headline': '', 'name': None, 'seo': None, 'sub': None}","['Threats and Threatening Messages', 'Swatting (Crime)', 'Washington (State)']",2024-01-27T19:17:18+0000,article,U.S.
"The city’s top prosecutor from 1973 to 2003, he led an office that sent hundreds of Black men to prison and became known for its record of wrongful convictions.","Harry Connick Sr., a long-serving district attorney in New Orleans whose office gained national notoriety for prosecutorial overreach that eventually resulted in many reversed convictions, died on Thursday at his home in New Orleans. He was 97.","{'main': 'Harry Connick Sr., New Orleans D.A. Criticized for Overreach, Dies at 97', 'kicker': None, 'content_kicker': None, 'print_headline': 'Harry Connick Sr., 97,  D.A. With Record Rate Centered on Race, Dies', 'name': None, 'seo': None, 'sub': None}","['Connick, Harry Sr', 'Deaths (Obituaries)', 'False Arrests, Convictions and Imprisonments', 'Ethics and Official Misconduct', 'Prosecutorial Misconduct', 'District Attorneys', 'Ginsburg, Ruth Bader', 'New Orleans (La)', 'Orleans Parish (La)']",2024-01-27T21:20:41+0000,article,U.S.
