abstract,lead_paragraph,headline,keywords,pub_date,document_type,section_name
Con artists and ghost stories are among our recommendations from the subscription streaming services this month.,"A unique horror omnibus, an existentialist supernatural story, and atypical star turns are among our recommendations from the subscription streaming services this month, along with some essential background viewing for one of this year’s Oscar nominees.","{'main': '‘Mister Organ,’ ‘Destroyer’ and More Streaming Gems', 'kicker': 'Beyond the Algorithm', 'content_kicker': None, 'print_headline': '', 'name': None, 'seo': None, 'sub': None}","['Movies', 'A Ghost Story (Movie)', 'Destroyer (Movie)', 'Mister Organ (Movie)']",2024-02-21T10:02:34+0000,article,Movies
"The director of the Merchant’s House Museum in the East Village, a rowhouse that is 192 years old, is worried about a plan to construct a new building next door.","Good morning. It’s Wednesday. We’ll look at why a museum is at odds with the city, which owns the 192-year-old rowhouse it occupies. We’ll also look at a class-action lawsuit that accuses the agency responsible for investigating child abuse of using “coercive tactics” that traumatize families.","{'main': 'A Fight to Preserve a Pristine Piece of Old New York', 'kicker': 'New York Today', 'content_kicker': None, 'print_headline': '', 'name': None, 'seo': None, 'sub': None}","['New York City', 'internal-storyline-no', 'Historic Buildings and Sites', 'Child Abuse and Neglect', 'Children and Childhood', 'Museums', ""Administration for Children's Services (NYC)"", 'Family Justice Law Center', 'Greenwich Village Society for Historic Preservation', ""Merchant's House Museum"", 'Gardiner, Margaret Halsey', 'East Village (Manhattan, NY)']",2024-02-21T10:02:40+0000,article,New York
"Mr. Erwitt, who died last year, moved to the Brentmore more than 50 years ago. His estate has listed the co-op for $11.5 million and the studio for $2.3 million.",Elliott Erwitt had already gained worldwide renown for his memorable photographs of the famous and whimsical when he settled into his grand apartment at 88 Central Park West in the late 1960s.,"{'main': 'Elliott Erwitt’s Co-op and Photo Studio Are Listed on Central Park West', 'kicker': None, 'content_kicker': None, 'print_headline': 'Elliott Erwitt’s Central Park West Apartment and Photo Studio Are Available', 'name': None, 'seo': None, 'sub': None}","['Real Estate and Housing (Residential)', 'Photography', 'Art', 'High Net Worth Individuals', 'Collectors and Collections', 'Magnum Photos', 'Erwitt, Elliott', 'Central Park (Manhattan, NY)', 'Upper West Side (Manhattan, NY)', 'Manhattan (NYC)']",2024-02-21T10:02:53+0000,article,Real Estate
"On a snowy trip to Rochester and Auburn, N.Y., a writer explores the cities that Frederick Douglass and Harriet Tubman called home.","Memphis. Atlanta. Birmingham. There are certain American cities that are known for Black history. But African American history and culture can, of course, be found across the United States, in seemingly unlikely cities, like Portland, Maine, say, or Providence, R.I.","{'main': '2 Black Heroes, 2 Cities in New York: A Journey Into the Past', 'kicker': None, 'content_kicker': None, 'print_headline': '', 'name': None, 'seo': None, 'sub': None}","['Black People', 'Blacks', 'Slavery (Historical)', 'Historic Buildings and Sites', 'Douglass, Frederick', 'Tubman, Harriet', 'Rochester (NY)', 'Auburn (NY)']",2024-02-21T10:02:56+0000,article,Travel
Sometimes a simple pasta of pantry staples is the best company.,"I recently moved in with a man. Until now, for the last decade, I lived alone in a shoe-box studio apartment on the north end of Manhattan with my dog, Quentin Compson. Now the man, the dog and I live in a shoe-box one-bedroom in Brooklyn. It took awhile to get used to having another occupy my space, when all I ever had to account for was myself and my wire-haired familiar.","{'main': 'The Night Owl’s Special: Midnight Spaghetti', 'kicker': None, 'content_kicker': None, 'print_headline': 'Late-Night Diner: A simple pasta of pantry staples is a night owl’s best company.', 'name': None, 'seo': None, 'sub': None}","['Recipes', 'Pasta', 'Cooking and Cookbooks']",2024-02-21T10:03:03+0000,article,Magazine
"Thirty years ago, the U.S. entered an era of productivity gains that enabled healthy growth. Experts are asking if it could happen again.","The last time the American economy was posting surprising economic growth numbers amid rapid wage gains and moderating inflation, Ace of Base and All-4-One topped the Billboard charts and denim overalls were in vogue.","{'main': 'Are We in a Productivity Boom? For Clues, Look to 1994.', 'kicker': None, 'content_kicker': None, 'print_headline': 'Is the Economy  About to Party  Like It’s 1994?', 'name': None, 'seo': None, 'sub': None}","['United States Economy', 'Productivity', 'Labor and Jobs', 'Computers and the Internet', 'Telecommuting', 'Innovation', 'Layoffs and Job Reductions', 'Federal Reserve System', 'Greenspan, Alan', 'Powell, Jerome H']",2024-02-21T10:03:11+0000,article,Business Day
The Israeli military said its latest deadly raid targeted “terrorism” and was part of a broader operation in the Israeli-occupied territory.,"Israeli forces killed three people and detained at least 14 others in an overnight raid in the West Bank city of Jenin, the Israeli military said on Wednesday.","{'main': 'Israeli Raid in West Bank City of Jenin Kills 3, Military Says', 'kicker': None, 'content_kicker': None, 'print_headline': '', 'name': None, 'seo': None, 'sub': None}","['Jenin (West Bank)', 'West Bank', 'Israel', 'Israel-Gaza War (2023- )', 'Hamas', 'Terrorism']",2024-02-21T10:03:12+0000,article,World
A look at how the Field Museum in Chicago is responding to recent federal regulations that have led officials to cover objects they may need to return to tribes.,"When new federal regulations took effect last month requiring museums to get consent from tribes before exhibiting certain Native cultural items, museums across the country began to remove objects from cases, cover up displays and even close entire halls.","{'main': '6 Objects That Explain New Rules on Native Displays in Museums', 'kicker': None, 'content_kicker': None, 'print_headline': 'Native Displays And New Rules For Museums', 'name': None, 'seo': None, 'sub': None}","['Museums', 'Native Americans', 'Art', 'Arts and Antiquities Looting', 'Regulation and Deregulation of Industry', 'Law and Legislation', 'Field Museum', 'Chicago (Ill)', 'United States']",2024-02-21T10:03:34+0000,article,Arts
Elaine Kamarck breaks down the presidential nomination process.,"[You can listen to this episode of “The Ezra Klein Show” on the NYT Audio App, Apple, Spotify, Amazon Music, Google or wherever you get your podcasts.]","{'main': 'Here’s How an Open Democratic Convention Would Work', 'kicker': None, 'content_kicker': None, 'print_headline': '', 'name': None, 'seo': None, 'sub': None}","['Presidential Election of 2024', 'United States Politics and Government', 'Democratic National Convention', 'Politics and Government', 'Primaries and Caucuses', 'Democracy (Theory and Philosophy)', 'Biden, Joseph R Jr', 'Democratic Party', 'audio-neutral-informative']",2024-02-21T10:03:35+0000,article,Opinion
"Why are 18 shows opening in March and April, and which one is for you? Our theater reporter has answers.",Is Broadway facing a bonanza or a blood bath?,"{'main': 'What to Know About This Crazily Crowded Broadway Spring Season', 'kicker': None, 'content_kicker': None, 'print_headline': 'We’ve Got the Skinny On the Coming Season', 'name': None, 'seo': None, 'sub': None}","['Theater', 'Theater (Broadway)', 'New York City', 'Tony Awards (Theater Awards)', 'An Enemy of the People (Play)', 'Cabaret (Play)', 'Doubt (Play)', ""Hell's Kitchen (Play)"", 'Lempicka (Play)', 'Mary Jane (Play)', 'Mother Play (Play)', 'Patriots (Play)', 'Stereophonic (Play)', 'Suffs (Play)', 'The Great Gatsby (Play)', 'The Heart of Rock and Roll (Play)', 'The Notebook (Play)', 'The Outsiders (Play)', 'The Wiz (Play)', 'Uncle Vanya (Play)', 'Water for Elephants (Play)']",2024-02-21T10:03:46+0000,article,Theater
The economy is driven by greed and shot with uncertainty. That’s what Americans said in more than 30 small-group discussions in the past two years.,"When asked what drives the economy, many Americans have a simple, single answer that comes to mind immediately: “greed.” They believe the rich and powerful have designed the economy to benefit themselves and have left others with too little or with nothing at all.","{'main': 'Many Americans Believe the Economy Is Rigged', 'kicker': 'Guest Essay', 'content_kicker': None, 'print_headline': '', 'name': None, 'seo': None, 'sub': None}","['Income Inequality', 'United States Economy', 'Labor and Jobs', 'Tax Credits, Deductions and Exemptions', 'Wages and Salaries', 'Income', 'Inflation (Economics)', 'Polls and Public Opinion', 'United States']",2024-02-21T10:03:47+0000,article,Opinion
"A two-bedroom cottage in New Braunfels, a one-bedroom condominium in Atlanta and a Craftsman bungalow in Omaha.","This house, once part of a church complex, was moved to its current location last year and renovated. New plumbing and electrical systems were installed, and the home was furnished with antique and vintage pieces that are available to buy.","{'main': '$300,000 Homes in Texas, Georgia and Nebraska', 'kicker': 'What You Get', 'content_kicker': None, 'print_headline': '', 'name': None, 'seo': None, 'sub': None}","['Real Estate and Housing (Residential)', 'Omaha (Neb)', 'Atlanta (Ga)', 'New Braunfels (Tex)']",2024-02-21T10:03:50+0000,article,Real Estate
"Gorgeous, abundant visuals are just pale imitations of what young people used to have: an actual scene.","A few weeks ago, my 12-year-old daughter showed me a video created by a Dallas clothing store called Dear Hannah Prep, depicting a girl’s first time visiting “the preppiest boutique in Texas.” “How excited are you?” an off-camera voice asks. “I’m so excited!” the girl says. Then she opens the door, gasps and declares, “It’s so preppy in here!” ","{'main': 'Teen Subcultures Are Fading. Pity the Poor Kids.', 'kicker': 'Screenland', 'content_kicker': None, 'print_headline': 'Fashion Victims', 'name': None, 'seo': None, 'sub': None}","['Teenagers and Adolescence', 'Social Media', 'TikTok (ByteDance)', 'Fashion and Apparel']",2024-02-21T10:03:55+0000,article,Magazine
"Thirty years ago, the U.S. entered an era of productivity gains that enabled healthy growth. Experts are asking if it could happen again.","Thirty years ago, the U.S. entered an era of productivity gains that enabled healthy growth. Experts are asking if it could happen again.","{'main': 'How Productivity Affects the Economy', 'kicker': None, 'content_kicker': None, 'print_headline': '', 'name': None, 'seo': None, 'sub': None}","['United States Economy', 'Productivity', 'Computers and the Internet', 'Inflation (Economics)']",2024-02-21T10:03:55+0000,multimedia,Business Day
Adelle Waldman on why a certain corporate loophole needs tightening.,"One of the lesser-known problems facing many low-wage workers in America is unpredictable and scarce work hours — something the writer Adelle Waldman knows firsthand. She worked at a big-box store for six months to research her latest novel, about a group of employees plotting to overthrow their bad boss. In this audio essay, Waldman explains how her experience exposed her to the way inflexible hours can wreak havoc in people’s lives, from lack of health insurance to the inability to pick up a second job.","{'main': 'I Worked at a Big-Box Store. Here’s a Way to Improve the Lives of Low-Wage Workers.', 'kicker': None, 'content_kicker': None, 'print_headline': '', 'name': None, 'seo': None, 'sub': None}","['Part-Time Employment', 'Labor and Jobs', 'Wages and Salaries', 'Working Hours', 'Health Insurance and Managed Care', 'Employee Fringe Benefits', 'audio-neutral-informative']",2024-02-21T10:03:58+0000,article,Opinion
"The 1990 documentary about Patrice Lumumba by Raoul Peck (“I Am Not Your Negro”), showing at the Brooklyn Academy of Music, looks and feels newly minted.","“If the prophet dies, so does the future,” the director Raoul Peck says early in “Lumumba: Death of a Prophet.” The movie, a personal essay in the form of a history lesson, is as much a poem as it is a documentary.","{'main': '‘Lumumba: Death of a Prophet’: Revisiting a Mythic Figure', 'kicker': 'Rewind', 'content_kicker': None, 'print_headline': 'Sixty-Three Years Later, A Leader’s Death Haunts', 'name': None, 'seo': None, 'sub': None}","['Documentary Films and Programs', 'Content Type: Personal Profile', ""Coups D'Etat and Attempted Coups D'Etat"", 'Colonization', 'Lumumba: Death of a Prophet (Movie)', 'Lumumba, Patrice', 'Peck, Raoul', 'Congo, Democratic Republic of (Congo-Kinshasa)', 'Belgium', 'Brooklyn Academy of Music']",2024-02-21T10:04:06+0000,article,Movies
N.I.H. researchers found notable differences between the immune systems and other physiological functions of patients with ME/CFS and those of healthy patients.,"Jennifer Caldwell was active and energetic, working two jobs and taking care of her daughter and her parents, when she developed a bacterial infection that was followed by intense lightheadedness, fatigue and memory problems.","{'main': 'Study of Patients With a Chronic Fatigue Condition May Offer Clues to Long Covid', 'kicker': None, 'content_kicker': None, 'print_headline': 'Chronic Fatigue Study May Help With Long Covid', 'name': None, 'seo': None, 'sub': None}","['Chronic Condition (Health)', 'Long Covid', 'Immune System', 'Research', 'Chronic Fatigue Syndrome', 'Infections', 'National Institutes of Health', 'National Institute of Neurological Disorders and Stroke', 'Nature Communications (Journal)', 'audio-neutral-informative']",2024-02-21T10:04:09+0000,article,Health
"The armorer, Hannah Gutierrez-Reed, is charged with involuntary manslaughter in the fatal shooting of a cinematographer on the set of the film “Rust.” She has pleaded not guilty.",The armorer who loaded the gun that Alec Baldwin was rehearsing with on a film set in 2021 when it fired a live round and killed the movie’s cinematographer is standing trial in New Mexico on a charge of involuntary manslaughter.,"{'main': 'Armorer Who Loaded Gun in Alec Baldwin Shooting Stands Trial: What to Know', 'kicker': None, 'content_kicker': None, 'print_headline': '', 'name': None, 'seo': None, 'sub': None}","['Murders, Attempted Murders and Homicides', 'Movies', 'Baldwin, Alec', 'Gutierrez-Reed, Hannah', 'Hutchins, Halyna (1979-2021)', 'Santa Fe (NM)', 'Rust (Movie)', 'Accidents and Safety']",2024-02-21T10:04:14+0000,article,Movies
"Voices from the tents, shelters, cars, motels and couches of America.","Voices from the tents, shelters, cars, motels and couches of America.","{'main': 'A Life Without a Home', 'kicker': None, 'content_kicker': None, 'print_headline': '', 'name': None, 'seo': None, 'sub': None}","['Homeless Persons', 'Yearwood, Lori Teresa (1965-2023)', 'Milwaukee (Wis)', 'Nashville (Tenn)', 'Los Angeles County (Calif)']",2024-02-21T10:04:16+0000,multimedia,Opinion
"The assaults on the village of Robotyne, which come at the same time as successful attacks in the east, are designed to pressure Ukrainian troops across the front line, analysts say.","Russian forces in recent days have launched multiple attacks around the southern Ukrainian village of Robotyne, military officials and experts said, targeting land hard-won by Ukraine in a rare success of its counteroffensive last summer.","{'main': 'Russian Forces Press On With Attacks in Southern Ukraine', 'kicker': None, 'content_kicker': None, 'print_headline': 'Russia Attacks in South To Pressure Front Line', 'name': None, 'seo': None, 'sub': None}","['Russian Invasion of Ukraine (2022)', 'Defense and Military Forces', 'Russia', 'Ukraine', 'Avdiivka (Ukraine)', 'Robotyne (Ukraine)']",2024-02-21T10:04:21+0000,article,World
Two key presumptions are at the heart of the debate over Ukraine vs. Taiwan.,"Over the weekend Senator J.D. Vance of Ohio went to the Munich Security Conference to play an unpopular part — a spokesman, at a gathering of the Western foreign policy establishment, for the populist critique of American support for Ukraine’s war effort.","{'main': 'What the Ukraine Aid Debate Is Really About', 'kicker': 'Ross Douthat', 'content_kicker': None, 'print_headline': 'The Shadow of China on the Ukraine Debate', 'name': None, 'seo': None, 'sub': None}","['United States International Relations', 'Russian Invasion of Ukraine (2022)', 'Defense and Military Forces', 'North Atlantic Treaty Organization', 'Republican Party', 'Biden, Joseph R Jr', 'Putin, Vladimir V', 'Trump, Donald J', 'China', 'Eastern Europe', 'Russia', 'Taiwan']",2024-02-21T10:04:27+0000,article,Opinion
Democratic strategists are asking whether the president’s attempt to recapture these voters is a fool’s errand.,A chorus of political analysts on the center left is once again arguing that the Democratic Party must reclaim a significant share of racially and culturally conservative white working-class voters if it is to regain majority status.,"{'main': 'Does Biden Have to Cede the White Working Class to Trump?', 'kicker': 'Guest Essay', 'content_kicker': None, 'print_headline': '', 'name': None, 'seo': None, 'sub': None}","['Presidential Election of 2024', 'United States Politics and Government', 'Labor and Jobs', 'Income Inequality', 'Conservatism (US Politics)', 'Minorities', 'Race and Ethnicity', 'United States Economy', 'Polls and Public Opinion', 'Liberalism (US Politics)', 'Democratic Party', 'Republican Party', 'Biden, Joseph R Jr', 'Trump, Donald J']",2024-02-21T10:04:39+0000,article,Opinion
"Politics and speed dating: What could go wrong? Astead Herndon, host of “The Run-Up,” talks to Anna Martin about his recent reporting excursion.","The New York Times political reporter Astead Herndon went speed dating in a swing state to ask daters fun questions like: How early do you tell a prospective date whether you lean red or blue? When do you talk about your stances on issues like abortion or gender equality? It’s hard enough to find someone you click with. Then add election-year tensions into the mix, and things get even more complicated.","{'main': 'A Politics Reporter Walks Into a Singles Mixer', 'kicker': None, 'content_kicker': None, 'print_headline': '', 'name': None, 'seo': None, 'sub': None}","['Love (Emotion)', 'Dating and Relationships', 'Politics and Government', 'Television', 'Single Persons']",2024-02-21T10:04:43+0000,article,Podcasts
An executive order expands powers to the Department of Homeland Security amid increased fears of a conflict with China.,"President Biden signed an executive order on Wednesday to strengthen the government’s ability to respond to maritime cybersecurity threats, amid heightened concerns that China could seek to hobble crucial infrastructure systems in the United States.","{'main': 'Biden Hardens Protection Against Cybersecurity Threats to Ports', 'kicker': None, 'content_kicker': None, 'print_headline': 'Biden Toughens Cybersecurity Safeguards for U.S. Ports', 'name': None, 'seo': None, 'sub': None}","['Cyberwarfare and Defense', 'United States Politics and Government', 'Ports', 'Executive Orders and Memorandums', 'Ships and Shipping', 'Freight (Cargo)', 'Cybersecurity and Infrastructure Security Agency', 'Homeland Security Department', 'United States Coast Guard', 'China', 'Biden, Joseph R Jr']",2024-02-21T10:04:50+0000,article,U.S.
Fancy a chance to claim the Rose Bowl? Get really good at carrying stones.,"At a traditional Scottish Highland Games, fit athletes engage in rigorous pursuits like caber-tossing, hammer-throwing and stone-carrying.","{'main': 'A Missing Scottish Trophy Will Be Awarded Again After 95 Years', 'kicker': None, 'content_kicker': None, 'print_headline': 'Missing 95 Years, A Beloved Trophy Is Up for Grabs ', 'name': None, 'seo': None, 'sub': None}","['Scotland', 'Track and Field', 'Awards, Decorations and Honors']",2024-02-21T10:06:56+0000,article,World
"One of the first voices heard on the airwaves in Asia, he became recognized by generations of listeners in India over 42 years of broadcasting Bollywood music.","Ameen Sayani, a pioneering radio presenter who drew in generations of listeners in India with his melodic voice on a radio show that became a national phenomenon, died on Tuesday in Mumbai. He was 91.","{'main': 'Ameen Sayani, Pioneering Radio Star in India, Dies at 91', 'kicker': None, 'content_kicker': None, 'print_headline': '', 'name': None, 'seo': None, 'sub': None}","['Deaths (Obituaries)', 'Radio', 'India', 'Mumbai (India)', 'Bollywood/Hollywood (Movie)', 'Far East, South and Southeast Asia and Pacific Areas']",2024-02-21T10:29:51+0000,article,World
"Can you find St. Lucia on a map? What else do you know about this Caribbean island nation with about 180,000 people?","Can you find St. Lucia on a map? What else do you know about this Caribbean island nation with about 180,000 people?","{'main': 'How Much Do You Know About St. Lucia?', 'kicker': 'Geography Quizzes', 'content_kicker': None, 'print_headline': '', 'name': None, 'seo': None, 'sub': None}",['St Lucia'],2024-02-21T10:30:00+0000,multimedia,The Learning Network
"Plus, the embryo ruling shaking doctors and patients.","The New York Times Audio app is home to journalism and storytelling, and provides news, depth and serendipity. If you haven’t already, download it here — available to Times news subscribers on iOS — and sign up for our weekly newsletter.","{'main': 'Biden’s Fund-Raising Edge, and Ukrainian Troops Are Feared Missing', 'kicker': None, 'content_kicker': None, 'print_headline': '', 'name': None, 'seo': None, 'sub': None}","['Russian Invasion of Ukraine (2022)', 'Biden, Joseph R Jr', 'United States Politics and Government', 'Embryos (Human)']",2024-02-21T11:00:12+0000,article,Podcasts
Faltering U.S. support for Ukraine and comments from Donald Trump about NATO have caused alarm in European capitals.,"Over the past few weeks, a growing sense of alarm across Europe over the future of the continent’s security has turned into outright panic.","{'main': 'What Happens if America Turns Its Back on Its Allies in Europe', 'kicker': None, 'content_kicker': None, 'print_headline': '', 'name': None, 'seo': None, 'sub': None}","['United States International Relations', 'International Relations', 'Politics and Government', 'Russian Invasion of Ukraine (2022)', 'North Atlantic Treaty Organization', 'Trump, Donald J', 'Europe', 'Russia', 'Ukraine', 'United States']",2024-02-21T11:00:15+0000,article,Podcasts
"Israel did not comment on the attack, though it has acknowledged hundreds of past strikes on Iran-linked targets in Syria.","Syrian state media reported on Wednesday that an airstrike on a residential building in Damascus had killed two people, and said that Israel was responsible for the attack.","{'main': 'Syria Blames Israel for Deadly Airstrike in Damascus', 'kicker': None, 'content_kicker': None, 'print_headline': '', 'name': None, 'seo': None, 'sub': None}","['Syria', 'Israel', 'Damascus (Syria)', 'War and Armed Conflicts', 'Iran']",2024-02-21T11:36:37+0000,article,World
"We look at promising, evidence-based efforts to prevent suicide.","“The bridge is sealed up.” Last month, with those words, the general manager of the Golden Gate Bridge announced the completion of a suicide barrier — stainless steel netting that extends about 20 feet out from the walkway for the length of the bridge, making a jump into the water below extraordinarily difficult.","{'main': 'Hope for Suicide Prevention', 'kicker': None, 'content_kicker': None, 'print_headline': '', 'name': None, 'seo': None, 'sub': None}","['internal-storyline-no', 'Suicides and Suicide Attempts', 'California', 'Golden Gate Bridge']",2024-02-21T11:38:51+0000,article,Briefing
He was best known for his portrayal of the lackluster accountant Keith Bishop on Ricky Gervais’s celebrated series.,"Ewen MacIntosh, a British actor and comedian acclaimed for his dry portrayal of Keith Bishop, a lackluster accountant, on the British sitcom “The Office,” died on Monday in the English town of Darlington. He was 50.","{'main': 'Ewen MacIntosh, a Star of the British Sitcom ‘The Office,’ Dies at 50', 'kicker': None, 'content_kicker': None, 'print_headline': 'Ewen Macintosh, 50, Actor Who Starred in the British Sitcom ‘The Office’', 'name': None, 'seo': None, 'sub': None}","['MacIntosh, Ewen (1973-2024)', 'Deaths (Obituaries)', 'The Office (TV Program)', 'Comedy and Humor', 'Television', 'Great Britain', 'Gervais, Ricky']",2024-02-21T11:41:18+0000,article,Arts
New surveys show that many parents play a big role in their adult children’s lives — and that both parties seem happy with the arrangement. Would you welcome it?,"When you imagine adulthood, do you picture your parents still playing a big role in your life? Or do you hope to be largely self-sufficient?","{'main': 'How Involved Do You Expect Your Parents to Be in Your Adult Life?', 'kicker': 'Student Opinion', 'content_kicker': None, 'print_headline': '', 'name': None, 'seo': None, 'sub': None}",[],2024-02-21T12:48:33+0000,article,The Learning Network
