abstract,lead_paragraph,headline,keywords,pub_date,document_type,section_name
Many civilians in Rafah are sheltering in rickety tents made of plastic and wood and say there is nowhere left in Gaza to avoid Israeli shelling.,"Prime Minister Benjamin Netanyahu has ordered the Israeli military to draw up plans to evacuate Rafah, a Gazan city packed with more than a million people, in advance of an expected ground offensive that has set off international alarm.","{'main': 'Netanyahu Orders Evacuation Plan for City Where a Million Gazans Shelter', 'kicker': None, 'content_kicker': None, 'print_headline': 'Netanyahu Tells Military To Plan Clearing Of City', 'name': None, 'seo': None, 'sub': None}","['Israel-Gaza War (2023- )', 'Israel', 'Defense and Military Forces', 'Gaza Strip', 'Rafah (Gaza Strip)', 'Palestinians', 'Civilian Casualties', 'Refugees and Displaced Persons', 'Evacuations and Evacuees', 'International Relations', 'Netanyahu, Benjamin', 'Egypt', 'Biden, Joseph R Jr', 'United States International Relations']",2024-02-10T00:00:51+0000,article,World
"Hundreds gathered in a Greenwich Village church to pay their respects to the transgender activist Cecilia Gentili, who died this week at 52.","The strumming of a Spanish guitar and the voices of Eydie Gormé and Los Panchos echoed throughout the hall as “Sabor a Mí” played on a loudspeaker. Hundreds of mourners made their way into Judson Memorial Church, near Washington Square Park in Manhattan.","{'main': 'A ‘Mother’ Is Mourned by the Queer New Yorkers She Left Behind', 'kicker': None, 'content_kicker': None, 'print_headline': '', 'name': None, 'seo': None, 'sub': None}","['Gentili, Cecilia (1972-2024)', 'Homosexuality and Bisexuality', 'Transgender', 'Funerals and Memorials', 'Judson Memorial Church']",2024-02-10T00:00:52+0000,article,Style
"The $95 billion package appeared on track for eventual passage, but Republicans who killed a bipartisan version were still trying to make changes.",The long-stalled emergency national security package to send aid to Ukraine and Israel is back on track in the Senate and headed toward passage within days — but not before Republican senators try to take a few partisan shots at the legislation.,"{'main': 'Senators Work Into Weekend on Ukraine and Israel Bill as G.O.P. Slows Progress', 'kicker': None, 'content_kicker': None, 'print_headline': 'G.O.P. Senators Slow Aid Bill for Ukraine and Israel', 'name': None, 'seo': None, 'sub': None}","['United States Politics and Government', 'Law and Legislation', 'Foreign Aid', 'Immigration and Emigration', 'Senate', 'Republican Party', 'Russian Invasion of Ukraine (2022)', 'Russia', 'Ukraine']",2024-02-10T00:02:42+0000,article,U.S.
"Israel’s creditworthiness remains high, but the rating agency noted that the outlook for the country was negative considering the risks from the continued conflict.","Moody’s on Friday became the first major rating agency to downgrade Israel’s creditworthiness, citing the prolonged war with Hamas and the toll it is taking on the country’s finances.","{'main': 'Moody’s Downgrades Israel’s Credit Rating, Citing Toll of War', 'kicker': None, 'content_kicker': None, 'print_headline': '', 'name': None, 'seo': None, 'sub': None}","[""Moody's Investors Service Inc"", 'Israel', 'Israel-Gaza War (2023- )', 'Stocks and Bonds', 'Government Bonds', 'Netanyahu, Benjamin', 'Hamas']",2024-02-10T00:07:41+0000,article,World
The message came as congressional lawmakers were working on a package with billions in assistance but an uncertain fate.,"President Biden and Chancellor Olaf Scholz of Germany used a meeting at the Oval Office on Friday to pressure Congress to pass billions more in aid for Ukraine, as legislative dysfunction and opposition among some Republicans have left the critical package in limbo.","{'main': 'Biden and German Leader Meet at White House and Push for Ukraine Aid', 'kicker': None, 'content_kicker': None, 'print_headline': 'White House and Germany Pressure Congress for Aid', 'name': None, 'seo': None, 'sub': None}","['United States Politics and Government', 'Senate', 'Republican Party', 'United States International Relations', 'Russian Invasion of Ukraine (2022)', 'Defense and Military Forces', 'Germany', 'Russia', 'Ukraine', 'Scholz, Olaf (1958- )', 'Biden, Joseph R Jr']",2024-02-10T00:34:07+0000,article,U.S.
"A federal investigator said that President Biden had “poor memory” and “diminished faculties.” But such a diagnosis would require close medical assessment, experts said.",A lengthy report by the Department of Justice on President Biden’s handling of classified documents contained some astonishing assessments of his well-being and mental health.,"{'main': 'Memory Loss Requires Careful Diagnosis, Scientists Say', 'kicker': None, 'content_kicker': None, 'print_headline': '', 'name': None, 'seo': None, 'sub': None}","['Memory', 'Classified Information and State Secrets', 'United States Politics and Government', 'Dementia', 'Justice Department', 'Biden, Joseph R Jr', 'Hur, Robert Kyoung', 'United States']",2024-02-10T00:40:42+0000,article,Health
"The teenager, Jesus Alejandro Rivas Figueroa, is accused of firing at a security guard and instead hitting a woman from Brazil.","A 15-year-old boy was arrested on Friday, accused of shooting a Brazilian tourist in Times Square the night before and then firing twice at a police officer while fleeing the scene, officials said.","{'main': '15-Year-Old Is Arrested in Shooting of a Tourist in Times Square', 'kicker': None, 'content_kicker': None, 'print_headline': '', 'name': None, 'seo': None, 'sub': None}","['Assaults', 'Police', 'Crime and Criminals', 'Shoplifting and Employee Theft (Retail)', 'Robberies and Thefts', 'Guardian Angels', 'Police Department (NYC)', 'Bragg, Alvin', 'Sliwa, Curtis', 'Times Square and 42nd Street (Manhattan, NY)', 'internal-storyline-no']",2024-02-10T00:56:47+0000,article,New York
"A lawyer for the co-defendant said she had a witness who could testify that the relationship began before Fani Willis, the Fulton County district attorney, hired Nathan Wade.",A lawyer for one of former President Donald J. Trump’s co-defendants in the Georgia election case suggested on Friday that the two prosecutors leading the case had lied about when their romantic relationship started.,"{'main': 'Trump Co-Defendant Suggests Georgia Prosecutors Lied About Relationship Timing', 'kicker': None, 'content_kicker': None, 'print_headline': '', 'name': None, 'seo': None, 'sub': None}","['Georgia Criminal Case Against Trump (2020 Election)', 'Willis, Fani T', 'Wade, Nathan J', 'Roman, Mike (1972- )', 'Trump, Donald J', 'Legal Profession', 'Special Prosecutors (Independent Counsel)', 'Fulton County (Ga)']",2024-02-10T01:07:23+0000,article,U.S.
"Growing a spice once worth its weight in gold, a tiny isle in Indonesia was so coveted that the Dutch traded Manhattan for it. Some 350 years later, life on the two islands couldn’t be more different.","The isles of Manhattan and Pulau Rhun could hardly be farther apart, not just in geography, but also in culture, economy and global prominence.","{'main': 'Manhattan or Pulau Rhun? In 1667, Nutmeg Made the Choice a No-Brainer.', 'kicker': 'Indonesia Dispatch', 'content_kicker': None, 'print_headline': 'Manhattan or a Spice-Rich Isle? In 1667, the Choice Was Easy.', 'name': None, 'seo': None, 'sub': None}","['Indonesia', 'Banda Islands (Indonesia)', 'Nutmeg', 'Spices', 'Colonization', 'War Crimes, Genocide and Crimes Against Humanity', 'International Relations', 'International Trade and World Market']",2024-02-10T01:57:20+0000,article,World
"The authorities said on Friday that they believed they had recovered the remains of six family members, including the person believed to have shot a young niece and two police officers.","The remains of six family members have been recovered from a burned home in southeastern Pennsylvania, including those of a man who is believed to have shot two police officers on Wednesday, the authorities said on Friday.","{'main': '6 Bodies Found at Burned Pennsylvania House Where 2 Officers Were Shot', 'kicker': None, 'content_kicker': None, 'print_headline': '6 Burned Bodies Recovered From House in Pennsylvania', 'name': None, 'seo': None, 'sub': None}","['Fires and Firefighters', 'Attacks on Police', 'Deaths (Fatalities)', 'Pennsylvania']",2024-02-10T02:17:00+0000,article,U.S.
Zhouqin Burnikel returns to the Saturday puzzle page in style.,"SATURDAY PUZZLE — Although this is Zhouqin Burnikel’s 79th New York Times crossword, it has been more than six long years since we’ve solved a Saturday grid by her. She is a constructor with a devoted following; many solvers who started in the last decade grew to love her wit and subtle style in themed puzzles on Mondays and Tuesdays. She shines just as brightly in a challenging grid like this one, which is technically themeless, although it does feature a particular celebratory event that we discover as we solve.","{'main': 'Rocked, So to Speak', 'kicker': 'Wordplay, The CROSSWORD COLUMN', 'content_kicker': None, 'print_headline': '', 'name': None, 'seo': None, 'sub': None}","['Crossword Puzzles', 'Burnikel, Zhouqin (Crossword Constructor)', 'Lunar New Year']",2024-02-10T03:00:07+0000,article,Crosswords & Games
This week’s episode finally answers some questions that have been teased out for a long time.,This week’s recap is posting earlier than usual because the episode premiered Friday on Max.,"{'main': '‘True Detective’ Season 4, Episode 5 Recap: Dots Finally Connect', 'kicker': None, 'content_kicker': None, 'print_headline': '', 'name': None, 'seo': None, 'sub': None}","['Television', 'True Detective (TV Program)']",2024-02-10T03:05:07+0000,article,Arts
"Corrections that appeared in print on Saturday, Feb. 10, 2024.","An article on Friday about a growing number of schools extending the deadline for registration commitments because of delayed financial aid information, using incorrect information provided by Saint Louis University, misstated Rob Reddy’s title at Saint Louis University. He is interim vice president of enrollment management, not vice president of enrollment management.","{'main': 'Corrections: Feb. 10, 2024', 'kicker': None, 'content_kicker': None, 'print_headline': 'Corrections', 'name': None, 'seo': None, 'sub': None}",[],2024-02-10T03:14:17+0000,article,Corrections
"Quotation of the Day for Saturday, February 10, 2024.","“He will throw it to anybody, anywhere, at any time. And it will be on the money.”","{'main': 'Quotation of the Day: Mahomes Says He’s ‘Not Even Close’ to Brady', 'kicker': None, 'content_kicker': None, 'print_headline': 'Quote of the Day', 'name': None, 'seo': None, 'sub': None}",[],2024-02-10T03:17:24+0000,article,Corrections
"In a speech in Harrisburg, Pa., on Friday, former President Donald J. Trump said if President Biden was not going to be charged over classified documents, he should not be either.","Former President Donald J. Trump, who faces a criminal case accusing him of illegally retaining classified documents, blasted on Friday a special counsel’s decision not to charge President Biden for his handling of classified material, accusing prosecutors of an unfair double standard.","{'main': 'Trump Calls His Classified Documents Case ‘Selective Persecution’', 'kicker': None, 'content_kicker': None, 'print_headline': '', 'name': None, 'seo': None, 'sub': None}",[],2024-02-10T03:27:28+0000,article,U.S.
First comes wedding cake. Then game-day margaritas.,"In weddings, as in football, the will to win may be nothing without the will to prepare. That’s why Laura Arvizu and Robert Marquez, of Paso Robles, Calif., started planning their wedding in Mexico 14 months ago.","{'main': 'For Some Couples, Marrying on Super Bowl Weekend Is a Win', 'kicker': 'Field Notes', 'content_kicker': None, 'print_headline': 'A Super Bowl Weekend Wedding? It’s a Risky Play.', 'name': None, 'seo': None, 'sub': None}","['Weddings and Engagements', 'Super Bowl', 'Football', 'Parties (Social)']",2024-02-10T05:00:06+0000,article,Style
"As it votes on Sunday for a new president, NATO’s newest member says Moscow is testing it by turning asylum seekers into a political pressure point.",Poking up through the snow drifts on the Finnish-Russian border lies a symbol of Moscow’s biggest provocation yet toward NATO’s newest member: a sprawling heap of broken bicycles.,"{'main': 'On a Frozen Border, Finland Puzzles Over a ‘Russian Game’', 'kicker': None, 'content_kicker': None, 'print_headline': 'On 830-Mile Border, Russia Taunts a New NATO Member', 'name': None, 'seo': None, 'sub': None}","['Finland', 'Russia', 'International Relations', 'Asylum, Right of', 'Illegal Immigration', 'Elections', 'Politics and Government', 'Border Barriers', 'North Atlantic Treaty Organization', 'Defense and Military Forces', 'United States International Relations', 'Law and Legislation', 'Refugees and Displaced Persons', 'Russian Invasion of Ukraine (2022)', 'Human Rights and Human Rights Violations', 'European Union', 'Frontex']",2024-02-10T05:01:20+0000,article,World
"Convicted of money laundering, Ricardo Martinelli, a conservative ex-president who had planned to run again, has sought refuge in the embassy of leftist and autocratic Nicaragua.","As Panama jumps into its boisterous Carnival period, the celebrations this weekend come amid a bizarre political drama playing out in the capital.","{'main': 'Panamanian Candidate, Facing Prison, Vows to Campaign From an Embassy', 'kicker': None, 'content_kicker': None, 'print_headline': 'Panama Candidate, Facing Jail, Vows to Run for President While in Asylum', 'name': None, 'seo': None, 'sub': None}","['Martinelli, Ricardo', 'Panama', 'Nicaragua', 'Asylum, Right of', 'Decisions and Verdicts', 'Fugitives', 'International Relations', 'Murders, Attempted Murders and Homicides', 'Money Laundering', 'Polls and Public Opinion']",2024-02-10T05:19:20+0000,article,World
In case you need some puzzle help.,"Welcome to The Wordle Review. Be warned: This page contains spoilers for today’s puzzle. Solve Wordle first, or scroll at your own risk.","{'main': 'Today’s Wordle Review', 'kicker': None, 'content_kicker': None, 'print_headline': '', 'name': None, 'seo': None, 'sub': None}","['Wordle (Puzzle)', 'Crossword Puzzles']",2024-02-10T08:00:03+0000,article,Crosswords & Games
In case you need some puzzle help.,"Good morning, dear connectors. Welcome to today’s Connections forum, where you can give and receive puzzle — and emotional — support.","{'main': 'The Connections Companion', 'kicker': None, 'content_kicker': None, 'print_headline': '', 'name': None, 'seo': None, 'sub': None}","['Crossword Puzzles', 'Connections (Game)']",2024-02-10T08:00:06+0000,article,Crosswords & Games
Feeling stuck on today’s puzzle? We can help.,"Hi busy bees! Welcome to today’s Spelling Bee forum. There are a number of terms that appear in both this article and other online discussions of the Spelling Bee; a glossary of those terms compiled by Monicat, a Times reader, can be found below.","{'main': 'Spelling Bee Forum', 'kicker': None, 'content_kicker': None, 'print_headline': '', 'name': None, 'seo': None, 'sub': None}","['Spelling Bee (Game)', 'Crossword Puzzles']",2024-02-10T08:00:07+0000,article,Crosswords & Games
"Upfront costs for renters — security deposits, broker fees and a month’s rent — are at their highest levels in years, another sign of the city’s housing crisis.",Hannah Brooks needed a new apartment and she was running out of time.,"{'main': 'Boxes, Tape, $10,000: What It Takes to Move Into an N.Y.C. Apartment', 'kicker': None, 'content_kicker': None, 'print_headline': 'Boxes, Tape, $10,000: Moving to New York City', 'name': None, 'seo': None, 'sub': None}","['New York City', 'Renting and Leasing (Real Estate)', 'Prices (Fares, Fees and Rates)', 'Moving and Moving Industry', 'Real Estate and Housing (Residential)', 'Real Estate Brokers', 'StreetEasy', 'Real Estate Board of New York']",2024-02-10T08:00:13+0000,article,New York
"Shannan Ferry, who co-anchors “Weekends on 1” for NY1, wakes up in the middle of the night to head to work, then spends her day on dates or with friends.","“I’m more of a morning than a night person,” Shannan Ferry said.","{'main': 'How a Weekend News Anchor Who Wakes Up Before Dawn Spends Her Sundays', 'kicker': None, 'content_kicker': None, 'print_headline': 'Getting a Very Early Start on Work', 'name': None, 'seo': None, 'sub': None}","['News and News Media', 'Content Type: Personal Profile', 'Chelsea Market', 'NY1', 'Dating and Relationships']",2024-02-10T08:00:17+0000,article,New York
Arthur Dukes Jr. had made three false starts at college before becoming the star player for LaGuardia Community College’s scrappy new team.,"Arthur Dukes Jr. played in pickup basketball games whenever he could, which is why he showed up for an open-gym session at Public School 92 in Harlem one evening last year. At 21, he was living at home in a two-bedroom apartment with his parents and seven siblings while working as a security guard at a shoe store.","{'main': 'This Junior College Basketball Star Was Discovered at a Pickup Game', 'kicker': None, 'content_kicker': None, 'print_headline': 'Pickup Game Standout Becomes Junior College Star', 'name': None, 'seo': None, 'sub': None}","['Basketball (College)', 'Community Colleges', 'LaGuardia Community College', 'Long Island City (Queens, NY)', 'Content Type: Personal Profile']",2024-02-10T08:00:33+0000,article,New York
"For almost 20 years, Combatants For Peace has called for non-violence and an “end to Israel’s occupation of Palestine.” But after Oct. 7, some attendees are more hesitant to speak out about their activism. Times reporters attended one of their sessions.","For almost 20 years, Combatants For Peace has called for non-violence and an “end to Israel’s occupation of Palestine.” But after Oct. 7, some attendees are more hesitant to speak out about their activism. Times reporters attended one of their sessions.","{'main': 'Promoting Peace as War Rages: Israeli and Palestinian Activists Meet', 'kicker': None, 'content_kicker': None, 'print_headline': '', 'name': None, 'seo': None, 'sub': None}","['Palestinians', 'Israel-Gaza War (2023- )', 'Demonstrations, Protests and Riots', 'Defense and Military Forces', 'Peace Process']",2024-02-10T09:55:00+0000,multimedia,World
"In her new novel, “Leaving,” Roxana Robinson reunites a former couple. One of them is divorced; the other is still married. What now?","Every love story needs an obstacle, someone or something that threatens to keep the lovers apart. What obstacles are suitable for a contemporary American love story? The writer of such a story may wish to avoid the over-communication, the tolerance (real or performed) and the jadedness that dispel romantic tension. Can lovers still be “star-crossed,” doomed from the start to labor under a “malign star”?","{'main': 'A Tale of Midlife Love With a Bombshell Ending', 'kicker': 'Fiction', 'content_kicker': None, 'print_headline': 'Unfinished Business', 'name': None, 'seo': None, 'sub': None}","['Books and Literature', 'Leaving: A Novel (Book)', 'Robinson, Roxana']",2024-02-10T10:00:09+0000,article,Books
"On the 25th anniversary of the director’s death, two film scholars have published “Kubrick: An Odyssey.”","The passions, obsessions, habits, talents and fears that shaped the extraordinary movies of Stanley Kubrick were well chewed over in his lifetime. Some of the reporting came from those who knew him; other impressions came from journalists who didn’t know him, but enjoyed the digging. It was easy quarrying, because there was so much rich topsoil. A son of the Bronx who became the self-styled squire of Childwickbury Manor in Hertfordshire, England, Kubrick was a visionary filmmaker whose greatest works — including “Paths of Glory” and “Dr. Strangelove,” “Lolita” and “2001: A Space Odyssey,” “The Shining” and “A Clockwork Orange” — are as vital and prescient about culture and society today as they were when they blazed through the second half of the 20th century.","{'main': 'A New Biography Tackles the Remarkable Career of Stanley Kubrick', 'kicker': 'Nonfiction', 'content_kicker': None, 'print_headline': 'Paths of Glory', 'name': None, 'seo': None, 'sub': None}","['Kubrick, Stanley', 'Content Type: Personal Profile', 'Books and Literature', 'Kubrick: An Odyssey (Book)', 'Kolker, Robert', 'Abrams, Nathan (Author)', 'Movies', '2001: A SPACE ODYSSEY (MOVIE)', 'Dr Strangelove: Or How I Learned to Stop Worrying and Love the Bomb (Movie)', 'Lolita (Movie)', 'Eyes Wide Shut (Movie)', 'Paths of Glory (Movie)', 'A Clockwork Orange (Movie)', 'The Shining (Movie)']",2024-02-10T10:01:08+0000,article,Books
A pile of film negatives started a collector on an obsession to collect old photos that offer a history of  Rio de Janeiro and the event that has made it world famous — carnival.,A pile of film negatives started a collector on an obsession to collect old photos that offer a history of  Rio de Janeiro and the event that has made it world famous — carnival.,"{'main': 'Lost Images Reveal the History of Rio’s Carnival', 'kicker': None, 'content_kicker': None, 'print_headline': '', 'name': None, 'seo': None, 'sub': None}","['Carnival (Pre-Lenten)', 'Parades', 'Rio de Janeiro (Brazil)', 'Dancing', 'Photography', 'vis-photo', 'vis-design']",2024-02-10T10:01:29+0000,multimedia,World
Thoughts on the coolest boy in Ontario.,"Our elementary school was set deep in the rural Ontario countryside, nestled in the forest beside the local dump. In the late 1990s, when I was in sixth grade, the school had a drug bust in which more than 20 kids were suspended and charged with possession of marijuana, magic mushrooms and ecstasy. I was not one of those kids.","{'main': 'My First Cigarette Was My Last', 'kicker': 'episode', 'content_kicker': None, 'print_headline': 'Smoke Fades, but a Nudge Endures', 'name': None, 'seo': None, 'sub': None}","['Teenagers and Adolescence', 'Smoking and Tobacco', 'Content Type: Personal Profile']",2024-02-10T10:01:37+0000,article,Style
Thompson’s 1971 book “Fear and Loathing in Las Vegas” and a later article on the Super Bowl glimpsed much of what has become of these exemplars of American excess.,"“When you bring an act into this town, you want to bring it in heavy. Don’t waste any time with cheap shucks and misdemeanors. Go straight for the jugular. Get right into felonies.”","{'main': 'The Super Bowl in Las Vegas: What Would Hunter S. Thompson Think?', 'kicker': None, 'content_kicker': None, 'print_headline': 'Seeking ‘Loathing’ Of Gonzo Author  In Modern Vegas', 'name': None, 'seo': None, 'sub': None}","['Las Vegas (Nev)', 'Football', 'Super Bowl', 'National Football League', 'Kansas City Chiefs', 'San Francisco 49ers', 'Thompson, Hunter S', 'Writing and Writers', 'Gambling', 'vis-photo']",2024-02-10T10:01:37+0000,article,U.S.
It’s possible that the listed limits in a building’s offering plans are lower than what city code allows. Here’s how to find out.,"Q: We have two rooftop lounges on top of our Hell’s Kitchen condominium building, where I serve on the board. Residents use them and sometimes rent them for private events. There are maximum capacities for the lounges listed in the building’s offering plans, but they seem too low — the spaces have double doors and double exits for easy evacuation in case of emergency. We were never told to post capacity limits for the residents, as public places are. How do we find out how many people can legally be in these lounges at the same time?","{'main': 'Our Condo Building Has a Huge Roof. Why Aren’t More People Allowed on It?', 'kicker': 'Ask Real Estate', 'content_kicker': None, 'print_headline': 'Our Condo Building Has a Huge Roof.  Why Aren’t More People Allowed on It?', 'name': None, 'seo': None, 'sub': None}","['Real Estate and Housing (Residential)', 'Roofs', 'Condominiums', 'Accidents and Safety']",2024-02-10T10:01:45+0000,article,Real Estate
"Positions have hardened on both sides in the face of the Gaza war, but some activists refuse to give up hope. They let us sit in on one of their meetings.","On a sunny January day, dozens of Israelis and Palestinians crowded into a small house in a town outside Bethlehem, as their compatriots fought in the Gaza Strip, to talk about a subject that has become nearly taboo in their cities and towns:","{'main': 'These Israelis and Palestinians Are Still Working for Peace. Just Quietly.', 'kicker': None, 'content_kicker': None, 'print_headline': '', 'name': None, 'seo': None, 'sub': None}","['Israel-Gaza War (2023- )', 'Israel', 'Defense and Military Forces', 'Gaza Strip', 'West Bank', 'Palestinians', 'Conscientious Objectors', 'Combatants for Peace', 'Peace Process', 'Hamas', 'Terrorism']",2024-02-10T10:01:49+0000,article,World
