abstract,lead_paragraph,headline,keywords,pub_date,document_type,section_name
Dan Osborn led a strike in 2021 against the Kellogg’s plant in Omaha. Now he is challenging Senator Deb Fischer as an independent in deep-red Nebraska.,"In 2021, as the first Halloween decorations were coming out in Omaha, Neb., a mechanic named Dan Osborn led 500 of his fellow union members  out of the Kellogg’s cereal plant on F Street and onto the picket lines.","{'main': 'A Union Leader in Nebraska Tries to Leap to the Senate on Labor’s Strength', 'kicker': None, 'content_kicker': None, 'print_headline': 'In Nebraska, Putting Labor’s Muscle to the Test', 'name': None, 'seo': None, 'sub': None}","['Elections, Senate', 'United States Politics and Government', 'Organized Labor', 'Strikes', 'Fischer, Deb', 'Republican Party', 'Kellogg Company', 'Nebraska', 'Omaha (Neb)', 'Third-Party Politics (US)', 'Content Type: Personal Profile', 'Osborn, Dan (1975- )']",2024-02-18T10:04:21+0000,article,U.S.
"An exhibition in the Israeli-occupied West Bank features works evoking Palestinian life and protest. But the show is as much about the art that cannot be displayed, lost forever in the war.",The incessant buzzing of an Israeli drone fills the room.,"{'main': 'Against a Canvas of Despair, Gaza’s Artists Trace Their Struggle', 'kicker': None, 'content_kicker': None, 'print_headline': 'At Gaza Artists’ Exhibit,  Despair and Loss Hang On Walls, and in the Air', 'name': None, 'seo': None, 'sub': None}","['Israel-Gaza War (2023- )', 'Palestinians', 'Culture (Arts)', 'Art', 'Museums', 'Palestinian Museum', 'West Bank', 'Gaza Strip', 'Israel']",2024-02-18T10:04:33+0000,article,World
Books — often riddled with gross grammatical and factual errors — are appearing for sale online soon after the death of well-known people.,"After Joseph Lelyveld, a former executive editor of The New York Times, died last month, his brother Michael Lelyveld went online to see how he was being remembered. He found obituaries in major news outlets, as expected. But he also found other, unexpected portraits of his brother.","{'main': 'A Celebrity Dies, and New Biographies Pop Up Overnight. The Author? A.I.', 'kicker': None, 'content_kicker': None, 'print_headline': 'A.I. Specialty:  Super-Fast (But Lousy)  Biographies', 'name': None, 'seo': None, 'sub': None}","['Book Trade and Publishing', 'Books and Literature', 'Artificial Intelligence', 'Deaths (Fatalities)', 'Amazon.com Inc']",2024-02-18T10:04:41+0000,article,Books
"A society in which members of different generations do not interact “is a dangerous experiment,” said one researcher.","On Fridays at 10 a.m., Richard Bement and Zach Ahmed sign on to their weekly video chat. The program that brought them together provides online discussion prompts and suggests arts-related activities, but the two largely ignore all that.","{'main': 'Old and Young, Talking Again', 'kicker': 'the new old age', 'content_kicker': None, 'print_headline': 'The Upside of Leaning In to the Generation Gap', 'name': None, 'seo': None, 'sub': None}","['Elderly', 'Youth', 'Age, Chronological', 'Education', 'Research', 'Discrimination', 'Mental Health and Disorders', 'United States']",2024-02-18T10:04:50+0000,article,Health
"The former South Carolina governor is expected to lose big in her home state. Beyond that, it’s an even steeper climb.","One week before the Republican presidential primary in South Carolina, where polls suggest she trails by an insurmountable margin, Nikki Haley was in Texas, promising to go national, as most primary candidates, even in the most dire circumstances, usually do.","{'main': 'Haley Says She Is Going the Distance Against Trump. Here’s Her Plan.', 'kicker': None, 'content_kicker': None, 'print_headline': 'Despite Odds, Haley Vows She Is Going the Distance Against Trump', 'name': None, 'seo': None, 'sub': None}","['Presidential Election of 2024', 'United States Politics and Government', 'Primaries and Caucuses', 'Haley, Nikki R', 'Trump, Donald J', 'Republican Party', 'South Carolina']",2024-02-18T10:04:59+0000,article,U.S.
"The entrepreneur wants to help build the new space economy, one Prada spacesuit and Jeff Koons-filled lunar lander at a time.","Much of the American space program is run out of nondescript offices in the Washington, D.C., suburbs. That’s where Kam Ghaffarian, the billionaire space entrepreneur, could be found on an auspicious day. Exactly 47 years before, he had immigrated to the United States from Iran. Mr. Ghaffarian, 66, sat at a table made of gently glowing white onyx, also from Iran.","{'main': 'Kam Ghaffarian’s Moonshots', 'kicker': None, 'content_kicker': None, 'print_headline': 'Envisioning a Market That’s Out of This World', 'name': None, 'seo': None, 'sub': None}","['Ghaffarian, Kam', 'Content Type: Personal Profile', 'Moon', 'Private Spaceflight', 'Axiom Space Inc', 'Intuitive Machines LLC', 'National Aeronautics and Space Administration', 'Space Exploration Technologies Corp', 'Entrepreneurship', 'High Net Worth Individuals']",2024-02-18T10:06:13+0000,article,Business Day
"When Donald J. Trump became president, condominiums in buildings emblazoned with his name began selling for less, according to an analysis.","In the world of real estate, Donald J. Trump’s name has long been synonymous with luxury. At one of his buildings in Manhattan, a five-story waterfall slides down a wall of Breccia Perniche marble. White-gloved doormen, cascading chandeliers and panoramic views of the city’s skyline are the hallmarks of another.","{'main': 'In New York, the Trump Brand Is Costing Some Condo Owners', 'kicker': None, 'content_kicker': None, 'print_headline': 'In Real Estate, A Certain Name Is Losing Luster', 'name': None, 'seo': None, 'sub': None}","['Real Estate and Housing (Residential)', 'Condominiums', 'Prices (Fares, Fees and Rates)', 'Trademarks and Trade Names', 'United States Politics and Government', 'Trump, Donald J', 'Trump Organization', 'Trump Tower (Manhattan, NY)', 'CityRealty.com', 'Manhattan (NYC)']",2024-02-18T10:06:28+0000,article,Real Estate
"Nicole McClure said she spent hours in a jail cell, enduring taunts, until a delayed medical check revealed that she had a life-threatening problem with her brain.","Driving home from work on the day her life changed forever, Nicole McClure could feel her feet tingling and her sense of direction faltering. Then she noticed colorful lights illuminating the early morning landscape.","{'main': 'Officers Charged Her With Drunken Driving. But Her Brain Was Bleeding.', 'kicker': None, 'content_kicker': None, 'print_headline': 'Officers Mistook Driver  Suffering Brain Bleed As Drunk and Defiant', 'name': None, 'seo': None, 'sub': None}","['Drunken and Reckless Driving', 'Hemorrhagic Stroke', 'Tests (Sobriety)', 'Olympia (Wash)', 'Washington (State)', 'Police Brutality, Misconduct and Shootings']",2024-02-18T10:06:30+0000,article,U.S.
"Toward the end of Russia’s long assault, hundreds of civilians still remained in Avdiivka. Those who escaped in the last weeks spoke of relentless devastation.","Even from a few miles away, the death rattle of another Ukrainian city echoed through the mist and fog. Russian warplanes were dropping more thousand-pound bombs on Avdiivka in eastern Ukraine, reducing an already battered city to rubble and ashes.","{'main': 'The Death Throes of a Ukrainian City', 'kicker': None, 'content_kicker': None, 'print_headline': 'Scenes of ‘Armageddon’ As a Ukrainian City Falls', 'name': None, 'seo': None, 'sub': None}","['Russian Invasion of Ukraine (2022)', 'Avdiivka (Ukraine)', 'Russia', 'Ukraine', 'Defense and Military Forces']",2024-02-18T10:18:04+0000,article,World
"Officials have found the toxic mineral at 34 sites, including schools and parks. The grounds outside a Taylor Swift concert venue tested negative.","Officials in Sydney, Australia, said on Sunday that they had found traces of asbestos at 34 public sites across the city in recent weeks, and that a venue for an upcoming Taylor Swift concert was declared free of the toxic mineral.","{'main': 'Asbestos Contamination Multiplies at Public Sites in Sydney', 'kicker': None, 'content_kicker': None, 'print_headline': 'Traces of Asbestos Contamination Are Detected at 34 Public Sites Across Sydney', 'name': None, 'seo': None, 'sub': None}","['Hazardous and Toxic Substances', 'Asbestos', 'Mulch', 'Recycling of Waste Materials', 'Swift, Taylor', 'Sydney (Australia)', 'New South Wales (Australia)']",2024-02-18T10:29:09+0000,article,World
The surprising confession appeared to lend weight to accusations by Imran Khan’s party that the military had tampered with the vote count in dozens of races.,"A senior Pakistani official confessed on Saturday to helping manipulate results in the country’s elections — a startling claim strengthening a sense that the vote was among the least credible in Pakistan’s history, and deepening the turmoil that has seized the country ever since people went to the polls this month.","{'main': 'Senior Pakistani Official Admits to Helping Rig the Vote', 'kicker': None, 'content_kicker': None, 'print_headline': 'Senior Pakistani Official Admits to Vote Rigging', 'name': None, 'seo': None, 'sub': None}","['Elections', 'Voter Fraud (Election Fraud)', 'Defense and Military Forces', 'Pakistan Tehreek-e-Insaf', 'Pakistan Muslim League-N', 'Khan, Imran', 'Pakistan']",2024-02-18T11:59:52+0000,article,World
When is decolonization helpful? And when does it set us back?,"Amid the graphic images, fierce polemics and endless media criticism that have dominated my social media feeds since the war in Gaza began late last year, I noticed a seemingly bizarre subplot emerge: skin cancer in Israel.","{'main': 'Restoring the Past Won’t Liberate Palestine', 'kicker': 'Lydia Polgreen', 'content_kicker': None, 'print_headline': '', 'name': None, 'seo': None, 'sub': None}","['Israel-Gaza War (2023- )', 'Colonization', 'Jews and Judaism', 'Palestinians', 'Indigenous People', 'Politics and Government', 'Books and Literature', 'Israel', 'Gaza Strip', 'Fanon, Frantz', 'Said, Edward W', 'Taiwo, Olufemi O']",2024-02-18T12:24:54+0000,article,Opinion
"Biometric tech, like facial recognition, is becoming more common at airports.","Biometrics are transforming the way we travel. The technology, which identifies travelers using unique physical traits like fingerprints and faces, is becoming more common at airports in the United States. As a result, time-consuming rituals that once required repeated ID checks — such as bag dropping, security screening and boarding — are getting easier and faster. ","{'main': 'Flying into the Future', 'kicker': None, 'content_kicker': None, 'print_headline': '', 'name': None, 'seo': None, 'sub': None}","['internal-storyline-no', 'Facial Recognition Software', 'Identification Devices', 'Airport Security', 'Biometrics', 'American Civil Liberties Union']",2024-02-18T12:26:47+0000,article,Briefing
I ask my writing students to stand in another person’s shoes. They’re finding it harder and harder to do.,“Write down a phrase you find abhorrent — something you yourself would never say.”,"{'main': 'The Most Important Writing Exercise I’ve Ever Assigned', 'kicker': 'Guest Essay', 'content_kicker': None, 'print_headline': 'The Most Important Writing Exercise I’ve Ever Assigned', 'name': None, 'seo': None, 'sub': None}","['Empathy', 'Writing and Writers']",2024-02-18T14:00:02+0000,article,Opinion
"When it comes to the monarch’s health, even a little bit of transparency is a revelation.",The most surprising thing about the disclosure that King Charles III has been diagnosed with cancer after less than two years on the throne is the fact that it’s been disclosed at all.,"{'main': 'King Charles Has Done What Monarchs Before Him Would Not Dare', 'kicker': 'Guest Essay', 'content_kicker': None, 'print_headline': 'King Charles Has Rewritten the Royal Script', 'name': None, 'seo': None, 'sub': None}","['Royal Families', 'Genetics and Heredity', 'Cancer', 'Politics and Government', 'Charles III, King of the United Kingdom', 'Elizabeth II, Queen of Great Britain', 'Charlotte, Princess of Cambridge', 'George III, King of England (1738-1820)', 'George V, King of Great Britain', 'George VI, King of Great Britain', 'Nicholas II, Czar of Russia', 'Nicholas, George III', 'Richard III, King of England', 'Victoria, Queen of Great Britain', 'Great Britain']",2024-02-18T14:00:11+0000,article,Opinion
He was proud of the work he did because it allowed him to build a family and a life in this country.,"When I was in the fifth grade, my grandpa took me to my school’s dumpster. “You know the Coca-Cola and water bottles that people throw out?” he asked me in Mandarin. I nodded, spotting two empty Poland Spring bottles lying on top of a nearby garbage pile. He swiftly plucked them out and stowed them away in a plastic bag. “That’s 10 cents. Your turn,” he said, smiling as I ran to another trash can. Seconds later, I emerged victorious, holding a Pepsi can over my head as if it were a trophy.","{'main': 'My Grandpa Redeemed Cans for Money. He Deserved a Raise.', 'kicker': 'Guest Essay', 'content_kicker': None, 'print_headline': 'Recycling Cans Changed My Grandpa’s Life', 'name': None, 'seo': None, 'sub': None}","['Recycling of Waste Materials', 'Plastic Bottles', 'Glass', 'Aluminum', 'Law and Legislation', 'Income', 'Immigration and Emigration', 'New York City', 'New York State']",2024-02-18T14:00:11+0000,article,Opinion
"After four long years, there’s reason to hope that the condition will get the attention that it and the many who suffer from it deserve.","Senator Roger Marshall’s voice was shaking with emotion as he made the case for speedy and focused research into long Covid. Marshall, the junior senator from Kansas, is a Republican and a medical doctor. But addressing the first-ever Senate hearing on long Covid last month, he wanted the audience to know that his interest wasn’t just professional and it definitely wasn’t just political. It was also personal.","{'main': 'Could Long Covid Be the Senate’s Bipartisan Cause?', 'kicker': 'Zeynep Tufekci', 'content_kicker': None, 'print_headline': 'Could Long Covid Be the Senate’s Bipartisan Cause?', 'name': None, 'seo': None, 'sub': None}","['Long Covid', 'United States Politics and Government', 'Clinical Trials', 'Research', 'Senate', 'National Institutes of Health']",2024-02-18T14:00:21+0000,article,Opinion
Nowhere is this more true than in red states.,"Amid the constant drumbeat of sensational news stories — the scandals, the legal rulings, the wild political gambits — it’s sometimes easy to overlook the deeper trends that are shaping American life. For example, are you aware how much the constant threat of violence, principally from MAGA sources, is now warping American politics? If you wonder why so few people in red America seem to stand up directly against the MAGA movement, are you aware of the price they might pay if they did?","{'main': 'MAGA’s Violent Threats Are Warping Life in America', 'kicker': 'David French', 'content_kicker': None, 'print_headline': 'MAGA’s Violent Threats Are Warping Life in America', 'name': None, 'seo': None, 'sub': None}","['Right-Wing Extremism and Alt-Right', 'Threats and Threatening Messages', 'Cyberharassment', 'United States Politics and Government', 'Trump, Donald J']",2024-02-18T14:00:22+0000,article,Opinion
"Millions of people in California were under a flood watch as an atmospheric river was expected to engulf much of the state in heavy rains on Sunday, forecasters said.","The West Coast braced for more flooding as heavy rains from an atmospheric river were forecast to spread over California starting on Sunday, in the latest series of storms to pound the state this month.","{'main': 'California Braces for Atmospheric River That Could Bring More Floods', 'kicker': None, 'content_kicker': None, 'print_headline': '', 'name': None, 'seo': None, 'sub': None}","['Rain', 'Floods', 'Coastal Areas', 'California', 'Wind']",2024-02-18T14:25:28+0000,article,U.S.
"He became wealthy working as a hairdresser in New York, then used his funds to free enslaved people, build churches and house orphans of color.","This article is part of Overlooked, a series of obituaries about remarkable people whose deaths, beginning in 1851, went unreported in The Times.","{'main': 'Overlooked No More: Pierre Toussaint, Philanthropist and Candidate for Sainthood', 'kicker': None, 'content_kicker': None, 'print_headline': 'Pierre Toussaint', 'name': None, 'seo': None, 'sub': None}","['Biographical Information', 'Black People', 'Blacks', 'Philanthropy', 'Slavery (Historical)', 'Roman Catholic Church', 'Toussaint, Pierre (1766-1853)', 'Haiti', 'Manhattan (NYC)']",2024-02-18T14:27:04+0000,article,Obituaries
The death of Aleksei A. Navalny in a Russian prison has been a blow to an opposition movement in which he was the figurehead. But it has also raised hopes of a united front against President Vladimir V. Putin.,"The death of Aleksei A. Navalny, Russia’s main opposition leader, has stunned Russian dissidents. But it is also spurring some hope that in its desperate moment, the opposition to President Vladimir V. Putin will be able to unite like never before.","{'main': 'A Stunned Russian Opposition in Exile Considers a Future Without Navalny', 'kicker': None, 'content_kicker': None, 'print_headline': 'Movement in Opposition To Putin Weighs a Future Without Navalny’s Clout', 'name': None, 'seo': None, 'sub': None}","['Politics and Government', 'International Relations', 'Assassinations and Attempted Assassinations', 'Political Prisoners', 'Russian Invasion of Ukraine (2022)', 'Navalny, Aleksei A', 'Putin, Vladimir V', 'Russia']",2024-02-18T14:53:41+0000,article,World
"Corrections that appeared in print on Sunday, Feb. 18, 2024.",An article last Sunday about photographs taken by Paul McCartney misidentified the member of the British royal family who met with the Beatles in 1963. The Beatles met the Queen Mother (and Princess Margaret) that year; they met Queen Elizabeth II in 1965.,"{'main': 'Corrections: Feb. 18, 2024', 'kicker': None, 'content_kicker': None, 'print_headline': 'Corrections', 'name': None, 'seo': None, 'sub': None}",[],2024-02-18T15:00:48+0000,article,Corrections
The largely symbolic move followed proposals by international allies that were discussed during recent cease-fire negotiations in Cairo.,"The Israeli government on Sunday approved a resolution rejecting any international attempts to impose a Palestinian state on Israel, saying that Israel would have to directly negotiate any “permanent"" arrangement with the Palestinians.","{'main': 'Israel’s government formally rejects the unilateral recognition of a Palestinian state.', 'kicker': None, 'content_kicker': None, 'print_headline': '', 'name': None, 'seo': None, 'sub': None}","['Israel-Gaza War (2023- )', 'Netanyahu, Benjamin', 'Palestinians', 'Cameron, David', 'Hamas', 'ABDULLAH II, KING OF JORDAN', 'Gantz, Benny']",2024-02-18T15:15:28+0000,article,World
"David Tanis’s five-star recipe adds layers of flavor — via sage, garlic, prosciutto and fontina — to pounded, marinated chicken breasts.","Good morning. Saltimbocca — the name translates from the Italian as “jump in the mouth” — is a dish traditionally made with veal cutlets wrapped with prosciutto and sage, quickly cooked in butter and oil, and occasionally topped with cheese for a run beneath the broiler.","{'main': 'Sprightly, Speedy Chicken Saltimbocca', 'kicker': None, 'content_kicker': None, 'print_headline': '', 'name': None, 'seo': None, 'sub': None}","['Cooking and Cookbooks', 'Content Type: Service']",2024-02-18T16:00:02+0000,article,Food
"After the capture of Avdiivka, Ukrainian forces will need a new defensive line in unforgiving terrain, while Russia tries to press its advantage.","With the Russian military’s capture of the eastern Ukrainian city of Avdiivka on Saturday, the front line has shifted substantially, setting the stage for the war’s next grueling chapter as Ukrainian forces retrench and Russian troops reform for future assaults.","{'main': 'City’s Fall Leaves Ukraine With an Even Tougher Fight Ahead', 'kicker': None, 'content_kicker': None, 'print_headline': 'City’s Capture Leaves Ukraine With an Even Tougher Fight Ahead', 'name': None, 'seo': None, 'sub': None}","['Defense and Military Forces', 'International Relations', 'Russian Invasion of Ukraine (2022)', 'Foreign Aid', 'Avdiivka (Ukraine)', 'Ukraine', 'Russia', 'Donbas (Ukraine)']",2024-02-18T16:24:50+0000,article,World
"In just the past year, Mr. Trump has promoted trading cards, his mug shot, scraps of his clothes and firearms bearing his name and likeness.","Former President Donald J. Trump, reeling from a ruling in a New York civil fraud case on Friday that ordered him to pay about $450 million, appeared at a footwear convention in Philadelphia the next day to promote Trump-branded sneakers, retailing for just under $400.","{'main': 'Reeling From $450 Million Penalty, Trump Hawks $400 Shoes', 'kicker': None, 'content_kicker': None, 'print_headline': '', 'name': None, 'seo': None, 'sub': None}","['Trump, Donald J', 'Sneakers', 'Presidential Election of 2024']",2024-02-18T16:33:01+0000,article,U.S.
"Officials said that the shooting happened while emergency responders were at a call involving a man barricaded with his family, including seven children, in the city of Burnsville, near Minneapolis.","A man barricaded in his home outside of Minneapolis with seven children and other family members opened fire early on Sunday during attempted negotiations with law enforcement officials, killing two police officers and a paramedic, the authorities said.","{'main': 'Two Police Officers and One Paramedic Killed in Minnesota Shooting, Officials Say', 'kicker': None, 'content_kicker': None, 'print_headline': '2 Officers and Paramedic Are Killed in a Shooting', 'name': None, 'seo': None, 'sub': None}","['Murders, Attempted Murders and Homicides', 'Attacks on Police', 'Burnsville (Minn)']",2024-02-18T16:48:06+0000,article,U.S.
"See what stars including Emma Stone, Margot Robbie, Ayo Edebiri, Colman Domingo and Dua Lipa wore to British filmmaking’s biggest night.","Stars of the past year’s biggest movies descended on the Royal Festival Hall in London for the BAFTA Film Awards on Sunday. The ceremony, which was hosted this year by the actor David Tennant, honors achievement in British filmmaking, but American celebrities were well represented on the (actually) red carpet.","{'main': '2024 BAFTA Film Awards: Looks From the Red Carpet', 'kicker': None, 'content_kicker': None, 'print_headline': '', 'name': None, 'seo': None, 'sub': None}","['British Academy of Film and Television', 'Awards, Decorations and Honors', 'Actors and Actresses', 'Movies', 'Fashion and Apparel']",2024-02-18T17:18:38+0000,article,Style
Vice President Kamala Harris tried to reassure European and Ukrainian leaders that America would come through with security aid. But worries persist as House Republican leaders block the measure.,"When Vice President Kamala Harris flew to Germany for the Munich Security Conference last year, she made an unequivocal promise. “The United States,” she said, “will continue to support Ukraine, and we will do so for as long as it takes.”","{'main': 'For Harris, Promises to Ukraine Prove Harder to Make Amid G.O.P. Resistance', 'kicker': 'White House Memo', 'content_kicker': None, 'print_headline': 'Promises to Kyiv Prove Harder to Keep Amid G.O.P. Resistance', 'name': None, 'seo': None, 'sub': None}","['United States Politics and Government', 'International Relations', 'United States International Relations', 'Russian Invasion of Ukraine (2022)', 'North Atlantic Treaty Organization', 'Republican Party', 'House of Representatives', 'Biden, Joseph R Jr', 'Harris, Kamala D', 'Johnson, Mike (1972- )', 'Navalny, Aleksei A', 'Putin, Vladimir V', 'Trump, Donald J', 'Zelensky, Volodymyr', 'Ukraine', 'Russia']",2024-02-18T17:21:37+0000,article,U.S.
"Demonstrators expressed their anger toward Benjamin Netanyahu and his government and called for immediate elections, in one of the country’s largest protests since the start of the Israel-Hamas war.","Demonstrators expressed their anger toward Benjamin Netanyahu and his government and called for immediate elections, in one of the country’s largest protests since the start of the Israel-Hamas war.","{'main': 'Thousands Rally in Tel Aviv Against the Israeli Government', 'kicker': None, 'content_kicker': None, 'print_headline': '', 'name': None, 'seo': None, 'sub': None}","['Netanyahu, Benjamin', 'Demonstrations, Protests and Riots', 'Israel-Gaza War (2023- )', 'Israel', 'Tel Aviv (Israel)', 'Gaza Strip', 'Politics and Government']",2024-02-18T17:47:11+0000,multimedia,World
"He popularized the term “institutional racism"" and, with Stokely Carmichael, wrote a book in 1967 that was seen as a radical manifesto.","Charles V. Hamilton, a philosophical godfather of the Black Power movement, which he envisioned as the means to subvert what he stigmatized as America’s “institutional racism,” died on Nov. 18 in Chicago, it was recently confirmed. He was 94.","{'main': 'Charles V. Hamilton, an Apostle of ‘Black Power,’ Dies at 94', 'kicker': None, 'content_kicker': None, 'print_headline': 'Charles V. Hamilton, 94, Apostle of the Black Power Movement, Dies', 'name': None, 'seo': None, 'sub': None}","['Deaths (Obituaries)', 'Black People', 'Blacks', 'Discrimination', 'Civil Rights Movement (1954-68)', 'Books and Literature', 'Colleges and Universities', 'Hamilton, Charles V', 'Carmichael, Stokely', 'Powell, Adam Clayton Jr', 'Columbia University']",2024-02-18T17:50:16+0000,article,U.S.
