abstract,lead_paragraph,headline,keywords,pub_date,document_type,section_name
"His death united world leaders and demonstrators in grief, but it also left Russia without a charismatic counterweight to its leader’s increasingly repressive policies.","In Munich, world leaders were left hushed and hollow-eyed, their annual security conference suddenly transformed into a wake. In London, demonstrators projected a giant image of Aleksei A. Navalny on to the facade of the Russian embassy. In Washington, an angry President Biden called a news conference to declare, “Make no mistake: Putin is responsible for Navalny’s death.”","{'main': 'Navalny’s Death Shocked the World, but Will It Galvanize Opposition to Putin?', 'kicker': None, 'content_kicker': None, 'print_headline': 'Navalny’s Death Could Be Galvanizing Moment', 'name': None, 'seo': None, 'sub': None}","['Political Prisoners', 'European Union', 'Republican Party', 'Navalnaya, Yulia B', 'Navalny, Aleksei A', 'Russia', 'Putin, Vladimir V']",2024-02-18T17:58:30+0000,article,World
"There is a dawning recognition that the continent urgently needs to step up its own defense, especially as the U.S. wavers, but the commitments still are not coming.","As the leaders of the West gathered in Munich over the past three days, President Vladimir V. Putin had a message for them: Nothing they’ve done so far — sanctions, condemnation, attempted containment — would alter his intentions to disrupt the current world order.","{'main': 'As Putin Threatens, Despair and Hedging in Europe', 'kicker': None, 'content_kicker': None, 'print_headline': 'Gravity of Putin Threats Is Dawning on Europe', 'name': None, 'seo': None, 'sub': None}","['International Relations', 'Politics and Government', 'Defense and Military Forces', 'Presidential Election of 2024', 'United States International Relations', 'Russian Invasion of Ukraine (2022)', 'Foreign Aid', 'Elections', 'Nuclear Weapons', 'European Union', 'North Atlantic Treaty Organization', 'Harris, Kamala D', 'Kuleba, Dmytro', 'Navalny, Aleksei A', 'Pistorius, Boris', 'Putin, Vladimir V', 'Scholz, Olaf (1958- )', 'Stoltenberg, Jens', 'Trump, Donald J', 'Zelensky, Volodymyr', 'Europe', 'Munich (Germany)', 'Ukraine']",2024-02-18T17:59:29+0000,article,World
"Seismic world events in Ukraine and the Middle East draw Zoya Cherkassky’s highly personal responses. “There was nothing to be ironic about,” she said.","It was just 10 days after the Oct. 7 attack in Israel when the artist Zoya Cherkassky posted a drawing on her Instagram account. The drawing, “7 Oct. 2023,” depicts three generations of a family seemingly in hiding, the mother covering her baby’s mouth to keep it quiet; all stare desperately at the viewer, their horror unmasked. Above them a solitary lightbulb emits jagged illumination — a direct quotation from Picasso’s “Guernica,” the totemic Modernist depiction of war’s horrors.","{'main': 'The Artist Whose Oct. 7 Series ‘Attracts Fire’', 'kicker': None, 'content_kicker': None, 'print_headline': 'Compassion Not Just For Israelis', 'name': None, 'seo': None, 'sub': None}","['Israel-Gaza War (2023- )', 'Art', 'Jews and Judaism', 'Museums', 'Russian Invasion of Ukraine (2022)', 'Jewish Museum (Manhattan, NY)', 'Gaza Strip', 'Israel', 'Kyiv (Ukraine)']",2024-02-18T18:43:43+0000,article,Arts
“One Love” landed in what has become a box office sweet spot — stories that feel both nostalgic and new — while the Spider-Man spinoff is another sign that the comics-character boom is over.,"The sleepy United States box office finally lifted its eyelids over the holiday weekend. “Bob Marley: One Love,” a feel-good musical biopic, was on track to take in $33.2 million from Friday through Monday, for a strong total of roughly $51 million since opening on Valentine’s Day, according to Paramount Pictures.","{'main': 'Bob Marley Film Has a Strong Start, but ‘Madame Web’ Unravels', 'kicker': None, 'content_kicker': None, 'print_headline': 'Marley Film Starts Strong, but Not ‘Madame Web’', 'name': None, 'seo': None, 'sub': None}","['Box Office Sales', 'Comic Books and Strips', 'Movies', 'Spider-Man (Fictional Character)', 'Paramount Pictures', 'Sony Corporation', 'Ben-Adir, Kingsley', 'Johnson, Dakota', 'Marley, Bob']",2024-02-18T18:45:48+0000,article,Business Day
"His New York Times scoop enraged the Nixon White House, which ordered a tap on his phone. He later won a Pulitzer Prize for The Boston Globe.","William Beecher, who as a reporter for The New York Times revealed President Richard M. Nixon’s secret bombing campaign over Cambodia during the Vietnam War, and who later won a Pulitzer Prize at The Boston Globe, died on Feb. 9 at his home in Wilmington, N.C. He was 90.","{'main': 'William Beecher, Who Revealed Secret Cambodia Bombing, Dies at 90', 'kicker': None, 'content_kicker': None, 'print_headline': 'William Beecher, 90, Who Revealed Cambodia Bombing', 'name': None, 'seo': None, 'sub': None}","['Beecher, William (1933-2024)', 'Deaths (Obituaries)', 'News and News Media', 'Vietnam War', 'Pulitzer Prizes', 'New York Times', 'Boston Globe', 'Wall Street Journal', 'Cambodia', 'Nixon, Richard Milhous']",2024-02-18T19:28:15+0000,article,Business Day
"Fearful of antagonizing the former president, congressional Republicans downplayed the remarks, instead lauding the former president’s record and criticizing President Biden.","Senator Tim Scott, Republican of South Carolina, said on Sunday that President Vladimir V. Putin of Russia was a “murderous dictator” responsible for the death of the opposition leader Aleksei A. Navalny, and that “we need strong leadership coming from America that actually pushes back against Russia and other dictators.”","{'main': 'Republicans Push Hard Line on Russia While Defending Trump’s NATO Comments', 'kicker': None, 'content_kicker': None, 'print_headline': 'Republicans  Attack Putin  While They Back Trump', 'name': None, 'seo': None, 'sub': None}","['United States Politics and Government', 'Presidential Election of 2024', 'Russian Invasion of Ukraine (2022)', 'Foreign Aid', 'House of Representatives', 'North Atlantic Treaty Organization', 'Republican Party', 'Senate', 'Cheney, Liz', 'Graham, Lindsey', 'Johnson, Mike (1972- )', 'Navalny, Aleksei A', 'Putin, Vladimir V', 'Scott, Timothy Eugene', 'Trump, Donald J', 'Turner, Michael R']",2024-02-18T19:39:43+0000,article,U.S.
"Vyacheslav Igorevich Penchukov, 37, of Ukraine, pleaded guilty in federal court for his role in two separate malware schemes that caused tens of millions of dollars in losses.","A Ukrainian man pleaded guilty in federal court on Thursday to his leadership role in two cyberattack schemes that caused tens of millions of dollars in losses and temporarily crippled a Vermont hospital in 2020, according to the Justice Department.","{'main': '‘Most Wanted’ Man Pleads Guilty in Cyberattack That Upended Vermont Hospital', 'kicker': None, 'content_kicker': None, 'print_headline': '', 'name': None, 'seo': None, 'sub': None}","['Cyberattacks and Hackers', 'Racketeering and Racketeers', 'Robberies and Thefts', 'Hospitals', 'Enterprise Computing', 'Penchukov, Vyacheslav Igorevich', 'University of Vermont', 'Vermont', 'Ukraine']",2024-02-18T19:43:07+0000,article,U.S.
"“The Holdovers” and “Poor Things” were also honored at the British equivalent of the Oscars, while “Saltburn” and “Barbie” left empty-handed.","“Oppenheimer,” Christopher Nolan’s blockbuster movie about the development of the atomic bomb, swept the board at the EE British Academy Film Awards in London on Sunday.","{'main': '‘Oppenheimer’ Sweeps the BAFTAs With 7 Awards Including Best Film', 'kicker': None, 'content_kicker': None, 'print_headline': '‘Oppenheimer’ Dominates at the BAFTAs', 'name': None, 'seo': None, 'sub': None}","['Movies', 'The Holdovers (Movie)', 'Oppenheimer (Movie)', 'Poor Things (Movie)', 'Anatomy of a Fall (Movie)', 'Killers of the Flower Moon (Movie)', 'British Academy of Film and Television', 'Nolan, Christopher', 'Triet, Justine', 'Payne, Alexander', 'Scorsese, Martin', 'Lanthimos, Yorgos', 'Stone, Emma', 'Murphy, Cillian', 'London (England)', 'Downey, Robert Jr', 'Glazer, Jonathan', ""Randolph, Da'Vine Joy""]",2024-02-18T20:45:25+0000,article,Movies
"Also, Russians mourn Aleksei Navalny.","Ukrainian forces retreated from Avdiivka, which had been a stronghold in the Donetsk region for more than a decade, giving Russia its first significant victory in almost a year. Now, Ukraine’s outgunned troops may be in their most precarious position since the first months of the war almost two years ago.","{'main': 'Monday Briefing: Avdiivka Falls to Russia', 'kicker': None, 'content_kicker': None, 'print_headline': '', 'name': None, 'seo': None, 'sub': None}","['Far East, South and Southeast Asia and Pacific Areas']",2024-02-18T20:46:55+0000,article,World
"Representative Michael R. Turner, who drew criticism last week after releasing a cryptic statement about a new threat, said he wanted to avoid “an international crisis.”",Representative Michael R. Turner defended his decision to hint publicly about classified intelligence that Russia is moving to deploy a new space-based nuclear weapon.,"{'main': 'Intelligence Chairman Defends His Hints About a Russian Space Weapon', 'kicker': None, 'content_kicker': None, 'print_headline': '', 'name': None, 'seo': None, 'sub': None}","['United States Politics and Government', 'Classified Information and State Secrets', 'Russian Invasion of Ukraine (2022)', 'Foreign Aid', 'Nuclear Weapons', 'House Committee on Intelligence', 'Turner, Michael R', 'Biden, Joseph R Jr', 'Russia', 'Ukraine']",2024-02-18T21:09:16+0000,article,U.S.
Wesley Morris honors the year’s performances with some awards of his own invention.,Wesley Morris honors the year’s performances with some awards of his own invention.,"{'main': 'The Best, Weirdest, Wildest Performances of the Year', 'kicker': 'Great Performers', 'content_kicker': None, 'print_headline': '', 'name': None, 'seo': None, 'sub': None}","['Movies', 'Actors and Actresses', 'Air (Movie)', 'Nyad (Movie)', 'Mission: Impossible -- Dead Reckoning Part One (Movie)', 'Bening, Annette', 'Cooper, Bradley', 'Cruise, Tom', 'Damon, Matt', 'Davis, Viola', 'Ferrera, America', 'Giamatti, Paul', 'Gosling, Ryan', 'Ruffalo, Mark', 'Stone, Emma', 'Robbie, Margot']",2024-02-18T21:12:57+0000,multimedia,Magazine
"President Biden may owe his place in the top third to his predecessor: Mr. Biden’s signature accomplishment, according to the historians, was evicting Donald J. Trump from the Oval Office.","President Biden has not had a lot of fun perusing polls lately. He has a lower approval rating than every president going back to Dwight D. Eisenhower at this stage of their tenures, and he trails former President Donald J. Trump in a fall rematch. But Mr. Biden can take solace from one survey in which he is way out in front of Mr. Trump.","{'main': 'Poll Ranks Biden as 14th-Best President, With Trump Last', 'kicker': None, 'content_kicker': None, 'print_headline': 'Historians Rate Biden as 14th Of Presidents, Trump as Last', 'name': None, 'seo': None, 'sub': None}","['United States Politics and Government', 'Presidents and Presidency (US)', 'Polls and Public Opinion', 'Biden, Joseph R Jr', 'Buchanan, James', 'Bush, George', 'Bush, George W', 'Clinton, Bill', 'Eisenhower, Dwight David', 'Grant, Ulysses S', 'Jackson, Andrew', 'Jefferson, Thomas', 'Johnson, Andrew', 'Lincoln, Abraham', 'Obama, Barack', 'Pierce, Franklin', 'Reagan, Ronald Wilson', 'Roosevelt, Franklin Delano', 'Trump, Donald J', 'Washington, George (1732-99)', 'Wilson, Woodrow']",2024-02-18T21:40:58+0000,article,U.S.
Israel said it had asked for a meeting with the Brazilian ambassador.,"Brazil’s president, Luiz Inácio Lula da Silva, drew the ire of Israeli authorities on Sunday after he compared Israel’s actions in the war against Hamas to the Holocaust, in which Nazis killed six million Jews in a systematic roundup in Europe during World War II.","{'main': 'Brazil’s President Angers Israel After Comparing War in Gaza to the Holocaust', 'kicker': None, 'content_kicker': None, 'print_headline': '', 'name': None, 'seo': None, 'sub': None}","['Israel-Gaza War (2023- )', 'International Relations', 'Holocaust and the Nazi Era', 'Da Silva, Luiz Inacio Lula', 'Brazil', 'Netanyahu, Benjamin', 'Gaza Strip', 'Israel']",2024-02-18T21:46:17+0000,article,World
Officials in Budapest declined to meet with a bipartisan group of American lawmakers who favor expanding the military alliance.,"Hungary, the last holdout blocking Sweden’s entry into NATO, thumbed its nose over the weekend at the United States, declining to meet with a bipartisan delegation of senators who had come to press the government of Prime Minister Viktor Orban to swiftly approve the Nordic nation’s entry into the military alliance.","{'main': 'Hungary Snubs U.S. Senators Pushing for Sweden’s Entry Into NATO', 'kicker': None, 'content_kicker': None, 'print_headline': 'Hungary Snubs U.S. Group on Sweden’s NATO Entry', 'name': None, 'seo': None, 'sub': None}","['Hungary', 'Sweden', 'North Atlantic Treaty Organization', 'Senate', 'Shaheen, Jeanne', 'Tillis, Thomas R', 'Orban, Viktor', 'International Relations']",2024-02-18T22:15:05+0000,article,World
The American military said it believes it is the first time such an undersea weapon had been used in the current conflict in the Red Sea.,"The United States struck five Houthi military targets, including an undersea drone, in Houthi-controlled areas of Yemen on Saturday, the U.S. military announced on Sunday.","{'main': 'U.S. Says It Struck 5 Houthi Targets in Yemen, Including an Underwater Drone', 'kicker': None, 'content_kicker': None, 'print_headline': '', 'name': None, 'seo': None, 'sub': None}","['Israel-Gaza War (2023- )', 'Houthis', 'Yemen', 'Red Sea', 'Gulf of Aden', 'Drones (Pilotless Planes)', 'United States Navy']",2024-02-18T22:27:29+0000,article,World
Adam Wagner orders us to enunciate.,Jump to: Today’s Theme | Tricky Clues,"{'main': 'Have People Over', 'kicker': 'wordplay, the crossword column', 'content_kicker': None, 'print_headline': 'If You Solve One Puzzle Today, Make It Count', 'name': None, 'seo': None, 'sub': None}","['Crossword Puzzles', 'Games']",2024-02-18T23:00:07+0000,article,Crosswords & Games
"At least 366 people were detained over the weekend, leading to concern that the arrests could signal greater government repression ahead of Russia’s elections in March.",A bishop who planned a public prayer for the Russian opposition leader Aleksei A. Navalny was detained as he left his house. Two men were arrested for having a photograph of Mr. Navalny in a backpack. Another man who lay flowers at a memorial said he was beaten by police officers for the small act of remembrance.,"{'main': 'Arrested for Leaving Flowers, Navalny Mourners Fear Worse to Come', 'kicker': None, 'content_kicker': None, 'print_headline': 'Russia Targets Those Grieving Navalny Death', 'name': None, 'seo': None, 'sub': None}","['Political Prisoners', 'Funerals and Memorials', 'Navalny, Aleksei A', 'Putin, Vladimir V', 'Russia', 'Moscow (Russia)', 'St Petersburg (Russia)']",2024-02-18T23:35:05+0000,article,World
