abstract,lead_paragraph,headline,keywords,pub_date,document_type,section_name
A rally along the Rio Grande featured an unexpected blend of political anger and religious ardor.,"Last Saturday, a crowd of several hundred people gathered in a grassy field near the bank of the Rio Grande in Quemado, Texas, for a rally in support of the state’s defiant stance on immigration.","{'main': 'At the Border, a Blending of Politics and Religion', 'kicker': 'Guest Essay', 'content_kicker': None, 'print_headline': 'At the Border, a Blending of Politics and Religion', 'name': None, 'seo': None, 'sub': None}","['Illegal Immigration', 'Immigration and Emigration', 'Texas', 'Evangelical Movement', 'Demonstrations, Protests and Riots', 'Conservatism (US Politics)', 'Right-Wing Extremism and Alt-Right', 'Conspiracy Theories', 'Federal-State Relations (US)', 'United States Politics and Government', 'vis-photo']",2024-02-10T16:37:39+0000,article,Opinion
"The party of Imran Khan, the jailed former prime minister, took the most seats, humiliating the country’s military rulers and creating a political crisis.","The party of the imprisoned former prime minister of Pakistan, Imran Khan, won the most seats in parliamentary elections this week, delivering a strong rebuke to the country’s powerful generals and throwing the political system into chaos.","{'main': 'Shocking Opposition Victory Throws Pakistan Into Chaos', 'kicker': None, 'content_kicker': None, 'print_headline': 'Party of Jailed Leader Scores Jarring Election Upset in Pakistan', 'name': None, 'seo': None, 'sub': None}","['Pakistan', 'Politics and Government', 'Elections', 'Legislatures and Parliaments', 'Pakistan Tehreek-e-Insaf', 'Pakistan Muslim League-N', 'Defense and Military Forces', 'Khan, Imran', 'Sharif, Nawaz', 'Political Prisoners', 'Polls and Public Opinion', 'Voter Fraud (Election Fraud)']",2024-02-10T16:52:35+0000,article,World
"Cupid is no lexicographer. So, before Valentine’s Day, we looked into the evolution of the word “crush.”","A crush can be thrilling, said Anna Martin, the host of the New York Times podcast “Modern Love.” It can also be devastating or just “a starting point” — if not of a romantic relationship then of self-discovery. “In every story we’ve had about a crush, someone learned something about themselves from having it,” Ms. Martin told Times Insider.","{'main': 'The First Meaning of ‘Crush’ Came Long Before a ‘First Crush’', 'kicker': 'Word through the times', 'content_kicker': None, 'print_headline': '', 'name': None, 'seo': None, 'sub': None}","['English Language', 'Dating and Relationships', 'Dictionaries', 'Teenagers and Adolescence', 'Dictionary.com', 'Safire, William', 'New York Times']",2024-02-10T17:00:08+0000,article,Times Insider
"Herbert Wigwe, the director of one of Nigeria’s leading financial institutions, died in the crash on Friday.","A helicopter carrying six people crashed and caught on fire on Friday night near the California-Nevada border, killing all of those aboard, the authorities said. The victims included Herbert Wigwe, a prominent Nigerian banker, and his wife and son, as well as Abimbola Ogunbanjo, another businessman.","{'main': 'Top Nigerian Banker Among 6 Killed After Helicopter Crash in California', 'kicker': None, 'content_kicker': None, 'print_headline': '', 'name': None, 'seo': None, 'sub': None}","['Aviation Accidents, Safety and Disasters', 'Helicopters', 'Deaths (Fatalities)', 'California', 'Nevada', 'Nipton (Calif)', 'San Bernardino County (Calif)']",2024-02-10T17:01:32+0000,article,U.S.
"Record numbers of cases of the mosquito-borne virus have been reported in the Southern Hemisphere summer, and the surge is likely to move north.","Brazil is experiencing an enormous outbreak of dengue fever, the sometimes fatal mosquito-borne disease, and public health experts say it is a harbinger of a coming surge in cases in the Americas, including Puerto Rico.","{'main': 'Brazil Has a Dengue Emergency, Portending a Health Crisis for the Americas', 'kicker': 'Global Health', 'content_kicker': None, 'print_headline': 'Brazil’s Dengue Outbreak Portends a Health Crisis for the Americas', 'name': None, 'seo': None, 'sub': None}","['Dengue Fever', 'Brazil', 'Disease Rates', 'Mosquitoes', 'Vaccination and Immunization']",2024-02-10T17:31:15+0000,article,Health
"The main U.N. agency in Gaza said it has long investigated claims of links, firing several employees over the years. Israel says it is a compromised organization too weak to protect itself.","When the United Nations launched an investigation a decade ago into whether a handful of its employees in Gaza were members of Hamas, it was not long before a senior U.N. legal officer in the territory started receiving death threats.","{'main': 'U.N. Agency in Gaza Fought Hamas Infiltration; Not Hard Enough, Israel Says', 'kicker': None, 'content_kicker': None, 'print_headline': 'Hamas Presence In U.N. Gaza Unit Is Longtime Issue', 'name': None, 'seo': None, 'sub': None}","['Israel-Gaza War (2023- )', 'Israel', 'Defense and Military Forces', 'United Nations Relief and Works Agency', 'Gaza Strip', 'Palestinians', 'Hamas', 'Terrorism', 'International Relations', 'Bridges and Tunnels', 'Humanitarian Aid', 'Foreign Aid', 'Politics and Government']",2024-02-10T17:45:45+0000,article,World
The rapper formerly known as Kanye West has been mired in controversy after making a string of antisemitic remarks. Thousands showed up to hear “Vultures 1” on Friday night.,"Adidas severed ties with him. His talent agency dropped him. But on Friday night, an arena on Long Island was filled with thousands of people who most certainly had not turned their backs on Ye, the artist formerly known as Kanye West.","{'main': 'Ye’s New LP Debuts at a New York Arena. Why Do His Fans Stay Loyal?', 'kicker': None, 'content_kicker': None, 'print_headline': 'Despite the Controversies, Ye’s Fans Remain Loyal', 'name': None, 'seo': None, 'sub': None}","['Rap and Hip-Hop', 'Fashion and Apparel', 'Fans (Persons)', 'Anti-Semitism', 'West, Kanye', 'Ty Dolla Sign (1985- )']",2024-02-10T18:13:10+0000,article,Arts
"The third-term congressman won key Democratic support Saturday in his run for U.S. Senate in New Jersey, beating the state’s first lady, Tammy Murphy, on her home turf.","Representative Andy Kim, a third-term Democratic congressman, won an early but significant victory on Saturday against New Jersey’s first lady, Tammy Murphy, as they compete in one of the country’s most closely watched Senate primaries.","{'main': 'Andy Kim Wins a Vote Rich in Symbolism in Race to Replace Menendez', 'kicker': None, 'content_kicker': None, 'print_headline': 'Win Holds Symbolism in Race to Replace Menendez', 'name': None, 'seo': None, 'sub': None}","['United States Politics and Government', 'Primaries and Caucuses', 'Elections, Senate', 'Women and Girls', 'Elections', 'Democratic Party', 'Senate', 'Kim, Andy (1982- )', 'Menendez, Robert', 'Murphy, Tammy (1965- )', 'Monmouth County (NJ)', 'New Jersey']",2024-02-10T18:48:55+0000,article,New York
"Super Bowl week is an excuse to party every year. In Las Vegas, events featuring Future, Travis Scott and Ice Spice are supersize.","Music blared as the Baltimore Ravens wide receiver Odell Beckham Jr. had a conversation across a barricade. Close by were Machine Gun Kelly, the platinum-blond musician, and his partner, the actor Megan Fox. Outside the 45,000-square-foot, strobe-light-filled tent near the Las Vegas Strip, a man climbed a life-size statue of an elephant. Other partyers cheered him on and snapped pictures.","{'main': 'The Big Pregame (Vegas’s Version)', 'kicker': None, 'content_kicker': None, 'print_headline': '', 'name': None, 'seo': None, 'sub': None}","['Football', 'Super Bowl', 'Parties (Social)', 'Bars and Nightclubs', 'H Wood Group', 'Fanatics Inc', 'National Football League', 'Las Vegas (Nev)']",2024-02-10T18:54:34+0000,article,Arts
Both Donald J. Trump and President Biden are over 75. But voters are much less likely to worry that Mr. Trump is too old to serve.,"Donald J. Trump has praised Hungary’s prime minister, Viktor Orban, for his leadership of Turkey, and confused Nikki Haley with Nancy Pelosi. President Biden has named dead former European leaders when describing his contemporary peers, and referred to Egypt as Mexico.","{'main': 'Why the Age Issue Is Hurting Biden So Much More Than Trump', 'kicker': None, 'content_kicker': None, 'print_headline': 'Views Are Split On Candidates Of Similar Age', 'name': None, 'seo': None, 'sub': None}","['Biden, Joseph R Jr', 'Age, Chronological', 'Polls and Public Opinion', 'Presidential Election of 2024', 'United States Politics and Government', 'Trump, Donald J']",2024-02-10T18:55:14+0000,article,U.S.
"Come for the draft analysis, stay for the anti-Biden rant. A growing class of commentators is blending sports and conservative politics.","Just before flying to Las Vegas this week for the Super Bowl, Clay Travis announced his prediction for the game on his popular sports podcast, “OutKick.” The San Francisco 49ers would defeat the Kansas City Chiefs.","{'main': 'Once an Escape, Sports Talk Embraces Politics', 'kicker': None, 'content_kicker': None, 'print_headline': 'Sports Talk Goes Deep Into Politics, On the Right', 'name': None, 'seo': None, 'sub': None}","['Podcasts', 'Radio', 'Media', 'Football', 'Athletics and Sports', 'Super Bowl', 'Barstool Sports Inc', 'ESPN', 'McAfee, Pat (1987- )', 'Travis, Clay (1979- )', 'Smith, Stephen A (1967- )', 'Conservatism (US Politics)', 'Presidential Election of 2024', 'United States Politics and Government']",2024-02-10T18:56:04+0000,article,U.S.
"Traci Soderstrom, a district judge in Lincoln County, said that the messages sent while she was on the bench during the trial were “inappropriate.”",A judge in Oklahoma who exchanged 500 text messages with her bailiff while presiding over the murder trial of a man accused of beating a toddler to death resigned on Friday.,"{'main': 'Oklahoma Judge Resigns After Exchanging 500 Texts During Murder Trial', 'kicker': None, 'content_kicker': None, 'print_headline': '', 'name': None, 'seo': None, 'sub': None}","['Soderstrom, Traci (Judge)', 'Courts and the Judiciary', 'Ethics and Official Misconduct', 'Text Messaging', 'Lincoln County (Okla)', 'Oklahoma', 'Appointments and Executive Changes']",2024-02-10T19:00:42+0000,article,U.S.
Homes and a vehicle were hit in the southern Gazan city where hundreds of thousands of displaced Palestinians have fled since the war began.,Homes and a vehicle were hit in the southern Gazan city where hundreds of thousands of displaced Palestinians have fled since the war began.,"{'main': 'Gazans Search Rubble After Israeli Strikes on Rafah', 'kicker': None, 'content_kicker': None, 'print_headline': '', 'name': None, 'seo': None, 'sub': None}","['Refugees and Displaced Persons', 'Israel-Gaza War (2023- )', 'Rafah (Gaza Strip)', 'Israel', 'Gaza Strip']",2024-02-10T20:13:14+0000,multimedia,World
"Katalin Novak, an outspoken champion of family values, announced her resignation on Saturday, the latest in a series of prominent figures in the governing party felled by sex scandals.","The president of Hungary, a loyal and largely powerless ally of the country’s authoritarian prime minister, Viktor Orban, resigned on Saturday amid a public outcry over her pardoning of a man implicated in a sex abuse scandal at a children’s home.","{'main': 'Hungary’s President Resigns Amid Outcry Over Sex Abuse Case Pardon', 'kicker': None, 'content_kicker': None, 'print_headline': 'Hungary President Resigns After Outcry Over Pardon', 'name': None, 'seo': None, 'sub': None}","['Hungary', 'Novak, Katalin', 'Politics and Government', 'Appointments and Executive Changes', 'Fidesz Party', 'Orban, Viktor', 'Amnesties, Commutations and Pardons', 'Child Abuse and Neglect', 'Sex Crimes']",2024-02-10T20:13:44+0000,article,World
"Two superficially similar special counsel investigations came to contrasting ends — criminal charges in one case, and closure in the other — because the facts significantly diverged.",A special counsel’s conclusion that “no criminal charges are warranted” against President Biden for possessing classified material while he was out of office stands in contrast with another special counsel’s decision to bring criminal charges against former President Donald J. Trump for keeping classified documents after he left the White House.,"{'main': 'How Biden’s Mishandling of Classified Papers Differs From Trump’s Criminal Case', 'kicker': None, 'content_kicker': None, 'print_headline': '2 Classified Files Cases With Major Differences', 'name': None, 'seo': None, 'sub': None}","['Classified Information and State Secrets', 'Federal Criminal Case Against Trump (Documents Case)', 'United States Politics and Government', 'Special Prosecutors (Independent Counsel)', 'National Archives and Records Administration', 'Biden, Joseph R Jr', 'Hur, Robert Kyoung', 'Trump, Donald J', 'Justice Department', 'Federal Bureau of Investigation', 'Mar-a-Lago (Palm Beach, Fla)', 'Penn Biden Center for Diplomacy and Global Engagement']",2024-02-10T20:21:08+0000,article,U.S.
"Seven people from two families died in the inferno in Kharkiv on Friday night, as burning oil flowed like lava. “People were doomed,” an official said.","Firefighters were digging through the burned remains of a house Saturday morning searching for the body of a child, the last member of a family killed in a catastrophic fire caused by a Russian drone attack.","{'main': 'Russian Drone Strike Ignites a Fuel Depot, Setting a Neighborhood Ablaze in Ukraine', 'kicker': None, 'content_kicker': None, 'print_headline': 'Russian Strike Sets Ukraine Homes on Fire; 7 Dead', 'name': None, 'seo': None, 'sub': None}","['Russian Invasion of Ukraine (2022)', 'Fires and Firefighters', 'Kharkiv (Ukraine)']",2024-02-10T20:25:34+0000,article,World
The Lunar New Year begins on Saturday. Here is how the holiday is going in China.,The Lunar New Year begins on Saturday. Here is how the holiday is going in China.,"{'main': 'China Welcomes a Chilly Year of the Dragon', 'kicker': None, 'content_kicker': None, 'print_headline': '', 'name': None, 'seo': None, 'sub': None}","['China', 'Lunar New Year', 'Travel and Vacations', 'Weather', 'Holidays and Special Occasions']",2024-02-10T21:36:59+0000,multimedia,World
"Snowfall of up to two inches an hour are possible starting Monday night in sections of New Jersey, the Hudson Valley in New York and Southern Connecticut, forecasters said.","A winter storm is expected to move through the Northeast starting on Monday and lasting into Tuesday, bringing up to a foot of snow in some areas stretching from central Pennsylvania to the Catskills and Hudson Valley in New York, forecasters said.","{'main': 'Winter Storm Could Bring Up to a Foot of Snow to Parts of the Northeast', 'kicker': None, 'content_kicker': None, 'print_headline': '', 'name': None, 'seo': None, 'sub': None}","['Snow and Snowstorms', 'Northeastern States (US)']",2024-02-10T22:15:35+0000,article,New York
President Biden’s age has once again become a talking point in national politics. Many older Americans agree that it’s an issue; others feel it’s insulting.,"Bill Murphy, an 80-year-old retired veterinarian in suburban Phoenix, sometimes blanks on names he could once summon with ease, so he has empathy for 81-year-old President Biden. But he winced when he watched Mr. Biden defend his mental sharpness at a news conference, only to mix up the presidents of Egypt and Mexico. Mr. Murphy, a Republican, believes Mr. Biden is not up to another term.","{'main': 'Other 80-Somethings Have Thoughts About Age and the Presidency', 'kicker': None, 'content_kicker': None, 'print_headline': 'Voters in Their 80s See a Mirror in Questions About Age and the Presidency', 'name': None, 'seo': None, 'sub': None}","['Biden, Joseph R Jr', 'Trump, Donald J', 'Elderly', 'White House Building (Washington, DC)', 'Arizona', 'Presidential Election of 2024', 'Classified Information and State Secrets']",2024-02-10T22:16:35+0000,article,U.S.
Peter Koetters makes a glowing Sunday debut puzzle.,Jump to: Tricky Clues | Today’s Theme,"{'main': 'Bright Ideas', 'kicker': 'Wordplay, The CROSSWORD COLUMN', 'content_kicker': None, 'print_headline': '', 'name': None, 'seo': None, 'sub': None}","['Crossword Puzzles', 'Koetters, Peter (Crossword Constructor)']",2024-02-10T23:00:10+0000,article,Crosswords & Games
"The state law, which goes into effect Sunday, requires businesses to include any surcharges in the prices listed for the products or services they sell.","A new law going into effect on Sunday will require businesses in New York to clearly post the cost of purchasing items with a credit card, including any surcharges being imposed, for customers before checkout.","{'main': 'New N.Y. Law Mandates More Transparency in Credit Card Surcharges', 'kicker': None, 'content_kicker': None, 'print_headline': 'New York Law Demanding Clarity in Card Surcharges', 'name': None, 'seo': None, 'sub': None}","['Law and Legislation', 'Credit Cards', 'Prices (Fares, Fees and Rates)', 'Small Business', 'Yemeni American Merchants Assn', 'New York State']",2024-02-10T23:07:01+0000,article,New York
"At a rally in South Carolina on Saturday, former President Donald J. Trump asked of Nikki Haley: “What happened to her husband? Where is he?”","Former President Donald J. Trump continued his aggressive attacks on Nikki Haley Saturday, insinuating at a rally in South Carolina that her husband, a National Guardsmen, left for a deployment in order to escape her.","{'main': 'Trump Insinuates Haley’s Husband Deployed to Africa to Escape Her', 'kicker': None, 'content_kicker': None, 'print_headline': '', 'name': None, 'seo': None, 'sub': None}","['Presidential Election of 2024', 'Primaries and Caucuses', 'Haley, Nikki R', 'Trump, Donald J']",2024-02-10T23:30:22+0000,article,U.S.
