abstract,lead_paragraph,headline,keywords,pub_date,document_type,section_name
Two bishops and 17 other clergymen were freed after Pope Francis drew attention to the government’s persecution in his New Year’s Day address.,"The Nicaraguan authorities said on Sunday that they had released 19 clergymen who had been jailed and handed them over to the Vatican, the latest development in the autocratic government’s longstanding persecution of the Roman Catholic Church.","{'main': 'After Criticism From Pope, Nicaragua Hands Jailed Clerics Over to Vatican', 'kicker': None, 'content_kicker': None, 'print_headline': '', 'name': None, 'seo': None, 'sub': None}","['Priests', 'Political Prisoners', 'Roman Catholic Church', 'Alvarez, Rolando', 'Ortega, Daniel', 'Nicaragua', 'Prisons and Prisoners']",2024-01-15T01:07:53+0000,article,World
"According to Customs and Border Protection, federal agents were “physically barred” by state officials from responding to the situation. Texas officials said that was “wholly inaccurate.”","Three migrants drowned in the Rio Grande by Eagle Pass, Texas, officials said Saturday, setting off a dispute among state and federal officials in what seemed to escalate the feud between the Biden administration and Gov. Greg Abbott over the stringent security measures the state has imposed to keep migrants from entering the country. ","{'main': '3 Migrants, Including 2 Children, Drown Near Texas Border', 'kicker': None, 'content_kicker': None, 'print_headline': '3 Migrants Drown Near a Recently Closed Border Entrance in Texas', 'name': None, 'seo': None, 'sub': None}","['Illegal Immigration', 'Federal-State Relations (US)', 'Immigration and Emigration', 'Border Patrol (US)', 'Customs and Border Protection (US)', 'Homeland Security Department', 'Abbott, Gregory W (1957- )', 'Biden, Joseph R Jr', 'Cuellar, Henry', 'Eagle Pass (Tex)', 'El Paso (Tex)', 'Mexico', 'Rio Grande Valley (Tex)', 'Texas']",2024-01-15T02:37:39+0000,article,U.S.
"The new season, starring Jodie Foster and Kali Reis, moves north of the Arctic Circle. Unsurprisingly, the crimes are as bleak and chilly as the setting.","In the absence of any other connective tissue, the “True Detective” series continues to move forward on bad vibes and attitude, a darker-than-dark noir ambience propped up by gruesome crimes, hard-living sleuths and philosophical discourse that dances on the edge of self-parody. When Evangeline Navarro (Kali Reis), a state trooper in the Arctic hinterland of Ennis, Alaska, is asked whether she believes in God, it doesn’t seem very “True Detective” for her to affirm that she does. “Must be nice,” says her inquisitor. “Knowing we’re not alone.”","{'main': '‘True Detective: Night Country’ Season Premiere Recap:', 'kicker': 'True Detective', 'content_kicker': None, 'print_headline': '', 'name': None, 'seo': None, 'sub': None}","['Television', 'True Detective (TV Program)']",2024-01-15T03:00:07+0000,article,Arts
"The bill would extend government funding through early March, teeing up a race to pass the bipartisan deal into law before an end-of-week deadline.","Congressional leaders unveiled stopgap legislation on Sunday to avert a partial government shutdown, teeing up a race to pass the bipartisan spending deal into law before a deadline at the end of the week.","{'main': 'Congressional Leaders Unveil Stopgap Bill to Head Off Shutdown', 'kicker': None, 'content_kicker': None, 'print_headline': '', 'name': None, 'seo': None, 'sub': None}","['Law and Legislation', 'United States Politics and Government', 'Shutdowns (Institutional)', 'Federal Budget (US)', 'House of Representatives', 'Senate', 'Republican Party', 'Johnson, Mike (1972- )', 'Schumer, Charles E']",2024-01-15T03:00:39+0000,article,World
"Republican voters will render a first verdict on the entreaties Donald J. Trump’s rivals have made to move the party past his grip, as he seeks a turbocharged launch to the nomination.",The coldest Iowa caucuses in history arrive Monday night amid expectations that Republicans in the state will put former President Donald J. Trump on the march to a third G.O.P. presidential nomination.,"{'main': 'What to Watch For in the 2024 Iowa Caucuses', 'kicker': None, 'content_kicker': None, 'print_headline': '', 'name': None, 'seo': None, 'sub': None}","['Presidential Election of 2024', 'Primaries and Caucuses', 'United States Politics and Government', 'Republican Party', 'DeSantis, Ron', 'Haley, Nikki R', 'Trump, Donald J', 'Iowa']",2024-01-15T05:01:23+0000,article,U.S.
Soaring rents have left many struggling to afford homes in Dublin and have created a generational divide. Two-thirds of younger adults in the city live with their parents.,"Before sunrise each day, Aoife Diver, a teacher in Dublin, gets into her car and drives for up to 90 minutes from her uncle’s house to the opposite side of the Irish capital.","{'main': '‘The Social Contract Has Been Completely Ruptured’: Ireland’s Housing Crisis', 'kicker': None, 'content_kicker': None, 'print_headline': 'Ireland’s Housing Crisis Is Pricing Workers Out of the Places They Serve', 'name': None, 'seo': None, 'sub': None}","['Dublin (Ireland)', 'Income Inequality', 'Real Estate and Housing (Residential)', 'Public and Subsidized Housing', 'Affordable Housing', 'Homeless Persons', 'Landlords', 'Immigration and Emigration', 'Renting and Leasing (Real Estate)', 'Evictions', 'Europe', 'Great Britain', 'Ireland']",2024-01-15T05:01:51+0000,article,World
"As a proliferation of pools threatens some water supplies and housing costs skyrocket, people of the Cycladic islands say the Aegean islands’ character is being lost to real-estate homogenization.","With a deluge of foreign visitors fueling seemingly nonstop development on once pristine Greek islands, local residents and officials are beginning to fight back, moving to curb a wave of construction that has started to cause water shortages and is altering the islands’ unique cultural identity.","{'main': 'As Development Alters Greek Islands’ Nature and Culture, Locals Push Back', 'kicker': None, 'content_kicker': None, 'print_headline': 'As Sprawl From Tourism Alters Islands’ Character, Greeks Fight for Culture', 'name': None, 'seo': None, 'sub': None}","['Conservation of Resources', 'Real Estate (Commercial)', 'Travel and Vacations', 'Hotels and Travel Lodgings', 'Local Government', 'Mykonos (Greece)', 'Paros (Greece)', 'Cyclades Islands', 'Greece']",2024-01-15T05:01:51+0000,article,World
100 days of war in Gaza.,"The war in Gaza has entered its 100th day. Since Hamas led its deadly Oct. 7 assault on Israel, more than 23,000 Palestinians have been killed in Gaza and most of the enclave’s population has been displaced by the Israeli military’s war, according to Gazan health officials. More than 120 hostages are believed to be held by Hamas and other militant groups, according to Israeli officials.","{'main': 'Monday Briefing', 'kicker': None, 'content_kicker': None, 'print_headline': '', 'name': None, 'seo': None, 'sub': None}",[],2024-01-15T05:09:02+0000,article,Briefing
"In Iowa and other states, Republican voters have the opportunity and the obligation to select a presidential candidate who will uphold the rule of law.","Republicans who will gather to cast the first votes of the 2024 presidential primary season have one essential responsibility: to nominate a candidate who is fit to serve as president, one who will “preserve, protect and defend the Constitution of the United States.”","{'main': 'The Responsibility of Republican Voters', 'kicker': 'The Editorial Board', 'content_kicker': None, 'print_headline': 'The Responsibility of Republican Voters', 'name': None, 'seo': None, 'sub': None}","['Presidential Election of 2024', 'United States Politics and Government', 'Trump, Donald J', 'Iowa', 'United States', 'Primaries and Caucuses', 'Republican Party']",2024-01-15T06:00:09+0000,article,Opinion
"Quotation of the Day for Monday, January 15, 2024.","“You get mad with yourself, then you get mad because you got mad with yourself.”","{'main': 'Quotation of the Day: ‘The Kindest Player,’ Who Can Turn Into a Madman, Is Searching for Peace', 'kicker': None, 'content_kicker': None, 'print_headline': 'Quote of the Day', 'name': None, 'seo': None, 'sub': None}",[],2024-01-15T06:00:12+0000,article,Corrections
"The television awards show that was postponed from 2023 airs on Fox, and the FX drama wraps up its season.","Between network, cable and streaming, the modern television landscape is a vast one. Here are some of the shows, specials and movies coming to TV this week, Jan. 15-21. Details and times are subject to change.","{'main': 'What’s on TV This Week: Emmy Awards and ‘Fargo’', 'kicker': None, 'content_kicker': None, 'print_headline': 'This Week on TV', 'name': None, 'seo': None, 'sub': None}","['Television', 'Movies']",2024-01-15T06:00:16+0000,article,Arts
"No corrections appeared in print on Monday, Jan. 15, 2024.","Errors are corrected during the press run whenever possible, so some errors noted here may not have appeared in all editions.","{'main': 'No Corrections: Jan. 15, 2024', 'kicker': None, 'content_kicker': None, 'print_headline': '', 'name': None, 'seo': None, 'sub': None}",[],2024-01-15T06:01:29+0000,article,Corrections
Feeling stuck on today’s puzzle? We can help.,"Hi busy bees! Welcome to today’s Spelling Bee forum. There are a number of terms that appear in both this article and other online discussions of the Spelling Bee; a glossary of those terms compiled by Monicat, a Times reader, can be found below.","{'main': 'Spelling Bee Forum', 'kicker': None, 'content_kicker': None, 'print_headline': '', 'name': None, 'seo': None, 'sub': None}",['Spelling Bee (Game)'],2024-01-15T08:00:18+0000,article,Crosswords & Games
In case you need some puzzle help.,"Good morning, dear connectors. Welcome to today’s Connections forum, where you can give and receive puzzle — and emotional — support.","{'main': 'The Connections Companion', 'kicker': None, 'content_kicker': None, 'print_headline': '', 'name': None, 'seo': None, 'sub': None}","['Crossword Puzzles', 'Connections (Game)']",2024-01-15T08:00:18+0000,article,Crosswords & Games
It would be one of the largest state appropriations for research into the neurodegenerative disease. Ms. Hochul’s mother died from A.L.S.,"Gov. Kathy Hochul is set to propose an appropriation on Tuesday that would provide one of the largest sums ever invested by a state into research of amyotrophic lateral sclerosis, the neurodegenerative disease known as A.L.S.","{'main': 'Hochul to Propose $25 Million in State Funding for A.L.S. Research', 'kicker': None, 'content_kicker': None, 'print_headline': 'Hochul Taps $25 Million For Research Into A.L.S.', 'name': None, 'seo': None, 'sub': None}","['Amyotrophic Lateral Sclerosis', 'Research', 'Politics and Government', 'Philanthropy', 'Rare and Orphan Diseases', 'Target ALS', 'Hochul, Kathleen C', 'Doctoroff, Daniel L']",2024-01-15T08:00:19+0000,article,New York
Prosecutors put their faith in complex scientific evidence gathered painstakingly from burial sites and garbage cans.,"After 13 years of dead ends and blown leads, the Gilgo Beach murder investigation finally turned on pizza crusts that Rex Heuermann had tossed in a trash can in Midtown Manhattan.","{'main': 'Gilgo Beach Serial-Murder Case Hangs on a Single Strand of Hair', 'kicker': None, 'content_kicker': None, 'print_headline': 'Strands of Hair Will Be Central In Gilgo 4 Case', 'name': None, 'seo': None, 'sub': None}","['Serial Murders', 'Genetics and Heredity', 'DNA (Deoxyribonucleic Acid)', 'Forensic Science', 'Ellerup, Asa', 'Heuermann, Rex (1963- )', 'Waterman, Megan', 'Gilgo Beach (NY)', 'Massapequa Park (NY)']",2024-01-15T08:00:20+0000,article,New York
The writer has already won $5 million for his sexual abuse and his subsequent denials. But the former president still claims he does not know who she is.,A Manhattan jury will be asked a narrow question this week: How much money must former President Donald J. Trump pay the writer E. Jean Carroll for defaming her after she accused him of raping her?,"{'main': 'As Trump Continues to Insult E. Jean Carroll, 2nd Defamation Trial Opens', 'kicker': None, 'content_kicker': None, 'print_headline': 'Trump Derides Accuser as Second Defamation Trial Starts', 'name': None, 'seo': None, 'sub': None}","['Decisions and Verdicts', 'Libel and Slander', 'Sex Crimes', 'Compensation for Damages (Law)', 'Courts and the Judiciary', 'CARROLL, E JEAN', 'Habba, Alina', 'Kaplan, Lewis A', 'Kaplan, Roberta A', 'Trump, Donald J', 'Manhattan (NYC)']",2024-01-15T08:00:20+0000,article,New York
"Kellen Browning, a reporter based in San Francisco, recently relocated to Des Moines to cover the 2024 Republican campaign in Iowa, the first state to vote.",Kellen Browning had been covering the gig economy and the video game industry from San Francisco for three and a half years when he approached The New York Times’s politics team last fall: Could they use a hand with the 2024 campaign?,"{'main': 'On the Ground in Iowa, a Reporter on the Move', 'kicker': 'Times Insider', 'content_kicker': None, 'print_headline': 'On the Ground in Iowa, a Reporter on the Move', 'name': None, 'seo': None, 'sub': None}","['DeSantis, Ron', 'Haley, Nikki R', 'Ramaswamy, Vivek (1985- )', 'Trump, Donald J', 'Iowa', 'New York Times', 'Presidential Election of 2024', 'Primaries and Caucuses', 'News and News Media', 'Polls and Public Opinion', 'Republican Party', 'Browning, Kellen (Journalist)']",2024-01-15T08:00:27+0000,article,Times Insider
"Super PACs supporting Nikki Haley and Ron DeSantis are closing with attacks on each other, while the front-runner, Donald J. Trump, looks past them.","Subzero temperatures and swirling snow squalls have hampered campaign events around Iowa this weekend, but Iowans are getting plenty of exposure to the Republican presidential candidates through a last-minute blitz of advertising before Monday’s caucuses.","{'main': 'Negative, Defensive and Dark: The Final Ads of the Iowa Campaign', 'kicker': None, 'content_kicker': None, 'print_headline': 'Final Iowa Ads For Candidates Focus Mostly On Negatives', 'name': None, 'seo': None, 'sub': None}","['Haley, Nikki R', 'DeSantis, Ron', 'Trump, Donald J', 'Iowa', 'Political Advertising', 'Presidential Election of 2024', 'Republican Party', 'Primaries and Caucuses']",2024-01-15T08:00:27+0000,article,U.S.
"During a period of painful budget cuts, New York City lawmakers secured private funding to pay for free swim lessons for 2,000 second graders starting in June.","With New York City making deep budget cuts to key programs, two City Council members persuaded a philanthropist to help finance a city initiative to provide swim lessons to young children. ","{'main': 'Swim Lessons for N.Y.C. Children Were at Risk. A Billionaire Helped Out.', 'kicker': None, 'content_kicker': None, 'print_headline': 'Swim Class For Children Is Salvaged By Billionaire ', 'name': None, 'seo': None, 'sub': None}","['Swimming', 'Parks and Other Recreation Areas', 'Law and Legislation', 'Local Government', 'Philanthropy', 'Parks and Recreation Department (NYC)', 'New York City', 'Gray, Jonathan D (1970- )']",2024-01-15T08:00:28+0000,article,New York
"The tiny Pacific island of Nauru severed relations with Taiwan, a move that boosts China’s regional sway and was seemingly timed to Taiwan’s contentious recent election.","Just two days after Taiwan elected as its next leader Lai Ching-te, whom Beijing sees as a staunch separatist, it lost a diplomatic ally in its rivalry with China. Nauru, a tiny freckle of land in the Pacific Ocean, announced that it would be severing diplomatic relations with Taiwan, effective immediately.","{'main': 'Taiwan Loses Ally to China After Electing President Loathed by Beijing', 'kicker': None, 'content_kicker': None, 'print_headline': '', 'name': None, 'seo': None, 'sub': None}","['International Relations', 'Communist Party of China', 'Democratic Progressive Party (Taiwan)', 'Lai Ching-te', 'China', 'Nauru', 'Taiwan', 'Elections']",2024-01-15T08:51:48+0000,article,World
"A world away from the country’s luxury all-inclusive beach resorts, cool, aquamarine natural pools tempt travelers to jump in and feel the tingle.","The tree-ringed lagoon glowed a color you usually see only in the mouthwash aisle, and under the surface of its glassy water, fallen branches looked like open hands ready to make a catch. The boulders at the bottom were either a few feet down or impossibly deep — the clarity of the water made it impossible to tell.","{'main': 'Diving Into the Dominican Republic’s Springs and Rivers', 'kicker': None, 'content_kicker': None, 'print_headline': 'The Swimming Holes of the Dominican Republic', 'name': None, 'seo': None, 'sub': None}","['Travel and Vacations', 'Dominican Republic', 'Rivers', 'Swimming', 'Beaches']",2024-01-15T10:00:46+0000,article,Travel
A small group of residents in San Francisco apartments are on a rent strike. Can a union model work for residents the same way it does for laborers?,"Auto workers in Detroit. Actors and screenwriters in Hollywood. Teachers in Portland, Ore. ","{'main': 'In San Francisco, Tenants Use Labor Tactics to Challenge Their Landlords', 'kicker': None, 'content_kicker': None, 'print_headline': 'Tenants Turn to Labor Tactics to Leverage Landlords', 'name': None, 'seo': None, 'sub': None}","['Strikes', 'Landlords', 'Demonstrations, Protests and Riots', 'Renting and Leasing (Real Estate)', 'Organized Labor', 'Real Estate and Housing (Residential)', 'San Francisco (Calif)', 'Tenderloin (San Francisco, Calif)']",2024-01-15T10:00:46+0000,article,U.S.
"In the midst of chaos, the characters in these books find their own ways to metabolize real-life tragedy.","“It is up to us to write our own history,” declares the organizer of the desperate project at the heart of Lauren Grodstein’s latest novel, WE MUST NOT THINK OF OURSELVES (Algonquin, 304 pp., $34). He’s speaking on a bleak afternoonomg in one of the bleakest places in Poland, the Warsaw ghetto in December 1940. Those he will secretly assemble in the upstairs room of a library are intent on preserving the biographies of at least some of the hundreds of thousands of Jews imprisoned by the Nazis in three square kilometers of the city.","{'main': 'Lose Yourself in Three Absorbing New Historical Novels', 'kicker': 'Historical Fiction', 'content_kicker': None, 'print_headline': 'Responses to Groupthink, Three Ways', 'name': None, 'seo': None, 'sub': None}","['Grodstein, Lauren', 'Kempowski, Walter', 'Yakhina, Guzel', 'Books and Literature', 'genre-books-historical-fiction']",2024-01-15T10:00:46+0000,article,Books
"Around the globe, travelers are looking to get beyond superficial interactions with Native cultures for more in-depth experiences, like tours led by Indigenous guides and stays at Native-owned lodges.","For visitors to New Zealand, the chance to see a haka, the ceremonial Maori dance, has long been as much a part of the country’s allure as its glaciers, geysers and glowworm caves.","{'main': 'Indigenous Tourism Goes Deeper Than ‘Dinner and a Show’', 'kicker': None, 'content_kicker': None, 'print_headline': '', 'name': None, 'seo': None, 'sub': None}","['Travel and Vacations', 'Indigenous Australians', 'Maori', 'Indigenous People', 'Native Americans', 'Australia', 'New Zealand', 'North America']",2024-01-15T10:00:47+0000,article,Travel
"Fifty years ago, the Nakagin Capsule Tower was hailed as a marvel of organic architecture. Now its legacy lives on through 23 orphaned capsules.","In 1972, residents of Tokyo looked up to see something extraordinary looming over downtown. It looked like something out of a science-fiction film — a futuristic tower composed of 140 detachable capsules, each suitable for a single resident and with a porthole looking out, like a pile of eyes fixed on the city.","{'main': 'In Tokyo, Rescuing the Residential Spaceship That Fell to Earth', 'kicker': None, 'content_kicker': None, 'print_headline': 'A Futuristic Tokyo Building’s Legacy Lives On', 'name': None, 'seo': None, 'sub': None}","['Real Estate and Housing (Residential)', 'Tokyo (Japan)', 'ARCHITECTURE', 'Nagano (Japan)', 'Historic Buildings and Sites', 'Japan']",2024-01-15T10:00:48+0000,article,Real Estate
"In “Our Moon,” Rebecca Boyle elucidates how Earth’s closest neighbor makes us what — and who — we are.","I had two memorable experiences with the moon this year. The first was seeing the “blue supermoon” rise over Lake Michigan in August. The second, a few weeks later, was watching it quietly slip in front of our sun, casting the world below in an eerie, ethereal glow.","{'main': 'When We Look at the Moon, We See Ourselves — Craters and All', 'kicker': None, 'content_kicker': None, 'print_headline': 'Lunar Living', 'name': None, 'seo': None, 'sub': None}","['Books and Literature', 'Titan (Saturn Moon)', 'Space and Astronomy', 'Galilei, Galileo', 'Planets', 'Moon', 'Science and Technology', ""Our Moon: How Earth's Celestial Companion Transformed the Planet, Guided Evolution, and Made Us Who We Are (Book)"", 'Boyle, Rebecca (Journalist)']",2024-01-15T10:00:59+0000,article,Books
Condescending to Trump voters will not win many of them over; we should not shrink from honestly assessing economic performance under Trump as well as under Biden.,Why is Donald Trump continuing to poll so strongly with voters?,"{'main': 'What Trump Voters Understand About the Economy', 'kicker': 'Guest Essay', 'content_kicker': None, 'print_headline': 'Trump Voters Remember a Real Economic Fact', 'name': None, 'seo': None, 'sub': None}","['United States Economy', 'Trump, Donald J', 'Presidential Election of 2024', 'Biden, Joseph R Jr', 'Income Inequality', 'Inflation (Economics)']",2024-01-15T10:01:09+0000,article,Opinion
Worries are growing in Washington that a flood of Chinese products could put new American investments in clean energy and high-tech factories at risk.,"The Biden administration has begun pumping more than $2 trillion into U.S. factories and infrastructure, investing huge sums to try to strengthen American industry and fight climate change.","{'main': 'Flush With Investment, New U.S. Factories Face a Familiar Challenge', 'kicker': None, 'content_kicker': None, 'print_headline': 'Low-Priced Chinese Goods Present Familiar Challenge', 'name': None, 'seo': None, 'sub': None}","['Electric and Hybrid Vehicles', 'Solar Energy', 'Customs (Tariff)', 'United States Politics and Government', 'Factories and Manufacturing', 'Tax Credits, Deductions and Exemptions', 'Computer Chips', 'Protectionism (Trade)', 'International Trade and World Market', 'United States Economy', 'Europe', 'China', 'Tai, Katherine (1974- )', 'Biden, Joseph R Jr', 'Trump, Donald J', 'United States']",2024-01-15T10:01:17+0000,article,Business Day
"Volunteers with ZAKA, an Israeli group that recovers dead bodies, were among the first to reach the victims of the Hamas-led attacks. The trauma of what they witnessed may last a lifetime.","At 76, David Weissenstern has collected the remains of the dead for most of his adult life. But after the Oct. 7 attacks, in which Hamas-led fighters killed about 1,200 people along Israel’s border with Gaza, he can no longer stand the smell of grilled meat. The odor, he says, reminds him too much of burned human flesh.","{'main': 'They Thought They Knew Death, but That Didn’t Prepare Them for Oct. 7', 'kicker': None, 'content_kicker': None, 'print_headline': 'They Thought They Knew Death, but That Didn’t Prepare Them for Oct. 7', 'name': None, 'seo': None, 'sub': None}","['Israel', 'Israel-Gaza War (2023- )', 'Deaths (Fatalities)', 'Jews and Judaism', 'Orthodox Judaism', 'Content Type: Personal Profile', 'Hamas', 'Religion and Belief', 'Rumors and Misinformation', 'War Crimes, Genocide and Crimes Against Humanity']",2024-01-15T10:01:20+0000,article,World
"In an interview, the surviving members of the original cast — Ron Howard, Donny Most, Anson Williams, Henry Winkler and Marion Ross — look back on the nostalgic hit, which premiered Jan. 15, 1974.","On Tuesday night, Jan. 15, 1974, Richie, Potsie, Ralph and Fonzie entered our living rooms for a visit that would end up lasting more than a decade.","{'main': '‘Happy Days’ at 50: ‘The Fonz Bought Me a House’', 'kicker': None, 'content_kicker': None, 'print_headline': '50 Years Later,  Actors Reflect On ‘Happy Days’', 'name': None, 'seo': None, 'sub': None}","['Television', 'Happy Days (TV Program)', 'Howard, Ron', 'Most, Donny', 'Winkler, Henry', 'Marshall, Garry', 'ABC Inc', 'Williams, Anson (1949- )', 'Actors and Actresses', 'Content Type: Personal Profile', 'Ross, Marion (1928- )']",2024-01-15T10:01:42+0000,article,Arts
