abstract,lead_paragraph,headline,keywords,pub_date,document_type,section_name
Ryan Sasson built a business that reaped hundreds of millions of dollars in fees for helping people negotiate down their debts. But former clients — and prosecutors — say it was exploitative.,"In the early 1980s, 19-year-old Jordan Belfort — who would go on to become known as the Wolf of Wall Street, a title he bestowed on himself in a tell-all memoir — had a fortuitous encounter on Jones Beach, on Long Island, with another teenager selling ice cream named Stephen Drescher.","{'main': 'He Grew Up in the Shadow of the ‘Wolf of Wall Street.’ Then He Got Into Debt Settlement.', 'kicker': None, 'content_kicker': None, 'print_headline': 'Some Debtors, Seeking Relief, Say a Company Dug a Bigger Hole', 'name': None, 'seo': None, 'sub': None}","['Debt Collection', 'Strategic Financial Solutions LLC', 'Suits and Litigation (Civil)', 'Legal Profession', 'Securities and Commodities Violations', 'Regulation and Deregulation of Industry', 'Consumer Financial Protection Bureau', 'Belfort, Jordan Ross', 'Frauds and Swindling', 'internal-storyline-no']",2024-02-10T10:01:52+0000,article,Business Day
"Young people tend to lean more liberal on a range of issues pertaining to relationship norms. But when it comes to dating, the idea that men should pay still prevails in heterosexual courtship.","During a recent dinner at a cozy bar in Upper Manhattan, I was confronted with an age-old question about gender norms. Over bowls of ramen and sips of gin cocktails, my date and I got into a debate: Who should pay for dates?","{'main': 'For Gen Z, an Age-Old Question: Who Pays for Dates?', 'kicker': None, 'content_kicker': None, 'print_headline': 'For Gen Z, an Age-Old Question: Who Pays for Dates?', 'name': None, 'seo': None, 'sub': None}","['Dating and Relationships', 'Generation Z', 'Customs, Etiquette and Manners', 'Personal Finances', 'Gender']",2024-02-10T10:02:07+0000,article,Business Day
"Pavel Kolesnikov and Samson Tsoy, partners onstage and off, began to play as a duo in school. Now, they are dedicating their careers to it.",It looked like some kind of grand music exam. The pianists Pavel Kolesnikov and Samson Tsoy sat down at their instruments onstage at Wigmore Hall and began to play for an audience of two.,"{'main': 'Two Pianists Make a Life Out of an Intimate Art Form', 'kicker': None, 'content_kicker': None, 'print_headline': 'Two Pianists  Create One Life Using Their Art', 'name': None, 'seo': None, 'sub': None}","['Classical Music', 'Music', 'Dating and Relationships', 'Royal College of Music (London, England)', 'Carnegie Hall', 'Russia']",2024-02-10T10:02:12+0000,article,Arts
"Alexei Ratmansky, arguably the most important ballet choreographer today, has made a deeply personal first work as artist in residence that reflects his Ukrainian roots.","For the choreographer Alexei Ratmansky, the last two years have brought an uncomfortable intermingling of life and art. Known for ballets that combine wit with an almost surrealistic imagination, he has found his thoughts drawn insistently toward the war in Ukraine, the country where he spent his early years and began his dancing career, where he met his wife and where their families still live.","{'main': 'A War-Haunted Choreographer Steps Into a New Role at City Ballet', 'kicker': None, 'content_kicker': None, 'print_headline': 'Trying to Convey a War’s Ruptures', 'name': None, 'seo': None, 'sub': None}","['Dancing', 'Solitude (Ballet)', 'Ratmansky, Alexei', 'New York City Ballet', 'Balanchine, George', 'Kyiv (Ukraine)', 'Content Type: Personal Profile', 'Russian Invasion of Ukraine (2022)', 'Ukraine', 'Russia']",2024-02-10T10:02:13+0000,article,Arts
"When the star of the film “Sometimes I Think About Dying” listens to “This Is What I Mean,” she says, “I don’t shuffle it, nothing. It’s perfect.”","For her latest movie, “Sometimes I Think About Dying,” Daisy Ridley plays Fran, a drab, standoffish, occasionally obnoxious office worker. Strangely enough, she found it exciting.","{'main': 'Daisy Ridley Loves Every Single Track of This Stormzy Album', 'kicker': 'My Ten', 'content_kicker': None, 'print_headline': 'Daisy Ridley Wallows and Watches Bad TV', 'name': None, 'seo': None, 'sub': None}","['Movies', 'Content Type: Personal Profile', 'Actors and Actresses', 'Ridley, Daisy (1992- )', 'Sometimes I Think About Dying (Movie)', 'Star Wars (Movie)']",2024-02-10T10:02:15+0000,article,Movies
We looked into whether such a claim was merely a romantic notion.,"Ever since Taylor Swift started dating the Kansas City Chiefs’ Travis Kelce, she has elevated him into a new tier of celebrity.","{'main': 'Is Taylor Swift Actually Increasing N.F.L. Ratings?', 'kicker': None, 'content_kicker': None, 'print_headline': 'Millions Are Tuning In  To Watch Swift and Kelce. Or Is It Mahomes and Kelce?', 'name': None, 'seo': None, 'sub': None}","['Swift, Taylor', 'Kelce, Travis', 'Ratings (Audience Measurement)', 'Football', 'Super Bowl', 'Pop and Rock Music', 'Kansas City Chiefs', 'National Football League']",2024-02-10T10:02:28+0000,article,The Upshot
The “Aya” series explores the pains and pleasures of everyday life in a working-class neighborhood in West Africa.,"One of the most successful African comics has no super heroes, and certainly no supernatural powers.","{'main': 'A Graphic Novel Finds a Relatable Hero in a Modern African Woman', 'kicker': None, 'content_kicker': None, 'print_headline': 'Young African Women as Everyday Heroes', 'name': None, 'seo': None, 'sub': None}","['Comic Books and Strips', 'Women and Girls', 'Children and Childhood', 'Abouet, Marguerite']",2024-02-10T10:02:39+0000,article,Books
"This year’s Africa Cup of Nations, like several previous editions, played out in Chinese-built arenas. It will end with familiar questions about their legacy.","The Alassane Ouattara stadium rises like a piece of sculpture from the dusty brown earth north of Ivory Coast’s largest city, its undulating roof and white columns towering over the empty landscape like a spaceship that has dropped onto a uninhabited planet.","{'main': 'China Keeps Building Stadiums in Africa. But at What Cost?', 'kicker': None, 'content_kicker': None, 'print_headline': 'Long Walk  To Stadium  China Built  In Africa   ', 'name': None, 'seo': None, 'sub': None}","['Stadiums and Arenas', 'African Cup of Nations (Soccer)', 'Infrastructure (Public Works)', 'Developing Countries', 'Soccer', 'Belt and Road Initiative (China)', 'Ouattara, Alassane D', 'Abidjan (Ivory Coast)', 'China', 'Ivory Coast', 'vis-photo']",2024-02-10T10:02:53+0000,article,World
"Electronic tables, which can cost thousands of dollars, are fueling new interest in the game.","If you run through iconic mahjong scenes from film — classics like “The Joy Luck Club” or the final throwdown in “Crazy Rich Asians” — they all start with an almost ritualistic shuffling, the players’ hands sweeping the table, the tiles clacking in a happy clamor.","{'main': 'How New Technology Changed Mahjong', 'kicker': None, 'content_kicker': None, 'print_headline': '', 'name': None, 'seo': None, 'sub': None}","['Gambling', 'Electronics', 'Mah-Jongg (Game)']",2024-02-10T10:03:18+0000,article,Crosswords & Games
"Astronomers tracked the entry of a small space rock into Earth’s atmosphere, and then meteorite hunters made an unexpected discovery.","Scientists have found pieces of a meteorite that fell near Berlin just after midnight on Jan. 21. It is a rare find, from an asteroid that was identified just before it entered Earth’s atmosphere. Only a handful of such events in the recent past have allowed astronomers to trace an incoming rock’s origin in the solar system.","{'main': 'Fragments of Asteroid With Mystery Origin Are Found Outside Berlin', 'kicker': None, 'content_kicker': None, 'print_headline': 'Meteoric Mystery: Origin of Space Rocks in Berlin? Maybe Express Delivery From Mercury.', 'name': None, 'seo': None, 'sub': None}","['Meteors and Meteorites', 'Asteroids', 'Solar System', 'Mercury (Planet)', 'Research', 'Berlin (Germany)']",2024-02-10T10:03:28+0000,article,Science
"Either of the leading 2024 candidates would be the oldest occupant of the Oval Office ever by the end of his term, and neither seems eager to discuss the ramifications.","When Dwight D. Eisenhower weighed the pros and cons of running for a second term, one factor that concerned him was his age.","{'main': 'How Old Is Too Old to Be President? An Uncomfortable Question Arises Again.', 'kicker': None, 'content_kicker': None, 'print_headline': 'A Political Gray Area: How Old Is Too Old to Be President?', 'name': None, 'seo': None, 'sub': None}","['Age, Chronological', 'Biden, Joseph R Jr', 'Trump, Donald J', 'Polls and Public Opinion', 'United States Politics and Government', 'Presidential Election of 2024', 'Presidents and Presidency (US)', 'Twenty-Fifth Amendment (US Constitution)', 'Eisenhower, Dwight David', 'Roosevelt, Franklin Delano', 'Wilson, Woodrow']",2024-02-10T10:03:32+0000,article,U.S.
"He has dressed music, TV and Hollywood stars. He has had a fashion business since the 1980s. His clothes have become social media hits. But B Michael is not a household name.","He has had a fashion business in New York since the late 1980s, the same decade that Michael Kors and Donna Karan started their namesake lines. He was inducted into the Council of Fashion Designers of America in 1998. From 1999 to 2018, he showed two collections each year, some on the schedule at New York Fashion Week.","{'main': 'What Do Beyoncé, ‘Dynasty,’ and Halle Berry Have in Common? His Clothes.', 'kicker': None, 'content_kicker': None, 'print_headline': '', 'name': None, 'seo': None, 'sub': None}","['Fashion and Apparel', 'Black People', 'Blacks', 'Content Type: Personal Profile', 'Race and Ethnicity', 'Hats and Caps', 'B Michael (Fashion Designer)', 'Tyson, Cicely', 'Rashad, Phylicia']",2024-02-10T10:03:34+0000,article,Style
"The White House’s cloistered nature reflects the concern of aides who worry that even small mistakes will be amplified. Lately, the president has burst through that bubble, with mixed results.","Aides have President Biden take the shorter stairs to board Air Force One. When it comes to news conferences, they yell loudly — and quickly — to end the questions, sometimes stealing a classic awards show tactic and playing loud music to signal the conclusion of the event. And forget about regular interviews with major news publications, including a traditional presidential sit-down on Super Bowl Sunday.","{'main': 'Inside Biden’s Protective White House', 'kicker': 'White House Memo', 'content_kicker': None, 'print_headline': 'Protecting President From Stumbles and Gaffes', 'name': None, 'seo': None, 'sub': None}","['Biden, Joseph R Jr', 'Age, Chronological', 'Presidential Election of 2024', 'United States Politics and Government', 'Presidents and Presidency (US)', 'Polls and Public Opinion']",2024-02-10T10:03:34+0000,article,U.S.
"While no new stadiums will be built in Vancouver or Toronto, multimillion-dollar renovations must be finished on a tight deadline.","This week we learned how many World Cup games will take place in Vancouver and Toronto, which will co-host the men’s soccer tournament with cities in the United States and Mexico in 2026.","{'main': 'Canada Prepares for Soccer’s 2026 World Cup', 'kicker': None, 'content_kicker': None, 'print_headline': '', 'name': None, 'seo': None, 'sub': None}","['Soccer', 'Stadiums and Arenas', 'World Cup 2026 (Soccer)', 'Building (Construction)', 'Canada', 'British Columbia (Canada)', 'Toronto (Ontario)', 'Vancouver (British Columbia)']",2024-02-10T11:00:02+0000,article,World
Two schools of thought on the best way to find love.,"When it comes to finding love, there seem to be two schools of thought on the best way to go about it. One says, wait for that lightning-strike magic. The other says, make a calculation and choose the best option. Which school has it right?","{'main': 'Math or Magic?', 'kicker': None, 'content_kicker': None, 'print_headline': '', 'name': None, 'seo': None, 'sub': None}",[],2024-02-10T11:00:07+0000,article,Podcasts
Egypt has reinforced its frontier with Gaza and warned Israel that any move that would send Gazans spilling into Egyptian territory could jeopardize their decades-old peace treaty.,The pressure on Egypt is building.,"{'main': 'Egypt Warily Eyes Gaza as War Builds Pressure on Its Border', 'kicker': None, 'content_kicker': None, 'print_headline': 'Egypt Feels Pressure at Border as Israel Threatens to Invade Rafah', 'name': None, 'seo': None, 'sub': None}","['Israel-Gaza War (2023- )', 'Palestinians', 'Refugees and Displaced Persons', 'Muslim Brotherhood (Egypt)', 'Hamas', 'Sinai Province of the Islamic State', 'Egypt', 'Gaza Strip', 'Rafah (Gaza Strip)', 'Sinai Peninsula (Egypt)', 'Israel']",2024-02-10T11:03:15+0000,article,World
"Valentine’s Day is on Wednesday. It’s the one day a year when we endorse unfettered demonstrations of affection, but it doesn’t need to to be.","It was customary when I was in grade school to bestow a valentine upon every person in one’s class. These valentines were not of the handmade or heartfelt variety, but rather bought in bulk from CVS, from the red-cellophane aisle, on the shelf next to the seasonal Whitman’s Samplers and conversation hearts.","{'main': 'Love Letters', 'kicker': None, 'content_kicker': None, 'print_headline': '', 'name': None, 'seo': None, 'sub': None}","['internal-storyline-no', ""Valentine's Day""]",2024-02-10T11:44:41+0000,article,Briefing
"At last, one thing that all Americans can agree on.","Ask the people in your life to name a woman who’s got it good, with wealth and beauty and talent and true love, and I’d bet at least a few of them would name Taylor Swift.","{'main': 'Why Is Everything Suddenly Taylor Swift’s Fault?', 'kicker': 'Guest Essay', 'content_kicker': None, 'print_headline': 'Why Is Everything Suddenly Taylor Swift’s Fault?', 'name': None, 'seo': None, 'sub': None}","['Swift, Taylor', 'Pop and Rock Music', 'Women and Girls', 'Social Media', 'Fans (Persons)', 'Polls and Public Opinion', 'Content Type: Personal Profile']",2024-02-10T12:00:03+0000,article,Opinion
"Midsize cultural venues are teetering on the brink. To save them, we need to fund them like other forms of essential infrastructure.",Ask any workers in the nonprofit arts sector — maybe after they have had a few drinks — and they will tell you that arts funding in this country is a mess.,"{'main': 'To Save Museums, Treat Them Like Highways', 'kicker': 'Guest Essay', 'content_kicker': None, 'print_headline': 'To Save Museums, Treat Them Like Highways', 'name': None, 'seo': None, 'sub': None}","['Museums', 'Culture (Arts)', 'Finances', 'Federal Aid (US)', 'Federal Budget (US)', 'Nonprofit Organizations', 'Philanthropy', 'National Endowment for the Arts', 'Infrastructure (Public Works)', 'United States']",2024-02-10T12:00:03+0000,article,Opinion
Readers discuss a column by Pamela Paul about children with gender dysphoria who regret their transitions.,To the Editor:,"{'main': 'The Debate Over Transgender Care and Detransitioning', 'kicker': 'letters', 'content_kicker': None, 'print_headline': 'Debate Over Transgender Care', 'name': None, 'seo': None, 'sub': None}","['Transgender', 'Homosexuality and Bisexuality', 'Children and Childhood', 'Discrimination', 'Teenagers and Adolescence', 'Youth', 'Medicine and Health']",2024-02-10T12:00:03+0000,article,Opinion
Poland voted out authoritarianism. Reproductive rights tipped the scales.,"Poland recently ousted its right-wing, nationalist Law and Justice Party. In 2020, a party-appointed tribunal severely restricted the country’s abortion rights, sparking nationwide protests and an opposition movement. After a trip to Poland, the Times Opinion columnist Michelle Goldberg came to recognize that similar dynamics could prevail in the United States in 2024. In this audio essay, she argues that Joe Biden’s campaign should take note of what a “powerful mobilizing force the backlash to abortion bans can be.”","{'main': 'Don’t Underestimate the Mobilizing Force of Abortion', 'kicker': None, 'content_kicker': None, 'print_headline': '', 'name': None, 'seo': None, 'sub': None}","['audio-neutral-informative', 'Poland', 'Politics and Government', 'Democracy (Theory and Philosophy)', 'Polls and Public Opinion', 'Tusk, Donald', 'Law and Legislation', 'Abortion', 'Law and Justice (Poland)', 'Women and Girls', 'Presidential Election of 2024', 'Trump, Donald J', 'Biden, Joseph R Jr', 'United States Politics and Government', 'Europe']",2024-02-10T12:00:06+0000,article,Opinion
The Supreme Court can put a stop to the former president’s attempts to delay his criminal trial.,The most important words to issue from the federal appeals court in Washington on Tuesday were not in its unanimous 57-page opinion rejecting Donald Trump’s claim of absolute immunity from prosecution.,"{'main': 'No More Legal Games for Donald Trump', 'kicker': 'The Editorial Board', 'content_kicker': None, 'print_headline': 'No More Legal Games For Trump', 'name': None, 'seo': None, 'sub': None}","['Trump, Donald J', 'Immunity from Prosecution', 'Supreme Court (US)', 'Federal Criminal Case Against Trump (2020 Election Case)', 'Presidential Election of 2024', 'Storming of the US Capitol (Jan, 2021)', 'United States Politics and Government']",2024-02-10T12:00:12+0000,article,Opinion
Biden must confront the age-old question.,"Once, when my father was in West Virginia on police business, a man approached him and demanded to know about “rumors” that President Franklin Roosevelt was “crippled.” The man threatened to beat up my father or anyone who said F.D.R. was in a wheelchair.","{'main': 'Mr. President, Ditch the Stealth About Health', 'kicker': 'Maureen Dowd', 'content_kicker': None, 'print_headline': 'Mr. President, Ditch the Stealth About Health', 'name': None, 'seo': None, 'sub': None}","['Biden, Joseph R Jr', 'Age, Chronological', 'Presidential Election of 2024', 'United States Politics and Government', 'Democratic Party', 'Polls and Public Opinion', 'Trump, Donald J', 'Hur, Robert Kyoung']",2024-02-10T12:00:14+0000,article,Opinion
Condense the Democratic nomination into the format that was originally designed for handling intraparty competition: the national convention.,Joe Biden should not be running for re-election. That much was obvious well before the special prosecutor’s comments on the president’s memory lapses inspired a burst of age-related angst. And Democrats who are furious at the prosecutor have to sense that it will become only more obvious as we move deeper into an actual campaign.,"{'main': 'The Question Is Not if Biden Should Step Aside. It’s How.', 'kicker': 'Ross Douthat', 'content_kicker': None, 'print_headline': 'Biden Should Step Aside. But How?', 'name': None, 'seo': None, 'sub': None}","['Biden, Joseph R Jr', 'Democratic Party', 'Democratic National Convention', 'Presidential Election of 2024', 'United States Politics and Government', 'Trump, Donald J']",2024-02-10T12:00:15+0000,article,Opinion
Study Spanish in Bolivia. Or teach English in South Korea. Or volunteer in Nepal.,"Why has the isolationist wing of Congress been blocking aid to Ukraine and become, in effect, a tool for President Vladimir Putin of Russia?","{'main': 'The Backpack You Need Isn’t for Carrying Books', 'kicker': 'Nicholas Kristof', 'content_kicker': None, 'print_headline': 'The Isolationism Antidote', 'name': None, 'seo': None, 'sub': None}","['International Study and Teaching', 'Language and Languages', 'Volunteers and Community Service', 'Colleges and Universities', 'United States Politics and Government', 'United States International Relations', 'Youth', 'Travel and Vacations']",2024-02-10T12:00:16+0000,article,Opinion
Scrappy domestic novellas and a novel about the unhappy rich.,"Dear readers,","{'main': 'Two Books From Down Under', 'kicker': None, 'content_kicker': None, 'print_headline': '', 'name': None, 'seo': None, 'sub': None}",['Books and Literature'],2024-02-10T12:50:02+0000,article,Books
"As team valuations skyrocket, the league is weighing whether to relax ownership rules that prohibit investment from private equity funds.","The biggest upcoming football event for many of the N.F.L. owners and business executives who will populate luxury boxes at the Super Bowl this weekend is not, perhaps surprisingly, the game. It actually won’t take place until six weeks later, in Orlando, Fla., when football executives gather for the National Football League’s annual meeting — an event that has particular significance this year.","{'main': 'The New N.F.L. Owners?', 'kicker': 'DealBOok Newsletter', 'content_kicker': None, 'print_headline': 'Who Can Own a Team in the N.F.L.? The Rules Might Change This Year.', 'name': None, 'seo': None, 'sub': None}","['Football', 'Private Equity', 'Athletics and Sports', 'Super Bowl']",2024-02-10T13:00:03+0000,article,Business Day
"Human remains found last month in an area of Prince Edward Island that was perilous for ships were most likely buried after a shipwreck in the 1800s, experts say.",Human bones were found protruding from the side of an eroding cliff on Prince Edward Island in Canada late last month.,"{'main': 'Bones on Canadian Beach Are Likely From a Shipwreck, but Which One?', 'kicker': None, 'content_kicker': None, 'print_headline': '', 'name': None, 'seo': None, 'sub': None}","['Shipwrecks (Historic)', 'Prince Edward Island (Canada)', 'Ships and Shipping', 'Bones', 'Sailboats and Sailing', 'Coast Erosion', 'Royal Canadian Mounted Police', 'Canada']",2024-02-10T13:00:12+0000,article,World
"The Palestine Red Crescent had issued a series of posts about the girl, named Hind, and two rescuers sent to find her after she was trapped in a car with dead relatives in it.","A 6-year-old Palestinian girl and the two rescuers who went looking for her nearly two weeks ago were found dead on Saturday, the Palestine Red Crescent said, ending a desperate effort to discover their fates.","{'main': 'Missing 6-Year-Old and Rescue Team Found Dead in Gaza, Aid Group Says', 'kicker': None, 'content_kicker': None, 'print_headline': 'Hunt for Girl, 6, Missing in Gaza Ends in Tragedy', 'name': None, 'seo': None, 'sub': None}","['Israel-Gaza War (2023- )', 'Gaza Strip', 'Palestinians', 'Civilian Casualties', 'Children and Childhood', 'Ambulances', 'Deaths (Fatalities)', 'International Federation of Red Cross and Red Crescent Societies', 'Hamas', 'Terrorism', 'Israel', 'Defense and Military Forces']",2024-02-10T14:15:18+0000,article,World
Willy Chavarria makes the case for a new (multi)national style.,"The sun had gone down on the first day of New York Fashion Week — which also happened to be the first day of the whole fashion season — when Willy Chavarria invited everyone to a drive-in on the far reaches of Greenpoint, Brooklyn.","{'main': 'The Founding Father of a New American Style', 'kicker': 'show of the day', 'content_kicker': None, 'print_headline': '', 'name': None, 'seo': None, 'sub': None}","['Fashion and Apparel', 'New York Fashion Week', 'Chavarria, Willy', 'Greenpoint (Brooklyn, NY)', 'your-feed-fashion']",2024-02-10T15:40:49+0000,article,Style
"Though we’d welcome baked Buffalo wings, bacon-Cheddar dip and Frito pie on any given Sunday.","New York Times Cooking isn’t known for its sports coverage — you’ll want to head over to The Athletic for that — but one thing we do know is snacks. We know crunchy snacks. We know melty snacks. We know savory snacks and sweet snacks and salty snacks and sour snacks and spicy snacks. So while we may struggle to explain the particulars of the Big Sports Game tomorrow, we certainly have the snacks quotient covered, and you should make Ali Slagle’s baked Buffalo wings. They’re easy, fast and a fan favorite: That classic mix of garlicky hot sauce and funky blue cheese is always a winner. We’d say to set out plenty of napkins, but let’s be real, everyone will be licking their fingers clean.","{'main': 'Super Snacks for the Super Bowl', 'kicker': None, 'content_kicker': None, 'print_headline': '', 'name': None, 'seo': None, 'sub': None}","['Cooking and Cookbooks', 'Content Type: Service']",2024-02-10T16:00:02+0000,article,Food
"Oasis and Sade will appear on the ballot for the first time, alongside Dave Matthews Band, A Tribe Called Quest, Mary J. Blige and others.","Cher, Mariah Carey, Sinead O’Connor, Oasis and Sade are among the first-time nominees for the Rock & Roll Hall of Fame’s class of 2024, which were revealed Saturday.","{'main': 'Cher, Mariah Carey and Sinead O’Connor Are Rock Hall Nominees', 'kicker': None, 'content_kicker': None, 'print_headline': 'Cher and Mariah Carey Are Among Rock Hall Nominees', 'name': None, 'seo': None, 'sub': None}","['Pop and Rock Music', 'Rhythm and Blues (Music)', 'Dave Matthews Band', 'Eric B & Rakim (Music Group)', ""Jane's Addiction"", 'Oasis (Music Group)', 'Rock and Roll Hall of Fame and Museum', 'Tribe Called Quest, A (Music Group)', 'Carey, Mariah', 'Cher (1946- )', 'Kravitz, Lenny', ""O'Connor, Sinead"", 'Osbourne, Ozzy', 'Sade', 'Frampton, Peter', 'Blige, Mary J', 'Foreigner (Music Group)']",2024-02-10T16:30:09+0000,article,Arts
