abstract,lead_paragraph,headline,keywords,pub_date,document_type,section_name
In case you need some puzzle help.,"Welcome to The Wordle Review. Be warned: This page contains spoilers for today’s puzzle. Solve Wordle first, or scroll at your own risk.","{'main': 'Today’s Wordle Review', 'kicker': None, 'content_kicker': None, 'print_headline': '', 'name': None, 'seo': None, 'sub': None}",['Wordle (Puzzle)'],2024-01-16T08:00:03+0000,article,Crosswords & Games
Mathew Bianchi took routine traffic stops seriously and handed out tickets regardless of people’s connections within the Police Department. He says he was punished for it.,"A red Mazda sped past a police officer’s unmarked car stationed at a tree-lined Staten Island intersection. The officer inside, Mathew Bianchi, clocked the Mazda at well over the limit and prepared to make a stop at a nearby streetlight. But the car blew through a red light. Bianchi turned on his siren.","{'main': 'An Idealistic Cop, a Forbidden Ticket and a Police Career on the Brink', 'kicker': None, 'content_kicker': None, 'print_headline': 'Officer’s Career May Be Undone By Ticket Taboo', 'name': None, 'seo': None, 'sub': None}","['Police', 'Police Brutality, Misconduct and Shootings', 'Nepotism', 'Traffic and Parking Violations', 'Suits and Litigation (Civil)', 'Content Type: Personal Profile', 'Bianchi, Mathew (New York, NY, Police Officer)', 'Police Department (NYC)', 'Maddrey, Jeffrey', 'Staten Island (NYC)', 'New York City', 'audio-neutral-informative']",2024-01-16T08:00:18+0000,article,New York
Feeling stuck on today’s puzzle? We can help.,"Hi busy bees! Welcome to today’s Spelling Bee forum. There are a number of terms that appear in both this article and other online discussions of the Spelling Bee; a glossary of those terms compiled by Monicat, a Times reader, can be found below.","{'main': 'Spelling Bee Forum', 'kicker': None, 'content_kicker': None, 'print_headline': '', 'name': None, 'seo': None, 'sub': None}",['Spelling Bee (Game)'],2024-01-16T08:00:19+0000,article,Crosswords & Games
In case you need some puzzle help.,"Good morning, dear connectors. Welcome to today’s Connections forum, where you can give and receive puzzle — and emotional — support.","{'main': 'The Connections Companion', 'kicker': None, 'content_kicker': None, 'print_headline': '', 'name': None, 'seo': None, 'sub': None}","['Crossword Puzzles', 'Connections (Game)']",2024-01-16T08:00:27+0000,article,Crosswords & Games
"Gov. Kathy Hochul has ordered a review of art in the Capitol that depicts Native Americans, often in ways that glorify violence against Indigenous people.","At an informal gathering last summer at the Executive Mansion in Albany, N.Y., Gov. Kathy Hochul shared an anecdote about making an unpleasant discovery there, not long after taking residence: a painting depicting the marriage of Pocahontas.","{'main': 'N.Y. Reconsiders Capitol Artworks That Offend Native Americans', 'kicker': None, 'content_kicker': None, 'print_headline': 'New York Reconsiders Capitol’s Offensive Artworks', 'name': None, 'seo': None, 'sub': None}","['Native Americans', 'Politics and Government', 'Art', 'Murals', 'Discrimination', 'Hochul, Kathleen C', 'Albany (NY)', 'New York State']",2024-01-16T08:00:33+0000,article,New York
The retired boxer’s foray into the cannabis market in New York is a test of how far a celebrity can carry a brand.,"On a recent weekend, fans of Mike Tyson, one of the greatest boxers ever, lined up by the hundreds at dispensaries in New York for a chance to meet him and to support his latest business move: selling weed in his home state.","{'main': 'Can Mike Tyson Become a Heavyweight in the New York Marijuana Industry?', 'kicker': None, 'content_kicker': None, 'print_headline': 'Already a Heavyweight in the Cannabis Market', 'name': None, 'seo': None, 'sub': None}","['Marijuana', 'Boxing', 'Celebrities', 'Tyson, Mike', 'New York State']",2024-01-16T08:00:33+0000,article,New York
"As E. Jean Carroll, whom Donald Trump assaulted decades ago, seeks millions to deter his verbal attacks, the former president tries to make a political virtue of his legal travails.","Hours after Donald J. Trump cemented his political standing with a romp through the caucus rooms of Iowa, he arrived Tuesday morning in his other world: a courtroom.","{'main': 'Jury Selection in Trump’s Defamation Trial Has Watchful Eyes: His', 'kicker': None, 'content_kicker': None, 'print_headline': '', 'name': None, 'seo': None, 'sub': None}","['Decisions and Verdicts', 'Sex Crimes', 'Compensation for Damages (Law)', 'Assaults', 'Bergdorf Goodman', 'Truth Social (Social Network)', 'CARROLL, E JEAN', 'Kaplan, Lewis A', 'Trump, Donald J']",2024-01-16T08:00:47+0000,article,New York
"Colombia created its latest, and perhaps last, national park by befriending the traditional ranching culture that surrounds it.","The llanos region spans more than 200,000 square miles through Colombia and Venezuela. Hot winds blow over its grassy hills, and scattered forests of Mauritius palms shelter hidden streams and lagoons. For centuries this landscape, shaped by ancient rivers, has been shared by ranchers and cattle, which learned to coexist with jaguars, panthers, anacondas, electric eels and crocodiles.","{'main': 'Where Anteaters and Anacondas Roam, and Ranchers Are Now Rangers', 'kicker': None, 'content_kicker': None, 'print_headline': 'On the Plains, Ranchers Are Now Rangers', 'name': None, 'seo': None, 'sub': None}","['National Parks, Monuments and Seashores', 'Parque Nacional Natural Serrania de Manacacias (Colombia)', 'Colombia', 'Agriculture and Farming', 'Conservation of Resources', 'Animals', 'Ranches', 'Anteaters', 'Nature Conservancy', 'World Wildlife Fund', 'Bove, Carol', 'AMAZON RIVER BASIN', 'your-feed-science', 'your-feed-animals']",2024-01-16T08:01:00+0000,article,Science
"Former President Donald Trump won the Iowa caucuses, while Ron DeSantis took second and Nikki Haley came in third.","Former President Donald Trump won the Iowa caucuses, while Ron DeSantis took second and Nikki Haley came in third.","{'main': 'What Happened at the Iowa Caucuses', 'kicker': None, 'content_kicker': None, 'print_headline': '', 'name': None, 'seo': None, 'sub': None}","['Primaries and Caucuses', 'Haley, Nikki R', 'Trump, Donald J', 'Iowa', 'DeSantis, Ron', 'Ramaswamy, Vivek (1985- )']",2024-01-16T09:12:17+0000,multimedia,U.S.
"Abandoning the longtime goal, however unlikely, Kim Jong-un, the North’s leader, instead threatened to subjugate South Korea in war.","North Korea’s approach toward South Korea has swayed widely over the past decades. While it has often called the South its “sworn” and “principal enemy” and threatened to “annihilate” it with nuclear weapons, at times it has also engaged in dialogue and discussed a possible reunification.","{'main': '\u200bNorth Korea Says It Is No Longer Interested in Reunifying With the South', 'kicker': None, 'content_kicker': None, 'print_headline': 'North Korea Says It No Longer Wants a Peaceful Reunification With the South', 'name': None, 'seo': None, 'sub': None}","['Politics and Government', 'International Relations', 'Korean War', 'Kim Jong-un', 'North Korea', 'South Korea', 'Yoon Suk-yeol']",2024-01-16T09:22:00+0000,article,World
"Jessica Roy’s “American Girls” traces the divergent fates of two sisters through a saga of poverty, misogyny, abuse and terrorism.","The narrative at the heart of Jessica Roy’s “American Girls” is so remarkable it could have been scripted for Hollywood: Sam and Lori Sally are sisters from the Ozarks, raised as strict Jehovah’s Witnesses. As young adults, they abandoned their faith and eventually married a pair of Moroccan-born brothers, Moussa and Yassine Elhassani, who proved domineering and violent. Lori divorced Yassine, but Sam stayed with Moussa. In 2015, she followed him from their home in Indiana all the way to Syria, where Moussa, radicalized by online propaganda, became a fighter with the Islamic State.","{'main': 'How a Young Woman From the Ozarks Wound Up an ISIS Wife in Syria', 'kicker': 'Nonfiction', 'content_kicker': None, 'print_headline': '', 'name': None, 'seo': None, 'sub': None}","['Terrorism', 'Books and Literature', 'Muslims and Islam', 'Human Trafficking', 'Indiana', 'Syria', ""American Girls: One Woman's Journey Into the Islamic State and Her Sister's Fight to Bring Her Home (Book)"", 'Roy, Jessica (Author)']",2024-01-16T10:00:14+0000,article,Books
"Research suggests that bilingual people enjoy some cognitive benefits later in life, but it probably requires more than a few Spanish lessons in your 60s.","My father decided to start learning French when he was 57. He hired a tutor to meet with him twice a week and diligently completed his homework before every lesson. Before long, he was visiting the French bakery across town to practice his pronunciation (and buy macarons). Now, 20 years later, he’s on his third tutor.","{'main': 'Can Learning a New Language Stave Off Dementia?', 'kicker': None, 'content_kicker': None, 'print_headline': 'Using Bilingualism To Delay Dementia', 'name': None, 'seo': None, 'sub': None}","['Brain', 'Language and Languages', 'Content Type: Service', 'Research', 'Dementia', 'Bilingual Education', 'Age, Chronological', 'Crossword Puzzles']",2024-01-16T10:00:14+0000,article,Well
"In “Tripping on Utopia,” Benjamin Breen chronicles the legendary anthropologist’s doomed effort to save the world through hallucinogens.","Halfway through “Tripping on Utopia: Margaret Mead, the Cold War and the Troubled Birth of Psychedelic Science,"" the historian Benjamin Breen presents a tantalizing hypothetical, one that would have had an inestimable impact on culture, medicine and perhaps the whole of civilization had it come to pass: What if, in the mid-1950s, Margaret Mead had publicly endorsed psychedelics?","{'main': 'Could LSD Have Achieved World Peace? Ask Margaret Mead.', 'kicker': 'nonfiction', 'content_kicker': None, 'print_headline': '', 'name': None, 'seo': None, 'sub': None}","['Books and Literature', 'Mead, Margaret', 'Psychedelic and Hallucinogenic Drugs', 'Cold War Era', 'LSD (Lysergic Acid Diethylamide)', 'Espionage and Intelligence Services', 'Breen, Benjamin']",2024-01-16T10:00:32+0000,article,Books
"From frozen berries to leafy greens, here’s inspiration for eating more of these Mediterranean diet superstars.",This is Day 2 of Well’s Mediterranean Diet Week. Start at the beginning here.,"{'main': 'How to Put Fruits and Vegetables at the Center of Your Plate', 'kicker': 'Mediterranean Diet Week', 'content_kicker': None, 'print_headline': '', 'name': None, 'seo': None, 'sub': None}","['Diet and Nutrition', 'Content Type: Service', 'Fruit', 'Vegetables', 'Cooking and Cookbooks', 'Mediterranean Food (Cuisine)']",2024-01-16T10:00:54+0000,article,Well
The surprising friendship that has made Donald Trump’s trade policies so durable.,"They met in the 1990s, at an event about the North American Free Trade Agreement, where they were the only people arguing against it. He was a conservative trade lawyer who filed anti-dumping cases on behalf of American steel companies and predicted that the treaty would hurt American jobs. (It did.) She was a liberal activist with a consumer advocacy organization who planned protests featuring giant puppets. Her worry was that NAFTA’s rules would hurt working people and override U.S. legal standards on food safety and the environment. (They did.)","{'main': 'Why This Unlikely Washington Friendship Endures', 'kicker': 'Farah Stockman', 'content_kicker': None, 'print_headline': 'Unlikely Co-Conspirators in the Fight Against Free Trade', 'name': None, 'seo': None, 'sub': None}","['International Trade and World Market', 'Demonstrations, Protests and Riots', 'North American Free Trade Agreement', 'United States Politics and Government', 'United States']",2024-01-16T10:00:57+0000,article,Opinion
Sounding the alarm on “the utter bleakness.”,"Former President Donald Trump handily won the Iowa caucuses on Monday night, bringing him one step closer to the Republican nomination. But was his victory inevitable?","{'main': 'Michelle Goldberg Imagines a Second Trump Inauguration', 'kicker': None, 'content_kicker': None, 'print_headline': '', 'name': None, 'seo': None, 'sub': None}","['audio-neutral-informative', 'Presidential Election of 2024', 'Democracy (Theory and Philosophy)', 'United States Politics and Government', 'United States', 'Republican Party', 'Trump, Donald J', 'Iowa', 'Primaries and Caucuses']",2024-01-16T10:01:05+0000,article,Opinion
"The case, to be argued by lawyers linked to the petrochemicals billionaire Charles Koch, could sharply curtail the government’s regulatory authority.","The Supreme Court is set to hear arguments on Wednesday that, on paper, are about a group of commercial fishermen who oppose a government fee that they consider unreasonable. But the lawyers who have helped to propel their case to the nation’s highest court have a far more powerful backer: the petrochemicals billionaire Charles Koch.","{'main': 'A Potentially Huge Supreme Court Case Has a Hidden Conservative Backer', 'kicker': None, 'content_kicker': None, 'print_headline': 'Conservative Magnate Backs Case With Potential to Disrupt Regulation', 'name': None, 'seo': None, 'sub': None}","['Koch, Charles G', 'Koch Industries Inc', 'Supreme Court (US)', 'Regulation and Deregulation of Industry', 'Law and Legislation', 'Conservatism (US Politics)', 'Fishing, Commercial', 'Suits and Litigation (Civil)', 'Citizens United v Federal Election Commission (Supreme Court Decision)', 'United States Politics and Government', 'Small Business', 'Conservation of Resources', 'Americans for Prosperity', 'Cause of Action Institute', 'Federalist Society', 'Chevron Corporation', 'Natural Resources Defense Council']",2024-01-16T10:01:32+0000,article,Climate
"A lethal combination of genetics, poor access to health care and diets high in processed foods is fueling a diabetes crisis in Latino communities, especially in Texas.","At a medical facility on the west side of San Antonio, the patients show up with disturbing regularity — most of them men. They have sores on their feet that won’t go away. And they leave with the same devastating news: Their diabetes has progressed to the point that their leg must be amputated to save their lives.","{'main': 'Diabetes Is Fueling an Amputation Crisis for Men in San Antonio', 'kicker': None, 'content_kicker': None, 'print_headline': 'Men Are Paying Diabetes’s Price In Amputations', 'name': None, 'seo': None, 'sub': None}","['Diabetes', 'AMPUTATION', 'Mexican-Americans', 'Hispanic-Americans', 'Bexar County (Tex)', 'San Antonio (Tex)', 'Texas', 'Men and Boys', 'Feet', 'Legs', 'Prostheses', 'Weight', 'Diet and Nutrition', 'audio-neutral-informative', 'audio-negative-sad']",2024-01-16T10:01:32+0000,article,U.S.
"Joe Lanteri, whose New York City Dance Alliance turns 30 this year, wants his dancers to have opportunities beyond competitions, including as college students.","The Oscar winner Ariana DeBose. The “Dancing With the Stars” judge Derek Hough. The ballet luminaries Catherine Hurlin, Tiler Peck and Taylor Stanley. Eleven cast members of last year’s Broadway production of “Bob Fosse’s Dancin’.”","{'main': 'The Man in the Sequined Tuxedo Who Built a Dance Community', 'kicker': None, 'content_kicker': None, 'print_headline': 'He Built a Community  Beyond Competitions', 'name': None, 'seo': None, 'sub': None}","['Dancing', 'New York City Dance Alliance', 'Steps on Broadway (Manhattan, NY)', 'New York City', 'Lanteri, Joe', 'Content Type: Personal Profile']",2024-01-16T10:01:32+0000,article,Arts
"Most of the awards on Monday night went to favored shows like “Succession” and “The Bear.” But the ceremony, delayed from September, still had a few surprises.",The 2023 Emmys finally happened. In 2024.,"{'main': 'Best and Worst Moments From the 2023 Emmys', 'kicker': None, 'content_kicker': None, 'print_headline': 'Best and Worst Moments From the Emmys', 'name': None, 'seo': None, 'sub': None}","['Television', 'Emmy Awards', 'Actors and Actresses', 'Beef (TV Program)', 'Succession (TV Program)', 'The Bear (TV Program)', 'Noah, Trevor (1984- )', 'APPLEGATE, CHRISTINA', 'Nash, Niecy', 'ANDERSON, ANTHONY', 'John, Elton', 'Better Call Saul (TV Program)']",2024-01-16T10:01:32+0000,article,Arts
"When Nate Berkus decorates your apartment, it’s best not to change a thing. Just ask this couple, who haven’t moved almost anything in 20 years.","When Nate Berkus decorates your apartment, it’s best not to change a thing. Just ask this couple, who haven’t moved almost anything in 20 years.","{'main': 'At Home with Patrick Page and Paige Davis', 'kicker': None, 'content_kicker': None, 'print_headline': '', 'name': None, 'seo': None, 'sub': None}","['Real Estate and Housing (Residential)', 'Home Repairs and Improvements', 'Restoration and Renovation', 'Berkus, Nate', 'Page, Patrick', 'Davis, Paige (1969- )']",2024-01-16T10:01:33+0000,multimedia,Real Estate
"Just ask the actors Patrick Page and Paige Davis, whose Upper West Side apartment has remained virtually untouched for two decades.","Patrick Page and Paige Davis met in the mid 1990s, during New York rehearsals for the first national tour of the musical “Beauty and the Beast.” But with Mr. Page working on his scenes in one studio (he played Lumière), and Ms. Davis, an ensemble member, singing and dancing in another, they didn’t really get acquainted until performances began in Minneapolis.","{'main': 'When Nate Berkus Decorates Your Home, It’s Best Not to Change a Thing', 'kicker': 'At Home With', 'content_kicker': None, 'print_headline': 'When Nate Berkus Decorates, Don’t Change a Thing', 'name': None, 'seo': None, 'sub': None}","['Interior Design and Furnishings', 'Actors and Actresses', 'Theater', 'Television', 'Page, Patrick', 'Davis, Paige (1969- )', 'Berkus, Nate', 'Upper West Side (Manhattan, NY)']",2024-01-16T10:01:34+0000,article,Real Estate
"Your water needs change as you age, and can also depend on your exercise habits and even where you live.",Q: How much water does the average person really need to drink? And is there such a thing as too much?,"{'main': 'How Much Water Do I Need to Drink?', 'kicker': 'ask well', 'content_kicker': None, 'print_headline': '', 'name': None, 'seo': None, 'sub': None}","['Water', 'Diet and Nutrition', 'Content Type: Service', 'Dehydration']",2024-01-16T10:01:35+0000,article,Well
Or do you still eagerly await the latest film release in the genre?,Are you a fan of comic books and superhero movies? Have you seen every film in the Marvel Cinematic Universe? Do you eagerly mark your calendar when the latest release date is announced? Or are you growing a little tired of the genre?,"{'main': 'Are You Growing Tired of Superhero Movies?', 'kicker': 'Student Opinion', 'content_kicker': None, 'print_headline': '', 'name': None, 'seo': None, 'sub': None}",[],2024-01-16T10:01:36+0000,article,The Learning Network
"The child care crisis, which has intensified since pandemic-era funding expired in September, is placing an undue and unhealthy burden on American parents.","On a Saturday morning last May, Julia Sachdev, a mother of a 2-year-old and 4-year-old, woke up to an email from her children’s preschool. The school — which her children adored and had been in operation for over 50 years — announced that it would be closing in a month.","{'main': 'What the Child Care Crisis Does to Parents', 'kicker': 'Guest Essay', 'content_kicker': None, 'print_headline': '', 'name': None, 'seo': None, 'sub': None}","['Child Care', 'Anxiety and Stress', 'Parenting', 'Education (Pre-School)', 'Mental Health and Disorders', 'Infrastructure (Public Works)', 'Medicine and Health']",2024-01-16T10:01:58+0000,article,Opinion
"Delving into the archives, the label’s new creative director ditches his predecessor’s pussy bows and tweaks the classics.","The headline was Gucci. The headline was always going to be Gucci, in the same way the Ever Given was destined to dominate the news cycle when the mammoth vessel, one of the largest container ships ever built, got stuck in the Suez Canal back in 2021.","{'main': 'Gucci’s Reboot Brings Back Old-School Cool', 'kicker': 'Fashion review', 'content_kicker': None, 'print_headline': 'Gucci’s Reboot Brings Back Old-School Cool', 'name': None, 'seo': None, 'sub': None}","['Gucci', 'Fashion and Apparel', 'Luxury Goods and Services', 'Fashion Shows', 'De Sarno, Sabato', 'Milan (Italy)']",2024-01-16T10:01:59+0000,article,Style
"The food industry has long touted its products as impossible to resist. But with a spotlight on the perils of compulsive eating, that tactic is getting another look.","One day about 60 years ago, the comedian Bert Lahr put on a devil suit, held up a potato chip and uttered a phrase that would become a food-marketing milestone: “Betcha can’t eat just one.”","{'main': 'In the Ozempic Age, Has ‘Craveable’ Lost Its Selling Power?', 'kicker': None, 'content_kicker': None, 'print_headline': 'Food Marketers Seek A Cravings Workaround', 'name': None, 'seo': None, 'sub': None}","['audio-neutral-informative', 'Food', 'Diet and Nutrition', 'Advertising and Marketing', 'Ozempic (Drug)', 'Addiction (Psychology)', 'Semaglutide (Drug)', 'Snack Foods']",2024-01-16T10:02:00+0000,article,Food
"They quietly became the de facto spaces to share dumb jokes, grief or even plans for an insurrection.","I am texting all the time. I am, at the very least, receiving texts all the time, a party to conversations in which I am alternately an eavesdropper and an active participant. This is because I am in a lot of group chats — constant, interlinked, text-message-based conversations among multiple friends that happen all day long. I dip into and out of these conversations, on my phone and on my computer. Sometimes I will put both away for two hours and return to find 279 new messages waiting.","{'main': 'How Group Chats Rule the World', 'kicker': None, 'content_kicker': None, 'print_headline': 'Buzz Feed', 'name': None, 'seo': None, 'sub': None}","['Text Messaging', 'Instant Messaging', 'Computers and the Internet', 'Friendship']",2024-01-16T10:02:01+0000,article,Magazine
Kristen Soltis Anderson unpacks why Republican voters want stability — and how Trump represents it.,"The fact that Donald Trump is the front-runner for the G.O.P. nomination in 2024 has created a chasm in our politics. In the past, Democrats and Republicans at least understood why members of the other party liked their chosen candidates. Most conservatives weren’t confused why liberals liked Barack Obama, and vice versa for George W. Bush. But for a lot of Democrats, it feels impossible to imagine why anyone would cast a vote for Trump. And as a result, the two parties don’t just feel hostile toward each other; they feel increasingly unknowable.","{'main': 'A Republican Pollster on Trump’s Undimmed Appeal', 'kicker': None, 'content_kicker': None, 'print_headline': '', 'name': None, 'seo': None, 'sub': None}","['audio-neutral-informative', 'United States Politics and Government', 'Presidential Election of 2024', 'Polls and Public Opinion', 'Voting and Voters', 'Anderson, Kristen Soltis (1984- )', 'Republican Party', 'Trump, Donald J', 'United States']",2024-01-16T10:02:01+0000,article,Opinion
"Inspired by her own experience, Representative Anna Paulina Luna of Florida has broken with her party to call for proxy voting for female members of Congress for six weeks after giving birth.","When she arrived in Congress last year, Representative Anna Paulina Luna, a hard-right Republican from Florida, joined the rest of her party in staunchly opposing proxy voting, a practice adopted by House Democrats to allow for remote legislating during the pandemic.","{'main': 'A New Republican Mom Wants to Change House Rules for Postpartum Voting', 'kicker': 'Congressional Memo', 'content_kicker': None, 'print_headline': 'New G.O.P. Mom Backs Proxy Voting Change She Once Fought', 'name': None, 'seo': None, 'sub': None}","['United States Politics and Government', 'Women and Girls', 'Pregnancy and Childbirth', 'Workplace Environment', 'House of Representatives', 'Republican Party', 'Luna, Anna Paulina']",2024-01-16T10:02:02+0000,article,U.S.
We should amend the Constitution to grant an affirmative right to vote.,"The history of voting in the United States shows the high cost of living with an old Constitution, unevenly enforced by a reluctant Supreme Court.","{'main': 'The U.S. Lacks What Every Democracy Needs', 'kicker': 'Guest Essay', 'content_kicker': None, 'print_headline': 'The U.S. Lacks What Every Democracy Needs', 'name': None, 'seo': None, 'sub': None}","['Presidential Election of 2024', 'Voting Rights, Registration and Requirements', 'Law and Legislation', 'Constitution (US)', 'Democracy (Theory and Philosophy)', 'United States Politics and Government', 'Democratic Party', 'Republican Party', 'Supreme Court (US)']",2024-01-16T10:02:12+0000,article,Opinion
