abstract,lead_paragraph,headline,keywords,pub_date,document_type,section_name
"Like Meta, the company opened access to its technology to outside programmers, but kept its most powerful system under wraps.","When Meta shared the raw computer code needed to build a chatbot last year, rival companies said Meta was releasing poorly understood and perhaps even dangerous technology into the world.","{'main': 'Google Is Giving Away Some of the A.I. That Powers Chatbots', 'kicker': None, 'content_kicker': None, 'print_headline': 'Google Shares A.I. Coding  That Powers  Its Chatbot', 'name': None, 'seo': None, 'sub': None}","['Artificial Intelligence', 'Computers and the Internet', 'Open-Source Software', 'Google Inc', 'Meta Platforms Inc', 'OpenAI Labs']",2024-02-21T13:00:07+0000,article,Technology
"Wall Street is closely watching the semiconductor giant’s earnings report, as questions swirl over its massive stock market valuation on the back of the boom in artificial intelligence.","The stock price of the chip giant Nvidia has marched steadily higher over the past year and a half, propelled by investors’ hopes that artificial intelligence is truly transformative technology — and by their hope that the company’s high-end semiconductors will continue to power that technology.","{'main': 'The Chips Riding on Nvidia', 'kicker': 'DealBook Newsletter', 'content_kicker': None, 'print_headline': '', 'name': None, 'seo': None, 'sub': None}","['internal-storyline-no', 'Stocks and Bonds', 'Computers and the Internet', 'Artificial Intelligence', 'NVIDIA Corporation', 'Google Inc', 'Meta Platforms Inc', ""Standard & Poor's 500-Stock Index""]",2024-02-21T13:20:36+0000,article,Business Day
"The American assessments are divided, however, and President Vladimir Putin denied having such an intention, saying that Russia was “categorically against” it.","American intelligence agencies have told their closest European allies that if Russia is going to launch a nuclear weapon into orbit, it will probably do so this year — but that it might instead launch a harmless “dummy” warhead into orbit to leave the West guessing about its capabilities.","{'main': 'U.S. Warns Allies Russia Could Put a Nuclear Weapon Into Orbit This Year', 'kicker': None, 'content_kicker': None, 'print_headline': 'Moscow Could Send Nuclear Weapon Into Orbit, U.S. Warns Allies', 'name': None, 'seo': None, 'sub': None}","['International Relations', 'Nuclear Weapons', 'Strategic Arms Reduction Treaty', 'Defense and Military Forces', 'United States International Relations', 'Russian Invasion of Ukraine (2022)', 'Space and Astronomy', 'Espionage and Intelligence Services', 'Satellites', 'National Intelligence Estimates', 'Cyberharassment', 'US Intelligence Documents Leak (2023)', 'Earth', 'United States Politics and Government', 'Nuclear Tests', 'North Atlantic Treaty Organization', 'Senate', 'Blinken, Antony J', 'Putin, Vladimir V', 'Shoigu, Sergei K', 'Russia', 'Europe', 'United States', 'audio-neutral-informative', 'audio-neutral-suspenseful']",2024-02-21T13:47:10+0000,article,World
"Scientists debate whether this object is the brightest in the visible universe, as a new study suggests.","Astronomers claimed on Monday that they had discovered what might be the hungriest, most luminous object in the visible universe — a supermassive black hole that was swallowing a star a day. That would be the mass equivalent of 370 suns a year disappearing down a cosmic gullet 11 billion years ago at the dawn of time.","{'main': 'A Voracious Black Hole at the Dawn of Time?', 'kicker': 'Out There', 'content_kicker': None, 'print_headline': 'The Very Hungry Black Hole at the Dawn of Time', 'name': None, 'seo': None, 'sub': None}","['Space and Astronomy', 'James Webb Space Telescope', 'Black Holes (Space)', 'Stars and Galaxies', 'Quasars', 'Australian National University', 'European Space Agency', 'Nature Astronomy (Journal)', 'Wolf, Christian']",2024-02-21T13:55:44+0000,article,Science
"A reader had hoped that her grandmother’s ring would stay in the family, perhaps to pass on to her daughter, but her former sister-in-law has so far refused to give it back.","When my brother got engaged, he gave his fiancée — with my blessing — a ring that is a family heirloom. It belonged to our grandmother, who died before we were born. It didn’t occur to me that the ring was possibly leaving our family, which is what happened when they later divorced. My brother asked his ex-wife if she would return the ring, but she refused. I’ve tried to let this go: It’s just an object and not worth a lot of money, but I still harbor hard feelings. I was fond of my former sister-in-law; she was sweet to me and my kids. But we don’t have many things that belonged to my grandparents, and I’d rather give the ring to my daughter than let a stranger hang on to it. (My brother’s ex-wife doesn’t have children.) May I ask for it back?","{'main': 'My Brother’s Ex-Wife Won’t Return a Family Heirloom. Help!', 'kicker': 'Social Q’s', 'content_kicker': None, 'print_headline': 'One-Ring Circus', 'name': None, 'seo': None, 'sub': None}","['Customs, Etiquette and Manners']",2024-02-21T14:00:02+0000,article,Style
"Also, did you know Oregon has two time zones?","Oregon’s state senate failed to advance a bill on Tuesday that would have abolished daylight saving time in most of the state and switched it to standard time for the entire year, the latest chapter in an effort by states to settle on whether clocks need to fall back or spring forward at all.","{'main': 'Oregon Tries and Fails to Eliminate Daylight Saving Time, for Now', 'kicker': None, 'content_kicker': None, 'print_headline': '', 'name': None, 'seo': None, 'sub': None}","['Law and Legislation', 'State Legislatures', 'Daylight Saving Time', 'Politics and Government', 'Seasons and Months', 'Franklin, Benjamin', 'Oregon']",2024-02-21T14:00:26+0000,article,U.S.
"Pakistanis once thought of the military as the iron hand controlling the country’s politics. That illusion has been broken following a contested election in early February, creating one of the establishment’s biggest crises yet.","Pakistanis once thought of the military as the iron hand controlling the country’s politics. That illusion has been broken following a contested election in early February, creating one of the establishment’s biggest crises yet.","{'main': 'How an Election Shattered the Image of Pakistan’s Military', 'kicker': None, 'content_kicker': None, 'print_headline': '', 'name': None, 'seo': None, 'sub': None}","['Politics and Government', 'Elections', 'Pakistan']",2024-02-21T14:04:12+0000,multimedia,World
Images of one ambush attempt show several dozen young men briefly forcing aid trucks off a highway and throwing stones at them.,"Amid widespread food shortages and a breakdown in civil order, groups of desperate civilians in Gaza are regularly attempting to ambush aid convoys, according to two Western officials who were recently in the enclave and images of one such ambush reviewed by The New York Times.","{'main': 'Amid Food Shortages, People in Gaza Are Ambushing Aid Convoys', 'kicker': None, 'content_kicker': None, 'print_headline': 'Food Scarce, Some in Need Try to Rush Aid Convoys', 'name': None, 'seo': None, 'sub': None}","['Israel-Gaza War (2023- )', 'Gaza Strip', 'Palestinians', 'Humanitarian Aid', 'Food Insecurity', 'Shortages', 'Hamas', 'Terrorism', 'Israel', 'Defense and Military Forces']",2024-02-21T14:06:19+0000,article,World
Voters will choose nominees for president and weigh in on state and local contests that could have big ramifications.,Primary season is officially underway for the 22 million registered voters in California.,"{'main': 'Key Races to Watch in California’s March 5 Primary', 'kicker': 'California Today', 'content_kicker': None, 'print_headline': '', 'name': None, 'seo': None, 'sub': None}",['California'],2024-02-21T14:07:13+0000,article,U.S.
Blue Origin’s New Glenn rocket rolled to the launchpad for a series of tests in preparation for its flight debut later this year.,"There’s an easy knock against the space dreams of Jeff Bezos and his rocket company, Blue Origin: In its 24th year of existence, the company has yet to launch a single thing to orbit.","{'main': 'Jeff Bezos’ Big Rocket Moves Into View and Closer to Launch', 'kicker': None, 'content_kicker': None, 'print_headline': 'Blue Origin Rocket Edges Closer to Its First Orbital Launch', 'name': None, 'seo': None, 'sub': None}","['Private Spaceflight', 'Blue Origin', 'Bezos, Jeffrey P', 'Space and Astronomy', 'Earth', 'Rocket Science and Propulsion', 'European Space Agency', 'National Aeronautics and Space Administration', 'Limp, David']",2024-02-21T14:29:48+0000,article,Science
A best actress nomination changes everything — Sandra Hüller knows that. She just isn’t sure that’s a good thing.,"After Sandra Hüller learned that two movies she stars in — “Anatomy of a Fall” and “The Zone of Interest” — had been selected for the competition at last year’s Cannes Film Festival, she was a little apprehensive about what it might mean for her anonymity. The German actress has always had a prickly relationship with fame: Aside from her role in the bittersweet 2016 feature “Toni Erdmann,” she has mainly kept a low profile, working in German theater.","{'main': 'A Top Oscar Nominee, Uneasy in the Spotlight', 'kicker': None, 'content_kicker': None, 'print_headline': 'Surprise Spotlight Focuses On a Stage Veteran', 'name': None, 'seo': None, 'sub': None}","['Movies', 'Huller, Sandra', 'Anatomy of a Fall (Movie)', 'The Zone of Interest (Movie)', 'Content Type: Personal Profile', 'Academy Awards (Oscars)']",2024-02-21T14:31:19+0000,article,Movies
"The former president, Juan Orlando Hernández, went on trial Wednesday in Manhattan, accused of years of misrule funded by cocaine proceeds.","Brick after brick of cocaine flowed for years into the United States from countries like Venezuela and Colombia, all of it funneled through the tiny Central American nation of Honduras.","{'main': 'Ex-President Made Honduras a Safe Haven for Drug Gangs, Prosecutors Say', 'kicker': None, 'content_kicker': None, 'print_headline': 'Ex-Leader of Honduras Goes to Trial on Charges Tied to Drug Smuggling', 'name': None, 'seo': None, 'sub': None}","['Honduras', 'Hernandez, Juan Orlando', 'Drug Abuse and Traffic', 'Politics and Government', 'Bribery and Kickbacks', 'Drug Cartels', 'Murders, Attempted Murders and Homicides', 'Medellin Cartel', 'New York City']",2024-02-21T15:00:06+0000,article,New York
The TaxiFilmFest is partly a protest over the miserable state of Berlin’s taxi industry. But it’s also a celebration of the cab’s iconic place in the urban cultural landscape.,"Some of international cinema’s biggest names gathered on Tuesday night at the Berlin International Film Festival as the event honored Martin Scorsese with a lifetime achievement award. Before accepting his trophy, Scorsese listened as the German director Wim Wenders gave a laudatory speech to an audience including celebrities and local dignitaries.","{'main': 'A Film Festival in the Back of a Taxi', 'kicker': None, 'content_kicker': None, 'print_headline': 'Cannes? Sundance? No, the Back of a Berlin Taxi.', 'name': None, 'seo': None, 'sub': None}","['Movies', 'Taxicabs and Taxicab Drivers', 'Berlin International Film Festival', 'Scorsese, Martin', 'Taxi (Movie)', 'Taxi Driver (Movie)', 'Berlin (Germany)']",2024-02-21T15:20:04+0000,article,Movies
How did your relationship go from “hey” to heartfelt? We want to see the messages that started it all — and hear about what happened next.,"Not long ago, nearly every initial conversation with a potential romantic partner was in person or over the phone. Now, they’re increasingly digital — taking place on dating apps, over text or in direct messages on social media. What were some of the first online words you exchanged with the person you’re with? Do you still have a record of that conversation on your phone or laptop?","{'main': 'In Love? Share Screenshots of Your First Digital Exchanges', 'kicker': 'Modern Love', 'content_kicker': None, 'print_headline': '', 'name': None, 'seo': None, 'sub': None}","['Love (Emotion)', 'Dating and Relationships', 'Text Messaging', 'Social Media', 'internal-reader-callout']",2024-02-21T15:32:59+0000,article,Style
China’s tech firms were caught off guard by breakthroughs in generative artificial intelligence. Beijing’s regulations and a sagging economy aren’t helping.,"In November, a year after ChatGPT’s release, a relatively unknown Chinese start-up leaped to the top of a leaderboard that judged the abilities of open-source artificial intelligence systems.","{'main': 'China’s Rush to Dominate A.I. Comes With a Twist: It Depends on U.S. Technology', 'kicker': None, 'content_kicker': None, 'print_headline': 'In the A.I. Race, China Lags Over a Year Behind the U.S.', 'name': None, 'seo': None, 'sub': None}","['China', 'Artificial Intelligence', 'Politics and Government', 'Foreign Investments', 'Computers and the Internet', 'Regulation and Deregulation of Industry', 'International Relations', 'Innovation', 'Start-ups', 'Computer Vision', 'ChatGPT', 'Open-Source Software', 'Computer Chips', 'Alibaba Group Holding Ltd', 'Beijing Bytedance Technology Co Ltd', 'Meta Platforms Inc', 'OpenAI Labs', 'Lee, Kai-Fu']",2024-02-21T15:43:42+0000,article,Technology
"Under intensifying scrutiny from U.S. lawmakers, top firms have pulled back from investing in Chinese start-ups.","DCM Ventures, a Silicon Valley venture capital firm, began investing in China’s start-ups in 1999. The move reaped such blockbuster returns that in 2021, DCM said it planned to “double down” on its strategy of investing in China, the United States and Japan.","{'main': 'Silicon Valley Venture Capitalists Are Breaking Up With China', 'kicker': None, 'content_kicker': None, 'print_headline': 'Tech Venture Capitalists Are Breaking Up With China', 'name': None, 'seo': None, 'sub': None}","['Foreign Investments', 'United States Politics and Government', 'Venture Capital', 'Computers and the Internet', 'Politics and Government', 'Start-ups', 'International Relations', 'Surveillance of Citizens by Government', 'Facial Recognition Software', 'Communist Party of China', 'DCM (Venture Capital Firm)', 'GGV Capital', 'Sequoia Capital', 'China', 'Silicon Valley (Calif)']",2024-02-21T15:44:16+0000,article,Technology
"The tower, once used to send telecom traffic, has been sold and will be transformed by the company that turned the TWA terminal at Kennedy Airport into a hotel.","St. Paul’s Cathedral, the Tower of London and the London Eye are all important landmarks in Britain’s capital. Yet you can’t spend the night in any of them.","{'main': 'The BT Tower, a Once-Futuristic London Landmark, Will Become a Hotel', 'kicker': None, 'content_kicker': None, 'print_headline': 'BT Tower in London Sold to an American Group, With Plans to Make It a Hotel', 'name': None, 'seo': None, 'sub': None}","['London (England)', 'Historic Buildings and Sites', 'BT Group PLC', 'Hotels and Travel Lodgings', 'MCR Hotels', 'Mergers, Acquisitions and Divestitures', 'Real Estate (Commercial)']",2024-02-21T15:56:54+0000,article,Business Day
"All the flavors and comfort of a classic lasagna in an easy, one-pot weeknight dinner.","Of all the wildly popular American takes on Italian cuisine (spaghetti and meatballs; fettuccine Alfredo; chicken Parmesan), the latest to go viral is lasagna soup, thanks to one TikTok user with a Lego set and a thing for pasta. Christina Morales got the whole story for The New York Times, and naturally we have the recipe. It retains everything you love about lasagna — the tomatoey marinara, spicy Italian sausage, soft sheets of pasta and milky ricotta cheese — and simmers it together with chicken stock to create the red sauced comfort food of your dreams.","{'main': 'If Garfield Made Soup, He’d Make This Soup', 'kicker': None, 'content_kicker': None, 'print_headline': '', 'name': None, 'seo': None, 'sub': None}","['Cooking and Cookbooks', 'Content Type: Service']",2024-02-21T16:00:02+0000,article,Food
Unusual experiments on organs recovered from three carcasses suggest how baleen whales call out at sea.,"People have told stories of strange underwater sounds for thousands of years, but it took until the mid-20th century for scientists to pinpoint one of the causes: whales, singing and whistling and squeaking in the blue.","{'main': 'These Whales Still Use Their Vocal Cords. But How?', 'kicker': 'Trilobites', 'content_kicker': None, 'print_headline': 'Big Voices: These Whales Still Use Their Vocal Cords. But How?', 'name': None, 'seo': None, 'sub': None}","['your-feed-science', 'Whales and Whaling', 'Voice and Speech', 'Animal Behavior', 'Fish and Other Marine Life', 'Larynx', 'Research', 'Acoustics']",2024-02-21T16:00:08+0000,article,Science
"We invite students to create a short video that defines or teaches one of our recent Words of the Day. Contest dates: Feb. 28-March 27, 2024.",Do you love the magic of words? Do you enjoy showing off your vocabulary — or finding new ways to expand it? And do you appreciate brevity — keeping things short and sweet?,"{'main': 'Our 11th Annual 15-Second Vocabulary Video Challenge', 'kicker': 'Contests', 'content_kicker': None, 'print_headline': '', 'name': None, 'seo': None, 'sub': None}",[],2024-02-21T16:07:46+0000,article,The Learning Network
"A local town’s vote against the U.S. automaker’s proposed expansion is nonbinding, but citizens expect it to be honored.","Residents in the German community where Tesla has its only assembly plant in Europe overwhelming rejected the company’s plan to expand its facilities, dealing a blow to the U.S. automaker and local supporters.","{'main': 'Let Tesla Expand? Germans Vote No.', 'kicker': None, 'content_kicker': None, 'print_headline': '', 'name': None, 'seo': None, 'sub': None}","['Tesla Motors Inc', 'Local Government', 'Electric and Hybrid Vehicles', 'Automobiles', 'BRANDENBURG (GERMANY)', 'Grunheide (Mark) (Germany)', 'Factories and Manufacturing']",2024-02-21T16:13:13+0000,article,Business Day
"The president announced another $1.2 billion in forgiveness, bringing the total canceled to $138 billion. But the piecemeal efforts have garnered him little praise.","After the Supreme Court struck down President Biden’s plan to cancel billions of dollars in student loan debt, borrowers wondered how he would make good on his promise to tackle debt burdening millions of Americans.","{'main': 'Biden Chips Away at Student Loan Debt, Bit by Bit, Amid High Expectations', 'kicker': None, 'content_kicker': None, 'print_headline': 'Biden Cancels $1.2 Billion in Student Debt, Addressing Issue on the Trail', 'name': None, 'seo': None, 'sub': None}","['Biden, Joseph R Jr', 'Democratic Party', 'United States Politics and Government', 'Student Loans', 'Executive Orders and Memorandums', 'Colleges and Universities', 'Community Colleges']",2024-02-21T16:17:35+0000,article,U.S.
Responses to an essay that suggested treating cultural spaces like infrastructure. Also: U.S. Steel; immigration; a no-victims defense; a shadow government.,To the Editor:,"{'main': 'Rethinking How We Fund the Arts in America', 'kicker': 'letters', 'content_kicker': None, 'print_headline': 'Rethinking How We Fund the Arts', 'name': None, 'seo': None, 'sub': None}","['Museums', 'Art', 'Infrastructure (Public Works)', 'Finances', 'United States Steel Corporation', 'Nippon Steel Corporation', 'Steel and Iron', 'Global Warming', 'United States Politics and Government', 'Immigration and Emigration', 'Biden, Joseph R Jr', 'Trump, Donald J', 'Republican Party']",2024-02-21T16:50:03+0000,article,Opinion
"After a dramatic rise in business and society, the art-world mogul Louise Blouin finds herself unloading a Hamptons dream home in bankruptcy court.","“I haven’t made many mistakes,” Louise Blouin said soon after her compound in the Hamptons was sold out from under her in a bankruptcy auction. “You can’t judge someone because they have an issue once in their life. I’m sure Steve Jobs didn’t have a perfect track record.”","{'main': '$89 Million Can’t Fix Her Mistakes', 'kicker': None, 'content_kicker': None, 'print_headline': 'Mistakes That $89 Million Can’t Fix', 'name': None, 'seo': None, 'sub': None}","['Blouin, Louise T', 'Hamptons (NY)', 'Real Estate and Housing (Residential)', 'Auctions', 'Louise Blouin Media Inc', ""Sotheby's"", 'Personal Bankruptcies', 'Art']",2024-02-21T16:50:59+0000,article,Style
"The United States urged the International Court of Justice not to call for immediate withdrawal of Israel from Palestinian territories, and to consider the country’s security needs.","The United States urged the International Court of Justice not to call for immediate withdrawal of Israel from Palestinian territories, and to consider the country’s security needs.","{'main': 'U.S. Defends Israeli Occupation of Palestinian Territories', 'kicker': None, 'content_kicker': None, 'print_headline': '', 'name': None, 'seo': None, 'sub': None}","['International Court of Justice (UN)', 'United States', 'Israel', 'Palestinians']",2024-02-21T16:53:47+0000,multimedia,World
"In an effort to program contemporary works, the company will present recent operas by Jeanine Tesori, John Adams, Jake Heggie and Osvaldo Golijov.","Contemporary works will be front and center in the coming season, the Metropolitan Opera announced on Wednesday, with four company premieres among its six new productions.","{'main': 'The Met Opera’s New Season: What We Want to See', 'kicker': None, 'content_kicker': None, 'print_headline': 'Contemporary Works for the Met', 'name': None, 'seo': None, 'sub': None}","['Opera', 'Metropolitan Opera', 'Antony and Cleopatra (2022) (Opera)', 'Fidelio (Opera)', 'Grounded (Opera)', 'La Boheme (Opera)', 'The Magic Flute (Opera)', 'The Queen of Spades (Opera)']",2024-02-21T17:00:09+0000,article,Arts
"With “Part Two” hitting theaters, they discuss another potential sequel, the impossible quest for onscreen perfection and those infamous popcorn buckets.","The director Denis Villeneuve and the actor Timothée Chalamet bound into the room talking at, and over, each other in rapid French. Villeneuve is from Quebec; Chalamet was born in New York City but has dual American and French citizenship. Together, they’re a dynamic tag team dressed near-identically in head-to-toe black, although Chalamet’s shiny leather layers have more swagger. The topic of the day is galactic genocide and dubious messiahs, central themes in “Dune: Part Two,” the second installment of their cerebral space epic based on the 1965 novel by Frank Herbert. Yet, the pair are prone to giggle fits.","{'main': 'Denis Villeneuve and Timothée Chalamet: ‘Dune’ Dynasty', 'kicker': None, 'content_kicker': None, 'print_headline': 'Back to ‘Dune,’ Finding Fun in Chaos', 'name': None, 'seo': None, 'sub': None}","['Movies', 'Actors and Actresses', 'Chalamet, Timothee (1995- )', 'Villeneuve, Denis', 'Dune (Movie)', 'Herbert, Frank', 'Dune: Part Two (Movie)']",2024-02-21T17:00:16+0000,article,Movies
His drumming lent spontaneity and imagination to the unfettered sound of seminal rock ’n’ roll records by Jerry Lee Lewis and others.,"Jimmy Van Eaton, who played drums on epoch-defining hits, including Jerry Lee Lewis’s “Great Balls of Fire” and “Whole Lotta Shakin’ Goin’ On,” and lent spontaneity and imagination to the unfettered sound of the influential Memphis label Sun Records, died on Feb. 9 at his home in Tuscumbia, Ala. He was 86.","{'main': 'Jimmy Van Eaton, Purveyor of the Sun Records Beat, Dies at 86', 'kicker': None, 'content_kicker': None, 'print_headline': 'Jimmy Van Eaton, 86, Drummer Who Added to Sound of Sun Records', 'name': None, 'seo': None, 'sub': None}","['Van Eaton, Jimmy (1937-2024)', 'Deaths (Obituaries)', 'Pop and Rock Music', 'Drums', 'Sun Records', 'Lewis, Jerry Lee', 'Riley, Billy Lee']",2024-02-21T17:04:24+0000,article,Arts
The magazine’s Ethicist columnist on bookstore etiquette.,"At the local Barnes & Noble, the in-store coffee shop is next to the vast selection of magazines for sale. Many coffee drinkers grab multiple magazines and take them to their table with their coffee and read them. After coffee, most, but not all, put the magazines back in the racks without paying for them. They are “stealing” content that is meant to be purchased. Is this a form of shoplifting? — Name Withheld","{'main': 'Are People Who Read Magazines Without Paying ‘Stealing’ Their Content?', 'kicker': 'The Ethicist', 'content_kicker': None, 'print_headline': '', 'name': None, 'seo': None, 'sub': None}","['Ethics (Personal)', 'internal-sub-only-nl', 'Magazines', 'Barnes & Noble Inc', 'Books and Literature', 'Shoplifting and Employee Theft (Retail)']",2024-02-21T17:08:13+0000,article,Magazine
"Nearly 10 percent of South Carolina voters were not in the state when Nikki Haley left office in 2017, and many newcomers brought with them an affection for Donald Trump.",Follow for live updates on the 2024 presidential election.,"{'main': 'Nikki Haley Can’t Count on South Carolina’s Newcomers for Help', 'kicker': None, 'content_kicker': None, 'print_headline': 'In South Carolina, An Affinity for Trump Among Newcomers', 'name': None, 'seo': None, 'sub': None}","['United States Politics and Government', 'Presidential Election of 2024', 'Primaries and Caucuses', 'Haley, Nikki R', 'Trump, Donald J', 'South Carolina', 'Charleston (SC)']",2024-02-21T17:16:04+0000,article,U.S.
