abstract,lead_paragraph,headline,keywords,pub_date,document_type,section_name
The West African country had planned to hold an election in three weeks. But President Macky Sall canceled it indefinitely pending an inquiry into corruption allegations at the constitutional court.,"Senegal’s president has canceled the election for his replacement three weeks before voting was set to take place, saying that a dispute between the legislative and judicial arms of government needed to be resolved first.","{'main': 'Senegal’s President Calls Off a National Election. His Critics Call It a Coup.', 'kicker': None, 'content_kicker': None, 'print_headline': 'Senegal’s President Calls Off Election', 'name': None, 'seo': None, 'sub': None}","['Senegal', 'Constitutions', ""Coups D'Etat and Attempted Coups D'Etat"", 'Sall, Macky', 'Sonko, Ousmane', 'Dakar (Senegal)', 'Elections']",2024-02-03T16:22:43+0000,article,World
"Ever wary of the Eastern establishment, President Johnson needed advice before a formal luncheon at The New York Times in 1964.","President Lyndon B. Johnson, a rough-and-tumble Texan, simultaneously held the Eastern establishment in contempt and understood the need to cultivate its leaders.","{'main': 'Lyndon B. Johnson, Reluctant Lunch Guest', 'kicker': 'In Times Past', 'content_kicker': None, 'print_headline': '', 'name': None, 'seo': None, 'sub': None}","['Politics and Government', 'CBS Corporation', 'Johnson, Lyndon Baines', 'Oakes, John B', 'Stanton, Frank N', 'Sulzberger, Arthur Hays']",2024-02-03T16:30:12+0000,article,Times Insider
A new law requires greater transparency by the police about their interactions with the public. Mayor Eric Adams and police officials call the law onerous.,"The New York City Council last week required police officers to record the race, age and gender of most people they approach, overriding Mayor Eric Adams’s veto and establishing a law that its supporters say will give a fuller picture of whom officers are stopping during investigations.","{'main': 'Race, Age, Gender: What the N.Y.P.D. Must Track During Stops, and Why', 'kicker': None, 'content_kicker': None, 'print_headline': 'N.Y.P.D. Told to Track Race, Age and Gender In Stops. Here’s Why.', 'name': None, 'seo': None, 'sub': None}","['Law and Legislation', 'City Councils', 'Police', 'Local Government', 'City Council (NYC)', 'Police Department (NYC)', 'New York City', 'Police Reform']",2024-02-03T16:50:31+0000,article,New York
American airstrikes hit Iran-linked targets in Syria and Iraq to retaliate for the recent killing of three U.S. soldiers in Jordan.,"As Iran and the United States assessed the damage done by American airstrikes in Syria and Iraq on Friday, the initiative suddenly shifted to Tehran and its pending decision whether to respond or to take the hit and de-escalate.","{'main': 'U.S. Strikes Test Iran’s Will to Escalate', 'kicker': 'News Analysis', 'content_kicker': None, 'print_headline': 'As U.S. Acts, Biden Deems Iran Unlikely to Shoot Back', 'name': None, 'seo': None, 'sub': None}","['United States International Relations', 'Israel-Gaza War (2023- )', 'Defense and Military Forces', 'Hamas', 'Islamic Revolutionary Guards Corps']",2024-02-03T16:54:43+0000,article,U.S.
"The Palestine Red Crescent said the girl, named Hind, was in a car in northern Gaza with six of her relatives who were all killed by Israeli fire. She was the sole survivor.","The post by the Palestine Red Crescent was a haunting plea, hoping to learn the fate of three people not heard from for five days.","{'main': 'Gaza Rescuers Go Missing on Mission to Save Girl Trapped in a Car', 'kicker': None, 'content_kicker': None, 'print_headline': 'Missing Girl, Her Rescuers, And Urgency For Answers', 'name': None, 'seo': None, 'sub': None}","['Israel-Gaza War (2023- )', 'Gaza Strip', 'Palestinians', 'Civilian Casualties', 'International Federation of Red Cross and Red Crescent Societies', 'Ambulances', 'Rescues', 'Humanitarian Aid', 'Israel', 'Defense and Military Forces']",2024-02-03T17:15:29+0000,article,World
Get live election results and maps from the South Carolina Democratic primary.,Get live election results and maps from the South Carolina Democratic primary.,"{'main': 'South Carolina Democratic Primary Results', 'kicker': None, 'content_kicker': None, 'print_headline': '', 'name': None, 'seo': None, 'sub': None}","['internal-paywall-exempt', 'South Carolina', 'Presidential Election of 2024', 'Biden, Joseph R Jr', 'Williamson, Marianne', 'Phillips, Dean B', 'Primaries and Caucuses']",2024-02-03T18:09:06+0000,multimedia,U.S.
"As a supervisor at America’s largest yeshiva, he wielded influence across the world of ultra-Orthodox Jews. He feared that the internet jeopardized the observance of Jewish customs.","Rabbi Matisyahu Salomon, a longtime spiritual counselor at America’s largest yeshiva who spearheaded a crusade to warn observant Jews of the risks posed by the internet, died on Jan. 2 in Lakewood, N.J. He was 86.","{'main': 'Matisyahu Salomon, 86, Dies; Rabbi Warned of Internet’s Dangers', 'kicker': None, 'content_kicker': None, 'print_headline': 'Rabbi Matisyahu Salomon, 86, Who Warned of Internet’s Dangers, Dies', 'name': None, 'seo': None, 'sub': None}","['Salomon, Matisyahu (1937-2024)', 'Deaths (Obituaries)', 'Jews and Judaism', 'Orthodox Judaism', 'Hasidism', 'Rabbis', 'Computers and the Internet', 'AGUDATH ISRAEL OF AMERICA']",2024-02-03T18:27:17+0000,article,New York
"In a widely viewed TikTok video, a high school history teacher highlighted the errors, which appeared in a “Civil Rights Magnetic Learning Activity.”","Target has pulled from its stores an educational magnet collection that misidentified three Black leaders, after a high school history teacher called attention to the errors in a TikTok video.","{'main': 'Target Pulls Magnet Kit That Misidentified Three Black Leaders', 'kicker': None, 'content_kicker': None, 'print_headline': 'Target Pulls  Magnet Kit Misnaming 3 Black Men', 'name': None, 'seo': None, 'sub': None}","['Black People', 'Blacks', 'Race and Ethnicity', 'History (Academic Subject)', 'Target Corporation', 'Du Bois, W E B', 'Washington, Booker T', 'Woodson, Carter G', 'Bendon Publishing']",2024-02-03T18:56:38+0000,article,Business Day
The move comes as the Senate is racing to finalize and vote on a bill that would also include new border policies and funding for the war in Ukraine.,"Speaker Mike Johnson pledged Saturday that the House would hold a vote next week on legislation to speed $17.6 billion in security assistance to Israel with no strings attached, a move likely to complicate Senate leaders’ efforts to rally support for a broader package with border security measures and aid to Ukraine.","{'main': 'House G.O.P. Plans Vote on Israel Aid as Senate Tries to Close Broader Deal', 'kicker': None, 'content_kicker': None, 'print_headline': 'House G.O.P. Plans Vote On Stand-Alone Aid for Israel', 'name': None, 'seo': None, 'sub': None}","['United States Politics and Government', 'Israel-Gaza War (2023- )', 'United States International Relations', 'Israel', 'Gaza Strip', 'Johnson, Mike (1972- )', 'Schumer, Charles E', 'House of Representatives', 'Republican Party', 'Senate']",2024-02-03T19:19:57+0000,article,U.S.
"The death toll is expected to rise as hundreds have been reported missing in the blazes near the cities of Viña del Mar and Valparaíso, an area home to more than a million people.","Forest fires ripping through central Chile’s coastal hills since Friday have killed at least 51 people and destroyed more than 1,000 homes, with many more feared dead, according to the national government.","{'main': 'Wildfires Threaten 2 Chilean Cities, Destroying 1,000 Homes and Killing Dozens', 'kicker': None, 'content_kicker': None, 'print_headline': 'Wildfires Threatening 2 Chilean Cities Destroy 1,000 Homes and Kill at Least 46', 'name': None, 'seo': None, 'sub': None}","['Wildfires', 'Boric, Gabriel', 'Chile']",2024-02-03T22:03:03+0000,article,World
"The airstrikes, meant to deter attacks on ships in the Red Sea, came one day after the United States struck at other Iran-backed militias in Iraq and Syria.","The United States and Britain carried out large-scale military strikes on Saturday against multiple sites in Yemen controlled by Houthi militants, according to a statement from the two countries and six allies, as the Biden administration continued its reprisal campaign in the Middle East targeting Iran-backed militias.","{'main': 'U.S. and U.K. Launch Heavy Strikes on Houthi Sites in Yemen', 'kicker': None, 'content_kicker': None, 'print_headline': 'U.S. And The U.K. Carry Out Blitz Against Houthis', 'name': None, 'seo': None, 'sub': None}","['Houthis', 'Yemen', 'United States Defense and Military Forces', 'Great Britain', 'Defense and Military Forces', 'Drones (Pilotless Planes)', 'Israel-Gaza War (2023- )', 'Red Sea', 'Ships and Shipping', 'Iran', 'Terrorism']",2024-02-03T22:08:54+0000,article,U.S.
CBS said the president declined its invitation to appear ahead of what may be the highest-rated television broadcast of the year.,President Biden is sitting out the Super Bowl for the second year in a row.,"{'main': 'Biden to Sit Out Super Bowl Interview for Second Year in a Row', 'kicker': None, 'content_kicker': None, 'print_headline': 'Biden to Sit Out Interview Before Super Bowl, Again', 'name': None, 'seo': None, 'sub': None}","['Football', 'Super Bowl', 'Biden, Joseph R Jr', 'Presidential Election of 2024', 'United States Politics and Government', 'Television', 'CBS News', 'News and News Media']",2024-02-03T22:37:30+0000,article,Business Day
"A conservative convoy gathered on the Texas border to support the state’s defiant stance on immigration. Despite worries over potential violence, the event was peaceful.","A line of trucks and campers, cars and vans — from South Dakota and North Carolina, Washington and Pennsylvania — snaked over farm roads before gathering on the winter-brown grass of a ranch, steps from the Rio Grande, in the rural community of Quemado, Texas.","{'main': 'At Rally for Border Security in Texas, Fears of ‘Invasion’ and ‘Civil War’', 'kicker': None, 'content_kicker': None, 'print_headline': 'At Border Rally, Fearing ‘Invasion’ and ‘Civil War’', 'name': None, 'seo': None, 'sub': None}","['Demonstrations, Protests and Riots', 'Illegal Immigration', 'Immigration and Emigration', 'Eagle Pass (Tex)', 'Texas', 'United States Politics and Government', 'Federal-State Relations (US)']",2024-02-03T22:57:37+0000,article,U.S.
Daniel Grinberg’s Sunday puzzle will make you look for who’s talking.,Jump to: Tricky Clues | Today’s Theme,"{'main': 'Punch Lines', 'kicker': 'Wordplay, The CROSSWORD COLUMN', 'content_kicker': None, 'print_headline': '', 'name': None, 'seo': None, 'sub': None}","['Crossword Puzzles', 'Grinberg, Daniel (Crossword Constructor)']",2024-02-03T23:00:07+0000,article,Crosswords & Games
