abstract,lead_paragraph,headline,keywords,pub_date,document_type,section_name
"In his annual “Urbi et Orbi” address, Francis called for the release of Israeli hostages while also urging an end to the military campaign in Gaza.","Pope Francis on Monday focused his Christmas address on the violence in Israel and war in Gaza, which had caused an “appalling” loss of civilian life and brought “sorrow” to Bethlehem, traditionally seen as the birthplace of Jesus, as he called for the release of Israeli hostages and an end to devastating military attacks.","{'main': 'Pope Laments ‘Appalling’ Loss of Life in War in Gaza', 'kicker': None, 'content_kicker': None, 'print_headline': 'Pope Pleads for Peace in Gaza and Around the World', 'name': None, 'seo': None, 'sub': None}","['Israel-Gaza War (2023- )', 'Civilian Casualties', 'Francis', 'Palestinians', 'Gaza Strip', 'Israel', 'Poverty', 'Christians and Christianity', 'Hamas', 'Roman Catholic Church', 'Bethlehem (West Bank)', 'Kidnapping and Hostages']",2023-12-25T13:46:59+0000,article,World
We should seize the moment right now to build a new set of protections against future public health crises.,"The thing that has surprised me most since I began my job leading foreign assistance for global health at the U.S. Agency for International Development is how much emergencies have defined my work. The bureau I oversee focuses on reducing the global burden of mortality and disease and on protecting the United States from health threats from abroad. Our work is supposed to primarily serve long-range goals — for instance, eradicating polio (after 35 years of effort, we’re down to just a handful of wild-type cases in the world) and ending the public health threat of H.I.V., malaria and tuberculosis by 2030. But from the moment I started, more immediate problems have diverted time, attention and resources.","{'main': 'Why the World Needs Its Own Immune System', 'kicker': 'Guest Essay', 'content_kicker': None, 'print_headline': '', 'name': None, 'seo': None, 'sub': None}","['Immune System', 'Medicine and Health', 'Ebola Virus', 'Foreign Aid', 'Disasters and Emergencies', 'Epidemics', 'Coronavirus (2019-nCoV)', 'United States Agency for International Development', 'World Health Organization', 'AFRICA', 'United States']",2023-12-25T14:00:10+0000,article,Opinion
We lose something when we force ourselves to be polite.,"Many of us envision a happy holiday as one when nothing dramatic occurs. We avoid religion, politics and other divisive issues like we avoid the questionable potato salad filled with raisins.","{'main': 'Why Arguing Is My Cherished Holiday Tradition', 'kicker': 'Guest Essay', 'content_kicker': None, 'print_headline': '', 'name': None, 'seo': None, 'sub': None}","['Holidays and Special Occasions', 'Black People', 'Blacks', 'Drug Abuse and Traffic', 'Love (Emotion)']",2023-12-25T14:00:10+0000,article,Opinion
An A.L.S. drug rejected by the F.D.A. made me rethink how doctors should give hope to patients.,"Of all the ways the body can go wrong, A.L.S. is one of the most frightening. It begins subtly — a twitching muscle, a cough when you swallow or a clumsy hand. But then it progresses. Motor neurons degenerate and die. You lose the ability to talk, to eat and ultimately to breathe. There is no cure. Treatment will slow progression somewhat, but not enough.","{'main': 'Can Hope Ever Be a Form of Medicine?', 'kicker': 'Guest Essay', 'content_kicker': None, 'print_headline': '', 'name': None, 'seo': None, 'sub': None}","['Amyotrophic Lateral Sclerosis', 'Drugs (Pharmaceuticals)', 'Clinical Trials', 'Doctors', 'Hospitals', 'Food and Drug Administration', 'Abrevaya, Sandra', 'Wallach, Brian']",2023-12-25T14:00:10+0000,article,Opinion
Culinary diplomacy is a vital tool in this time of sharp partisan divisions at home and spiraling violence abroad.,"People have connected over food and used meals for political ends for centuries. There are good reasons for this. Historically, the dining table has been considered a neutral space where weapons are put aside, frank conversations held, consensus built and agreements brokered. Egyptian pharaohs, Greek and Roman leaders, Chinese emperors and Russian czars used the lure of food to expand their reach. Jackie Kennedy drew inspiration for her soirees from those of Louis XIV of France. And food-savvy presidents such as Thomas Jefferson, Franklin Roosevelt, Dwight Eisenhower and Barack Obama used dinners to touch political bases, gather information and promote their agendas.","{'main': 'Diplomacy Is Best Conducted at the Dinner Table', 'kicker': 'Guest Essay', 'content_kicker': None, 'print_headline': 'Never Underestimate the Power of the Dinner Table', 'name': None, 'seo': None, 'sub': None}","['Food', 'United States International Relations', 'Presidents and Presidency (US)', 'State Department']",2023-12-25T14:00:11+0000,article,Opinion
"Americans love a good scammer. Frederick Cook, polar explorer and would-be oil tycoon, is the perfect fit for our age — 83 years after his death.","We don’t have national heroes anymore. When we put public figures up on pedestals today, it’s not always about their honor and bravery. And it may not even be for their beauty or wealth — scammers and criminals are seemingly as likely to become icons as any. We love those who put on a show.","{'main': 'The Polar Explorer, and Scammer, Who Should Be an American Hero', 'kicker': 'Guest Essay', 'content_kicker': None, 'print_headline': '', 'name': None, 'seo': None, 'sub': None}","['Frauds and Swindling', 'Exploration and Explorers', 'Records and Achievements', 'Cook, Frederick A', 'Peary, Robert E', 'ARCTIC REGIONS', 'North Pole']",2023-12-25T14:00:11+0000,article,Opinion
"The tree was supposed to be strong and whole, to stand for my mother in her absence. Now it was just another broken thing.","Off Route 6 on Cape Cod, a few miles in from the bay near Yarmouth, Mass., there hides a giant ancient English weeping beech. The tree is so big that it has its own parking lot.","{'main': 'In the Shelter of a Weeping Beech', 'kicker': 'Jesse Wegman', 'content_kicker': None, 'print_headline': '', 'name': None, 'seo': None, 'sub': None}","['Content Type: Personal Profile', 'Seasons and Months', 'Death and Dying', 'Trees and Shrubs', 'Memory', 'Cape Cod (Mass)', 'Yarmouth (Mass)']",2023-12-25T14:00:20+0000,article,Opinion
Readers weigh in on whether a procedure to assist breastfeeding is really overused. Also: Factory-built homes.,To the Editor:,"{'main': 'The Controversy Over Tongue Surgery for Infants', 'kicker': 'letters', 'content_kicker': None, 'print_headline': 'The Controversy Over Tongue Surgery', 'name': None, 'seo': None, 'sub': None}","['Babies and Infants', 'Tongue', 'Breastfeeding', 'Surgery and Surgeons', 'Prefabricated Buildings', 'SEARS, ROEBUCK & CO']",2023-12-25T16:00:02+0000,article,Opinion
"They’re much easier to assemble than individual sandwiches and, with their melty filling and buttery glaze, certain to delight.","Merry Christmas to you and yours! At my house we do our entertaining on Christmas Eve, so on Christmas Day, once the presents have been opened and the crème brûlée French toast has been devoured, we settle into one of the quietest days of the season. We take a leisurely walk in the park then sip hot cocoa and read whatever new books we found under the tree. It’s a blissful, serene moment amid the holiday whirlwind.","{'main': 'Simply Having a Wonderful Christmas Ham and Cheese Slider', 'kicker': None, 'content_kicker': None, 'print_headline': '', 'name': None, 'seo': None, 'sub': None}","['Cooking and Cookbooks', 'Content Type: Service']",2023-12-25T16:00:03+0000,article,Food
The accusations made by Russia’s ambassador to Serbia were the latest efforts by Moscow to thwart a diplomatic campaign to lure Serbia out of Russia’s orbit.,"Fishing in Serbia’s troubled waters after a contested general election, Russia on Monday accused the West of orchestrating anti-government street protests in Belgrade, the Serbian capital, that flared into violence on Sunday evening.","{'main': 'Russia Sees a Western Hand Behind Serbian Street Protests', 'kicker': None, 'content_kicker': None, 'print_headline': 'After Violence in Serbia, Moscow Blames the West', 'name': None, 'seo': None, 'sub': None}","['Demonstrations, Protests and Riots', 'International Relations', 'Politics and Government', 'Elections', 'Russian Invasion of Ukraine (2022)', 'City Councils', 'Legislatures and Parliaments', 'North Atlantic Treaty Organization', 'European Union', 'Vucic, Aleksandar', 'Seselj, Vojislav', 'Hill, Christopher R', 'Brnabic, Ana', 'Belgrade (Serbia)']",2023-12-25T18:29:43+0000,article,World
"Russia said it now had full control of the eastern town of Marinka. On Tuesday, Ukraine claimed to have destroyed a Russian ship.","The Ukrainian military said on Monday that it had shot down five Russian fighter jets in three days, one of the biggest weekly losses for the Russian air force since the war began and a rare bright spot for Ukraine, whose forces have faced setbacks since its failed monthslong counteroffensive this year.","{'main': 'Ukraine Says It Downed 5 Russian Planes, as Moscow Claims It Seized a Town', 'kicker': None, 'content_kicker': None, 'print_headline': 'Kyiv Says It Downed 5 Jets; Moscow Claims It Seized a Town', 'name': None, 'seo': None, 'sub': None}","['Defense and Military Forces', 'Russian Invasion of Ukraine (2022)', 'Military Aircraft', 'AIRLINES AND AIRPLANES', 'Missiles and Missile Defense Systems', 'Putin, Vladimir V', 'Zelensky, Volodymyr', 'Russia', 'Ukraine']",2023-12-25T19:19:45+0000,article,World
"It has not snowed in New York in a very long time. But onstage at Lincoln Center, inside a shop display, and in a busker’s saxophone, there are flakes to be found.","It has been more than 680 days since Central Park was dusted with more than one inch of snow, the longest, un-snowiest stretch in New York City since snowfall records began here in 1869. It hasn’t snowed on Christmas in 14 years.","{'main': 'A White Christmas in New York City (if You Squint a Little)', 'kicker': None, 'content_kicker': None, 'print_headline': 'White Christmas in New York? Only if You Stretch Definition of ‘Snow.’', 'name': None, 'seo': None, 'sub': None}","['Snow and Snowstorms', 'New York City']",2023-12-25T20:11:56+0000,article,New York
"Plus, Aleksei Navalny’s transfer to a remote prison.",Prime Minister Benjamin Netanyahu of Israel visited Israeli troops fighting in Gaza yesterday. His visit came after Gazan health officials said that an overnight strike on a crowded neighborhood had killed dozens of people.,"{'main': 'Tuesday Briefing: Netanyahu Visits Gaza', 'kicker': None, 'content_kicker': None, 'print_headline': '', 'name': None, 'seo': None, 'sub': None}","['Far East, South and Southeast Asia and Pacific Areas']",2023-12-25T20:22:52+0000,article,World
"Powerful winds and freezing temperatures were expected to cause poor visibility and icy roads through early Wednesday, forecasters said.","Nearly a million people across the Northern and Central Plains were under blizzard or ice storm warnings on Tuesday, and one person was killed in a traffic accident on Christmas, as heavy snow, freezing rain and powerful winds created treacherous road conditions that forecasters said could last through early Wednesday.","{'main': 'Blizzard Conditions Disrupt Travel Across Northern and Central Plains', 'kicker': None, 'content_kicker': None, 'print_headline': '', 'name': None, 'seo': None, 'sub': None}","['Snow and Snowstorms', 'Weather', 'Traffic Accidents and Safety', 'Delays (Transportation)', 'Cold and Cold Spells', 'National Weather Service', 'Great Plains (US)', 'Sioux Falls (SD)', 'South Dakota', 'Kansas', 'Nebraska', 'Colorado', 'North Dakota']",2023-12-25T20:50:04+0000,article,U.S.
"General Mousavi, who was killed on a farm outside Damascus, was said to have been involved in arming Hezbollah. Israeli officials said they were preparing for possible retaliation.",Iran accused Israel on Monday of killing a high-level military figure in a missile strike in Syria at a time when concerns are growing that the war in Gaza could escalate into a regional conflict.,"{'main': 'Iran Accuses Israel of Killing Sayyed Mousavi, a Military Official', 'kicker': None, 'content_kicker': None, 'print_headline': 'Iran Accuses Israel in Death Of Top Official', 'name': None, 'seo': None, 'sub': None}","['Israel-Gaza War (2023- )', 'Targeted Killings', 'Hezbollah', 'Islamic Revolutionary Guards Corps', 'Iran', 'Syria', 'Israel']",2023-12-25T23:37:59+0000,article,World
