abstract,lead_paragraph,headline,keywords,pub_date,document_type,section_name
"Judge Aileen Cannon previously indicated that she would push back the start of the proceeding from the initially planned date in May. Prosecutors want to begin in July, and the former president in August.","A federal judge in Florida held a hearing on Friday to consider a new date for former President Donald J. Trump’s trial on charges of mishandling classified documents, but made no immediate decision about a choice that could have major consequences for both his legal and political future.","{'main': 'Judge Makes No Immediate Decision on Timing of Trump Documents Trial', 'kicker': None, 'content_kicker': None, 'print_headline': 'Judge Considers Timing Of Trial Over Documents', 'name': None, 'seo': None, 'sub': None}","['Federal Criminal Case Against Trump (Documents Case)', 'Presidential Election of 2024', 'Supreme Court (US)', 'Trump, Donald J', 'Cannon, Aileen M', 'Smith, Jack (Attorney)', 'Fort Pierce (Fla)', 'Fulton County (Ga)']",2024-03-01T10:02:46+0000,article,U.S.
It’s time to find out what the film industry’s new normal looks like.,"The Academy Awards ceremony, which this year will take place on March 10, traditionally provides a reliable moment of optimism for a perennially anxious industry. The Oscars are the climax of an awards season that’s a prolonged exercise in collective congratulation, and in early March the rest of the year still looks bright. The Sundance Film Festival and its attendant bidding wars have wrapped up, offering nothing but promise and excitement. At the box office, the biggest bets of the year have typically not yet opened and thus have not yet bombed. Every unreleased movie on the schedule might yet be a great one. Every year feels as if it just might be the biggest year ever.","{'main': 'How Bad Can It Get for Hollywood?', 'kicker': 'Guest Essay', 'content_kicker': None, 'print_headline': 'Can Hollywood  Bounce Back?', 'name': None, 'seo': None, 'sub': None}","['Movies', 'Academy Awards (Oscars)', 'Warner Bros Discovery', 'Walt Disney Company', 'Paramount Pictures', 'Organized Labor', 'Strikes', 'Video Recordings, Downloads and Streaming']",2024-03-01T10:02:49+0000,article,Opinion
Have you noticed your grocery products shrinking? Here’s how that gets counted — and what gets missed — in inflation data.,Grocery store shoppers are noticing something amiss. Air-filled bags of chips. Shrunken soup cans. Diminished detergent packages.,"{'main': 'Shrinkflation 101: The Economics of Smaller Groceries', 'kicker': None, 'content_kicker': None, 'print_headline': 'Large Impact Of Incredible Shrinking Groceries', 'name': None, 'seo': None, 'sub': None}","['Containers and Packaging', 'Supermarkets and Grocery Stores', 'Shopping and Retail', 'Prices (Fares, Fees and Rates)', 'Cleansers, Detergents and Soaps', 'Inflation (Economics)', 'Advertising and Marketing', 'United States Economy']",2024-03-01T10:02:52+0000,article,Business Day
"Richard Haass on why America’s strategy on both Ukraine and Israel is untenable, and what he thinks should be the north star.","Joe Biden’s presidency has been dominated by two foreign policy crises: the wars in Ukraine and Gaza. The funding the United States has provided in those wars — billions to both Ukraine and Israel — has drawn backlash from both the right and the left. And now, as the conflicts move into new stages with no clear end game, Biden’s policies are increasingly drawing dissent from the center.","{'main': 'The Wars in Ukraine and Gaza Have Changed. America’s Policy Hasn’t.', 'kicker': None, 'content_kicker': None, 'print_headline': '', 'name': None, 'seo': None, 'sub': None}","['audio-neutral-informative', 'Biden, Joseph R Jr', 'Ukraine', 'Russia', 'Russian Invasion of Ukraine (2022)', 'Israel', 'Gaza Strip', 'Israel-Gaza War (2023- )', 'United States International Relations', 'Defense and Military Forces']",2024-03-01T10:02:55+0000,article,Opinion
The death of an animal companion can be every bit as devastating as other types of loss.,,"{'main': 'How to Support Someone Who Has Lost a Pet', 'kicker': None, 'content_kicker': None, 'print_headline': '', 'name': None, 'seo': None, 'sub': None}","['Pets', 'Grief (Emotion)']",2024-03-01T10:03:05+0000,article,Well
"With the wars in Ukraine and Gaza straining U.S. arsenals, Washington is seeking to expand production with global partners like Australia.","On the grassy plains of Australia’s vast interior, an industrial evolution in the American war machine is gathering momentum. In munitions factories with room to grow, Australia is on the verge of producing heaps of artillery shells and thousands of guided missiles in partnership with American companies.","{'main': 'Why More American Weapons Will Soon Be Made Outside America', 'kicker': None, 'content_kicker': None, 'print_headline': 'Stretched by Global Strife, Pentagon Enlists Allies Like Australia to Make Weapons', 'name': None, 'seo': None, 'sub': None}","['Defense and Military Forces', 'Defense Contracts', 'International Relations', 'Factories and Manufacturing', 'Bombs and Explosives', 'United States Defense and Military Forces', 'Arms Trade', 'Supply Chain', 'Defense Department', 'Lockheed Martin Corporation', 'Thales SA', 'Australia', 'United States']",2024-03-01T10:03:05+0000,article,World
The hosts disagree on where America’s abortion debate is headed.,"When the Supreme Court overturned Roe v. Wade in 2022, the Republican Party declared victory.","{'main': 'The Pro-Life Movement Had a Plan Post-Roe. The G.O.P. Didn’t.', 'kicker': None, 'content_kicker': None, 'print_headline': '', 'name': None, 'seo': None, 'sub': None}","['audio-neutral-informative', 'Alabama', 'Law and Legislation', 'Abortion', 'Reproduction (Biological)', 'In Vitro Fertilization', 'Birth Control and Family Planning', 'Roe v Wade (Supreme Court Decision)', ""Dobbs v Jackson Women's Health Organization (Supreme Court Decision)"", 'Embryos (Human)', 'Republican Party']",2024-03-01T10:03:10+0000,article,Opinion
Are you a “boy mom”? A parental debate heats up.,"Avery Woods has deleted a video that made her the subject of recent online discussion, but that doesn’t matter. The internet never forgets.","{'main': 'Is This Motherly Love or Something ‘Toxic’?', 'kicker': None, 'content_kicker': None, 'print_headline': '', 'name': None, 'seo': None, 'sub': None}","['Social Media', 'Parenting', 'Video Recordings, Downloads and Streaming', 'TikTok (ByteDance)']",2024-03-01T10:03:11+0000,article,Style
"‘Jodorowsky’s Dune’ chronicles a director’s determination to film his vision of the saga, one that would have included Mick Jagger and Gloria Swanson.","This week sees the release of “Dune: Part Two,” the second installment in Denis Villeneuve’s eye-popping adaptation of the 1965 Frank Herbert novel. “Dune” was also adapted in 1984, by David Lynch, who hated his version (or the cut that made it to theaters, anyhow) so much that he disavowed it.","{'main': '‘Dune’ Fans, Here’s a Documentary That Will Blow Your Mind', 'kicker': 'Critic’s Notebook', 'content_kicker': None, 'print_headline': 'Sci-Fi Epic That Existed Only in the Imagination', 'name': None, 'seo': None, 'sub': None}","['Documentary Films and Programs', 'Jodorowsky, Alejandro', 'Dune (Movie)', 'Dune: Part Two (Movie)', ""Jodorowsky's Dune (Movie)""]",2024-03-01T10:03:16+0000,article,Movies
"A “Road House” remake, and the satires “Palm Royale” and “The Regime” start streaming.","Every month, streaming services add movies and TV shows to its library. Here are our picks for some of March’s most promising new titles. (Note: Streaming services occasionally change schedules without giving notice. For more recommendations on what to stream, sign up for our Watching newsletter here.)","{'main': 'The Best Movies and TV Shows Coming to Amazon, Disney+, Hulu, Max and More in March', 'kicker': None, 'content_kicker': None, 'print_headline': '', 'name': None, 'seo': None, 'sub': None}","['Television', 'Movies', 'Road House (Movie)', 'MANHUNT (TV PROGRAM)', 'Queens (TV Program)', 'The Regime (TV Program)']",2024-03-01T10:03:26+0000,article,Arts
An Adam Sandler drama and a new series from the creators of “Game of Thrones” highlight the new offerings this month.,"Every month, Netflix adds movies and TV shows to its library. Here are our picks for some of March’s most promising new titles. (Note: Streaming services occasionally change schedules without giving notice. For more recommendations on what to stream, sign up for our Watching newsletter here.)","{'main': 'The Best Movies and TV Shows Coming to Netflix in March', 'kicker': None, 'content_kicker': None, 'print_headline': '', 'name': None, 'seo': None, 'sub': None}","['Television', 'Netflix Inc']",2024-03-01T10:03:26+0000,article,Arts
What causes do you support — with either your money or your time and effort?,Having $1 billion is hard to imagine. It’s probably even harder to imagine having that much money to give away.,"{'main': 'If You Had $1 Billion to Give Away, What Charity Would You Support?', 'kicker': 'Student Opinion', 'content_kicker': None, 'print_headline': '', 'name': None, 'seo': None, 'sub': None}",[],2024-03-01T10:03:28+0000,article,The Learning Network
"Take a look at major residential real estate listings and sales, including Kathy Hilton's Hamptons home.","Take a look at major residential real estate listings and sales, including Kathy Hilton's Hamptons home.","{'main': 'Big Ticket: N.Y.’s Top Sales and Listings in February', 'kicker': 'Big Ticket', 'content_kicker': None, 'print_headline': '', 'name': None, 'seo': None, 'sub': None}","['Real Estate and Housing (Residential)', 'High Net Worth Individuals', 'Second Homes and Non-Primary Residences', 'Leibovitz, Annie', 'New York City']",2024-03-01T10:03:31+0000,multimedia,Real Estate
"The arachnids, which are not spiders, were thought to have only two eyes, compared with many more on spiders.","Guilherme Gainett, then a biologist at the University of Wisconsin-Madison, was looking through a microscope at the embryo of a daddy longlegs when he saw it — or, rather, saw them. Daddy longlegs, the group of splendidly leggy arachnids also known as harvestmen, have been thought to have just two eyes. But there on the animal’s body, illuminated with fluorescent markers, were what looked like four more vestigial eyes.","{'main': 'Daddy Longlegs Have Been Hiding Extra Eyes From Us', 'kicker': 'Trilobites', 'content_kicker': None, 'print_headline': 'Seeing a Surplus: It Has Lots of Long Legs, Sure, but No Shortage of Eyes Either', 'name': None, 'seo': None, 'sub': None}","['Eyes and Eyesight', 'Evolution (Biology)', 'Current Biology (Journal)', 'Spiders', 'Research', 'Animal Behavior', 'your-feed-science', 'your-feed-animals']",2024-03-01T10:03:40+0000,article,Science
"Claudia Sheinbaum, a protégée of Mexico’s current president, holds a commanding lead in the polls. But to many in Mexico, she is still an enigma.","With Mexico’s presidential election just three months away, one thing is clear: The candidate for the governing party appears to be running away with it.","{'main': 'Why Mexico’s Ruling Party Candidate Is Already Dominating the Presidential Race', 'kicker': None, 'content_kicker': None, 'print_headline': 'In Mexico, a Candidate Is Already Dominating The Presidential Race', 'name': None, 'seo': None, 'sub': None}","['Mexico', 'Elections', 'Politics and Government', 'Sheinbaum, Claudia', 'Galvez, Xochitl (1963- )', 'Lopez Obrador, Andres Manuel', 'Morena (Mexican Political Party)', 'Mexico City (Mexico)', 'United States International Relations', 'Content Type: Personal Profile']",2024-03-01T10:03:41+0000,article,World
"Reesa Teesa’s 50-part drama about her marriage — one she says was built on lies about mortgages, car payments and a bad knee — is made for TikTok’s middle-aged users.","“Who TF Did I Marry?!?,” the TikTok user Reesa Teesa’s account of her relationship with her ex-husband, is a story for grown-ups. Over the course of 50 videos, in a monologue topping six hours, Reesa methodically unspools her ex’s web of purported lies. She gives him the code-name “Legion.”","{'main': '‘Who TF Did I Marry?!?’ Rings in TikTok’s Midlife Crisis Era', 'kicker': 'Critic’s Notebook', 'content_kicker': None, 'print_headline': 'Her Lousy Marriage Fascinates TikTokers', 'name': None, 'seo': None, 'sub': None}","['Social Media', 'Middle Age (Demographic)', 'TikTok (ByteDance)', 'Teesa, Reesa']",2024-03-01T10:03:47+0000,article,Arts
Gretchen Whitmer knows that abortion could decide the presidential race.,"At a Detroit union hall in mid-February, Gov. Gretchen Whitmer and Senator Debbie Stabenow of Michigan gathered representatives from local carpenters and construction unions, along with participants in an apprenticeship program, for a round-table event to draw attention to the ways the Biden administration has helped organized labor. At every seat around the U-shaped table, there was a flier from Whitmer’s Fight Like Hell PAC, but it didn’t address jobs; it was about abortion.","{'main': 'The Democrat Showing Biden How It’s Done', 'kicker': 'Michelle Goldberg', 'content_kicker': None, 'print_headline': 'Whitmer Is Showing Biden How It’s Done', 'name': None, 'seo': None, 'sub': None}","['Abortion', 'Presidential Election of 2024', 'Whitmer, Gretchen', 'Michigan', 'Democratic Party', 'Polls and Public Opinion', 'Biden, Joseph R Jr', 'Trump, Donald J', 'United States Politics and Government', 'Politics and Government', 'Law and Legislation']",2024-03-01T10:04:32+0000,article,Opinion
"Journeys to outer space, inner space and Nebraska.","Jon Pareles, The Times’s chief pop music critic, picks his favorite new tracks to listen to this weekend:","{'main': 'New Music for Your Weekend', 'kicker': None, 'content_kicker': None, 'print_headline': '', 'name': None, 'seo': None, 'sub': None}","['Culture (Arts)', 'SZA (Singer)', 'Big Thief (Music Group)', 'Residente (Rapper)', 'Segarra, Alynda']",2024-03-01T10:04:33+0000,article,Podcasts
A New York City housewife speaks about a new lawsuit against Andy Cohen and Bravo in which she alleges all of these things (and more) created a “rotted workplace culture.”,"“I thought it was going to be fun,” Leah McSweeney, a former star of Bravo’s “The Real Housewives of New York City,” said about joining the show’s cast in 2019.","{'main': '‘Dark Secrets,’ ‘Psychological Warfare,’ and Cocaine', 'kicker': None, 'content_kicker': None, 'print_headline': '', 'name': None, 'seo': None, 'sub': None}","['Suits and Litigation (Civil)', 'Reality Television', 'Workplace Hazards and Violations', 'Alcohol Abuse', 'Mental Health and Disorders', 'Bravo', 'NBCUniversal', 'McSweeney, Leah', 'Cohen, Andy (1968- )', 'The Real Housewives of New York (TV Program)']",2024-03-01T10:04:40+0000,article,Style
"It’s critical to recognize the signs, experts say.","Hearing loss can sneak up on us — so gradually that many of us don’t notice the change. You might think: Wow, was that restaurant noisy? I couldn’t hear a thing. My TV must be breaking down. I keep having to turn up the volume.","{'main': 'How to Spot Hearing Loss as You Age', 'kicker': 'the well newsletter', 'content_kicker': None, 'print_headline': '', 'name': None, 'seo': None, 'sub': None}","['internal-sub-only-nl', 'Ears and Hearing', 'Content Type: Service']",2024-03-01T10:04:42+0000,article,Well
Did you follow the news this week? Take our quiz to see how well you stack up with other Times readers.,Did you follow the news this week? Take our quiz to see how well you stack up with other Times readers.,"{'main': 'The New York Times News Quiz, Mar. 1, 2024', 'kicker': None, 'content_kicker': None, 'print_headline': '', 'name': None, 'seo': None, 'sub': None}",['Content Type: Quiz'],2024-03-01T10:04:50+0000,multimedia,Briefing
"At a discussion led by a House panel, students criticized their universities for not cracking down on antisemitism. An antiwar group pointed out that Muslim and Arab students are facing harassment, too.","Nine Jewish students from prominent universities told members of Congress on Thursday that they feel unsafe on campus, but that their complaints of antisemitism had been waved away by university administrations.","{'main': 'Jewish Students Describe Facing Antisemitism on Campus to Members of Congress', 'kicker': None, 'content_kicker': None, 'print_headline': '9 Students Describe Harassment Against Jews', 'name': None, 'seo': None, 'sub': None}","['Anti-Semitism', 'Israel-Gaza War (2023- )', 'House Committee on Education and Labor', 'Foxx, Virginia', 'School Discipline (Students)', 'Colleges and Universities', 'Jews and Judaism']",2024-03-01T10:04:52+0000,article,U.S.
"This week's selection includes titles by Mona Simpson, Joseph Earl Thomas, Jojo Moyes and more. ","This week's selection includes titles by Mona Simpson, Joseph Earl Thomas, Jojo Moyes and more. ","{'main': '6 New Paperbacks to Read This Week ', 'kicker': 'Paperback Row', 'content_kicker': None, 'print_headline': '', 'name': None, 'seo': None, 'sub': None}","['Books and Literature', 'Race and Ethnicity', 'Global Warming', 'Art', 'Discrimination']",2024-03-01T10:04:54+0000,multimedia,Books
We finally invited someone on the podcast who is meaner to Casey than Kevin is.,"Google removed the ability to generate images of people from its Gemini chatbot. We talk about why, and about the brewing culture war over artificial intelligence. Then, did Kara Swisher start “Hard Fork”? We clear up some podcast drama and ask about her new book, “Burn Book.” And finally, the legal expert Daphne Keller tells us how the U.S. Supreme Court might rule on the most important First Amendment cases of the internet era, and what Star Trek and soy boys have to do with it.","{'main': 'Gemini’s Culture War, Kara Swisher Burns Us and SCOTUS Takes Up Content Moderation', 'kicker': None, 'content_kicker': None, 'print_headline': '', 'name': None, 'seo': None, 'sub': None}","['Science and Technology', 'Google Inc', 'Hassabis, Demis', 'Swisher, Kara', 'Musk, Elon', 'Supreme Court (US)', 'Uber Technologies Inc', 'Etsy Inc', 'Facebook Inc', 'Instagram Inc']",2024-03-01T10:04:55+0000,article,Podcasts
Prices in the countries that use the euro trended downward in February. But the European Central Bank remains cautious about lowering interest rates.,"Inflation rates across most economies in Europe continued their descent last month. Consumer prices in the 20 countries that use the euro as their currency rose at an annual rate of 2.6 percent in February, down from 2.8 percent in January, the statistical office of the European Commission reported on Friday.","{'main': 'Eurozone Inflation, at 2.6%, Continues to Ease', 'kicker': None, 'content_kicker': None, 'print_headline': 'In Eurozone,  Inflation Rates Continue to Fall', 'name': None, 'seo': None, 'sub': None}","['Prices (Fares, Fees and Rates)', 'Banking and Financial Institutions', 'Interest Rates', 'Government Bonds', 'Inflation (Economics)', 'European Commission', 'Eurozone', 'European Central Bank', 'Europe', 'France', 'Germany', 'Spain', 'internal-storyline-no']",2024-03-01T10:16:55+0000,article,Business Day
The president and his likely election opponent visited the political hot spot on the same day and gave dueling speeches.,President Biden and Donald J. Trump both made appearances at the southern border on Thursday as they addressed an issue that is shaping up to be one of the most important in the 2024 election: immigration.,"{'main': 'Biden, Trump and a Split Screen at the Texas Border', 'kicker': None, 'content_kicker': None, 'print_headline': '', 'name': None, 'seo': None, 'sub': None}","['Presidential Election of 2024', 'United States Politics and Government', 'New York State Criminal Case Against Trump (71543-23)', 'Biden, Joseph R Jr', 'Trump, Donald J', 'United States', 'Texas']",2024-03-01T11:00:05+0000,article,Podcasts
"Plus, a federal court blocks a Texas border law.","The New York Times Audio app is home to journalism and storytelling, and provides news, depth and serendipity. If you haven’t already, download it here — available to Times news subscribers on iOS — and sign up for our weekly newsletter.","{'main': 'Crowds Gather for Navalny’s Funeral, and Gazans Killed Near Aid Convoy', 'kicker': None, 'content_kicker': None, 'print_headline': '', 'name': None, 'seo': None, 'sub': None}","['Funerals and Memorials', 'Decisions and Verdicts', 'Humanitarian Aid', 'Demonstrations, Protests and Riots', 'Immigration and Emigration', ""Women's National Basketball Assn"", 'Biden, Joseph R Jr', 'Clark, Caitlin (2002- )', 'Trump, Donald J', 'Israel', 'Texas']",2024-03-01T11:01:53+0000,article,Podcasts
"Single men traditionally get a head start in homeownership and reap the benefits faster, but single women are thinking creatively to close the gap.","Rachel Rodman always dreamed of owning her own home, but life kept getting in the way.","{'main': 'Buying Houses Before Finding Spouses', 'kicker': None, 'content_kicker': None, 'print_headline': 'Find a House Before a Spouse', 'name': None, 'seo': None, 'sub': None}","['Single Persons', 'Real Estate and Housing (Residential)', 'Women and Girls', 'Real Estate Brokers', 'Austin (Tex)']",2024-03-01T11:25:06+0000,article,Real Estate
"The Putin-friendly faction of the party is ascendant, while some of his biggest critics are retiring.","Large parts of the Republican Party now treat Vladimir Putin as if he were an ideological ally. Putin, by contrast, continues to treat the U.S. as an enemy.","{'main': 'Republicans Who Like Putin', 'kicker': None, 'content_kicker': None, 'print_headline': '', 'name': None, 'seo': None, 'sub': None}","['internal-storyline-no', 'United States Politics and Government', 'International Relations', 'Russia', 'Russian Invasion of Ukraine (2022)']",2024-03-01T11:42:03+0000,article,Briefing
"Daniela Klette, a militant from the Red Army Faction, was on the run for decades. Yet with publicly available digital recognition tools, German police could probably have found her much sooner.","It took authorities more than 30 years to hunt down one of Germany’s most wanted fugitives. For Michael Colborne, an investigative journalist running old photographs through a facial recognition service, it took about 30 minutes.","{'main': 'How Germany’s Most Wanted Criminal Hid in Plain Sight', 'kicker': None, 'content_kicker': None, 'print_headline': 'How Digital Tools Nabbed a 30-Year Fugitive', 'name': None, 'seo': None, 'sub': None}","['Berlin (Germany)', 'Klette, Daniela Marie-Luise', 'Red Army Faction', 'Fugitives', 'Terrorism', 'Facial Recognition Software', 'Politics and Government', 'Police', 'Espionage and Intelligence Services', 'Podcasts', 'Germany']",2024-03-01T11:56:45+0000,article,World
A three-day pre-wedding ceremony for the son of one of India’s richest men raises the bar for extravagant festivity.,"When a member of one of India’s wealthiest families gets married, big-name guests and showstopping pomp and circumstance are nothing unusual. But it’s not every day that the invitees include royalty, business titans, Bollywood luminaries and Rihanna, for three days of a pre-wedding spectacular, months ahead of the actual ceremony.","{'main': 'In a Land of Lavish Weddings, This Prenuptial Party Takes the Cake', 'kicker': None, 'content_kicker': None, 'print_headline': 'In India, A Wedding That Takes The Cake', 'name': None, 'seo': None, 'sub': None}","['Weddings and Engagements', 'Ambani, Mukesh D', 'India', 'Gujarat State (India)']",2024-03-01T12:14:25+0000,article,World
The deaths of dozens of people amid a rush for aid trucks in Gaza City showed the degree of hunger in the territory.,"The number of aid trucks entering Gaza dropped significantly in February, data shows, even as humanitarian leaders warned of famine and demanded that Israel and others increase aid to civilians trapped in the enclave. ","{'main': 'Gaza Aid Declined Significantly in February', 'kicker': None, 'content_kicker': None, 'print_headline': '', 'name': None, 'seo': None, 'sub': None}","['Gaza Strip', 'Israel-Gaza War (2023- )', 'Humanitarian Aid', 'War and Armed Conflicts', 'Israel']",2024-03-01T12:25:05+0000,article,World
Musk said the prominent A.I. start-up had put profits and commercial interests ahead of seeking to benefit humanity.,"OpenAI, the influential artificial intelligence company that ousted and then reinstated its high-profile chief executive three months ago, faces a new drama: a lawsuit from Elon Musk, one of the richest men in the world and a co-founder of the A.I. lab.","{'main': 'Elon Musk Sues OpenAI and Sam Altman for Violating the Company’s Principles', 'kicker': None, 'content_kicker': None, 'print_headline': 'OpenAI Breached Contract, Musk Says', 'name': None, 'seo': None, 'sub': None}","['Artificial Intelligence', 'Suits and Litigation (Civil)', 'Open-Source Software', 'Microsoft Corp', 'OpenAI Labs', 'Altman, Samuel H', 'Musk, Elon', 'Computers and the Internet']",2024-03-01T12:28:26+0000,article,Technology
