abstract,lead_paragraph,headline,keywords,pub_date,document_type,section_name
In case you need some puzzle help.,"Welcome to The Wordle Review. Be warned: This page contains spoilers for today’s puzzle. Solve Wordle first, or scroll at your own risk.","{'main': 'Today’s Wordle Review', 'kicker': None, 'content_kicker': None, 'print_headline': '', 'name': None, 'seo': None, 'sub': None}","['Wordle (Puzzle)', 'Crossword Puzzles']",2024-03-01T08:00:22+0000,article,Crosswords & Games
In case you need some puzzle help.,"Good morning, dear connectors. Welcome to today’s Connections forum, where you can give and receive puzzle — and emotional — support.","{'main': 'The Connections Companion', 'kicker': None, 'content_kicker': None, 'print_headline': '', 'name': None, 'seo': None, 'sub': None}","['Crossword Puzzles', 'Connections (Game)']",2024-03-01T08:00:27+0000,article,Crosswords & Games
"An in-depth look at the process that overhauls every single wheel, motor, brake, axel, wire and door on every car in the New York City system.","The average New York City subway car travels roughly 53,000 miles per year across some of the oldest transit infrastructure in the world. Rumbling through a web of grungy tunnels and weather-beaten elevated tracks, the cars are subjected to overcrowding, underfunding, vandalism, garbage and routine wear and tear.","{'main': 'Inside the Massive Repair Shops Where Subway Cars Go for a Makeover', 'kicker': None, 'content_kicker': None, 'print_headline': 'Inside the Machine Shops That Keep the Subway Running', 'name': None, 'seo': None, 'sub': None}","['Subways', 'New York City', 'Coney Island (Brooklyn, NY)', 'Manhattan (NYC)', 'Transport Workers Union', 'Transit Systems', 'Restoration and Renovation', 'Infrastructure (Public Works)', 'Factories and Manufacturing', 'Metropolitan Transportation Authority', 'vis-photo']",2024-03-01T08:00:31+0000,article,New York
What do you think this image is communicating?,What do you think this image is saying? How does it relate to or comment on society or current events? Can you relate to it personally? What is your opinion of its message?,"{'main': 'Behind Columns', 'kicker': 'Picture Prompts', 'content_kicker': None, 'print_headline': '', 'name': None, 'seo': None, 'sub': None}",[],2024-03-01T08:00:31+0000,article,The Learning Network
Donald J. Trump and his lawyers have bragged in public about his cash hoard. Court papers tell a different story.,This is a moment of financial truth for Donald J. Trump.,"{'main': 'What to Know About Trump’s Cash as He Faces Penalties of $537 Million', 'kicker': None, 'content_kicker': None, 'print_headline': 'After Huge Court Judgments, Trump Faces a Financial Crunch', 'name': None, 'seo': None, 'sub': None}","['New York State Civil Case Against Trump (452564/2022)', 'Trump, Donald J', 'Trump Organization', 'Libel and Slander', 'Suits and Litigation (Civil)', 'Courts and the Judiciary', 'James, Letitia', 'CARROLL, E JEAN', 'New York State', 'United States Politics and Government', 'Compensation for Damages (Law)', 'Fines (Penalties)', 'Frauds and Swindling']",2024-03-01T08:00:48+0000,article,New York
Barnard College is requiring students to strip decorations from their dorm doors in the wake of protests over the Israel-Hamas war.,Dorm door decorations are emerging as the next battleground in the fight over academic freedom and free speech at Barnard College.,"{'main': 'College Dorm Decorations Become a Front in the Campus Free Speech Wars', 'kicker': None, 'content_kicker': None, 'print_headline': 'A Door-to-Door Fight Over Free Speech', 'name': None, 'seo': None, 'sub': None}","['Colleges and Universities', 'Barnard College', 'Columbia University', 'Freedom of Speech and Expression', 'Israel-Gaza War (2023- )', 'Palestinians', 'Zionism', 'Anti-Semitism', 'Demonstrations, Protests and Riots', 'Suits and Litigation (Civil)', 'ACADEMIC FREEDOM', 'New York City']",2024-03-01T08:00:52+0000,article,New York
The Israeli military and Gazan officials have offered diverging accounts of one of the deadliest known disasters involving civilians in the nearly five-month war.,World leaders on Friday intensified their demands on Israel to get more aid into Gaza and provide more answers about the deaths of scores of Palestinians in a scene of chaos surrounding a humanitarian convoy its forces were securing.,"{'main': 'Cease-Fire Demand Grows Amid Questions Around Gaza Aid Convoy Deaths', 'kicker': None, 'content_kicker': None, 'print_headline': '', 'name': None, 'seo': None, 'sub': None}","['Israel-Gaza War (2023- )', 'Civilian Casualties', 'Israel', 'Gaza Strip']",2024-03-01T08:18:19+0000,article,World
"In her debut, Chemena Kamali revives the Chloé Girl.","For years the Chloé Girl was effectively another, more branded, version of the It Girl. You know: the sort of person for whom the word girl was less a judgment on age than a state of mind; the sort of person with a cool, somewhat careless magnetism, who had just enough accessibility that everyone couldn’t help thinking “goal.” And then imagined being her. Or at the very least, dressing like her.","{'main': 'There’s a New (Old) It Girl in Paris', 'kicker': 'Fashion Review', 'content_kicker': None, 'print_headline': 'A Familiar Face Makes This Scene', 'name': None, 'seo': None, 'sub': None}","['Fashion and Apparel', 'Appointments and Executive Changes', 'Chloe (Fashion Label)', 'Kamali, Chemena', 'your-feed-fashion', 'Paris Fashion Week']",2024-03-01T08:51:24+0000,article,Style
"A selection of entertainment highlights this weekend, including the second installment of Denis Villeneuve’s “Dune” series.","A selection of entertainment highlights this weekend, including the second installment of Denis Villeneuve’s “Dune” series.","{'main': '5 Things to Do This Weekend', 'kicker': None, 'content_kicker': None, 'print_headline': '', 'name': None, 'seo': None, 'sub': None}","['Comedy and Humor', 'Television', 'Theater (Broadway)', 'Movies', 'Computer and Video Games', 'SoHo Playhouse', 'Warner Brothers', 'Home Box Office', 'Chalamet, Timothee (1995- )', 'Herbert, Frank', 'Villeneuve, Denis', 'Winslet, Kate', 'New York City', 'Sweeney Todd: The Demon Barber of Fleet Street (Play)', 'Dune (Book)']",2024-03-01T09:00:00+0000,multimedia,Arts
"Stories about distinctive wildlife, Aboriginal mythology and idyllic Australian childhoods.","Last weekend, I hosted a baby shower for a friend whose little boy is due sometime in April. She and her husband are South African migrants, and I have joked for months that they like Australians so much that they have made one to come and live with them.","{'main': 'Celebrating Classic Australian Picture Books', 'kicker': 'LETTER 433', 'content_kicker': None, 'print_headline': '', 'name': None, 'seo': None, 'sub': None}","['Books and Literature', 'Indigenous Australians', 'EMUS (BIRDS)']",2024-03-01T09:27:33+0000,article,World
"The police presence appeared heavy for the service. Some attendees shouted, “No to war” and “Russia will be free” as they marched to the cemetery where the opposition leader was to be buried.","Thousands of people crowded a neighborhood on Moscow’s outskirts on Friday — some bearing flowers and chanting, “No to war!” — as they tried to catch a glimpse of the funeral for Aleksei A. Navalny. The outpouring turned the opposition leader’s last rites into a striking display of dissent in Russia at a time of deep repression.","{'main': 'Thousands Turn Out for Navalny’s Funeral in Moscow', 'kicker': None, 'content_kicker': None, 'print_headline': 'Crowds Flood Moscow Streets Over Navalny', 'name': None, 'seo': None, 'sub': None}","['Navalny, Aleksei A', 'Funerals and Memorials', 'Political Prisoners', 'Moscow (Russia)', 'Russia', 'Assassinations and Attempted Assassinations', 'Putin, Vladimir V']",2024-03-01T09:58:32+0000,article,World
"In the audiobook oral history “Surely You Can’t Be Serious: The True Story of ‘Airplane!,’” a cast of dozens fondly revisits a now-classic film.","“You ever seen a grown man naked?” As Captain Oveur in “Airplane!,” the handsome, stone-faced Peter Graves delivers to a starry-eyed child an immortal line in movie history, one of many in the 1980 classic that would be unthinkable in 2024. David Zucker, one-third of its writing and directing team along with Jim Abrahams and Jerry Zucker, has a standard answer for reporters who ask if the movie could be made today: “Sure, just without the jokes.”","{'main': 'It’s a Bird, It’s a Plane, It’s Comedy Gold', 'kicker': 'Audiobooks', 'content_kicker': None, 'print_headline': '', 'name': None, 'seo': None, 'sub': None}","['Audiobooks', 'Movies', 'Comedy and Humor', 'Abrahams, Jim', 'Zucker, David', 'Zucker, Jerry']",2024-03-01T10:00:06+0000,article,Books
"With her library, senior center,  markets and sports complexes, Fernanda Canales is bringing a sense of community, beauty and safety to underserved towns.","In July 2020 the Mexico City-based architect Fernanda Canales faced a difficult decision. Tapped to participate in a new federal initiative providing hundreds of civic facilities — like libraries, parks and streetscapes — to under-resourced towns across Mexico, she could either work on relatively familiar sites along her city’s periphery or take on a handful of structures 1,200 miles north in Agua Prieta and Naco, two small, poor towns with high crime rates along the U.S. border.","{'main': 'An Architect Builds Toward the Future on Mexico’s Border', 'kicker': None, 'content_kicker': None, 'print_headline': 'An Attempt  To Transform Border Towns  In Mexico', 'name': None, 'seo': None, 'sub': None}","['ARCHITECTURE', 'Libraries and Librarians', 'Politics and Government', 'Area Planning and Renewal', 'Infrastructure (Public Works)', 'Building (Construction)', 'Poverty', 'Canales, Fernanda (1974- )', 'AGUA PRIETA (MEXICO)', 'Naco (Mexico)', 'Sonora (Mexico)', 'Mexico', 'Secretariat of Agrarian, Land, and Urban Development (SEDATU)']",2024-03-01T10:00:33+0000,article,Arts
"A new wave of self-taught craftspeople are using the medium to make playful, thought-provoking works.","The artist Joel Hernandez, 39, first worked with papier-mâché as an 8-year-old, soon after moving from Mexico to rural Indiana. His parents had gone looking for piñatas — a staple of their family celebrations — at local stores but had come up short. “So we decided to make our own,” he says. Two decades later, when Hernandez began collecting traditional tribal masks from all over the world, he says that, as a gay person, he realized, “I couldn’t see my image in masks out there.” And so, like his parents before him, he decided to take matters into his own hands. Today, he makes brightly colored, highly animated papier-mâché face coverings that he builds by layering strips of recycled newspaper dipped in a flour, water and salt paste over Plasticine forms. “The first one I made was two guys cheek to cheek,” he says of the masks, which have been shown at galleries — he had a solo show at La Luz de Jesus in Los Angeles this past fall — and are sold online.","{'main': 'How Contemporary Artists Are Taking Papier-Mâché Out of the Classroom', 'kicker': 'Notes on the Culture', 'content_kicker': None, 'print_headline': 'Good on Paper', 'name': None, 'seo': None, 'sub': None}","['Handicrafts', 'Art']",2024-03-01T10:00:41+0000,article,T Magazine
"The two friends, both climate researchers, recently spent hours confronting the choices that will shape their careers, and the world. Their ideas are very different.","Two good friends, Rebecca Grekin and Yannai Kashtan, met up one crisp December morning at Stanford University, where they both study and teach. The campus was deserted for the holidays, an emptiness at odds with the school’s image as a place where giants roam, engaged in groundbreaking research on heart transplants, jet aerodynamics, high-performance computing. Work that has changed the world.","{'main': 'He Wants Oil Money Off Campus. She’s Funded by Exxon. They’re Friends.', 'kicker': None, 'content_kicker': None, 'print_headline': 'A Moral Climate Conundrum Between Friends', 'name': None, 'seo': None, 'sub': None}","['Graduate Schools and Students', 'Stanford University', 'Research', 'Corporations', 'Global Warming', 'Greenhouse Gas Emissions', 'Oil (Petroleum) and Gasoline', 'Exxon Mobil Corp', 'Corporate Social Responsibility']",2024-03-01T10:00:44+0000,article,Climate
"Three new books look at the tensions — left, center, right and further right — in the Democratic and Republican parties.","The Republican Party of the Sunshine State, the NBC News reporter Matt Dixon writes in SWAMP MONSTERS: Trump vs. DeSantis — The Greatest Show on Earth (or at Least in Florida) (Little, Brown, 323 pp., $30), is now “the party of Florida Man,” the mythic entity that wears “Mickey Mouse ears while riding an alligator through the Everglades.” It’s an important advent in a place that has become a laboratory for the national culture wars with Gov. Ron DeSantis as its chief scientist. DeSantis has outdone many of his more extreme colleagues in the G.O.P. He has restricted sex education in Florida schools — topics from homosexuality to menstruation are now taboo — and picked a fight with Disney over the company’s supposedly “woke” values. He has also lowered the number of jurors required to recommend the death penalty.","{'main': 'Can Either Party Hold It Together Until November?', 'kicker': 'Shortlist', 'content_kicker': None, 'print_headline': 'Politics', 'name': None, 'seo': None, 'sub': None}","['Books and Literature', 'United States Politics and Government', 'Republican Party', 'Democratic Party', 'DeSantis, Ron', 'Biden, Joseph R Jr', 'Warren, Elizabeth', 'Sanders, Bernard', 'Ocasio-Cortez, Alexandria', 'Trump, Donald J', 'Florida', 'United States']",2024-03-01T10:00:56+0000,article,Books
"Thanks to a street artist named Frank “Frankey” de Ruwe, a wander through the Dutch capital may lead to a playful discovery or two.","In the spring of 2020, at the height of the pandemic, the always bustling Dam Square in Amsterdam was deserted, silent and surrounded by concrete counterterrorism blocks. The Dutch street artist Frank de Ruwe, who goes by the name of Frankey, decided these daunting studded blocks resembled something more innocent — giant Lego blocks — and that the city needed something to lighten the gloom.","{'main': 'Meet the Artist Delighting Amsterdam', 'kicker': 'Q. and A.', 'content_kicker': None, 'print_headline': 'Street Artist Adds Whimsy In Amsterdam', 'name': None, 'seo': None, 'sub': None}","['Art', 'Sculpture', 'Content Type: Personal Profile', 'de Ruwe, Frank (Frankey)', 'AMSTERDAM (NETHERLANDS)']",2024-03-01T10:01:03+0000,article,Travel
"Eric Newman, who created the Netflix show “Narcos” and produced his new show with Sofia Vergara, shares his love for a lesser-known side of the South Florida playground.","The magic of Miami is that “you can still discover places,” said the writer and producer Eric Newman. “It doesn’t feel like people have a chip on their shoulder. There’s a healthy civic pride and gratitude.”","{'main': 'The ‘Griselda’ Creator’s Miami', 'kicker': '5 Favorite Places', 'content_kicker': None, 'print_headline': '', 'name': None, 'seo': None, 'sub': None}","['Miami (Fla)', 'Newman, Eric', 'Travel and Vacations', 'Vergara, Sofia', 'Hotels and Travel Lodgings', 'Bars and Nightclubs', 'Restaurants', 'Salsa Dancing', '27 (Miami Beach, Fla, Restaurant)', 'Vizcaya Museum and Gardens', 'Coconut Grove (Miami, Fla)', 'Little Havana (Miami, Fla)', 'Miami Beach (Fla)']",2024-03-01T10:01:11+0000,article,Travel
"Joan Jonas’s maximalist, category-defying work combines video, performance, folklore, sculpture and ecology. At 87, she still has no intention of simplifying anything.","JOAN JONAS, 87, perched on a stool in a room behind the scenes at MoMA, was immediately recognizable as the artist she had been — compact, tense, intense — when she emerged as a figure in New York’s downtown scene in the late 1960s. In an essay published many years later, the composer Alvin Curran recalled Jonas’s stature in that environment: “On the streets, children cry out, ‘Here comes Joan Jonas,’” he wrote, adding that some even wanted to be what she was when they grew up: a performance artist.","{'main': 'Meet One of America’s Most Elusive Artists', 'kicker': 'arts and letters', 'content_kicker': None, 'print_headline': 'The Woman In The Mirror', 'name': None, 'seo': None, 'sub': None}","['Jonas, Joan', 'Art', 'Museum of Modern Art']",2024-03-01T10:01:44+0000,article,T Magazine
See-through elements bring a playful edge to glossy materials.,,"{'main': 'This Season, Mix Texture and Transparency', 'kicker': None, 'content_kicker': None, 'print_headline': 'Second Skins', 'name': None, 'seo': None, 'sub': None}","['Fashion and Apparel', 'Shoes and Boots', 'Coats and Jackets', 'Leather and Leather Goods']",2024-03-01T10:01:51+0000,article,T Magazine
“Louder Than Hunger” joins a very small shelf of novels and memoirs that address eating disorders from a male point of view.,"Jake Stacey is trying to erase himself from the world. Just 13, he is wasting away — shunning food and rollerblading frantically to drop additional pounds. A part of him dreams of performing on Broadway someday, but a nightmarish inner voice doesn’t want him to have a future at all. “It’s louder than the hunger in my stomach,” Jake tells us. It shouts, “YOU — ARE — REPULSIVE!”","{'main': 'John Schu’s Novel-in-Verse Lets a Boy Speak About Anorexia', 'kicker': 'Children’s Books', 'content_kicker': None, 'print_headline': 'A Stifled Voice Learns to Roar', 'name': None, 'seo': None, 'sub': None}","['genre-books-childrens', 'genre-books-young-adult', 'Books and Literature', 'Children and Childhood', 'Teenagers and Adolescence', 'ANOREXIA NERVOSA', 'Men and Boys', 'Schu, John']",2024-03-01T10:01:54+0000,article,Books
"The celebrated Broadway performer, director and choreographer is asking $2.3 million for the apartment at 414 East 52nd Street, one of two he owns in the same co-op complex.","Tommy Tune, the Broadway song-and-dance man, is selling a penthouse at the Southgate, a prewar co-op complex designed by Emery Roth on a quiet cul-de-sac facing the East River.","{'main': 'Tommy Tune Lists a Penthouse on the Far East Side', 'kicker': 'exclusive', 'content_kicker': None, 'print_headline': 'A Song-and-Dance Man Puts a Penthouse on the Market', 'name': None, 'seo': None, 'sub': None}","['Real Estate and Housing (Residential)', 'Tune, Tommy', 'Theater', 'Theater (Broadway)', 'Content Type: Personal Profile', 'High Net Worth Individuals']",2024-03-01T10:02:00+0000,article,Real Estate
Republicans are using an old battle cry to defend razor wire.,"On Thursday, President Biden and Donald Trump separately toured strips of the border, flanked by federal and state agents. For both, there was an eerily similar use of border security backdrop, signaling the decisive role it and immigration will play in the election.","{'main': 'The Ugly History at the Root of the Border Standoff', 'kicker': 'Guest Essay', 'content_kicker': None, 'print_headline': 'A War Mentality On the Texas Border', 'name': None, 'seo': None, 'sub': None}","['Illegal Immigration', 'Asylum, Right of', 'Border Barriers', 'Politics and Government', 'Texas', 'United States Politics and Government', 'Federal-State Relations (US)', 'Presidential Election of 2024', 'Biden, Joseph R Jr', 'Trump, Donald J', 'Republican Party']",2024-03-01T10:02:05+0000,article,Opinion
Will exhaustion and despair lead to some kind of resolution for Palestinians and Israelis?,"As the morning of Oct. 7 recedes into the distance, its horrors only seem to be growing. Again and again, we Israelis tell ourselves what has become part of the formative story of our identity and our destiny. How for several hours Hamas terrorists invaded the homes of Israelis, murdered some 1,200 people, raped and kidnapped, looted and burned. During those nightmarish hours, before the Israel Defense Forces snapped out of its shock, Israelis had a harsh and concrete glimpse of what might happen if their country not only suffered a punishing blow but also actually ceased to exist. If Israel were no longer.","{'main': 'Israel Is Falling Into an Abyss', 'kicker': 'Guest Essay', 'content_kicker': None, 'print_headline': 'Israel Is More Fortress  Than Home Right Now', 'name': None, 'seo': None, 'sub': None}","['Israel-Gaza War (2023- )', 'Israel', 'Defense and Military Forces', 'Gaza Strip', 'Palestinians', 'Jews and Judaism', 'Terrorism', 'Hamas', 'International Relations', 'Politics and Government']",2024-03-01T10:02:11+0000,article,Opinion
"In gritty tales from China’s northeast, Shuang Xuetao chronicles a traumatic chapter of Chinese history with fresh resonance today: the mass layoffs that afflicted the region in the 1990s.","For a long time during Shuang Xuetao’s early teenage years, he wondered what hidden disaster had befallen his family.","{'main': 'Murder and Magic Realism: A Rising Literary Star Mines China’s Rust Belt', 'kicker': 'The Saturday Profile', 'content_kicker': None, 'print_headline': 'A Rising Literary Star Mines China’s Rust Belt', 'name': None, 'seo': None, 'sub': None}","['China', 'Shenyang (China)', 'Shuang Xuetao', 'Writing and Writers', 'Books and Literature', 'Content Type: Personal Profile', 'Economic Conditions and Trends', 'Nineteen Hundred Nineties', 'Communist Party of China', 'Layoffs and Job Reductions']",2024-03-01T10:02:15+0000,article,World
"Tessa Hulls’s “Feeding Ghosts” chronicles how China’s history shaped her family. But first, she had to tackle some basics.","When Tessa Hulls set out to write a book about three generations of women in her family, she had few illusions about how hard the task would be.","{'main': 'A Writer’s To-Do List: Learn History. Learn Chinese. Learn to Draw Comics.', 'kicker': None, 'content_kicker': None, 'print_headline': 'Tackling Her Family’s Story, and China’s Too', 'name': None, 'seo': None, 'sub': None}","['Graphic Novels', 'Books and Literature', 'Writing and Writers', 'Content Type: Personal Profile', 'Chinese-Americans', 'Hulls, Tessa', 'Feeding Ghosts (Book)', 'China']",2024-03-01T10:02:27+0000,article,Books
"Businesses, which the sanitation commissioner said create 50 percent of the city’s garbage, will now all be required to use curbside containers.",Good morning. It’s Friday. We’ll find out why today is another milestone in the effort to make the city less desirable to rats. We’ll also get details on F.B.I. searches of two houses owned by a close aide to Mayor Eric Adams.,"{'main': 'As of Today, Half of New York City’s Trash Must Go in Bins', 'kicker': 'New York Today', 'content_kicker': None, 'print_headline': '', 'name': None, 'seo': None, 'sub': None}","['New York City', 'internal-storyline-no', 'Rats', 'Sanitation Department (NYC)', 'Adams, Eric L']",2024-03-01T10:02:29+0000,article,New York
"If lack of cash is keeping you from buying a house, you may have options.","If lack of cash is keeping you from buying a house, you may have options.","{'main': 'I Don’t Have Enough for a Down Payment. Can I Still Buy a House?', 'kicker': None, 'content_kicker': None, 'print_headline': '', 'name': None, 'seo': None, 'sub': None}","['Real Estate and Housing (Residential)', 'Federal Home Loan Mortgage Corp (Freddie Mac)', 'Mortgages', 'Federal National Mortgage Assn (Fannie Mae)', 'Veterans Affairs Department']",2024-03-01T10:02:31+0000,multimedia,Real Estate
"Though moral hazard is a powerful concept for thinking about risk in economics, it’s a flawed approach to designing drug policy.","In 2016, Rachel Winograd began to see methadone patients who relapsed or left the treatment program where she worked start overdosing and dying at unprecedented rates. The culprit was illicitly manufactured fentanyl, which is generally 50 times as strong as heroin — with some variants an astonishing 5,000 times as potent. Fentanyl had begun to overtake heroin in Missouri.","{'main': 'Moral Hazard Has No Place in Addiction Treatment', 'kicker': 'Guest Essay', 'content_kicker': None, 'print_headline': 'Moral Hazard Has No Place in Addiction Treatment', 'name': None, 'seo': None, 'sub': None}","['Naloxone (Drug)', 'Drug Abuse and Traffic', 'Heroin', 'Methadone', 'Deaths (Fatalities)', 'Fentanyl', 'Addiction (Psychology)', 'Hypodermic Needles and Syringes']",2024-03-01T10:02:38+0000,article,Opinion
The push from an affluent community in South Carolina to kill a plan for 60 subsidized apartments brought into public view how hard it is to give low-income families access to opportunity-rich neighborhoods.,"When developers set out to build 60 subsidized apartments in an affluent corner of Florence, S.C., the chairman of the County Council waxed enthusiastic. Affordable housing “would serve a great need,” he wrote, and its proximity to services and jobs fit county planning goals. He pledged a small grant.","{'main': 'Developers Got Backing for Affordable Housing. Then the Neighborhood Found Out.', 'kicker': None, 'content_kicker': None, 'print_headline': 'Housing Plan Gets a Yes. Community Says No.', 'name': None, 'seo': None, 'sub': None}","['FLORENCE (SC)', 'Affordable Housing', 'Public and Subsidized Housing', 'Zoning', 'Urban Areas', 'Land Use Policies', 'Area Planning and Renewal', 'Real Estate and Housing (Residential)', 'Tax Credits, Deductions and Exemptions', 'Income Inequality', 'Poverty', 'Discrimination', 'Race and Ethnicity', 'City Councils']",2024-03-01T10:02:42+0000,article,U.S.
