abstract,lead_paragraph,headline,keywords,pub_date,document_type,section_name
"Prime Minister Benjamin Netanyahu said 15 Israeli soldiers had been killed since Friday, but vowed to keep fighting.","Israeli leaders vowed on Sunday to pursue their war against Hamas, even as Israel’s own casualties mounted, with 15 soldiers reported killed in the Gaza Strip since Friday.","{'main': 'Israel Says It Is Intensifying Its Campaign Against Hamas', 'kicker': None, 'content_kicker': None, 'print_headline': 'Netanyahu Cites ‘Heavy Cost’ of War, but Vows to Continue the Fight', 'name': None, 'seo': None, 'sub': None}","['Israel-Gaza War (2023- )', 'Defense and Military Forces', 'United States International Relations', 'Netanyahu, Benjamin', 'Biden, Joseph R Jr', 'Hamas', 'Israel', 'Gaza Strip']",2023-12-25T00:00:14+0000,article,World
"As dinner tables and snack menus feature far more chicken and cheese, farms are expanding where water is scarce.","As dinner tables and snack menus feature far more chicken and cheese, farms are expanding where water is scarce.","{'main': 'How America’s Diet Is Feeding the Groundwater Crisis', 'kicker': None, 'content_kicker': None, 'print_headline': 'America’s Diet Is Feeding a Groundwater Crisis', 'name': None, 'seo': None, 'sub': None}","['Agriculture and Farming', 'Factory Farming', 'Water', 'Aquifers', 'Poultry', 'Cheese', 'Food', 'Chickens', 'Dairy Products', 'Soybeans', 'United States', 'vis-design']",2023-12-25T01:00:01+0000,multimedia,Climate
Wishing you and your family an excellent holiday.,"At a dairy farm in New York this month, carolers serenaded a herd of 28 cattle. Across Europe, Christmas markets popped up like fairy-dusted street fairs. And there’s cheer to be found even in the farthest reaches of the cosmos — the winking lights of the Christmas Tree Galaxy Cluster shine from approximately 4.3 billion light-years away.","{'main': 'A Special Christmas Briefing', 'kicker': None, 'content_kicker': None, 'print_headline': '', 'name': None, 'seo': None, 'sub': None}",['Christmas'],2023-12-25T05:01:04+0000,article,Briefing
"The Ukrainian Orthodox Church formally changed the main date for the festivities, departing from the Russian tradition of celebrating on Jan. 7, according to the Julian calendar.",Christmas lights flickered on ahead of schedule. Families sang carols a little sooner. And the first presents of the season — by tradition hidden under a pillow or in a boot — appeared two weeks early.,"{'main': 'Christmas Moves to Dec. 25 in Ukraine, Another Rebuff of Russia', 'kicker': None, 'content_kicker': None, 'print_headline': 'Early Arrival  Of Christmas  Lifts Ukraine', 'name': None, 'seo': None, 'sub': None}","['Christmas', 'Russian Orthodox Church', 'Russian Invasion of Ukraine (2022)', 'Ukrainian Orthodox Church', 'Russia', 'Ukraine']",2023-12-25T05:01:27+0000,article,World
"No corrections appeared in print on Monday, Dec. 25, 2023.","Errors are corrected during the press run whenever possible, so some errors noted here may not have appeared in all editions.","{'main': 'No Corrections: Dec. 25, 2023', 'kicker': None, 'content_kicker': None, 'print_headline': '', 'name': None, 'seo': None, 'sub': None}",[],2023-12-25T05:49:11+0000,article,Corrections
Several networks air countdown-to-2024 specials. And HBO releases a documentary about mass hysteria in the final days of 1999.,"Between network, cable and streaming, the modern television landscape is a vast one. Here are some of the shows, specials and movies coming to TV this week, Dec. 24-31. Details and times are subject to change.","{'main': 'What’s on TV This Week: New Year’s Eve Specials and ‘Time Bomb Y2K’', 'kicker': None, 'content_kicker': None, 'print_headline': 'This Week on TV', 'name': None, 'seo': None, 'sub': None}","['Television', 'Movies']",2023-12-25T06:00:12+0000,article,Arts
In case you need some puzzle help.,"Welcome to The Wordle Review. Be warned: This page contains spoilers for today’s puzzle. Solve Wordle first, or scroll at your own risk.","{'main': 'Today’s Wordle Review', 'kicker': None, 'content_kicker': None, 'print_headline': '', 'name': None, 'seo': None, 'sub': None}",['Wordle (Puzzle)'],2023-12-25T08:00:02+0000,article,Crosswords & Games
Feeling stuck on today’s puzzle? We can help.,"Hi busy bees! Welcome to today’s Spelling Bee forum. There are a number of terms that appear in both this article and other online discussions of the Spelling Bee; a glossary of those terms compiled by Monicat, a Times reader, can be found below.","{'main': 'Spelling Bee Forum', 'kicker': None, 'content_kicker': None, 'print_headline': '', 'name': None, 'seo': None, 'sub': None}",['Spelling Bee (Game)'],2023-12-25T08:00:03+0000,article,Crosswords & Games
In case you need some puzzle help.,"Good morning, dear connectors. Welcome to today’s Connections forum, where you can give and receive puzzle — and emotional — support.","{'main': 'The Connections Companion', 'kicker': None, 'content_kicker': None, 'print_headline': '', 'name': None, 'seo': None, 'sub': None}","['Crossword Puzzles', 'Connections (Game)']",2023-12-25T08:00:03+0000,article,Crosswords & Games
"Riyadh is seeking to avoid getting dragged back into a bloody clash with the Yemeni militia, which has sowed chaos by attacking shipping and firing missiles at Israel.","After Iran-backed rebels took over the capital of Yemen in 2014, a 30-year-old Saudi prince named Mohammed bin Salman spearheaded a military intervention to rout them.","{'main': 'Hoping for Peace With Houthis, Saudis Keep Low Profile in Red Sea Conflict', 'kicker': None, 'content_kicker': None, 'print_headline': 'Saudis, Eager for Peace, Avoid a Red Sea Conflict', 'name': None, 'seo': None, 'sub': None}","['Yemen', 'Saudi Arabia', 'Gaza Strip', 'Israel', 'Iran', 'Red Sea', 'Mohammed bin Salman (1985- )', 'Houthis', 'Israel-Gaza War (2023- )', 'International Relations', 'War and Armed Conflicts']",2023-12-25T08:00:20+0000,article,World
Hobby crafts are growing in popularity. Sometimes they include anvils and fire.,"The amateur blacksmiths were hard at work: heating metal rods, then hammering them into shape. Reheating, hammering some more, twisting and bending, and finally, hours later, creating small metal hooks.","{'main': 'Metal, Fire, ‘Hitting Stuff Hard’: Everybody Wants to Be a Blacksmith Now', 'kicker': None, 'content_kicker': None, 'print_headline': 'Hobbyists Are Drawn By Hammer And Fire', 'name': None, 'seo': None, 'sub': None}","['Hobbies', 'Steel and Iron', 'Connecticut', 'Handicrafts']",2023-12-25T08:00:22+0000,article,New York
A large segment of the Israeli work force has been called up to fight or become jobless as a result of the conflict with Hamas.,"The Israeli economy is expected to shrink by 2 percent this quarter, according to a leading research center, with hundreds of thousands of workers displaced by the war with Hamas or called up as reservists.","{'main': 'Israel’s Economy Expected to Shrink 2% as War Sidelines Workers', 'kicker': None, 'content_kicker': None, 'print_headline': 'Call-Up Sidelines Workers,  Shrinking Israel’s Economy', 'name': None, 'seo': None, 'sub': None}","['Israel-Gaza War (2023- )', 'Labor and Jobs', 'Bank of Israel', 'Israel', 'Economic Conditions and Trends', 'Gaza Strip']",2023-12-25T09:31:51+0000,article,World
"At 86, Sheila Sullivan remains the star of her own show, with Tina Dupuy as her enthusiastic sidekick.","Sheila Sullivan turned 86 this summer, and she had aging on her mind, because she was genuinely curious. What do all those old people you hear about, those poor souls, do with themselves all day? She had no idea.","{'main': 'Two Friends, Still in Step, Get a Kick Out of the Rockettes', 'kicker': None, 'content_kicker': None, 'print_headline': '', 'name': None, 'seo': None, 'sub': None}","['Theater', 'Actors and Actresses', 'Radio City Music Hall', 'Content Type: Personal Profile', 'internal-sub-only', 'internal-great-read', 'Sullivan, Sheila (1949- )']",2023-12-25T10:00:18+0000,article,New York
"The narrow Bahamian island boasts miles of mostly empty beaches, walking trails, turquoise ocean waters and other natural wonders, with no major resorts or high-end shopping.","Twin Coves, on the Atlantic Ocean side of the narrow, finger-shaped Bahamian island of Eleuthera, is a gorgeous spot: Two crescent-shaped, pink-sand beaches free of crowds, with calm waters protected from heavy waves by offshore sandbars.","{'main': 'Eleuthera Offers a Rugged, Out-Island Experience That Lingers', 'kicker': None, 'content_kicker': None, 'print_headline': '', 'name': None, 'seo': None, 'sub': None}","['Travel and Vacations', 'Eleuthera (Bahamas)', 'Bahama Islands']",2023-12-25T10:00:30+0000,article,Travel
Contortionists and acrobats with celestial skills train in squalid conditions as the promise of a former sumo wrestler to restore the national circus to its past glory has gone mostly unfulfilled.,"It’s cold as a walk-in refrigerator at the Mongolian Circus School, housed in a once proud edifice now on the verge of collapse with cracked walls, moldy ceilings and the stale smell of decades of cigarette smoke embedded into the venue’s wooden frame.","{'main': 'Mongolians Are Circus Stars All Over the World, Except at Home', 'kicker': 'Mongolia dispatch', 'content_kicker': None, 'print_headline': ' Training Stars For the Big Top Far From Home', 'name': None, 'seo': None, 'sub': None}","['Mongolia', 'Circuses', 'ACROBATS AND ACROBATICS', 'Cirque du Soleil', 'Ringling Bros and Barnum & Bailey Circus']",2023-12-25T10:00:31+0000,article,World
"In a wide-ranging interview, Dr. Monica M. Bertagnolli, the director of the National Institutes of Health, discussed drug patents, trust in science and her own experience as a cancer patient.","When Dr. Monica M. Bertagnolli moved into the director’s suite at the National Institutes of Health, she brought with her a single piece of art, a lithograph created by the granddaughter of a cancer patient she once treated. It depicts an abstract geometric female figure and the organs she lost to cancer. Its title: “We Are Not What You Have Taken: A Response to Cancer.”","{'main': 'N.I.H.’s New Leader Wants to Broaden Participation in Medical Research', 'kicker': None, 'content_kicker': None, 'print_headline': '', 'name': None, 'seo': None, 'sub': None}","['Bertagnolli, Monica M', 'National Institutes of Health', 'Clinical Trials', 'Research', 'Inventions and Patents', 'Drugs (Pharmaceuticals)', 'United States Politics and Government']",2023-12-25T10:00:53+0000,article,U.S.
"For years, Theron Truluck was living in desperate conditions in New York City, mostly on the Q train. Now he’s part of a program that prioritizes housing for people who do not have shelter.","Theron Truluck has everything he needs, for now, in his 425-square-foot apartment in the Bronx. The modest dorm-style room, with white walls and red-tiled floors, comes with a mini fridge, a microwave, a sink, a twin-size bed, a desk and an armoire. He also has access to a shared shower and bathroom, a community kitchen, and his building has a computer room when he wants to use the internet.","{'main': 'The First Step to Get Off the Streets? A Room of His Own.', 'kicker': 'renters', 'content_kicker': None, 'print_headline': 'Off the Seats of the Q Train and Into His Own Space', 'name': None, 'seo': None, 'sub': None}","['Renting and Leasing (Real Estate)', 'Real Estate and Housing (Residential)', 'Homeless Persons', 'Public and Subsidized Housing', 'Mental Health and Disorders', 'Group Homes and Supportive Housing', 'New York City']",2023-12-25T10:00:57+0000,article,Real Estate
"“I looked different, I dressed different,” the multi-hyphenate star said in her first interview on fashion.",She flirted with Brando and even Prince Charles. She has been romantically linked with a succession of Hollywood hunks — think Warren Beatty and Ryan O’Neal.,"{'main': 'Barbra Streisand Talks Style', 'kicker': None, 'content_kicker': None, 'print_headline': 'Barbra Streisand Talks Fashion', 'name': None, 'seo': None, 'sub': None}","['Books and Literature', 'My Name Is Barbra (Book)', 'Streisand, Barbra', 'Content Type: Personal Profile', 'Fashion and Apparel']",2023-12-25T10:01:07+0000,article,Style
"“Kaathal,” about a closeted gay politician, is the latest example of what Kerala’s movie industry has become known for: nuanced films that find box office success.","It is an Indian film without song and dance. The lovers don’t share a word, their main interaction a fleeting moment of eye contact in the monsoon rain. There are no car chases and no action stunts. The men are vulnerable. They cry.","{'main': 'Beyond Bollywood’s Glitz, a Subtler Indian Cinema Embraces New Stories', 'kicker': None, 'content_kicker': None, 'print_headline': 'Beyond Bollywood’s Glitz, a Subtler Indian Cinema Emerges', 'name': None, 'seo': None, 'sub': None}","['Movies', 'Homosexuality and Bisexuality', 'Kaathal -- The Core (Movie)', 'Kerala (India)', 'KOCHI (INDIA)', 'India', 'Freedom of Speech and Expression', 'Baby, Jeo', 'Mammootty (1951- )']",2023-12-25T10:01:10+0000,article,World
"A super PAC backing the former governor of South Carolina plans to knock on 100,000 doors in Iowa before the caucuses, but it’s running out of time to spread her message.","Tyler Raygor rapped on the door of a gray, one-story house in a neighborhood in northern Ames, Iowa, and waited until a man in a hoodie and jeans appeared before launching into his pitch.","{'main': 'Newly Flush With Cash, Nikki Haley Makes Her Move in Iowa. Is It Too Late?', 'kicker': None, 'content_kicker': None, 'print_headline': 'Haley’s Effort in Iowa Is Picking Up Funding With the Clock Ticking', 'name': None, 'seo': None, 'sub': None}","['Haley, Nikki R', 'DeSantis, Ron', 'Trump, Donald J', 'Iowa', 'Presidential Election of 2024', 'Koch, Charles G', 'Koch, David H', 'Republican Party', 'Primaries and Caucuses']",2023-12-25T10:01:29+0000,article,U.S.
Toasting a year of breakthroughs (and a few breakdowns) in Silicon Valley and beyond.,"In the tech industry, 2023 was a year of transformation.","{'main': 'The 2023 Good Tech Awards', 'kicker': 'The Shift', 'content_kicker': None, 'print_headline': 'The 2023 Good Tech Awards', 'name': None, 'seo': None, 'sub': None}","['Two Thousand Twenty Three', 'Computers and the Internet', 'Artificial Intelligence', 'Genetic Engineering', 'Sickle Cell Anemia', 'Driverless and Semiautonomous Vehicles', 'Be My Eyes (Accessibly Inc)', 'Apple Inc', 'University of Texas at Austin', 'Vertex Pharmaceuticals Inc', 'CRISPR Therapeutics', 'University of Kentucky', 'Waymo', 'National Institute of Standards and Technology']",2023-12-25T10:01:43+0000,article,Technology
"A 1989 shingle-clad house in Bodega Bay, a townhouse in Santa Monica and a midcentury ranch house with a cabana and studio in Long Beach.","This house is about a mile from the Pacific Ocean, with views that also stretch east to the hills beyond the Russian River. It is a five-minute drive from beaches popular for surfing, swimming and fishing, as well as several waterfront restaurants and a fish market. Doran Regional Park and the Links at Bodega Harbour, an 18-hole golf course, are less than 10 minutes away.","{'main': '$1.6 Million Homes in California', 'kicker': 'What You Get', 'content_kicker': None, 'print_headline': '', 'name': None, 'seo': None, 'sub': None}","['Real Estate and Housing (Residential)', 'Bodega Bay (Calif)', 'Santa Monica (Calif)', 'Long Beach (Calif)']",2023-12-25T10:01:44+0000,article,Real Estate
A legal dispute in a tiny Texas town unexpectedly reveals how Chinese nationals can move money to the U.S. without drawing the attention of authorities in either country.,"Jerry Yu has the trappings of what the Chinese call second-generation rich. He boasts a Connecticut prep-school education. He lives in a Manhattan condominium bought for $8 million from Jeffrey R. Immelt, the former General Electric chief executive. And he is the majority owner of a Bitcoin mine in Texas, acquired last year for more than $6 million.","{'main': 'This N.Y.U. Student Owns a $6 Million Crypto Mine. His Secret Is Out.', 'kicker': None, 'content_kicker': None, 'print_headline': 'A Crypto Mine Brings Secrets To the Surface', 'name': None, 'seo': None, 'sub': None}","['Bitcoin (Currency)', 'BitRush Inc', 'Binance', 'Tether Operations Ltd', 'Texas', 'United States', 'China']",2023-12-25T10:02:00+0000,article,Technology
"George Gascón is running for re-election in a very different climate, where concerns about crime have overtaken demands for equity and accountability.","Three years ago, George Gascón rode a wave of collective outrage following the murder of George Floyd in Minneapolis to become district attorney of Los Angeles by promising to make the criminal justice system fairer and, most crucially, to rein in the police.","{'main': 'In L.A. District Attorney Race, Rhetoric Shifts From Reform to Fear', 'kicker': None, 'content_kicker': None, 'print_headline': 'In Bid to Keep Job, Los Angeles District Attorney Shifts Focus From Reform', 'name': None, 'seo': None, 'sub': None}","['Elections, District Attorneys', 'Gascon, George', 'Los Angeles (Calif)', 'Police Brutality, Misconduct and Shootings', 'Police', 'Black Lives Matter Movement', 'Criminal Justice', 'Crime and Criminals']",2023-12-25T10:02:04+0000,article,U.S.
"Movie audiences flocked to Taylor Swift, “Barbie” and “Oppenheimer” but were cooler toward returning superheroes like the Flash, Captain Marvel and Aquaman.","Hollywood’s movie factories run on conventional wisdom — entrenched notions, based on experience, about what types of films are likely to pop at the global box office.","{'main': '2023 Box Office Lessons: Audiences Sought Comfort, Skipped Spectacle', 'kicker': None, 'content_kicker': None, 'print_headline': 'Moviegoers Tuned Out Spectacle in 2023', 'name': None, 'seo': None, 'sub': None}","['Movies', 'Box Office Sales', 'Two Thousand Twenty Three', 'Barbie (Movie)', 'The Super Mario Bros Movie (Movie)', 'Oppenheimer (Movie)', 'Swift, Taylor', 'Sound of Freedom (Movie)']",2023-12-25T10:02:19+0000,article,Business Day
"Travel can be a gift that connects us in ways that surpass language barriers and cultural differences. At this time of year, in the spirit of gratitude, we want to hear your stories.","Several years ago, my now-husband, Alex, and I spent a few months sailing around Indonesia, experiencing both highs — turquoise waters, freshly caught fish and stunning sunsets — and lows, including a broken engine. We were also there during Ramadan, a special time to be traveling in the world’s most populous Muslim nation.","{'main': 'Have You Witnessed an Act of Kindness While Traveling? Share It With Us.', 'kicker': None, 'content_kicker': None, 'print_headline': '', 'name': None, 'seo': None, 'sub': None}","['internal-reader-callout', 'Travel and Vacations', 'Altruism']",2023-12-25T10:02:22+0000,article,Travel
Seeds of doubt have grown into a disturbance among some in the game’s top ranks.,"This is an era of milk and honey for those who live, breathe and make their livelihood from chess. But, like family members fighting over a piece of bread at the dinner table, the top players cannot seem to stop getting into disputes about the integrity of the game.","{'main': 'Elite Chess Players Keep Accusing Each Other of Cheating', 'kicker': None, 'content_kicker': None, 'print_headline': 'Accusations of Cheating Continue to Soar Among World’s Top Chess Players', 'name': None, 'seo': None, 'sub': None}","['Chess', 'Cheating', 'Carlsen, Magnus', 'Niemann, Hans (2003- )', 'Nakamura, Hikaru', 'Chess.com LLC', 'International Chess Federation']",2023-12-25T10:02:48+0000,article,Crosswords & Games
"A writer went behind the scenes with Shawn Killinger, whose breezy authority stands out on the shopping network. “The big secret is that I don’t sell,” she said.","On a Saturday night earlier this month, the QVC host Shawn Killinger kicked off another episode of “Shawn Saves Christmas,” the seasonal series she hosts live at QVC’s gargantuan 24/7 broadcast center in West Chester, Pa., about an hour’s drive from Philadelphia. But by the end of the first segment, it seemed like Shawn was going to sink Christmas instead.","{'main': 'This QVC Host Can Help You Sell Yourself', 'kicker': None, 'content_kicker': None, 'print_headline': 'A QVC Host Can Help You Sell Yourself', 'name': None, 'seo': None, 'sub': None}","['Television', 'QVC Inc', 'Killinger, Shawn', 'Shopping and Retail', 'Content Type: Personal Profile']",2023-12-25T10:02:48+0000,article,Arts
"“Bob’s Burgers,” “Frontline,” “Killing It” and “A Spy Among Friends” were among the series that gave us some of the best episodes of television this year.","Great TV series can run for dozens or hundreds of hours, but we still experience them a piece at a time. This list is dedicated to those pieces: a handful of the best episodes that Mike Hale, Margaret Lyons and I saw in a year of professional viewership.","{'main': 'Best TV Episodes of 2023', 'kicker': None, 'content_kicker': None, 'print_headline': '(Some of) the Best TV Episodes of 2023', 'name': None, 'seo': None, 'sub': None}","['Television', 'A Spy Among Friends (TV Program)', ""Bob's Burgers (TV Program)"", 'Cunk on Earth (TV Program)', 'Extraordinary (TV Program)', 'Frontline (TV Program)', 'Stolen Youth: Inside the Cult at Sarah Lawrence (TV Program)', 'Telemarketers (TV Program)', 'Wrestlers (TV Program)']",2023-12-25T10:03:01+0000,article,Arts
"Eye-popping looks from 12 months of openings, galas and parties.","The Covid-19 public health emergency officially expired in the United States in May, and it seemed the celebrations were nonstop.","{'main': 'The Year in Dressing Up', 'kicker': None, 'content_kicker': None, 'print_headline': 'Dazzling Looks From a Year Of Dressing Up', 'name': None, 'seo': None, 'sub': None}","['Parties (Social)', 'Torres, Julio (Comedian)', 'Nas']",2023-12-25T10:03:13+0000,article,Style
"As dinner tables and snack menus feature far more chicken and cheese, farms are expanding where water is scarce.","As dinner tables and snack menus feature far more chicken and cheese, farms are expanding where water is scarce.","{'main': 'How America’s Diet Is Feeding the Groundwater Crisis', 'kicker': None, 'content_kicker': None, 'print_headline': '', 'name': None, 'seo': None, 'sub': None}","['Cheese', 'Poultry', 'Agriculture and Farming', 'Water', 'Snack Foods', 'Diet and Nutrition']",2023-12-25T10:03:33+0000,multimedia,Climate
"What to wear as you age is a highly personal decision, our critic writes, but certain garments still come with associations and assumptions.","This is a question I ask myself a lot. After all, just because you can wear something doesn’t mean you should.","{'main': 'What Does It Mean to ‘Dress Your Age’?', 'kicker': 'ASK Vanessa', 'content_kicker': None, 'print_headline': '', 'name': None, 'seo': None, 'sub': None}","['Fashion and Apparel', 'Content Type: Service', 'Elderly']",2023-12-25T10:03:34+0000,article,Style
A selection of games and music for the holiday.,My colleagues and I thought today would be a good day to remind you of some recent Times games — as well as an all-time classic — that you can play on your own or with friends and family.,"{'main': 'A Day to Play', 'kicker': None, 'content_kicker': None, 'print_headline': '', 'name': None, 'seo': None, 'sub': None}","['internal-storyline-no', 'Games']",2023-12-25T11:33:02+0000,article,Briefing
"Quotation of the Day for Monday, December 25, 2023.",“The religious sphere cannot belong to an aggressor country.”,"{'main': 'Quotation of the Day: Early Arrival of Christmas Lifts Ukraine', 'kicker': None, 'content_kicker': None, 'print_headline': 'Quote of the Day', 'name': None, 'seo': None, 'sub': None}",[],2023-12-25T12:18:44+0000,article,Corrections
"Supporters of the Russian opposition leader lost contact with him 20 days ago, fueling concern about his health and whereabouts.","The Russian opposition leader Aleksei A. Navalny has been moved to a remote Arctic prison and “is doing well,” his spokeswoman said on Monday, ending a 20-day mystery over his whereabouts that had many supporters fearing the worst.","{'main': 'Aleksei Navalny Found in Remote Arctic Prison, Easing Fears Over His Safety', 'kicker': None, 'content_kicker': None, 'print_headline': 'Quest to Find Navalny Ends In a Prison In the Arctic', 'name': None, 'seo': None, 'sub': None}","['Political Prisoners', 'Navalny, Aleksei A', 'Russia']",2023-12-25T13:28:34+0000,article,World
"The Gazan Health Ministry blamed Israeli airstrikes for the deaths, and Israel’s military said it was reviewing the episode.","Prime Minister Benjamin Netanyahu visited Israeli troops fighting in the Gaza Strip on Monday, vowing to stay the course of the war even with the death toll mounting. His trip came hours after Gazan health officials reported that a devastating overnight strike on a crowded neighborhood had killed dozens.","{'main': 'Netanyahu Visits Gaza as Palestinians Mourn an Attack That Officials Say Killed Dozens', 'kicker': None, 'content_kicker': None, 'print_headline': 'Netanyahu Visits Gaza After Deadly Airstrikes', 'name': None, 'seo': None, 'sub': None}","['Israel', 'Gaza Strip', 'Israel-Gaza War (2023- )', 'Netanyahu, Benjamin', 'Civilian Casualties']",2023-12-25T13:36:22+0000,article,World
