abstract,lead_paragraph,headline,keywords,pub_date,document_type,section_name
"A Korean drink made locally, caramel galettes des rois and more food news.","Regardless of whether the concrete becomes a winter wonderland, fondue is having its moment this season. Jean-Georges Vongerichten’s new outdoor chalet, on Madison Avenue at the Mark Hotel, is serving fondue and other Swiss specialties to the Upper East Side. The Winter Chalet, a cozy new pop-up designed by Corey Damen Jenkins at the Hotel Indigo in Williamsburg, Brooklyn, through Feb. 29, serves cheese and chocolate fondues. Another, Partridge at The Standard, East Village, open until Dec. 31, features cheese fondue, and fondue has returned to Andrew Carmellini’s Lafayette, in NoHo. You can count on the simmering cheese-based communal dipping pot year-round at La Bonne Soupe, in Midtown; at the Lavaux Wine Bar, the three-year old Swiss establishment in the West Village, there are six varieties, including porcini, tomato and truffle, with Swiss wines to discover and chocolate fondue for dessert. And at the newly opened burger spot Cantiere Hambirreria, an Italian import parked in NoLIta, there are handmade bowls that are filled with cheese fondue. Williams-Sonoma now sells nine different fondue pots, $79.95 to $870 with various fuels and accessories.","{'main': 'Live Out Your Chalet Fantasies With These Fondue Pop-Ups', 'kicker': 'Front Burner', 'content_kicker': None, 'print_headline': 'To Dip: Enjoy Chalet Fantasies With Fondue Pop-Ups', 'name': None, 'seo': None, 'sub': None}","['Cooking and Cookbooks', 'Food', 'Chocolate', 'Caviar']",2023-12-26T10:03:22+0000,article,Food
"What if, instead of focusing on improving ourselves, we focused on improving the world?","New Year’s resolutions are penny-ante prayers. You are this way, but you hope to be that way. You used to want this, but now you want that.","{'main': 'This Year, Make a Resolution About Something Bigger Than Yourself', 'kicker': 'Guest Essay', 'content_kicker': None, 'print_headline': 'Resolve About Something Bigger Than Yourself', 'name': None, 'seo': None, 'sub': None}","['New Year', 'Whitman, Walt']",2023-12-26T10:03:29+0000,article,Opinion
"Polls have been pretty clear: If he is criminally convicted by a jury of his peers, voters are likely to punish him for it.",Recent general-election polling has generally shown Donald Trump maintaining a slight lead over President Biden. Yet many of those polls also reveal an Achilles’ heel for Mr. Trump that has the potential to change the shape of the race.,"{'main': 'A Trump Conviction Could Cost Him Enough Voters to Tip the Election', 'kicker': 'Guest Essay', 'content_kicker': None, 'print_headline': '', 'name': None, 'seo': None, 'sub': None}","['Presidential Election of 2024', 'Polls and Public Opinion', 'Jury System', 'Trump, Donald J', 'Biden, Joseph R Jr', 'Federal Criminal Case Against Trump (Documents Case)', 'Federal Criminal Case Against Trump (2020 Election Case)', 'Georgia Criminal Case Against Trump (2020 Election)', 'New York State Criminal Case Against Trump (71543-23)']",2023-12-26T10:03:30+0000,article,Opinion
Burgers & Beer offers an international lineup of burgers in the Village; Don Ceviche opens a full-service restaurant in the East Village; and more restaurant news.,,"{'main': 'Sixpoint Brewery Celebrates 20 Years With a Manhattan Taproom', 'kicker': 'off the menu', 'content_kicker': None, 'print_headline': '', 'name': None, 'seo': None, 'sub': None}","['Restaurants', 'Bars and Nightclubs', 'Sixpoint Brewery', 'New York City']",2023-12-26T10:03:39+0000,article,Food
"Over the past year, dance has shown its broader worth, from stage to film, #balletcore to music videos, TikTok tutorials to movement classes.","There’s been a lot of dance seemingly coming out of nowhere. A recent unexpected sighting — one of many this year — happened just this month on “Saturday Night Live,” when Chloe Fineman, dressed in a Santa coat, appeared on Weekend Update with an idea for a sexy present: re-enacting the dance that Julia Stiles performed at the end of “Save the Last Dance.” So random!","{'main': 'What if Dance Could Save the World?', 'kicker': 'CRITIC’S NOTEBOOK', 'content_kicker': None, 'print_headline': 'Uncork the Elixir of Bodies in Motion', 'name': None, 'seo': None, 'sub': None}","['Dancing', 'Social Media', 'Two Thousand Twenty Three', 'TikTok (ByteDance)']",2023-12-26T10:03:41+0000,article,Arts
"Deadheads, ballerinas and Mick Jagger: As 2023 winds down, revisit a memorable handful of the thousands of images commissioned by our photo editors that capture the year in culture.",,"{'main': '2023 in Retrospect: 59 Photographs That Defined the Year in Arts', 'kicker': None, 'content_kicker': None, 'print_headline': 'Deadheads, Ballerinas, Mick Jagger and More', 'name': None, 'seo': None, 'sub': None}","['Two Thousand Twenty Three', 'Photography', 'Culture (Arts)', 'vis-photo']",2023-12-26T10:03:44+0000,article,Arts
"Ending off-year elections will make races more competitive, increasing voter power and diminishing the role of special interests.","In a rare bit of political good news in the final days of 2023, Gov. Kathy Hochul of New York has signed into law legislation aimed at increasing voter turnout.","{'main': 'How to Boost Voter Turnout With Just One Signature', 'kicker': 'Mara Gay', 'content_kicker': None, 'print_headline': 'A New Law Will Help Bolster Voting in New York', 'name': None, 'seo': None, 'sub': None}","['Law and Legislation', 'State Legislatures', 'Voting and Voters', 'Governors (US)', 'Politics and Government', 'Hochul, Kathleen C', 'New York City', 'New York State', 'Elections']",2023-12-26T10:03:46+0000,article,Opinion
"Meal-flavored cocktails, premium water and lots of snacks: Here’s what the next year holds for food and drinks.","No one can predict with certainty what we will eat and drink in the new year, but multitudes try.","{'main': '9 Predictions for How We’ll Eat in 2024', 'kicker': None, 'content_kicker': None, 'print_headline': 'Peering Into the Bowls, Plates and Glasses of 2024', 'name': None, 'seo': None, 'sub': None}","['Food', 'Beverages', 'Soups', 'Snack Foods', 'Two Thousand Twenty Four']",2023-12-26T10:03:47+0000,article,Food
Analysts bullish on 2023 were largely right and expect more of the same in 2024. Bears caution that the Fed’s impact is yet to be determined.,"Twelve months ago, Tom Lee bet that 2023 was going to turn out just fine.","{'main': 'Downturn or Not? At Year’s End, Wall St. Is Split on What’s Ahead.', 'kicker': None, 'content_kicker': None, 'print_headline': 'Wall Street Ends the Year Split Over What to Expect in 2024', 'name': None, 'seo': None, 'sub': None}","['Stocks and Bonds', ""Standard & Poor's 500-Stock Index"", 'United States Economy', 'Inflation (Economics)', 'Russell 2,000 Stock Index']",2023-12-26T10:04:45+0000,article,Business Day
His candidacy and message are likely to be about restoring a prepandemic order and a sense of security in an unstable world.,"A wrecking ball. A bull in a China shop. A chaos candidate. During Donald Trump’s whirlwind rise to the presidency, his opponents and critics frequently noted his penchant for havoc. Surely, they believed, voters would not want to steer the country toward disorder and mayhem.","{'main': 'How Trump Is Running Differently This Time', 'kicker': 'Guest Essay', 'content_kicker': None, 'print_headline': 'Trump Is Running Differently This Time', 'name': None, 'seo': None, 'sub': None}","['Presidential Election of 2024', 'Biden, Joseph R Jr', 'Trump, Donald J', 'United States Economy', 'Illegal Immigration', 'Polls and Public Opinion', 'Coronavirus (2019-nCoV)', 'Afghanistan War (2001- )']",2023-12-26T10:04:45+0000,article,Opinion
"While the pace of growth slowed, spending stayed strong because of robust job growth and strong wage gains.","Despite lingering inflation, Americans increased their spending this holiday season, early data shows. That comes as a big relief for retailers that had spent much of the year fearing the economy would soon weaken and consumer spending would fall.","{'main': 'Holiday Spending Increased, Defying Fears of a Decline', 'kicker': None, 'content_kicker': None, 'print_headline': 'Holiday Spending Rises,  Defying Fears of a Decline', 'name': None, 'seo': None, 'sub': None}","['United States Economy', 'Consumer Behavior', 'Shopping and Retail', 'Labor and Jobs', 'Wages and Salaries', 'Holidays and Special Occasions', 'Christmas', 'Inflation (Economics)', 'Discount Selling', 'United States']",2023-12-26T10:04:46+0000,article,Business Day
"Members of Congress who have children with disabilities have bonded over that shared experience, despite vast political differences and broader polarization.","One year into his first term in Congress, Senator Eric Schmitt, Republican of Missouri, has sought to find his lane while learning how multilayered relationships in Washington can be.","{'main': 'Lawmakers With Disabled Children Find Common Ground in Divided Congress', 'kicker': None, 'content_kicker': None, 'print_headline': 'Lawmakers With Disabled Children Find Common Ground in Congress ', 'name': None, 'seo': None, 'sub': None}","['United States Politics and Government', 'Disabilities', 'Law and Legislation', 'Down Syndrome', 'Autism', 'McMorris Rodgers, Cathy', 'Schmitt, Eric (1975- )', 'Stauber, Peter (1966- )', 'Hassan, Margaret', 'Democratic Party', 'Republican Party', 'House of Representatives', 'Senate']",2023-12-26T10:04:48+0000,article,U.S.
"Jean Garnett is an editor at Little, Brown. Callie Garnett is an editor at Bloomsbury. They’re always rooting for each other — even when they’re competing for the same book.","One afternoon in August 2020, while staying at her parents’ house in the Hudson Valley, Jean Garnett, an editor at Little, Brown & Company, prepared to meet remotely with the author Chantal V. Johnson, whose novel “Post-traumatic” she wanted to acquire for publication.","{'main': 'Seeing Double With the Publishing Twins', 'kicker': None, 'content_kicker': None, 'print_headline': 'Writers, Editors, Sisters: Meet the Publishing Twins', 'name': None, 'seo': None, 'sub': None}","['Book Trade and Publishing', 'Content Type: Personal Profile', 'Twins', 'Garnett, Callie', 'Garnett, Jean (Editor)', 'Bloomsbury Publishing PLC', 'Little Brown & Co']",2023-12-26T10:04:49+0000,article,Style
A major military success at sea against Russia’s Black Sea Fleet was tempered by Ukraine’s acknowledgment that it had all but retreated from the city of Marinka.,"Ukraine scored a major success on Tuesday when it struck a Russian warship at port in Crimea, one of the most significant attacks against Moscow’s Black Sea Fleet in months. But in another setback for their ground campaign, Ukrainian officials acknowledged that they had all but retreated from the eastern city of Marinka after a monthslong battle to defend it.","{'main': 'Ukraine Hits Major Russian Warship, but Loses Ground in the East', 'kicker': None, 'content_kicker': None, 'print_headline': 'Ukraine Hits Russian Warship but Loses Ground in the East', 'name': None, 'seo': None, 'sub': None}","['Russian Invasion of Ukraine (2022)', 'Defense and Military Forces', 'Marinka (Ukraine)', 'Black Sea', 'Crimea (Ukraine)', 'Russia', 'Ukraine']",2023-12-26T10:15:33+0000,article,World
"The comments from the Russian opposition leader were written with a heavy dose of humor, and seemed intended to assuage concerns among allies after his three-week disappearance.","Aleksei A. Navalny, Russia’s most prominent opposition leader, published a letter on Tuesday describing an arduous transfer to his new penal colony in the Arctic, the first time his supporters had heard from him in three weeks.","{'main': 'In Letter Heavy With Irony, Navalny Describes Transfer to Arctic Prison', 'kicker': None, 'content_kicker': None, 'print_headline': 'Navalny Uses Humor to Write About His Transfer to an Arctic Circle Prison', 'name': None, 'seo': None, 'sub': None}","['Prisons and Prisoners', 'Political Prisoners', 'Navalny, Aleksei A', 'ARCTIC REGIONS', 'Russia']",2023-12-26T10:48:50+0000,article,World
"Many residents of Lahaina, on Maui, tried to escape — but they had nowhere to go.","This week, The Daily is revisiting some of our favorite episodes of the year and checking in on what has happened in the time since.","{'main': 'How a Paradise Became a Death Trap: An Update', 'kicker': None, 'content_kicker': None, 'print_headline': '', 'name': None, 'seo': None, 'sub': None}","['audio-neutral-informative', 'Fires and Firefighters', 'Deaths (Fatalities)', 'Historic Buildings and Sites', 'Lahaina (Hawaii)', 'Hawaii', 'Maui (Hawaii)']",2023-12-26T11:00:09+0000,article,Podcasts
"Stories about the Titan submersible, Matthew Perry and the House Speaker vote were among the most-read of the year.",This was the year when many Times readers began to care about artificial intelligence. It was also a year when they wanted their friends and family members to care about the subject.,"{'main': 'The Most Popular Times Articles of 2023', 'kicker': None, 'content_kicker': None, 'print_headline': '', 'name': None, 'seo': None, 'sub': None}","['internal-storyline-no', 'New York Times', 'Two Thousand Twenty Three', 'News and News Media']",2023-12-26T11:53:26+0000,article,Briefing
"Niels Arden Oplev’s drama about two sisters, one of whom is a woman with schizophrenia, on a bus tour of France brims with genuine feeling.","In the honest and heartfelt Danish drama “Rose,” two sisters take a bus tour to France. The elder, Inger (Sofie Grabol), lives with schizophrenia, and resides in a psychiatric clinic where she receives care from staff and coddling from her mother. The younger, Ellen (Lene Maria Christensen), sees the vacation as an chance to bond with her sister, whom she believes could benefit from more independence.","{'main': '‘Rose’ Review: My Sister’s Keeper', 'kicker': 'Critic’s Pick', 'content_kicker': None, 'print_headline': 'Anxiety and Adventure on the Road', 'name': None, 'seo': None, 'sub': None}","['Movies', 'Oplev, Niels Arden', 'Rose (Movie)']",2023-12-26T12:00:02+0000,article,Movies
The memoirist’s sentimental film speaks to Black Americans returning to the South.,"Consumed by fears of inner-city violence and the traumatic effects of the crack epidemic, “Down in the Delta” didn’t lead to a career in filmmaking for the writer Maya Angelou. Instead, 25 years later, the inspiring yet uniquely flawed film remains her lone directorial feature.","{'main': '‘Down in the Delta’ at 25: When Maya Angelou Considered Reverse Migration', 'kicker': None, 'content_kicker': None, 'print_headline': '', 'name': None, 'seo': None, 'sub': None}","['Documentary Films and Programs', 'Down in the Delta (Movie)', 'Black People', 'Blacks', 'ANGELOU, MAYA', 'Southern States (US)']",2023-12-26T12:00:10+0000,article,Movies
Regional bank failures and the conviction of Sam Bankman-Fried were among the big news events this year.,"The collapse of Silicon Valley Bank, the conviction of Sam Bankman-Fried, the reassertion of union power and the turmoil at OpenAI were just some of the big business stories in a year that was full of them.","{'main': 'A Look Back at the Top Business Stories of 2023', 'kicker': None, 'content_kicker': None, 'print_headline': 'What Rocked the Universe of Business in 2023', 'name': None, 'seo': None, 'sub': None}","['Taylor Swift: The Eras Tour (Movie)', 'Swift, Taylor']",2023-12-26T12:52:46+0000,article,Business Day
"The measure must now be passed by the full Parliament, but the foreign affairs committee said not to expect quick action.","The foreign affairs committee of Turkey’s Parliament on Tuesday approved Sweden’s bid to join NATO, placing the Nordic country one step closer to joining the military alliance.","{'main': 'Turkish Parliamentary Panel Approves Sweden’s NATO Bid', 'kicker': None, 'content_kicker': None, 'print_headline': 'Turkey Vote  Lets Sweden Move Ahead In NATO Bid', 'name': None, 'seo': None, 'sub': None}","['Turkey', 'Sweden', 'North Atlantic Treaty Organization', 'International Relations', 'Russian Invasion of Ukraine (2022)', 'Defense and Military Forces', 'Politics and Government', 'Legislatures and Parliaments']",2023-12-26T13:20:37+0000,article,World
"A mainstay of Detroit’s soul, funk and electronic music scenes, he also offered guidance to young hip-hop and electronic music aspirants, notably J Dilla.","Amp Fiddler, a former keyboardist with Parliament-Funkadelic who became a fixture of Detroit’s soul, funk and electronic music scenes, and whose tutelage of the young rapper J Dilla helped alter the trajectory of hip-hop, died on Dec. 18 in Detroit. He was 65.","{'main': 'Amp Fiddler, Versatile Keyboardist, Singer and Mentor, Dies at 65', 'kicker': None, 'content_kicker': None, 'print_headline': '', 'name': None, 'seo': None, 'sub': None}","['Fiddler, Amp (1958-2023)', 'Rhythm and Blues (Music)', 'Rap and Hip-Hop', 'J Dilla (1974-2006)', 'Parliament-Funkadelic', 'Mentors', 'Detroit (Mich)', 'Deaths (Obituaries)']",2023-12-26T14:06:35+0000,article,Arts
"Her new store, Atelier Jolie, occupies an unassuming building on Great Jones Street with an illustrious history.","When Angelina Jolie opened her first fashion boutique in a squat, two-story building at 57 Great Jones Street in Lower Manhattan this month, she joined a long line of notable New Yorkers, including gangsters and artists, who lived or worked at that unassuming address.","{'main': 'Angelina Jolie and the Ghosts of New York Past', 'kicker': None, 'content_kicker': None, 'print_headline': 'One Building Has Plenty of Pasts', 'name': None, 'seo': None, 'sub': None}","['Historic Buildings and Sites', 'Celebrities', 'Real Estate (Commercial)', 'Jolie, Angelina', 'Basquiat, Jean-Michel', 'Warhol, Andy', 'Fashion and Apparel', 'Bowery (Manhattan, NY)', 'Atelier Jolie (Manhattan, NY, Retailer)']",2023-12-26T14:21:35+0000,article,Style
A new revival directed by Emily Mann and starring Tim Daly leans into its flailing characters’ confusions.,"While not his most elegant work, Tennessee Williams’s “The Night of the Iguana,” about a group of lost souls at a coastal hotel in 1940s Mexico, is not without its misty pleasures. Even as his characters stumble tragically in search of meaning, their convictions carry the sharp-tongued certainty of soap opera idols. But a new revival from La Femme Theater at the Signature Center mires itself too deeply in its characters’ confusions to let the edges of his language shine.","{'main': 'Review: This ‘Night of the Iguana’ Is Williams Without the Excess', 'kicker': None, 'content_kicker': None, 'print_headline': 'Flailing Supplants Flourish in a Williams Revival', 'name': None, 'seo': None, 'sub': None}","['Theater', 'Signature Center', 'Daly, Tim', 'Mann, Emily', 'Williams, Tennessee', 'The Night of the Iguana (Play)']",2023-12-26T15:00:06+0000,article,Theater
Let’s not mince words. Let’s make soup.,"Hi, everyone. This is Margaux stepping in for Emily today. So happy to be here!","{'main': 'Cheap and Cozy One-Pot Soups Because the Holidays Wore Us Out', 'kicker': None, 'content_kicker': None, 'print_headline': '', 'name': None, 'seo': None, 'sub': None}","['Cooking and Cookbooks', 'Content Type: Service', 'Recipes']",2023-12-26T16:00:02+0000,article,Food
"A new study shows an increase in the rate of inpatient complications, including infections and falls, though patients were no more likely to die.","The rate of serious medical complications increased in hospitals after they were purchased by private equity investment firms, according to a major study of the effects of such acquisitions on patient care in recent years.","{'main': 'Serious Medical Errors Rose After Private Equity Firms Bought Hospitals', 'kicker': None, 'content_kicker': None, 'print_headline': 'Private Equity Ownership Linked to Hospital Errors', 'name': None, 'seo': None, 'sub': None}","['Hospitals', 'Private Equity', 'Mergers, Acquisitions and Divestitures', 'Workplace Hazards and Violations', 'Journal of the American Medical Assn', 'United States']",2023-12-26T16:00:17+0000,article,The Upshot
"Whitney Houston’s gospel music, Future’s prolific mixtape run, a chunk of Joni Mitchell’s archives and a soundtrack of Brooklyn’s early discos arrived in new packages this year.","Artists were eager to revisit the past in 2023 — some tweaking recent albums (like Taylor Swift), others revisiting long-dormant work in the vaults (like the two surviving Beatles). Boxed sets and reissue collections serve a different purpose, helping put catalogs and musicians into context, and bringing fresh revelations to light. Here are a dozen of the best our critics encountered this year.","{'main': 'Blasts From the Past: 12 Key Collections, From Julee Cruise to the Who', 'kicker': None, 'content_kicker': None, 'print_headline': '12 Key Music Collections, From Future to the Who', 'name': None, 'seo': None, 'sub': None}","['Pop and Rock Music', 'Gospel Music', 'Rap and Hip-Hop', 'Folk Music', 'Blues Music', 'Latin Music', 'DeYarmond Edison (Music Group)', 'Who, The (Music Group)', 'Cruise, Julee', 'Future (Rapper)', 'Griffith, Nanci', 'Houston, Whitney', 'Mitchell, Joni', 'Vernon, Justin (1981- )', 'Stax Records']",2023-12-26T16:00:19+0000,article,Arts
"The Bouroullec brothers, the most influential French designers since Philippe Starck, have broken up.","Since the turn of the millennium, when the French brothers Ronan and Erwan Bouroullec emerged as international product design prodigies while still in their 20s — hailed as the most famous French design stars since Philippe Starck — they have taken equal credit for almost everything they have brought into the world.","{'main': 'When Design Stars (and Brothers) Collide', 'kicker': None, 'content_kicker': None, 'print_headline': 'One Path Diverges Into Two', 'name': None, 'seo': None, 'sub': None}","['Design', 'Furniture', 'Interior Design and Furnishings', 'Bouroullec, Ronan', 'Bouroullec, Erwan', 'Content Type: Personal Profile', 'France']",2023-12-26T16:04:11+0000,article,Arts
"“I deeply regret any pain I may have caused,” wrote the rapper formerly known as Kanye West, who is releasing an album next month.","Ye, the rapper and producer formerly known as Kanye West, apologized to the Jewish community on Tuesday for a series of antisemitic comments he made last year.","{'main': 'Ye Apologizes for Antisemitic Comments With Post in Hebrew', 'kicker': None, 'content_kicker': None, 'print_headline': 'Kanye West Issues Apology For Antisemitic Comments', 'name': None, 'seo': None, 'sub': None}","['West, Kanye', 'Rap and Hip-Hop', 'Anti-Semitism', 'Apologies']",2023-12-26T16:06:02+0000,article,Arts
"Other dishes may come and go, but certain recipes always have a place on the holiday table.","Jane Matsumoto’s family is so eager to eat their annual ozoni that they gather around the table at 2 in the morning, right after they’ve cleaned the confetti, streamers and champagne glasses from their New Year’s Eve festivities. Ms. Matsumoto, who is sansei, or third-generation Japanese American, and the executive culinary director of the Japanese American Cultural & Community Center in Los Angeles, looks forward to the brothy soup bobbing with mochi pieces every year.","{'main': 'Japanese American New Year’s Food Traditions Transcend Time', 'kicker': None, 'content_kicker': None, 'print_headline': 'Tradition Is on the Japanese American Table', 'name': None, 'seo': None, 'sub': None}","['Japanese Food (Cuisine)', 'Japanese-Americans', 'New Year', 'Cooking and Cookbooks', 'Japan']",2023-12-26T16:10:12+0000,article,Food
She proved that women could gain fame as speed demons on land by setting records on the Bonneville Salt Flats and on the nation’s racetracks.,"Paula Murphy, a leading female car racer in an era when land speed records thrilled the American public, died on Thursday at an assisted living facility in Prescott, Ariz. She was 95.","{'main': 'Paula Murphy, Once ‘the Fastest Woman on Wheels,’ Dies at 95', 'kicker': None, 'content_kicker': None, 'print_headline': 'Paula Murphy, Driver  Who Shattered Records  And Norms, Dies at 95', 'name': None, 'seo': None, 'sub': None}","['Murphy, Paula (1928-2023)', 'Deaths (Obituaries)', 'Automobile Racing', 'Women and Girls', 'Records and Achievements', 'Bonneville Salt Flats (Utah)', 'Breedlove, Craig', 'Combs, Jessi (1983-2019)']",2023-12-26T16:53:38+0000,article,Sports
Scientists are already busy trying to understand whether 2023’s off-the-charts heat is a sign that global warming is accelerating.,"Earth is finishing up its warmest year in the past 174 years, and very likely the past 125,000.","{'main': 'Earth Was Due for Another Year of Record Warmth. But This Warm?', 'kicker': None, 'content_kicker': None, 'print_headline': 'Earth Was Due  For a Hot Year, But This Hot?', 'name': None, 'seo': None, 'sub': None}","['Global Warming', 'Greenhouse Gas Emissions', 'Carbon Dioxide', 'Air Pollution', 'Heat and Heat Waves', 'Hansen, James E']",2023-12-26T16:57:15+0000,article,Climate
