abstract,lead_paragraph,headline,keywords,pub_date,document_type,section_name
"A geomagnetic storm could produce captivating streaks of green or reddish light in the skies this weekend, said researchers who on Thursday recorded the largest solar flare since 2017.","A powerful geomagnetic storm could set off a colorful display of the northern lights this weekend, appearing in some sections of the United States where they are not usually visible, weather officials said on Friday.","{'main': 'Northern Lights Could Appear Farther South in U.S., Forecasters Say', 'kicker': None, 'content_kicker': None, 'print_headline': '', 'name': None, 'seo': None, 'sub': None}","['Magnets and Magnetism', 'Aurora Borealis', 'Lighting', 'Weather', 'Sun']",2023-12-16T16:35:39+0000,article,Science
"Matthew Perry’s death was attributed to the effects of high levels of the anesthetic drug, which is increasingly used to treat depression.","An autopsy report released by the Los Angeles County medical examiner on Friday said the death of “Friends” actor Matthew Perry, who was found face down and unresponsive in a hot tub at his home on Oct. 28, resulted from the “acute effects” of ketamine, an anesthetic with psychedelic properties.","{'main': 'What to Know About Ketamine', 'kicker': None, 'content_kicker': None, 'print_headline': '', 'name': None, 'seo': None, 'sub': None}","['Psychedelic and Hallucinogenic Drugs', 'Drug Abuse and Traffic', 'Anesthesia and Anesthetics', 'Depression (Mental)', 'Buprenorphine (Drug)', 'Mental Health and Disorders', 'Antidepressants', 'Addiction (Psychology)', 'Drugs (Pharmaceuticals)', 'Food and Drug Administration', 'Ketamine (Drug)', 'Perry, Matthew']",2023-12-16T16:42:34+0000,article,Health
"The case raised questions about financial mismanagement at the highest levels of the church, and about Pope Francis’ power.","A Vatican criminal court on Saturday sentenced Cardinal Giovanni Angelo Becciu, once one of the church’s most powerful Vatican officials, to five and a half years in prison for financial crimes, a high-profile case that raised questions about the prevalence of financial malfeasance and incompetence at the highest levels of the church.","{'main': 'Cardinal at Center of Vatican Corruption Trial Is Sentenced to 5 and a Half Years', 'kicker': None, 'content_kicker': None, 'print_headline': 'Vatican Fraud Scandal Ends in Prison Term for Once-Powerful Cardinal', 'name': None, 'seo': None, 'sub': None}","['Decisions and Verdicts', 'Cardinals (Roman Catholic Prelates)', 'Becciu, Giovanni Angelo', 'Roman Catholic Church', 'Francis', 'Vatican City', 'Italy', 'Corruption (Institutional)', 'Vatican Bank']",2023-12-16T18:27:44+0000,article,World
We want to hear from families about their experiences and medical bills in the past five years.,"Across the country, neonatal intensive care units provide critical care to seriously ill babies.","{'main': 'Did Your Baby Spend Time in the NICU? Tell Us About It.', 'kicker': None, 'content_kicker': None, 'print_headline': '', 'name': None, 'seo': None, 'sub': None}","['internal-reader-callout', 'Content Type: Service', 'Babies and Infants']",2023-12-16T18:34:42+0000,article,Health
The discussions over the southern border show how drastically the politics of immigration have shifted to the right in the United States.,"On his first day in office, President Biden sent a bill to Congress to “restore humanity and American values to our immigration system.” Nearly three years later, he is considering sweeping restrictions on migration in exchange for aid to Ukraine and Israel.","{'main': 'Biden’s Border Negotiations Mark Seismic Shift on Immigration Politics', 'kicker': None, 'content_kicker': None, 'print_headline': 'Biden’s Moves Show Seismic Shift on Immigration Politics', 'name': None, 'seo': None, 'sub': None}","['Biden, Joseph R Jr', 'Illegal Immigration', 'Asylum, Right of', 'Immigration and Emigration', 'Border Barriers', 'United States Politics and Government', 'Polls and Public Opinion', 'Law and Legislation', 'Democratic Party', 'Republican Party', 'House of Representatives', 'Senate', 'Ukraine', 'Foreign Aid', 'Russian Invasion of Ukraine (2022)']",2023-12-16T18:43:21+0000,article,U.S.
"After one of the most trying weeks in the university’s recent history, some students question whether they have a place on campus.","At Harvard University, the rabbi at a menorah lighting ceremony was unusually blunt.","{'main': 'Feeling Alone and Estranged, Many Jews at Harvard Wonder What’s Next', 'kicker': None, 'content_kicker': None, 'print_headline': 'Feeling Estranged, Some Jews Wonder if They Have a Place at Harvard', 'name': None, 'seo': None, 'sub': None}","['Harvard University', 'Colleges and Universities', 'Jews and Judaism', 'Anti-Semitism', 'Israel-Gaza War (2023- )', 'Demonstrations, Protests and Riots', 'Gay, Claudine', 'Massachusetts']",2023-12-16T18:50:32+0000,article,U.S.
"The military said the mistaken killing of the three men, who had been shirtless, was a violation of its rules of engagement.","The Israeli military on Saturday said three hostages mistakenly killed by Israeli troops had been shirtless, unarmed and bearing a makeshift white flag. The troubling details of how they died have created widespread anguish and prompted renewed calls for a pause in the fighting to allow more hostages to be released.","{'main': 'Israel Says 3 Hostages Bore White Flag Before Being Killed by Troops', 'kicker': None, 'content_kicker': None, 'print_headline': 'Hostages Held A White Flag As Israel Fired', 'name': None, 'seo': None, 'sub': None}","['Israel-Gaza War (2023- )', 'Israel', 'Defense and Military Forces', 'Kidnapping and Hostages', 'Deaths (Fatalities)', 'Friendly Fire (Military and Law Enforcement)', 'Gaza Strip', 'Hamas', 'Civilian Casualties', 'Palestinians', 'Terrorism']",2023-12-16T20:32:44+0000,article,World
"The men solicited loans on behalf of wine collectors who did not exist, backed by expensive bottles they did not have, prosecutors said.","In an elaborate Ponzi scheme that lasted nearly two years, two British men persuaded investors to put up nearly $100 million in loans to wealthy wine collectors, according to federal prosecutors.","{'main': '2 Men Bilked Wine Investors Out of $99 Million in Ponzi Scheme, U.S. Says', 'kicker': None, 'content_kicker': None, 'print_headline': '2 Men Bilked Wine Investors  Out of $99 Million, U.S. Says', 'name': None, 'seo': None, 'sub': None}","['Wines', 'Ponzi and Pyramid Schemes', 'Collectors and Collections', 'Extradition', 'Great Britain']",2023-12-16T20:50:37+0000,article,New York
Jeremy Newton’s puzzle challenges us to keep our feet dry.,Jump to: Tricky Clues | Today’s Theme,"{'main': 'Get Over It', 'kicker': 'Wordplay, The CROSSWORD COLUMN', 'content_kicker': None, 'print_headline': '', 'name': None, 'seo': None, 'sub': None}","['Crossword Puzzles', 'Newton, Jeremy (Crossword Constructor)', 'Shortz, Will']",2023-12-16T23:00:09+0000,article,Crosswords & Games
