abstract,lead_paragraph,headline,keywords,pub_date,document_type,section_name
"A proposed export terminal on the Louisiana coast highlights the tension between economic growth, geopolitics and the environment.","On a marshy stretch of the Louisiana coastline, a little-known company wants to build a $10 billion facility that would allow the United States to export vast stores of liquefied natural gas.","{'main': 'A Natural Gas Project Is Biden’s Next Big Climate Test', 'kicker': None, 'content_kicker': None, 'print_headline': 'Decision on Natural Gas Project Will Test Biden’s Energy Policy', 'name': None, 'seo': None, 'sub': None}","['Natural Gas', 'Gulf of Mexico', 'International Trade and World Market', 'Global Warming', 'Greenhouse Gas Emissions', 'United States Politics and Government', 'Energy Department', 'Venture Global LNG', 'Louisiana']",2023-12-26T17:08:45+0000,article,Climate
A group of parents reeling from a mass shooting at their children’s private Christian school believed no one was in a better position to persuade the G.O.P. to enact limited gun control.,"Mary Joyce told herself she would be kind, just as she always had been. Say enough, but not too much, she reminded herself.","{'main': 'The Covenant Parents Aren’t Going to Keep Quiet on Guns', 'kicker': None, 'content_kicker': None, 'print_headline': 'In Nashville, Parents Believed Time Had Come for Gun Limits', 'name': None, 'seo': None, 'sub': None}","['Covenant School, Nashville, Tenn, Shooting (2023)', 'Politics and Government', 'Mass Shootings', 'Nashville (Tenn)', 'Gun Control', 'School Shootings and Armed Attacks', 'State Legislatures']",2023-12-26T17:14:35+0000,article,U.S.
"Crispy-skinned air-fryer salmon, melty pressure-cooker chipotle chicken pozole and slow-cooker beef stew, dark with stout beer and maple syrup.","If the food (read: cookies) is the best part of the holidays, the second-best must be the presents. Especially those presents that make cooking easier, or just plain fun. If you have some new toys to play with in the kitchen — an air fryer, a pressure cooker or a powerful new blender to replace that old one with only two working buttons — we have recipes for you, starting with Eleanore Park’s brilliant air-fryer salmon. “Salmon cooks perfectly in the air fryer,” Eleanore explains, “because the device’s circulating high heat keeps the fish moist and crisps skin-on fillets.” More air-fryer must-makes: crispy cubes of tofu, perfect baked potatoes and everyone’s favorite game-day snack, chicken wings.","{'main': 'Clever Recipes for Your Kitchen Toys', 'kicker': None, 'content_kicker': None, 'print_headline': '', 'name': None, 'seo': None, 'sub': None}","['Cooking and Cookbooks', 'Content Type: Service']",2023-12-26T18:00:03+0000,article,Food
"In a public letter, dozens of actors, directors and other celebrities said he was the victim of a “lynching,” as he faces allegations of sex crimes.","Over 50 actors, artists and other celebrities in France have issued a letter ardently defending Gérard Depardieu, the actor accused of sexual harassment and assault, calling him the victim of a “lynching” and arguing that he should be able to continue working despite a storm of criticism.","{'main': 'Over 50 French Figures Defend Depardieu After Sexual Misconduct Allegations', 'kicker': None, 'content_kicker': None, 'print_headline': 'French Celebrities Defend Depardieu as Victim of ‘Lynching’ Over Sex Claims ', 'name': None, 'seo': None, 'sub': None}","['Sex Crimes', 'Sexual Harassment', 'Actors and Actresses', '#MeToo Movement', 'Depardieu, Gerard', 'France']",2023-12-26T18:37:41+0000,article,World
"The junior senator from California, appointed to serve out the term of the late Senator Dianne Feinstein, discussed adapting to the slow pace of the Senate and her goals before leaving office in a year.",Senator Laphonza Butler came to her job in Congress in an unusual way and quickly decided she was not going to stay.,"{'main': 'Laphonza Butler Just Got to the Senate, but She’s Not Planning to Stay Long', 'kicker': None, 'content_kicker': None, 'print_headline': 'Short-Term Senator Aims to Be a ‘Loud and Clear Voice’ for California', 'name': None, 'seo': None, 'sub': None}","['Butler, Laphonza', 'Senate', 'Democratic Party', 'United States Politics and Government', 'California']",2023-12-26T18:38:45+0000,article,U.S.
Readers discuss what sort of speech should be permissible and fears about speaking up. Also: Hillary Clinton scenario; traveling for abortions; morning sickness.,To the Editor: ,"{'main': 'The Free Speech Debate on Campus About the Israel-Gaza War', 'kicker': 'letters', 'content_kicker': None, 'print_headline': 'The Free Speech Debate on Campus', 'name': None, 'seo': None, 'sub': None}","['Demonstrations, Protests and Riots', 'Abortion', 'Colleges and Universities', 'Israel-Gaza War (2023- )', 'Morning Sickness', 'Palestinians', 'Freedom of Speech and Expression', 'Jews and Judaism', 'Anti-Semitism', 'Censorship', 'Pregnancy and Childbirth', 'Storming of the US Capitol (Jan, 2021)', 'Threats and Threatening Messages', 'Republican Party', 'Clinton, Hillary Rodham', 'Cox, Kate (1992- )', 'Douthat, Ross G', 'Israel', 'Gaza Strip']",2023-12-26T18:54:24+0000,article,Opinion
"Modern Love in miniature, featuring reader-submitted stories of no more than 100 words.","“I’ll drive; it’s 20 hours and I’ll be there for Christmas dinner,” my husband, Edwin, said, undeterred after a Canadian snowstorm grounded all flights. Imagining a fatality replacing our festivities, I insisted he come by train. Hours in, Edwin’s locomotive halted, its tracks blocked by debris. Eighteen hours of standstill later, the train reversed direction, returning to its starting point. But Edwin didn’t give up: He cabbed to the nearest airport and boarded a then-available plane. After 54 hours of travel (for a trip that would normally take two hours), Edwin smiled beside me at my family’s celebratory spread. — Laura Schep","{'main': 'Tiny Love Stories: ‘My First Post-Divorce Christmas’', 'kicker': 'Modern Love', 'content_kicker': None, 'print_headline': '', 'name': None, 'seo': None, 'sub': None}","['Love (Emotion)', 'Modern Love (Times Column)', 'Dating and Relationships', 'Christmas', 'Divorce, Separations and Annulments']",2023-12-26T20:00:19+0000,article,Style
"A veteran of 25 years with the Los Angeles Philharmonic, she was known as much for her eccentricities as for her exceptional musicianship.","When the Bronx-bred pianist Zita Carno auditioned for the Los Angeles Philharmonic in 1975, she played short excerpts from the orchestra’s repertoire for the music director, Zubin Mehta.","{'main': 'Zita Carno, Concert Pianist, Coltrane Scholar and More, Dies at 88', 'kicker': None, 'content_kicker': None, 'print_headline': 'Zita Carno, 88, Pianist And Coltrane Scholar  With Exceptional Mind', 'name': None, 'seo': None, 'sub': None}","['Carno, Zita (1935-2023)', 'Deaths (Obituaries)', 'Classical Music', 'Jazz', 'Los Angeles Philharmonic', 'Coltrane, John']",2023-12-26T20:14:50+0000,article,Obituaries
Jogging in a T-shirt in Minnesota in December? A scientist called the rare string of balmy days “a visceral feeling of what climate change looks and feels like.”,"Lucy Wallace, a recent transplant from San Diego, had been warned about the bone-chilling winters of her new hometown, Minneapolis. She bought a $900 winter coat, two pairs of boots and metal spikes to make her running shoes usable on icy sidewalks.","{'main': 'A Record-Breaking Warm, Snowless Winter Confounds Midwesterners', 'kicker': None, 'content_kicker': None, 'print_headline': 'Green Christmas in Snow Country: Record-Breaking Warm Weather Confounds Midwest', 'name': None, 'seo': None, 'sub': None}","['Global Warming', 'Winter (Season)', 'Weather', 'Fishing, Sport', 'Minneapolis (Minn)', 'Minnesota', 'Milwaukee (Wis)', 'Wisconsin']",2023-12-26T20:43:23+0000,article,U.S.
"Also, the U.S. hit Iran-backed fighters in Iraq.","In one of the most significant strikes against Russia’s Black Sea Fleet in months, Ukrainian missiles yesterday hit a warship moored in Crimea. But the success was tempered by a retreat from the eastern city of Marinka after a monthslong battle.","{'main': 'Wednesday Briefing: A Success and a Setback for Ukraine', 'kicker': None, 'content_kicker': None, 'print_headline': '', 'name': None, 'seo': None, 'sub': None}",[],2023-12-26T21:04:50+0000,article,World
"Selected Times graphics, visualizations and multimedia stories published this year. All free to read for a limited time.","Selected Times graphics, visualizations and multimedia stories published this year. All free to read for a limited time.","{'main': '2023: The Year in Visual Stories and Graphics.', 'kicker': None, 'content_kicker': None, 'print_headline': '', 'name': None, 'seo': None, 'sub': None}","['Two Thousand Twenty Three', 'vis-design']",2023-12-26T21:18:31+0000,multimedia,U.S.
Former Representative Jeff Fortenberry had been convicted on charges of lying to the federal authorities. An appeals court said his trial was in the wrong venue.,"A federal appeals court tossed out the conviction of former Representative Jeff Fortenberry, a Nebraska Republican, on Tuesday on the grounds that his trial never should have been held in Los Angeles in the first place.","{'main': 'Appeals Court Reverses Conviction of Former Nebraska Congressman', 'kicker': None, 'content_kicker': None, 'print_headline': 'Court Reverses Conviction Of a Former Congressman', 'name': None, 'seo': None, 'sub': None}","['Decisions and Verdicts', 'Ethics and Official Misconduct', 'Campaign Finance', 'United States Politics and Government', 'Fortenberry, Jeffrey L (1960- )', 'House of Representatives', 'Republican Party', 'Nebraska', 'Los Angeles (Calif)']",2023-12-26T22:44:33+0000,article,U.S.
"Plus, food trends in 2024","Ukraine said today it had destroyed the Russian warship Novocherkassk in Crimea, one of the most significant attacks against Moscow’s Black Sea Fleet in months. But in a setback, Ukraine acknowledged that it had largely retreated from the eastern city of Marinka after a monthslong battle.","{'main': 'The Evening: A Success and a Setback for Ukraine', 'kicker': None, 'content_kicker': None, 'print_headline': '', 'name': None, 'seo': None, 'sub': None}",[],2023-12-26T22:51:02+0000,article,Briefing
A military spokesman confirmed the move on the latest front in Israel’s war against Hamas.,"The Israeli military crossed into central Gaza between Dec. 24 and 26, new satellite images obtained and analyzed by The New York Times showed, giving a fuller picture of the latest front in Israel’s war to eradicate Hamas from the embattled enclave.","{'main': 'Satellite imagery shows Israel’s advance into central Gaza.', 'kicker': None, 'content_kicker': None, 'print_headline': '', 'name': None, 'seo': None, 'sub': None}","['Israel-Gaza War (2023- )', 'Gaza Strip', 'War and Armed Conflicts', 'Refugees and Displaced Persons', 'Palestinians']",2023-12-26T23:12:25+0000,article,World
